{"type": "stage1_complete", "proposals": {"A": "# Build a Minimal LLM Evaluation Loop in Python: Systematic Experiments for ML Engineers\n\nIf you want to stop manually testing prompts and start running systematic experiments, an evaluation loop is the right tool. This tutorial shows you how to build one using the OpenRouter API, covering essential steps from API key setup to saving results.\n\n## What You Will Build\n\nBy the end of this tutorial, you will have a working Python script that:\n1. Makes LLM API calls using OpenRouter\n2. Scores the output using a custom metric\n3. Implements a greedy hill-climbing loop to improve the output\n4. Saves the best artifact to a file\n5. Tracks costs and iterations\n6. Versions improvements using git\n7. Supports parallel model queries for comparative analysis\n\n## What You Need\n\n- Python 3.10+\n- An OpenRouter API key (sign up at openrouter.ai)\n- `httpx` installed: `pip install httpx`\n- `python-dotenv` installed: `pip install python-dotenv`\n- `asyncio` and `concurrent.futures` for parallel queries\n- Git installed and configured\n\n## Step 1: Setup API Key and Constants\n\nFirst, create a `.env` file in your project root with your OpenRouter API key:\n```plaintext\nOPENROUTER_API_KEY=sk-or-your-key-here\n```\n\n```python\nimport os\nimport httpx\nimport asyncio\nfrom dotenv import load_dotenv\n\nload_dotenv()  # Load environment variables from .env\n\nAPI_KEY = os.getenv(\"OPENROUTER_API_KEY\")\nAPI_URL = \"https://openrouter.ai/api/v1/chat/completions\"\nMODELS = [\"openai/gpt-4o-mini\", \"anthropic/claude-3-haiku\"]\nMAX_ITERATIONS = 20\nCOST_PER_TOKEN = {\"openai/gpt-4o-mini\": 0.000002, \"anthropic/claude-3-haiku\": 0.0000015}  # Example costs, check OpenRouter pricing\n\nasync def call_llm(model: str, prompt: str) -> str:\n    try:\n        async with httpx.AsyncClient() as client:\n            response = await client.post(\n                API_URL,\n                headers={\"Authorization\": f\"Bearer {API_KEY}\"},\n                json={\n                    \"model\": model,\n                    \"messages\": [{\"role\": \"user\", \"content\": prompt}]\n                },\n                timeout=10.0  # Add timeout to prevent hanging\n            )\n            response.raise_for_status()  # Raise an exception for bad status codes\n            data = response.json()\n            return data[\"choices\"][0][\"message\"][\"content\"]\n    except httpx.RequestError as e:\n        print(f\"API request failed for {model}: {e}\")\n        return \"\"\n```\n\n## Step 2: Define a Metric Function\n\nYour metric function scores the LLM output. Higher is better. Here is a simple example that scores based on length and coherence, with additional comments for clarity:\n\n```python\ndef score(text: str) -> float:\n    # Calculate the number of words in the output\n    words = len(text.split())\n    # Normalize length score to be between 0 and 1\n    length_score = min(words / 200, 1.0)\n    # Simple coherence check: higher lexical diversity is better\n    coherence_score = len(set(text.split())) / words if words > 0 else 0\n    # Weighted average of length and coherence scores\n    return 0.5 * length_score + 0.5 * coherence_score\n```\n\n## Step 3: Implement the Evaluation Loop with Parallel Model Queries\n\n```python\nimport json\nimport subprocess\n\nasync def main():\n    best_score = 0.0\n    artifact = open(\"artifact.txt\").read().strip()\n    total_cost = 0.0\n    results = []\n\n    # Initialize git repository if not already done\n    try:\n        subprocess.run([\"git\", \"rev-parse\"], check=True, capture_output=True)\n    except subprocess.CalledProcessError:\n        subprocess.run([\"git\", \"init\"], check=True)\n        subprocess.run([\"git\", \"add\", \"artifact.txt\"], check=True)\n        subprocess.run([\"git\", \"commit\", \"-m\", \"Initial artifact\"], check=True)\n\n    for i in range(MAX_ITERATIONS):\n        prompt = f\"Improve this text:\\n\\n{artifact}\"\n        tasks = [call_llm(model, prompt) for model in MODELS]\n        candidates = await asyncio.gather(*tasks)\n        \n        for model, candidate in zip(MODELS, candidates):\n            if not candidate:  # Skip iteration if API call failed\n                continue\n            \n            new_score = score(candidate)\n            cost = COST_PER_TOKEN[model] * (len(prompt) + len(candidate))  # Simplified cost calculation\n            total_cost += cost\n            \n            if new_score > best_score:\n                best_score = new_score\n                artifact = candidate.strip()\n                with open(\"artifact.txt\", \"w\") as f:\n                    f.write(artifact)\n                # Commit changes to git\n                subprocess.run([\"git\", \"add\", \"artifact.txt\"], check=True)\n                subprocess.run([\"git\", \"commit\", \"-m\", f\"Iter {i}: Improved artifact using {model}\"], check=True)\n                print(f\"Iter {i}: KEEP  score={new_score:.2f}  model={model}\")\n                results.append({\"iteration\": i, \"score\": new_score, \"action\": \"KEEP\", \"model\": model, \"cost\": total_cost})\n            else:\n                print(f\"Iter {i}: DISCARD  score={new_score:.2f}  best={best_score:.2f}  model={model}\")\n                results.append({\"iteration\": i, \"score\": new_score, \"action\": \"DISCARD\", \"model\": model, \"cost\": total_cost})\n\n    # Save results to a JSON file for later analysis\n    with open(\"results.json\", \"w\") as f:\n        json.dump(results, f, indent=2)\n\nif __name__ == \"__main__\":\n    asyncio.run(main())\n```\n\n## Step 4: Run Your Evaluation Loop\n\n```bash\npython loop.py\n```\n\nYou should see output like:\n\n```\nIter 0: KEEP  score=0.85  model=openai/gpt-4o-mini\nIter 1: DISCARD  score=0.81  best=0.85  model=anthropic/claude-3-haiku\nIter 2: KEEP  score=0.91  model=openai/gpt-4o-mini\nIter 3: DISCARD  score=0.88  best=0.91  model=anthropic/claude-3-haiku\n```\n\nThe artifact file is updated and committed to git whenever a better version is found, and results are saved to `results.json`, including the model used for each iteration.\n\n## Why Greedy Hill-Climbing?\n\nGreedy hill-climbing is simple and effective for many optimization tasks. It always moves towards better solutions, making it suitable for improving LLM outputs. However, it may get stuck in local optima. Consider adding randomness or more sophisticated optimization techniques for complex tasks.\n\n## Tradeoffs and Limitations\n\nWhile greedy hill-climbing is straightforward to implement, it lacks the ability to explore the solution space broadly. For tasks requiring more exploration, consider techniques like simulated annealing or genetic algorithms. Additionally, be mindful of the cost implications of repeated LLM queries.\n\n## Common Pitfalls\n\n1. **Metric Gaming**: Ensure your metric accurately reflects the desired outcome. A poorly designed metric can lead to suboptimal or misleading results.\n2. **Circular Feedback**: Be cautious when using LLM outputs to evaluate other LLM outputs. This can create feedback loops that degrade performance over time.\n3. **Runaway Costs**: Always track costs and consider implementing a budget constraint to prevent unexpected expenses.\n\n## Worked Example\n\nLet's say you start with a simple artifact: \"The quick brown fox jumps over the lazy dog.\" After running the evaluation loop, the artifact might improve to: \"The quick brown fox jumps over the lazy dog, demonstrating a classic example of a pangram that uses all the letters of the alphabet efficiently.\" The score improves from 0.4 to 0.8 as the output becomes more coherent and contextually relevant.\n\n## Comparative Analysis of Models\n\nBy querying multiple models in parallel, you can compare their performance on your specific task. This allows you to identify which model is most effective for your needs and potentially combine their strengths.\n\n## What's Next\n\nThis basic loop works, but you can enhance it further:\n- Implement more sophisticated optimization strategies like simulated annealing\n- Add more comprehensive error handling and logging mechanisms\n- Explore different scoring metrics tailored to your specific use case\n\nBy following this tutorial, you've built a systematic evaluation loop for LLM experiments that not only optimizes your prompts but also versions your improvements using git and compares different models. This foundation allows you to scale your experiments, track progress, and optimize your prompts effectively.", "B": "# Build a Minimal LLM Evaluation Loop in Python: Systematic Experiments for ML Engineers\n\nIf you want to stop manually testing prompts and start running systematic experiments, an evaluation loop is the right tool. This tutorial shows you how to build one using the OpenRouter API, covering essential steps from API key setup to adaptive optimization.\n\n## What You Will Build\n\nBy the end of this tutorial, you will have a working Python script that:\n1. Makes LLM API calls using OpenRouter\n2. Scores the output using a custom metric\n3. Implements an adaptive optimization strategy\n4. Tracks experiment history and performance\n5. Handles API failures and cost management\n6. Provides insights into optimization process\n\n## Key Innovation: Adaptive Exploration Strategy\n\nUnlike traditional greedy hill-climbing, this tutorial introduces a novel \"adaptive exploration\" approach that balances exploitation and exploration dynamically. This method prevents getting stuck in local optima while maintaining computational efficiency.\n\n## What You Need\n\n- Python 3.10+\n- An OpenRouter API key\n- `httpx` installed: `pip install httpx`\n- `python-dotenv` installed: `pip install python-dotenv`\n- Basic understanding of machine learning experimentation\n\n## Step 1: Advanced Setup with Robust Configuration\n\n```python\nimport os\nimport logging\nfrom dataclasses import dataclass\nfrom typing import Optional, Callable\nfrom dotenv import load_dotenv\n\nload_dotenv()\n\n@dataclass\nclass ExperimentConfig:\n    api_key: str = os.getenv(\"OPENROUTER_API_KEY\")\n    model: str = \"openai/gpt-4o-mini\"\n    max_iterations: int = 30\n    exploration_rate: float = 0.2\n    temperature: float = 0.7\n    budget_limit: float = 5.00  # USD\n\nclass ExperimentLogger:\n    def __init__(self, log_file: str = \"experiment_log.json\"):\n        self.log_file = log_file\n        self.experiments = []\n    \n    def log_iteration(self, iteration: int, score: float, cost: float, action: str):\n        log_entry = {\n            \"iteration\": iteration,\n            \"score\": score,\n            \"cost\": cost,\n            \"action\": action\n        }\n        self.experiments.append(log_entry)\n        self._save_log()\n    \n    def _save_log(self):\n        with open(self.log_file, 'w') as f:\n            json.dump(self.experiments, f, indent=2)\n```\n\n## Step 2: Adaptive Metric Function with Contextual Awareness\n\n```python\ndef adaptive_score(\n    text: str, \n    context: Optional[dict] = None\n) -> float:\n    \"\"\"\n    Calculates a dynamic score considering multiple dimensions.\n    \n    Args:\n        text (str): Generated text to evaluate\n        context (dict, optional): Additional context for scoring\n    \n    Returns:\n        float: Normalized score between 0 and 1\n    \"\"\"\n    # Multidimensional scoring logic\n    length_weight = context.get('length_preference', 0.3)\n    coherence_weight = context.get('coherence_preference', 0.4)\n    novelty_weight = context.get('novelty_preference', 0.3)\n    \n    words = text.split()\n    length_score = min(len(words) / 250, 1.0)\n    coherence_score = len(set(words)) / len(words) if words else 0\n    novelty_score = calculate_novelty(text, context)\n    \n    return (\n        length_weight * length_score + \n        coherence_weight * coherence_score + \n        novelty_weight * novelty_score\n    )\n\ndef calculate_novelty(text: str, context: Optional[dict] = None) -> float:\n    # Implement a basic novelty calculation\n    # This could involve comparing against previous generations\n    return 0.5  # Placeholder implementation\n```\n\n## Step 3: Adaptive Exploration Loop\n\n```python\ndef adaptive_experiment_loop(\n    initial_artifact: str, \n    metric_fn: Callable[[str, Optional[dict]], float],\n    config: ExperimentConfig = ExperimentConfig()\n):\n    logger = ExperimentLogger()\n    current_artifact = initial_artifact\n    best_score = metric_fn(current_artifact, {})\n    total_cost = 0.0\n\n    for iteration in range(config.max_iterations):\n        # Dynamically adjust exploration vs exploitation\n        exploration_strategy = (\n            \"random_mutation\" if random.random() < config.exploration_rate \n            else \"targeted_improvement\"\n        )\n        \n        prompt = generate_improvement_prompt(\n            current_artifact, \n            exploration_strategy\n        )\n        \n        # Implement robust API call with advanced error handling\n        try:\n            candidate = call_llm_with_retry(prompt, config)\n            candidate_score = metric_fn(candidate, {\"iteration\": iteration})\n            \n            if candidate_score > best_score:\n                current_artifact = candidate\n                best_score = candidate_score\n                logger.log_iteration(iteration, best_score, total_cost, \"KEEP\")\n            else:\n                logger.log_iteration(iteration, candidate_score, total_cost, \"DISCARD\")\n            \n            # Cost and budget management\n            total_cost += estimate_api_cost(prompt, candidate)\n            if total_cost > config.budget_limit:\n                break\n        \n        except Exception as e:\n            logging.error(f\"Iteration {iteration} failed: {e}\")\n    \n    return current_artifact, best_score\n```\n\n## Deeper Exploration: Why Adaptive Strategies Matter\n\nTraditional greedy algorithms often get trapped in local optima. By introducing controlled randomness and multi-dimensional scoring, we create a more robust optimization process that can:\n- Escape local maxima\n- Explore diverse solution spaces\n- Adapt to changing optimization objectives\n\n## Pitfalls and Mitigations\n\n1. **Metric Manipulation**: Use diverse, context-aware scoring functions\n2. **Runaway Complexity**: Implement strict budget and iteration constraints\n3. **Overfitting**: Maintain exploration even in high-performing regions\n\n## Next Steps and Advanced Techniques\n\n- Implement Bayesian optimization\n- Create ensemble scoring mechanisms\n- Develop more sophisticated novelty calculations\n\nBy embracing adaptive exploration, you transform prompt engineering from an art to a systematic, data-driven process.", "C": "# Build a Minimal LLM Evaluation Loop in Python: Systematic Experiments for ML Engineers\n\nManual prompt engineering is a bottleneck. To scale your development, you need an automated evaluation loop that treats prompts as code. This tutorial builds a \"Prompt Optimizer\" that uses greedy hill-climbing to iteratively refine an artifact until it hits a target quality threshold.\n\n## What You Will Build\nYou will create a Python-based harness that:\n1.  **Evaluates** model outputs using a deterministic metric.\n2.  **Optimizes** prompts via a feedback loop.\n3.  **Versions** improvements automatically using Git.\n4.  **Tracks** cumulative API costs and performance metrics.\n\n## Prerequisites\n- Python 3.10+\n- `pip install httpx python-dotenv`\n- A Git-initialized directory\n- An OpenRouter API Key (set in a `.env` file as `OPENROUTER_API_KEY`)\n\n## The Implementation\n\nWe use a simple hill-climbing algorithm: generate a candidate, compare its score to the current best, and update only if the new version is superior.\n\n```python\nimport os\nimport json\nimport httpx\nimport subprocess\nfrom typing import Dict, Any\nfrom dotenv import load_dotenv\n\nload_dotenv()\n\n# Configuration\nAPI_URL = \"https://openrouter.ai/api/v1/chat/completions\"\nMODEL = \"openai/gpt-4o-mini\"\nMAX_ITERATIONS = 10\n\ndef evaluate_quality(text: str) -> float:\n    \"\"\"A heuristic metric: higher score for length and presence of key terms.\"\"\"\n    score = 0.0\n    if len(text) > 50: score += 0.5\n    if \"crucial\" in text.lower(): score += 0.5\n    return score\n\ndef call_llm(prompt: str) -> str:\n    try:\n        response = httpx.post(\n            API_URL,\n            headers={\"Authorization\": f\"Bearer {os.getenv('OPENROUTER_API_KEY')}\"},\n            json={\"model\": MODEL, \"messages\": [{\"role\": \"user\", \"content\": prompt}]},\n            timeout=20.0\n        )\n        response.raise_for_status()\n        return response.json()[\"choices\"][0][\"message\"][\"content\"]\n    except Exception as e:\n        print(f\"API Error: {e}\")\n        return \"\"\n\ndef run_loop():\n    artifact = \"Initial draft of the marketing copy.\"\n    best_score = evaluate_quality(artifact)\n    history = []\n\n    for i in range(MAX_ITERATIONS):\n        # The 'Optimizer' prompt: ask the model to improve itself\n        system_prompt = f\"Current best version: {artifact}\\nImprove this text to be more persuasive.\"\n        candidate = call_llm(system_prompt)\n        \n        if not candidate: continue\n        \n        new_score = evaluate_quality(candidate)\n        \n        if new_score > best_score:\n            print(f\"Iteration {i}: Improvement found ({new_score:.2f} > {best_score:.2f})\")\n            best_score = new_score\n            artifact = candidate\n            \n            # Version Control\n            with open(\"best_artifact.txt\", \"w\") as f: f.write(artifact)\n            subprocess.run([\"git\", \"add\", \"best_artifact.txt\"])\n            subprocess.run([\"git\", \"commit\", \"-m\", f\"Improvement at iter {i}\"])\n        else:\n            print(f\"Iteration {i}: No improvement ({new_score:.2f})\")\n            \n        history.append({\"iter\": i, \"score\": new_score})\n\n    with open(\"results.json\", \"w\") as f: json.dump(history, f, indent=2)\n\nif __name__ == \"__main__\":\n    run_loop()\n```\n\n## Why This Architecture?\n\n### The Subprocess Pattern\nWe use `subprocess` to call `git` directly. This treats your prompt directory as a true development environment. Every \"KEEP\" action creates a verifiable snapshot, allowing you to `git diff` your prompt evolution over time.\n\n### The Hill-Climbing Tradeoff\nGreedy hill-climbing is the \"Hello World\" of optimization. Its primary strength is **monotonic improvement**\u2014the state never gets worse. Its weakness is **local optima**: the model might get stuck in a \"style trap.\" To mitigate this, consider adding a \"temperature\" parameter to your optimization prompt or periodically forcing the model to rewrite with a different persona.\n\n## Common Pitfalls: The Feedback Trap\n1.  **Metric Gaming**: If your metric is too simple (e.g., word count), the model will learn to be verbose rather than accurate. Use LLM-as-a-Judge (calling an LLM to grade another LLM) for more nuanced tasks.\n2.  **Recursive Degradation**: If you feed the *previous* output back into the model infinitely, it may hallucinate or lose context. Always maintain a \"golden\" reference prompt in your source code alongside the evolving artifact.\n3.  **Cost Blindness**: When scaling to 100+ iterations, costs will accumulate. Always log the `usage` field returned by the OpenRouter API to track your spend per experiment.\n\n## Advanced Strategies\nOnce this loop is stable, move beyond simple hill-climbing:\n- **Parallel Evaluation**: Query three variants in parallel and pick the best one to reduce the probability of hitting a local optimum.\n- **Dynamic Metrics**: Instead of a hardcoded `evaluate_quality` function, use a secondary \"Judge LLM\" with a structured rubric (e.g., 1-5 scale on tone, accuracy, and brevity).\n- **Early Stopping**: Implement a \"patience\" counter; if your score hasn't increased in 5 iterations, stop the loop and tweak your objective function.\n\nBy moving your prompt logic into this loop, you stop guessing why a prompt works and start building a data-backed history of your model's performance. You are no longer just writing prompts; you are engineering systems.", "D": "# Build a Minimal LLM Evaluation Loop in Python: Systematic Experiments for ML Engineers\n\nIf you want to transition from manual prompt testing to automated LLM optimization, building an evaluation loop is essential. This tutorial guides you through creating a simple one using the OpenRouter API, focusing on a lean implementation that's quick to understand and extend. We'll cover key steps while emphasizing practical insights for ML engineers.\n\n## What You Will Build\n\nBy the end of this tutorial, you'll have a Python script that automates LLM prompt improvement through a greedy hill-climbing loop. It includes API calls, custom scoring, decision logic for keeping or discarding outputs, cost tracking, result saving, and git versioning. This setup allows for repeatable experiments, helping you refine prompts systematically.\n\n## What You Need\n\n- Python 3.10 or higher\n- An OpenRouter API key (obtain one at openrouter.ai)\n- Install these packages: `pip install httpx python-dotenv`\n- Git installed and configured on your system\n\n## Step 1: Setup API Key and Constants\n\nStart by securing your API key. Create a `.env` file in your project directory with the following:\n```plaintext\nOPENROUTER_API_KEY=sk-or-your-key-here\n```\n\nThis loads the key from an environment variable, avoiding hardcoding for security.\n\n```python\nimport os\nimport httpx\nfrom dotenv import load_dotenv\n\nload_dotenv()  # Loads variables from .env file\n\nAPI_KEY = os.getenv(\"OPENROUTER_API_KEY\")\nAPI_URL = \"https://openrouter.ai/api/v1/chat/completions\"\nMODEL = \"openai/gpt-4o