{"type": "stage1_complete", "proposals": {"A": "# Build a Minimal LLM Evaluation Loop in Python: Systematic Experiments for ML Engineers\n\nIf you want to stop manually testing prompts and start running systematic experiments, an evaluation loop is the right tool. This tutorial shows you how to build one using the OpenRouter API, covering essential steps from API key setup to saving results.\n\n## What You Will Build\n\nBy the end of this tutorial, you will have a working Python script that:\n1. Makes LLM API calls using OpenRouter\n2. Scores the output using a custom metric\n3. Implements a greedy hill-climbing loop to improve the output\n4. Saves the best artifact to a file\n5. Tracks costs and iterations\n6. Versions improvements using git\n7. Supports configurable parameters for flexible experimentation\n\n## What You Need\n\n- Python 3.10+\n- An OpenRouter API key (sign up at openrouter.ai)\n- `httpx` installed: `pip install httpx`\n- `python-dotenv` installed: `pip install python-dotenv`\n- Git installed and configured\n\n## Step 1: Setup API Key and Constants\n\nFirst, create a `.env` file in your project root with your OpenRouter API key:\n```plaintext\nOPENROUTER_API_KEY=sk-or-your-key-here\n```\n\n```python\nimport os\nimport httpx\nfrom dotenv import load_dotenv\nfrom dataclasses import dataclass\n\nload_dotenv()  # Load environment variables from .env\n\n@dataclass\nclass Config:\n    api_key: str = os.getenv(\"OPENROUTER_API_KEY\")\n    api_url: str = \"https://openrouter.ai/api/v1/chat/completions\"\n    model: str = \"openai/gpt-4o-mini\"\n    max_iterations: int = 20\n    cost_per_token: float = 0.000002  # Example cost, check OpenRouter pricing\n    initial_artifact: str = \"The quick brown fox jumps over the lazy dog.\"\n\ndef call_llm(config: Config, prompt: str) -> str:\n    try:\n        response = httpx.post(\n            config.api_url,\n            headers={\"Authorization\": f\"Bearer {config.api_key}\"},\n            json={\n                \"model\": config.model,\n                \"messages\": [{\"role\": \"user\", \"content\": prompt}]\n            },\n            timeout=10.0  # Add timeout to prevent hanging\n        )\n        response.raise_for_status()  # Raise an exception for bad status codes\n        data = response.json()\n        return data[\"choices\"][0][\"message\"][\"content\"]\n    except httpx.RequestError as e:\n        print(f\"API request failed: {e}\")\n        return \"\"\n```\n\n## Step 2: Define a Metric Function\n\nYour metric function scores the LLM output. Higher is better. Here is a simple example that scores based on length and coherence, with additional comments for clarity:\n\n```python\ndef score(text: str) -> float:\n    # Calculate the number of words in the output\n    words = len(text.split())\n    # Normalize length score to be between 0 and 1\n    length_score = min(words / 200, 1.0)\n    # Simple coherence check: higher lexical diversity is better\n    coherence_score = len(set(text.split())) / words if words > 0 else 0\n    # Weighted average of length and coherence scores\n    return 0.5 * length_score + 0.5 * coherence_score\n```\n\n## Step 3: Implement the Evaluation Loop with Cost Tracking and Git Versioning\n\n```python\nimport json\nimport subprocess\n\ndef main():\n    config = Config()\n    best_score = 0.0\n    artifact = config.initial_artifact\n    total_cost = 0.0\n    results = []\n\n    # Initialize git repository if not already done\n    try:\n        subprocess.run([\"git\", \"rev-parse\"], check=True, capture_output=True)\n    except subprocess.CalledProcessError:\n        subprocess.run([\"git\", \"init\"], check=True)\n        with open(\"artifact.txt\", \"w\") as f:\n            f.write(artifact)\n        subprocess.run([\"git\", \"add\", \"artifact.txt\"], check=True)\n        subprocess.run([\"git\", \"commit\", \"-m\", \"Initial artifact\"], check=True)\n\n    for i in range(config.max_iterations):\n        prompt = f\"Improve this text:\\n\\n{artifact}\"\n        candidate = call_llm(config, prompt)\n        \n        if not candidate:  # Skip iteration if API call failed\n            continue\n        \n        new_score = score(candidate)\n        total_cost += config.cost_per_token * (len(prompt) + len(candidate))  # Simplified cost calculation\n        \n        if new_score > best_score:\n            best_score = new_score\n            artifact = candidate.strip()\n            with open(\"artifact.txt\", \"w\") as f:\n                f.write(artifact)\n            # Commit changes to git\n            subprocess.run([\"git\", \"add\", \"artifact.txt\"], check=True)\n            subprocess.run([\"git\", \"commit\", \"-m\", f\"Iter {i}: Improved artifact\"], check=True)\n            print(f\"Iter {i}: KEEP  score={new_score:.2f}\")\n            results.append({\"iteration\": i, \"score\": new_score, \"action\": \"KEEP\", \"cost\": total_cost})\n        else:\n            print(f\"Iter {i}: DISCARD  score={new_score:.2f}  best={best_score:.2f}\")\n            results.append({\"iteration\": i, \"score\": new_score, \"action\": \"DISCARD\", \"cost\": total_cost})\n\n    # Save results to a JSON file for later analysis\n    with open(\"results.json\", \"w\") as f:\n        json.dump(results, f, indent=2)\n\nif __name__ == \"__main__\":\n    main()\n```\n\n## Step 4: Run Your Evaluation Loop\n\n```bash\npython loop.py\n```\n\nYou should see output like:\n\n```\nIter 0: KEEP  score=0.85\nIter 1: DISCARD  score=0.81  best=0.85\nIter 2: KEEP  score=0.91\nIter 3: DISCARD  score=0.88  best=0.91\n```\n\nThe artifact file is updated and committed to git whenever a better version is found, and results are saved to `results.json`.\n\n## Why Greedy Hill-Climbing?\n\nGreedy hill-climbing is simple and effective for many optimization tasks. It always moves towards better solutions, making it suitable for improving LLM outputs. However, it may get stuck in local optima. Consider adding randomness or more sophisticated optimization techniques for complex tasks.\n\n## Tradeoffs and Limitations\n\nWhile greedy hill-climbing is straightforward to implement, it lacks the ability to explore the solution space broadly. For tasks requiring more exploration, consider techniques like simulated annealing or genetic algorithms. Additionally, be mindful of the cost implications of repeated LLM queries.\n\n## Common Pitfalls\n\n1. **Metric Gaming**: Ensure your metric accurately reflects the desired outcome. A poorly designed metric can lead to suboptimal or misleading results.\n2. **Circular Feedback**: Be cautious when using LLM outputs to evaluate other LLM outputs. This can create feedback loops that degrade performance over time.\n3. **Runaway Costs**: Always track costs and consider implementing a budget constraint to prevent unexpected expenses.\n\n## Worked Example\n\nLet's say you start with a simple artifact: \"The quick brown fox jumps over the lazy dog.\" After running the evaluation loop, the artifact might improve to: \"The quick brown fox jumps over the lazy dog, demonstrating a classic example of a pangram that uses all the letters of the alphabet efficiently.\" The score improves from 0.4 to 0.8 as the output becomes more coherent and contextually relevant.\n\n## Advanced Configuration and Future Enhancements\n\nTo make your evaluation loop more flexible, consider adding command-line arguments or a configuration file to adjust parameters like the model, max iterations, and cost per token. This would allow you to run different experiments without modifying the code.\n\n## What's Next\n\nThis basic loop works, but you can enhance it further:\n- Query multiple models in parallel to compare their performance\n- Implement more sophisticated optimization strategies like simulated annealing\n- Add more comprehensive error handling and logging mechanisms\n- Integrate with a dashboard for real-time monitoring of experiments\n\nBy following this tutorial, you've built a systematic evaluation loop for LLM experiments that not only optimizes your prompts but also versions your improvements using git. This foundation allows you to scale your experiments, track progress, and optimize your prompts effectively.", "B": "# Build a Minimal LLM Evaluation Loop in Python: Systematic Experiments for ML Engineers\n\nIf you want to stop manually testing prompts and start running systematic experiments, an evaluation loop is the right tool. This tutorial shows you how to build a robust, extensible framework for LLM optimization using the OpenRouter API.\n\n## What You Will Build\n\nBy the end of this tutorial, you will have a Python script that:\n1. Makes LLM API calls with intelligent retry and backoff mechanisms\n2. Implements a multi-strategy optimization approach\n3. Tracks experimental metadata and performance\n4. Supports pluggable scoring and exploration strategies\n5. Provides comprehensive error handling and logging\n\n## Prerequisites\n\n- Python 3.10+\n- OpenRouter API key\n- `httpx`, `python-dotenv`, `structlog` installed\n- Git installed and configured\n\n## Step 1: Advanced API Configuration with Intelligent Retry\n\n```python\nimport os\nimport time\nimport random\nimport httpx\nimport structlog\nfrom typing import Dict, Any, Optional\nfrom dotenv import load_dotenv\n\nload_dotenv()\n\nclass OpenRouterClient:\n    def __init__(self, \n                 api_key: str, \n                 max_retries: int = 3, \n                 base_delay: float = 1.0):\n        self.api_key = api_key\n        self.max_retries = max_retries\n        self.base_delay = base_delay\n        self.logger = structlog.get_logger()\n\n    def call_with_retry(\n        self, \n        prompt: str, \n        model: str = \"openai/gpt-4o-mini\"\n    ) -> Optional[str]:\n        for attempt in range(self.max_retries):\n            try:\n                response = httpx.post(\n                    \"https://openrouter.ai/api/v1/chat/completions\",\n                    headers={\n                        \"Authorization\": f\"Bearer {self.api_key}\",\n                        \"Content-Type\": \"application/json\"\n                    },\n                    json={\n                        \"model\": model,\n                        \"messages\": [{\"role\": \"user\", \"content\": prompt}]\n                    },\n                    timeout=15.0\n                )\n                response.raise_for_status()\n                return response.json()['choices'][0]['message']['content']\n            \n            except (httpx.RequestError, httpx.HTTPStatusError) as e:\n                delay = self.base_delay * (2 ** attempt) * (1 + random.random())\n                self.logger.warning(\n                    \"API call failed\", \n                    attempt=attempt, \n                    error=str(e), \n                    next_retry_in=delay\n                )\n                time.sleep(delay)\n        \n        self.logger.error(\"All API retry attempts exhausted\")\n        return None\n```\n\n## Step 2: Sophisticated Scoring with Multiple Evaluation Strategies\n\n```python\nfrom dataclasses import dataclass\nfrom typing import Protocol, List\n\nclass ScoringStrategy(Protocol):\n    def evaluate(self, text: str) -> float:\n        ...\n\n@dataclass\nclass MultiMetricScorer:\n    strategies: List[ScoringStrategy]\n    weights: List[float]\n\n    def score(self, text: str) -> float:\n        if len(self.strategies) != len(self.weights):\n            raise ValueError(\"Strategies and weights must match\")\n        \n        scores = [\n            strategy.evaluate(text) * weight \n            for strategy, weight in zip(self.strategies, self.weights)\n        ]\n        return sum(scores)\n\nclass LengthStrategy:\n    def evaluate(self, text: str) -> float:\n        return min(len(text.split()) / 200, 1.0)\n\nclass CoherenceStrategy:\n    def evaluate(self, text: str) -> float:\n        words = text.split()\n        return len(set(words)) / len(words) if words else 0\n```\n\n## Step 3: Advanced Exploration Loop with Strategy Injection\n\n```python\n@dataclass\nclass ExperimentConfig:\n    api_client: OpenRouterClient\n    scorer: MultiMetricScorer\n    max_iterations: int = 20\n    exploration_rate: float = 0.2\n\nclass LLMExperimentLoop:\n    def __init__(self, config: ExperimentConfig):\n        self.config = config\n        self.best_artifact = \"\"\n        self.best_score = 0.0\n        self.iterations = []\n\n    def run(self, initial_artifact: str) -> str:\n        current_artifact = initial_artifact\n\n        for iteration in range(self.config.max_iterations):\n            # Exploration vs exploitation\n            if random.random() < self.config.exploration_rate:\n                candidate = self._explore(current_artifact)\n            else:\n                candidate = self._exploit(current_artifact)\n\n            score = self.config.scorer.score(candidate)\n\n            if score > self.best_score:\n                self.best_artifact = candidate\n                self.best_score = score\n                self._record_iteration(iteration, candidate, score, \"IMPROVE\")\n            else:\n                self._record_iteration(iteration, candidate, score, \"EXPLORE\")\n\n        return self.best_artifact\n\n    def _explore(self, artifact: str) -> str:\n        # Add randomness or perturbation to the artifact\n        pass\n\n    def _exploit(self, artifact: str) -> str:\n        # Use LLM to refine the artifact\n        pass\n\n    def _record_iteration(self, *args):\n        # Record iteration details\n        pass\n```\n\n## Key Innovations and Trade-offs\n\nThis implementation introduces several advanced concepts:\n- Intelligent API retry with exponential backoff\n- Pluggable scoring strategies\n- Multi-metric evaluation\n- Exploration vs exploitation trade-off\n- Comprehensive logging\n\n## Limitations and Future Work\n\nWhile powerful, this approach has limitations:\n- Computational cost of repeated API calls\n- Potential for metric gaming\n- Limited exploration compared to more advanced techniques like simulated annealing\n\n## Conclusion\n\nBy leveraging this flexible framework, you can systematically optimize LLM outputs while maintaining a clear, extensible architecture.", "C": "# Systematic LLM Prompt Optimization: A Minimal Evaluation Loop\n\nMoving from \"artisanal\" prompt engineering to systematic optimization requires a feedback loop. By treating your prompt as a variable and your output metric as a objective function, you can automate the process of finding the most effective instructions for your specific use case.\n\n## What You Will Build\n\nYou will build a Python-based **Greedy Hill-Climbing Optimizer**. This script treats your prompt as an evolving artifact, testing variations against a scoring function and committing only those that improve performance to your git repository.\n\n- **Automated Experimentation:** Iteratively refines prompts using an LLM.\n- **Systematic Versioning:** Uses Git to track every successful \"mutation\" of your prompt.\n- **Cost Awareness:** Tracks cumulative API spend per session.\n- **Metric-Driven:** Uses a pluggable scoring function to define \"success.\"\n\n## Prerequisites\n\n- Python 3.10+\n- `pip install httpx python-dotenv`\n- A Git-initialized directory\n\n## The Implementation\n\nWe use a modular structure: an `optimizer` loop, an `evaluator` function, and a `mutator` that generates prompt variations.\n\n```python\nimport os\nimport httpx\nimport json\nimport subprocess\nfrom typing import Callable\nfrom dotenv import load_dotenv\n\nload_dotenv()\n\n# Configuration\nAPI_KEY = os.getenv(\"OPENROUTER_API_KEY\")\nAPI_URL = \"https://openrouter.ai/api/v1/chat/completions\"\nMODEL = \"openai/gpt-4o-mini\"\nMAX_ITERATIONS = 10\n\ndef call_llm(prompt: str, system_msg: str = \"You are a helpful assistant.\") -> str:\n    \"\"\"Core API interaction with error handling.\"\"\"\n    try:\n        with httpx.Client(timeout=30.0) as client:\n            response = client.post(\n                API_URL,\n                headers={\"Authorization\": f\"Bearer {API_KEY}\", \"HTTP-Referer\": \"eval-loop\"},\n                json={\n                    \"model\": MODEL,\n                    \"messages\": [\n                        {\"role\": \"system\", \"content\": system_msg},\n                        {\"role\": \"user\", \"content\": prompt}\n                    ]\n                }\n            )\n            response.raise_for_status()\n            return response.json()[\"choices\"][0][\"message\"][\"content\"]\n    except Exception as e:\n        print(f\"API Error: {e}\")\n        return \"\"\n\ndef score_output(text: str) -> float:\n    \"\"\"\n    Custom Metric: Measures 'conciseness' vs 'content density'.\n    Replace this with your business logic (e.g., regex matching or LLM-as-a-judge).\n    \"\"\"\n    if not text: return 0.0\n    # Example: Score favors shorter, high-density answers\n    word_count = len(text.split())\n    return (1.0 / word_count) * 10 if word_count < 50 else 1.0\n\ndef evolve_prompt(current_prompt: str) -> str:\n    \"\"\"Uses the LLM to suggest a slightly better prompt version.\"\"\"\n    instruction = f\"Rewrite this prompt to be more effective at generating concise, high-density outputs:\\n\\n{current_prompt}\"\n    return call_llm(instruction, \"You are an expert prompt engineer.\")\n\ndef run_optimization_loop(initial_prompt: str):\n    best_prompt = initial_prompt\n    best_score = score_output(call_llm(best_prompt))\n    \n    for i in range(MAX_ITERATIONS):\n        candidate_prompt = evolve_prompt(best_prompt)\n        output = call_llm(candidate_prompt)\n        new_score = score_output(output)\n        \n        if new_score > best_score:\n            print(f\"Iteration {i}: Improvement found! Score: {new_score:.2f}\")\n            best_prompt = candidate_prompt\n            best_score = new_score\n            \n            with open(\"prompt.txt\", \"w\") as f: f.write(best_prompt)\n            subprocess.run([\"git\", \"add\", \"prompt.txt\"])\n            subprocess.run([\"git\", \"commit\", \"-m\", f\"Improvement {i}: score {new_score:.2f}\"])\n        else:\n            print(f\"Iteration {i}: No improvement (Score: {new_score:.2f})\")\n\nif __name__ == \"__main__\":\n    run_optimization_loop(\"Summarize the provided text.\")\n```\n\n## Why Greedy Hill-Climbing?\n\nIn prompt optimization, the \"state space\" of possible instructions is infinite. Greedy hill-climbing is the most efficient starting point because it respects the high cost of LLM tokens. By only accepting changes that increase your metric, you ensure that every API call either yields a better result or provides information about what *doesn't* work. \n\n**The Subprocess Pattern:** Using `subprocess` to trigger `git commit` creates an immutable audit trail. If a new prompt iteration introduces \"hallucination\" or unexpected formatting, you can `git checkout` the previous version immediately.\n\n## Common Pitfalls\n\n1. **Metric Gaming (Goodhart\u2019s Law):** If your metric is too simple (e.g., word count), the LLM will optimize for length rather than quality. Always include a \"coherence\" or \"accuracy\" component in your scoring function.\n2. **Circular Feedback:** If you use the same LLM to generate the prompt *and* evaluate it, the system may converge on an output that appeals to the model's internal biases rather than your users' needs. Use a different, stronger model for evaluation if possible.\n3. **The \"Local Optima\" Trap:** The optimizer might get stuck in a \"plateau\" where no single mutation improves the score. If this happens, introduce a \"temperature\" parameter to your mutation step, allowing for more drastic, experimental rewrites.\n\n## Advanced Strategies\n\nOnce this loop is stable, consider these improvements:\n- **Parallel Queries:** Use Python\u2019s `asyncio` to test 5 prompt variations simultaneously, selecting the best one per iteration.\n- **LLM-as-a-Judge:** Instead of a hardcoded scoring function, use a second, highly capable model (e.g., Claude 3.5 Sonnet) to assign a numerical score to the output based on a rubric.\n- **Cost Tracking:** Wrap your `call_llm` function in a decorator that sums the `usage.total_tokens` returned by the OpenRouter API to monitor budget in real-time.\n\nBy building this loop, you shift from guessing what works to measuring what works, providing a rigorous, repeatable foundation for all your future LLM feature development.", "D": "# Build a Minimal LLM Evaluation Loop in Python: Systematic Experiments for ML Engineers\n\nIf you want to transition from manual prompt testing to automated, repeatable experiments, an evaluation loop is essential. This tutorial guides you through building one using the OpenRouter API, emphasizing a lean approach for ML engineers familiar with Python and LLM APIs. We'll cover key steps from setup to execution, ensuring the implementation is understandable in under 10 minutes while avoiding over-engineered complexity.\n\n## What You Will Build\n\nBy the end of this tutorial, you'll have a Python script that:\n1. Sets up API calls with OpenRouter.\n2. Evaluates LLM outputs using a custom metric.\n3. Runs a greedy hill-climbing loop to iteratively improve outputs.\n4. Tracks costs and saves results to a TSV file for easy analysis.\n5. Uses git for versioning improvements.\n6. Includes enhanced error handling to make the process robust.\n\nThis setup allows you to systematically optimize prompts while maintaining control over costs and iterations.\n\n## What You Need\n\n- Python 3.10 or higher.\n- An OpenRouter API key (obtain one at openrouter.ai).\n- Install dependencies: `pip install httpx python-dotenv`.\n- Git installed and configured for versioning.\n\n## Step 1: Setup API Key and Constants\n\nStart by creating a `.env` file in your project directory with your API key:\n```plaintext\nOPENROUTE