{"type": "stage2_complete", "rankings": [{"letter": "A", "display_letter": "A", "avg_position": 1.25, "votes": 4}, {"letter": "D", "display_letter": "E", "avg_position": 1.25, "votes": 4}, {"letter": "C", "display_letter": "B", "avg_position": 2.0, "votes": 4}, {"letter": "B", "display_letter": "C", "avg_position": 2.25, "votes": 4}, {"letter": "E", "display_letter": "D", "avg_position": 3.25, "votes": 4}], "shuffle_map": {"A": "A", "C": "B", "B": "C", "E": "D", "D": "E"}, "votes": [{"model": "meta-llama/llama-4-maverick", "display_ranking": "C > A > E > B > D", "original_ranking": "B > A > D > C > E", "reasoning": "## Step 1: Evaluate Version A\nVersion A is comprehensive, covering all essential steps, and includes a complete, runnable Python code example with cost tracking, git versioning, and a worked example, making it strong in completeness and clarity.\n\n## Step 2: Evaluate Version C\nVersion C stands out for its flexibility and extensibility, implementing a multi-strategy optimization approach and a modular design that allows for easy replacement of components, enhancing its depth and code quality.\n\n## Step 3: Evaluate Version E\nVersion E provides a clear, step-by-step guide to building a minimal LLM evaluation loop, emphasizing a lean implementation with basic safeguards like error handling and cost monitoring, making it strong in clarity and correctness.\n\n## Step 4: Evaluate Version B\nVersion B is concise and effectively conveys the core concepts of building an evaluation loop using greedy hill-climbing, but it lacks some details on cost tracking and advanced strategies compared to other versions, affecting its completeness.\n\n## Step 5: Evaluate Version D\nVersion D is very similar to Version A but lacks some refinements such as explicit timeout handling in the initial code snippet and a detailed \"what you will build\" overview section, making it slightly less comprehensive.\n\n## Step 6: Compare All Versions\nComparing all versions based on the evaluation criteria:\n- **Correctness**: All versions have syntactically valid code, but some handle errors and edge cases better than others.\n- **Completeness**: Versions A, C, and E cover essential steps comprehensively.\n- **Clarity**: Versions A, C, and E are clear and well-structured, with Version E being particularly concise.\n- **Code Quality**: Versions A, C, and E demonstrate good code quality with meaningful variable names and basic error handling.\n- **Depth**: Version C stands out for its discussion of multiple optimization strategies and design decisions.\n\n## Step 7: Rank the Versions\nBased on the evaluation:\n- Version C excels in depth and flexibility.\n- Version A is comprehensive and clear.\n- Version E is concise and well-structured.\n- Version B is effective but lacks some details.\n- Version D is comprehensive but slightly less refined than Version A."}, {"model": "anthropic/claude-3-5-haiku", "display_ranking": "A > B > E > D > C", "original_ranking": "A > C > D > E > B", "reasoning": "Analysis of Versions:\n\nVersion A: Strong, comprehensive tutorial with clear structure and practical implementation. Covers all key aspects thoroughly, with good explanations of design choices and potential extensions.\n\nVersion B: Concise and pragmatic approach, with a more conversational tone. Slightly less comprehensive than A, but still provides solid technical guidance and insights into the optimization process.\n\nVersion C: More abstract and framework-oriented, with a focus on flexibility and extensibility. Less beginner-friendly, with a more complex implementation that might overwhelm new practitioners.\n\nVersion D: Very similar to Version A, but slightly less polished and with fewer nuanced explanations. Appears to be a less refined version of the same core content.\n\nVersion E: Solid implementation with good explanations, but feels slightly more verbose and less tightly structured compared to Version A. Provides good technical depth but lacks the crisp clarity of the top version.\n\nDetailed Evaluation:\n\nCorrectness:\n- A: Most precise and error-free implementation\n- B: Very solid, slightly less rigorous\n- C: More complex, introduces more potential points of failure\n- D: Nearly identical to A\n- E: Good, but with some potential complexity issues\n\nCompleteness:\n- A: Most comprehensive, covers all essential steps\n- B: Strong, but slightly less detailed\n- C: More abstract, misses some practical implementation details\n- D: Very similar to A\n- E: Good coverage, but less systematic\n\nClarity:\n- A: Extremely clear, step-by-step explanation\n- B: Conversational and engaging\n- C: More abstract, less immediately comprehensible\n- D: Similar to A, but slightly less crisp\n- E: Good, but occasionally overwrought\n\nCode Quality:\n- A: Cleanest, most idiomatic implementation\n- B: Pragmatic and solid\n- C: More complex, potentially over-engineered\n- D: Nearly identical to A\n- E: Good, but with slightly more complexity\n\nDepth:\n- A: Excellent balance of practical implementation and theoretical insight\n- B: Strong practical focus with good theoretical grounding\n- C: Most theoretical, least practical\n- D: Similar depth to A\n- E: Good depth, but occasionally meandering"}, {"model": "google/gemini-3.1-flash-lite-preview", "display_ranking": "B > E > C > A > D", "original_ranking": "C > D > B > A > E", "reasoning": "The evaluation of these tutorials centers on the balance between code robustness, pedagogical clarity, and adherence to the constraints of a \"minimal\" yet professional LLM evaluation loop.\n\n**Version B** is the strongest because it uses a clean, modular design with type hints and a well-explained \"Optimizer/Evaluator\" pattern that is highly extensible for an engineer. It provides the most thoughtful \"Common Pitfalls\" section and maintains a professional tone throughout.\n\n**Version E** is a very close second, offering excellent documentation and a slightly more \"production-ready\" approach to error handling (e.g., checking for file existence and graceful handling of API failures). It strikes the best balance between simplicity and robustness.\n\n**Version C** attempts a more advanced, object-oriented framework. While impressive, it risks being \"over-engineered\" for a 10-minute tutorial, and the code contains a logic error (`datetime` is used but not imported), which violates the correctness criterion.\n\n**Version A and Version D** are functionally identical. They are both solid, readable, and fulfill the requirements, but they are less \"clean\" than B and E. They lack type hints and rely on a slightly less robust file-reading approach (e.g., `open(\"artifact.txt\").read()` without checking for existence, which will crash the script on the first run if the file is missing). They are ranked below the others for these minor code quality/safety issues.\n\n*   **Version B:** Excellent structure, clear separation of concerns, and great professional advice on pitfalls.\n*   **Version E:** Very clear, well-commented, and robust code that feels like a solid foundation for an engineer.\n*   **Version C:** Ambitious and well-structured, but includes a Python `NameError` (missing `datetime` import) which hurts the correctness score.\n*   **Version A:** Simple and functional, but lacks the polish and error-handling robustness of B and E.\n*   **Version D:** Identical to A, but slightly less polished in its error handling (e.g., the file opening logic is even more prone to failure)."}, {"model": "x-ai/grok-3-mini-beta", "display_ranking": "E > A > D > C > B", "original_ranking": "D > A > E > B > C", "reasoning": "Below is my ranking of the versions from best to worst based on the evaluation criteria (Correctness, Completeness, Clarity, Code Quality, and Depth). I scored each version holistically out of 100 points, focusing on how well they align with the tutorial's goals for a minimal, understandable implementation.\n\n- **Version E**: This version excels in clarity and depth by providing detailed explanations of key decisions (e.g., why greedy hill-climbing and when to stop), while maintaining strong correctness and completeness, making it highly suitable for the target audience. (Score: 88/100)\n\n- **Version A**: It offers a balanced, complete tutorial with good code quality and explanations of tradeoffs and pitfalls, though it lacks some of the additional depth in E's worked examples. (Score: 85/100)\n\n- **Version D**: Nearly identical to Version A, it performs well across all criteria but doesn't introduce any unique enhancements, resulting in a slight tiebreaker disadvantage. (Score: 84/100)\n\n- **Version C**: While it demonstrates high depth and code quality through extensible features like multi-strategy optimization, it over-engineers for a \"minimal\" tutorial, potentially reducing clarity for intermediate users. (Score: 80/100)\n\n- **Version B**: This version is correct and clear in basics but falls short in completeness and depth due to its simplistic metric and lack of robust error handling or comprehensive result tracking. (Score: 72/100)"}], "model_names": {"A": "meta-llama/llama-4-maverick", "B": "anthropic/claude-3-5-haiku", "C": "google/gemini-3.1-flash-lite-preview", "D": "x-ai/grok-3-mini-beta"}}
{"type": "stage3_complete", "winner": "D", "winner_model": "x-ai/grok-3-mini-beta", "council_score": 95, "sub_scores": {"CORRECTNESS": 20, "COMPLETENESS": 20, "CLARITY": 18, "CODE_QUALITY": 19, "DEPTH": 18}, "critique": "Proposal D effectively addresses all critical components required for the tutorial, including API setup, metric definition, and the implementation of the evaluation loop with proper error handling. The clarity is strong, though a few sections could benefit from additional inline comments for novice readers. The code quality is high, adhering to Pythonic standards and ensuring safety with environment variable management. Depth is solid, with a good balance of explanation for design choices and potential trade-offs, but could further explore alternative optimization methods. Overall, this version represents a robust and comprehensive tutorial for ML engineers transitioning to automated LLM experimentation.", "chairman_full_response": "WINNER: D\nSCORE_CORRECTNESS: 20\nSCORE_COMPLETENESS: 20\nSCORE_CLARITY: 18\nSCORE_CODE_QUALITY: 19\nSCORE_DEPTH: 18\nCOUNCIL_SCORE: 95\n\nCRITIQUE:\nProposal D effectively addresses all critical components required for the tutorial, including API setup, metric definition, and the implementation of the evaluation loop with proper error handling. The clarity is strong, though a few sections could benefit from additional inline comments for novice readers. The code quality is high, adhering to Pythonic standards and ensuring safety with environment variable management. Depth is solid, with a good balance of explanation for design choices and potential trade-offs, but could further explore alternative optimization methods. Overall, this version represents a robust and comprehensive tutorial for ML engineers transitioning to automated LLM experimentation.", "chairman_model": "openai/gpt-4o-mini", "model_names": {"A": "meta-llama/llama-4-maverick", "B": "anthropic/claude-3-5-haiku", "C": "google/gemini-3.1-flash-lite-preview", "D": "x-ai/grok-3-mini-beta"}}
{"type": "iteration_result", "iteration": 4, "status": "DISCARD", "council_score": 95, "winner": "D", "best_score": 94, "commit": "ebb51dd", "spent_usd": 0.077976, "timestamp": "2026-04-03T14:33:17.944032Z"}
