{"type": "stage1_complete", "proposals": {"A": "# Build a Minimal LLM Evaluation Loop in Python: Systematic Experiments for ML Engineers\n\nIf you want to stop manually testing prompts and start running systematic experiments, an evaluation loop is the right tool. This tutorial shows you how to build one using the OpenRouter API, covering essential steps from API key setup to saving results.\n\n## What You Will Build\n\nBy the end of this tutorial, you will have a working Python script that:\n1. Makes LLM API calls using OpenRouter\n2. Scores the output using a custom metric\n3. Implements a greedy hill-climbing loop to improve the output\n4. Saves the best artifact to a file\n5. Tracks costs and iterations\n\n## What You Need\n\n- Python 3.10+\n- An OpenRouter API key (sign up at openrouter.ai)\n- `httpx` installed: `pip install httpx`\n- `python-dotenv` installed: `pip install python-dotenv`\n\n## Step 1: Setup API Key and Constants\n\nFirst, create a `.env` file in your project root with your OpenRouter API key:\n```plaintext\nOPENROUTER_API_KEY=sk-or-your-key-here\n```\n\n```python\nimport os\nimport httpx\nfrom dotenv import load_dotenv\n\nload_dotenv()  # Load environment variables from .env\n\nAPI_KEY = os.getenv(\"OPENROUTER_API_KEY\")\nAPI_URL = \"https://openrouter.ai/api/v1/chat/completions\"\nMODEL = \"openai/gpt-4o-mini\"\nMAX_ITERATIONS = 20\nCOST_PER_TOKEN = 0.000002  # Example cost, check OpenRouter pricing\n\ndef call_llm(prompt: str) -> str:\n    try:\n        response = httpx.post(\n            API_URL,\n            headers={\"Authorization\": f\"Bearer {API_KEY}\"},\n            json={\n                \"model\": MODEL,\n                \"messages\": [{\"role\": \"user\", \"content\": prompt}]\n            },\n            timeout=10.0  # Add timeout to prevent hanging\n        )\n        response.raise_for_status()  # Raise an exception for bad status codes\n        data = response.json()\n        return data[\"choices\"][0][\"message\"][\"content\"]\n    except httpx.RequestError as e:\n        print(f\"API request failed: {e}\")\n        return \"\"\n```\n\n## Step 2: Define a Metric Function\n\nYour metric function scores the LLM output. Higher is better. Here is a simple example that scores based on length and coherence:\n\n```python\ndef score(text: str) -> float:\n    words = len(text.split())\n    length_score = min(words / 200, 1.0)\n    # Simple coherence check: higher is better\n    coherence_score = len(set(text.split())) / words if words > 0 else 0\n    return 0.5 * length_score + 0.5 * coherence_score\n```\n\n## Step 3: Implement the Evaluation Loop with Cost Tracking\n\n```python\nimport json\n\ndef main():\n    best_score = 0.0\n    artifact = open(\"artifact.txt\").read()\n    total_cost = 0.0\n    results = []\n\n    for i in range(MAX_ITERATIONS):\n        prompt = f\"Improve this text:\\n\\n{artifact}\"\n        candidate = call_llm(prompt)\n        \n        if not candidate:  # Skip iteration if API call failed\n            continue\n        \n        new_score = score(candidate)\n        total_cost += COST_PER_TOKEN * (len(prompt) + len(candidate))  # Simplified cost calculation\n        \n        if new_score > best_score:\n            best_score = new_score\n            artifact = candidate\n            with open(\"artifact.txt\", \"w\") as f:\n                f.write(artifact)\n            print(f\"Iter {i}: KEEP  score={new_score:.2f}\")\n            results.append({\"iteration\": i, \"score\": new_score, \"action\": \"KEEP\", \"cost\": total_cost})\n        else:\n            print(f\"Iter {i}: DISCARD  score={new_score:.2f}  best={best_score:.2f}\")\n            results.append({\"iteration\": i, \"score\": new_score, \"action\": \"DISCARD\", \"cost\": total_cost})\n\n    # Save results to a JSON file for later analysis\n    with open(\"results.json\", \"w\") as f:\n        json.dump(results, f, indent=2)\n\nif __name__ == \"__main__\":\n    main()\n```\n\n## Step 4: Run Your Evaluation Loop\n\n```bash\npython loop.py\n```\n\nYou should see output like:\n\n```\nIter 0: KEEP  score=0.85\nIter 1: DISCARD  score=0.81  best=0.85\nIter 2: KEEP  score=0.91\nIter 3: DISCARD  score=0.88  best=0.91\n```\n\nThe artifact file is updated whenever a better version is found, and results are saved to `results.json`.\n\n## Why Greedy Hill-Climbing?\n\nGreedy hill-climbing is simple and effective for many optimization tasks. It always moves towards better solutions, making it suitable for improving LLM outputs. However, it may get stuck in local optima. Consider adding randomness or more sophisticated optimization techniques for complex tasks.\n\n## Common Pitfalls\n\n1. **Metric Gaming**: Ensure your metric accurately reflects the desired outcome. A poorly designed metric can lead to suboptimal or misleading results.\n2. **Circular Feedback**: Be cautious when using LLM outputs to evaluate other LLM outputs. This can create feedback loops that degrade performance over time.\n3. **Runaway Costs**: Always track costs and consider implementing a budget constraint to prevent unexpected expenses.\n\n## What's Next\n\nThis basic loop works, but you can enhance it further:\n- Query multiple models in parallel\n- Use git to version each improvement\n- Implement more sophisticated optimization strategies\n- Add more comprehensive error handling and logging\n\nBy following this tutorial, you've built a systematic evaluation loop for LLM experiments. This foundation allows you to scale your experiments, track progress, and optimize your prompts effectively.", "B": "# Build a Minimal LLM Evaluation Loop in Python\n\nIf you want to stop manually testing prompts and start running systematic experiments, an evaluation loop is the right tool. This tutorial shows you how to build one using the OpenRouter API.\n\n## What You Need\n\n- Python 3.10+\n- An OpenRouter API key (sign up at openrouter.ai)\n- `httpx` and `python-dotenv` installed: `pip install httpx python-dotenv`\n\n## Avoiding Common Pitfalls\n\nBefore diving into code, understand the key challenges in LLM evaluation:\n- Metric gaming: Your scoring function can be manipulated\n- Runaway costs: Unbounded API calls can quickly become expensive\n- Circular feedback: Repeated iterations might converge to a local optimum\n\n## Step 1: Secure API Configuration\n\n```python\nimport os\nfrom dotenv import load_dotenv\nimport httpx\n\n# Load API key securely from .env file\nload_dotenv()\nAPI_KEY = os.getenv(\"OPENROUTER_API_KEY\")\nif not API_KEY:\n    raise ValueError(\"No API key found. Create a .env file with OPENROUTER_API_KEY=your_key\")\n```\n\nThis approach prevents accidental key exposure and follows security best practices.\n\n## Step 2: Robust LLM API Call\n\n```python\nasync def call_llm(prompt: str, max_tokens: int = 500, timeout: float = 30.0) -> str:\n    try:\n        async with httpx.AsyncClient() as client:\n            response = await client.post(\n                \"https://openrouter.ai/api/v1/chat/completions\",\n                headers={\"Authorization\": f\"Bearer {API_KEY}\"},\n                json={\n                    \"model\": \"openai/gpt-4o-mini\",\n                    \"messages\": [{\"role\": \"user\", \"content\": prompt}],\n                    \"max_tokens\": max_tokens\n                },\n                timeout=timeout\n            )\n            response.raise_for_status()\n            return response.json()[\"choices\"][0][\"message\"][\"content\"]\n    except httpx.RequestError as e:\n        print(f\"API request failed: {e}\")\n        return \"\"\n    except KeyError:\n        print(\"Unexpected API response format\")\n        return \"\"\n```\n\nKey improvements:\n- Async support for better performance\n- Explicit timeout and max tokens\n- Comprehensive error handling\n- Graceful failure modes\n\n## Step 3: Sophisticated Scoring\n\n```python\nimport re\nfrom typing import Callable\n\ndef create_metric(criteria: dict[str, float]) -> Callable[[str], float]:\n    def score(text: str) -> float:\n        total_score = 0.0\n        for metric, weight in criteria.items():\n            if metric == 'length':\n                total_score += min(len(text.split()) / 200, 1.0) * weight\n            elif metric == 'complexity':\n                # Measure linguistic complexity\n                sentences = len(re.findall(r'\\w+[.!?]', text))\n                unique_words = len(set(text.split()))\n                total_score += min((sentences * unique_words) / 1000, 1.0) * weight\n        return min(total_score, 1.0)\n    return score\n```\n\nThis metric allows:\n- Weighted scoring across multiple dimensions\n- Easy customization for different evaluation needs\n- Normalized scores between 0-1\n\n## Step 4: Evaluation Loop\n\n```python\nimport asyncio\n\nasync def evaluation_loop(\n    initial_artifact: str, \n    score_fn: Callable[[str], float], \n    max_iterations: int = 20,\n    budget: float = 10.0\n):\n    current_artifact = initial_artifact\n    best_score = score_fn(current_artifact)\n    total_cost = 0.0\n\n    for iteration in range(max_iterations):\n        improvement_prompt = f\"Improve this text, focusing on clarity and depth:\\n\\n{current_artifact}\"\n        candidate = await call_llm(improvement_prompt)\n        \n        # Estimated cost (adjust based on actual OpenRouter pricing)\n        iteration_cost = 0.05  \n        total_cost += iteration_cost\n\n        if total_cost > budget:\n            print(f\"Budget exceeded after {iteration} iterations\")\n            break\n\n        new_score = score_fn(candidate)\n        if new_score > best_score:\n            current_artifact = candidate\n            best_score = new_score\n            print(f\"Iteration {iteration}: IMPROVED (Score: {new_score:.2f})\")\n        else:\n            print(f\"Iteration {iteration}: No improvement\")\n\n    return current_artifact\n```\n\n## Running the Experiment\n\n```python\nasync def main():\n    initial_text = open(\"artifact.txt\").read()\n    scoring_criteria = {\n        'length': 0.4,\n        'complexity': 0.6\n    }\n    metric = create_metric(scoring_criteria)\n    \n    result = await evaluation_loop(initial_text, metric)\n    \n    with open(\"improved_artifact.txt\", \"w\") as f:\n        f.write(result)\n\nasyncio.run(main())\n```\n\nThis implementation provides a robust, flexible framework for systematic LLM artifact improvement.", "C": "# Build a Minimal LLM Evaluation Loop in Python\n\nMoving from manual prompt engineering to automated optimization requires a systematic \"evaluation loop\"\u2014a mechanism to propose changes, score them objectively, and iterate based on performance. This tutorial builds a lean, greedy hill-climbing loop that moves your prompts toward a target metric.\n\n## What You Will Build\nWe will construct a Python-based experiment harness. It reads a base prompt, asks an LLM to refine it, evaluates the output against a numeric metric, and persists the winner. We use the OpenRouter API for model access and implement robust HTTP handling to ensure your loop doesn't crash on transient network errors.\n\n## Prerequisites\n- **Python 3.10+**\n- **Environment Variable:** Set `OPENROUTER_API_KEY` in your shell.\n- **Dependencies:** `pip install httpx python-dotenv`\n\n## Implementation\n\n### 1. Robust API Integration\nWe use `httpx` with a timeout and error handling. Hardcoding keys is a security risk; we fetch the key from the environment.\n\n```python\nimport os\nimport httpx\nfrom dotenv import load_dotenv\n\nload_dotenv()\nAPI_KEY = os.getenv(\"OPENROUTER_API_KEY\")\n\ndef call_llm(prompt: str) -> str:\n    try:\n        response = httpx.post(\n            \"https://openrouter.ai/api/v1/chat/completions\",\n            headers={\"Authorization\": f\"Bearer {API_KEY}\", \"HTTP-Referer\": \"https://localhost\"},\n            json={\n                \"model\": \"openai/gpt-4o-mini\",\n                \"messages\": [{\"role\": \"user\", \"content\": prompt}],\n                \"temperature\": 0.7\n            },\n            timeout=30.0\n        )\n        response.raise_for_status()\n        return response.json()[\"choices\"][0][\"message\"][\"content\"]\n    except Exception as e:\n        print(f\"API Error: {e}\")\n        return \"\"\n```\n\n### 2. Defining the Metric\nA loop is only as good as its feedback signal. For this example, we optimize for \"conciseness and clarity,\" rewarding outputs that stay under 100 words but contain a required keyword (e.g., \"Python\").\n\n```python\ndef score(text: str) -> float:\n    word_count = len(text.split())\n    # Reward: 1.0 if under 100 words, 0.5 otherwise. Add 0.5 if 'Python' is present.\n    s = 1.0 if word_count <= 100 else 0.5\n    if \"Python\" in text:\n        s += 0.5\n    return s\n```\n\n### 3. The Evaluation Loop\nWe implement a greedy hill-climbing algorithm. We track the `best_score` and only overwrite the artifact if the new version performs strictly better.\n\n```python\nimport time\n\ndef run_loop(iterations=10):\n    with open(\"prompt.txt\", \"r\") as f:\n        current_prompt = f.read()\n\n    best_score = score(current_prompt)\n    \n    for i in range(iterations):\n        print(f\"Iteration {i+1}...\")\n        candidate = call_llm(f\"Refine this prompt for clarity and brevity: {current_prompt}\")\n        \n        if not candidate: continue\n        \n        new_score = score(candidate)\n        \n        if new_score > best_score:\n            best_score = new_score\n            current_prompt = candidate\n            with open(\"prompt.txt\", \"w\") as f:\n                f.write(current_prompt)\n            print(f\"  [KEEP] Score: {new_score}\")\n        else:\n            print(f\"  [DISCARD] Score: {new_score}\")\n        \n        time.sleep(1) # Rate limit protection\n```\n\n## Why Greedy Hill-Climbing?\nIn LLM optimization, the \"loss landscape\" is noisy and discrete. A greedy approach is computationally efficient: it minimizes API costs by only committing to changes that demonstrate immediate, measurable improvement. While this can get stuck in local optima, it is the standard starting point for prompt optimization because it requires no massive datasets or complex training infrastructure.\n\n## Common Pitfalls\n1. **Metric Gaming:** If your metric is too simple (e.g., just word count), the LLM will learn to produce gibberish that satisfies the length constraint. Your metric must be a proxy for the *actual* quality you desire.\n2. **Circular Feedback:** If you use the LLM to rewrite a prompt, and the model's instructions are too vague, it may slowly degrade the prompt's intent. Always include a \"system instruction\" or \"golden rule\" in your prompt that the model is forbidden to change.\n3. **Runaway Costs:** Always verify your per-iteration cost. Even small models add up when running hundreds of iterations.\n\n## Next Steps\nTo evolve this into a production-grade system:\n*   **Cost Tracking:** Log `usage` metadata from the OpenRouter response to monitor spend.\n*   **Parallelism:** Use `asyncio` to fire 5 concurrent requests and pick the best one of the batch (a \"best-of-N\" strategy).\n*   **Git Integration:** Use `subprocess.run([\"git\", \"commit\", \"-am\", \"...\"])` inside the `KEEP` block to create a version-controlled history of your prompt evolution.", "D": "# Build a Minimal LLM Evaluation Loop in Python\n\nIf you're an ML engineer tired of one-off prompt experiments and ready to implement systematic optimization, this tutorial guides you through building a simple evaluation loop using the OpenRouter API. By the end, you'll have a lean, repeatable system that automates prompt refinement, ensuring you can track improvements without over-engineered tools.\n\n## What You Will Build\n\nThis tutorial walks you through creating a basic greedy hill-climbing loop. It starts with an initial artifact (like a piece of text), iteratively prompts an LLM to improve it, scores each candidate using a custom metric, and retains only the best versions. You'll use Python 3.10+ to handle API calls, evaluation, and file updates securely. The result is a script you can run in under 10 minutes, helping you transition from manual tweaks to automated workflows while keeping things minimal and understandable.\n\n## What You Need\n\n- Python 3.10 or higher\n- An OpenRouter API key (obtain one from openrouter.ai and set it as an environment variable named `OPENROUTER_API_KEY`)\n- The `httpx` library for HTTP requests: Install it via `pip install httpx`\n- Basic familiarity with environment variables (e.g., using a `.env` file and the `python-dotenv` library for local development)\n\nWe'll avoid over-engineering by focusing on a single, runnable code example that you can extend.\n\n## Step 1: Make an LLM API Call\n\nTo interact with the OpenRouter API, we need a function that sends a prompt and retrieves the response. This function includes error handling to manage common issues like network failures or invalid responses, ensuring the loop doesn't crash unexpectedly.\n\n```python\nimport httpx\nimport os\nfrom typing import Optional\n\ndef call_llm(prompt: str) -> Optional[str]:\n    api_key = os.environ.get(\"OPENROUTER_API_KEY\")\n    if not api_key:\n        raise ValueError(\"OPENROUTER_API_KEY environment variable is not set.\")\n    \n    try:\n        response = httpx.post(\n            \"https://openrouter.ai/api/v1/chat/completions\",\n            headers={\"Authorization\": f\"Bearer {api_key}\"},\n            json={\n                \"model\": \"openai/gpt-4o-mini\",\n                \"messages\": [{\"role\": \"user\", \"content\": prompt}]\n            },\n            timeout=10  # Add a 10-second timeout to prevent hanging\n        )\n        response.raise_for_status()  # Raise an error for HTTP failures\n        data = response.json()\n        return data[\"choices\"][0][\"message\"][\"content\"]\n    except httpx.HTTPError as e:\n        print(f\"API request failed: {e}\")\n        return None  # Graceful failure; loop can handle this\n    except KeyError:\n        print(\"Unexpected response format from API\")\n        return None\n```\n\nThis function checks for the API key in your environment, makes the request with a timeout to avoid indefinite waits, and handles exceptions. If the call fails, it returns None, allowing the evaluation loop to skip or log the iteration.\n\n## Step 2: Define a Metric\n\nA metric is essential for quantifying improvements. It takes the LLM's output and returns a score (higher is better). For this example, we'll use a simple word-count-based metric, but in practice, you'd replace it with something domain-specific, like an F1 score or an LLM-evaluated rubric.\n\n```python\ndef score(text: str) -> float:\n    \"\"\"\n    Scores text based on word count, normalized to a maximum of 1.0.\n    In a real scenario, use a more meaningful metric, such as accuracy or semantic similarity.\n    \"\"\"\n    words = len(text.split())\n    return min(words / 200, 1.0)  # Cap at 1.0 for texts longer than 200 words\n```\n\nThis metric encourages longer responses up to a point, but you should adapt it to your needs. For instance, if optimizing for concise outputs, invert the logic or use a library like `sacrebleu` for advanced evaluations.\n\n## Step 3: Write the Evaluation Loop\n\nThe core of the system is the loop, which uses greedy hill-climbing to iteratively improve the artifact. It generates candidates, scores them, and updates only if there's an improvement. We've added features like result logging to a TSV file for easy analysis, addressing completeness by tracking iterations systematically.\n\n```python\nimport os\n\nbest_score = 0.0\nartifact = \"\"  # Start with an empty string; in practice, load from a file\nresults_file = \"results.tsv\"  # File to save iteration results\n\n# Write header for TSV\nwith open(results_file, \"w\") as f:\n    f.write(\"iteration\\tscore\\taction\\n\")\n\nfor i in range(20):  # Run for 20 iterations; adjust as needed\n    prompt = f\"Improve this text:\\n\\n{artifact}\"\n    candidate = call_llm(prompt)\n    \n    if candidate is not None:  # Only score if API call succeeded\n        new_score = score(candidate)\n        \n        with open(results_file, \"a\") as f:  # Log to TSV\n            action = \"KEEP\" if new_score > best_score else \"DISCARD\"\n            f.write(f\"{i}\\t{new_score:.2f}\\t{action}\\n\")\n        \n        if new_score > best_score:\n            best_score = new_score\n            artifact = candidate\n            with open(\"artifact.txt\", \"w\") as f:  # Save improved artifact\n                f.write(artifact)\n            print(f\"Iter {i}: KEEP  score={new_score:.2f}\")\n        else:\n            print(f\"Iter {i}: DISCARD  score={new_score:.2f}  best={best_score:.2f}\")\n    else:\n        print(f\"Iter {i}: SKIPPED due to API error\")\n```\n\nThis loop is idiomatic Python, with meaningful variable names and basic safeguards. It saves results to a TSV file, making it easy to review progress later, and handles API failures by skipping iterations.\n\n## Step 4: Run It\n\nSave the code in a file named `loop.py`, set your `OPENROUTER_API_KEY` environment variable (e.g., via `export OPENROUTER_API_KEY=your_key` in your terminal or using a `.env` file with `python-dotenv`), and run:\n\n```bash\npython loop.py\n```\n\nYou'll see output like:\n\n```\nIter 0: KEEP  score=0.85\nIter 1: DISCARD  score=0.81  best=0.85\nIter 2: KEEP  score=0.91\n```\n\nThe `artifact.txt` file will contain the latest best version, and `results.tsv` will log all scores for analysis.\n\n## Common Pitfalls\n\nWhile this setup is straightforward, be aware of potential issues. Metric gaming can occur if the LLM learns to optimize for your scoring function rather than genuine quality\u2014 for example, if your metric rewards length, outputs might become verbose nonsense. To mitigate this, use diverse 