{"type": "stage2_complete", "rankings": [{"letter": "C", "display_letter": "D", "avg_position": 1.25, "votes": 4}, {"letter": "A", "display_letter": "B", "avg_position": 1.25, "votes": 4}, {"letter": "D", "display_letter": "C", "avg_position": 1.75, "votes": 4}, {"letter": "B", "display_letter": "E", "avg_position": 2.25, "votes": 4}, {"letter": "E", "display_letter": "A", "avg_position": 3.5, "votes": 4}], "shuffle_map": {"B": "A", "E": "B", "D": "C", "C": "D", "A": "E"}, "votes": [{"model": "meta-llama/llama-4-maverick", "display_ranking": "E > D > B > C > A", "original_ranking": "B > C > A > D > E", "reasoning": "## Step 1: Evaluate Version B\nVersion B is strong due to its comprehensive coverage of essential steps, clear explanations, and robust implementation with features like cost tracking and git versioning.\n\n## Step 2: Evaluate Version E\nVersion E stands out for its advanced features such as intelligent API retry, multi-strategy optimization, and pluggable scoring strategies, making it highly extensible and robust.\n\n## Step 3: Evaluate Version D\nVersion D is notable for its modular structure, clear explanations of key concepts like greedy hill-climbing, and discussion of common pitfalls, making it both practical and insightful.\n\n## Step 4: Evaluate Version C\nVersion C is commendable for its lean implementation, enhanced error handling, and clear explanations, although it lacks some advanced features present in other versions.\n\n## Step 5: Evaluate Version A\nVersion A provides a solid foundation with a basic evaluation loop, cost tracking, and git versioning, but it is less comprehensive and lacks some advanced features and explanations.\n\n## Step 6: Compare All Versions\nComparing all versions based on the evaluation criteria: correctness, completeness, clarity, code quality, and depth.\n\n- Version E excels in depth and code quality due to its advanced features.\n- Version B and Version D are strong in clarity and completeness.\n- Version C is a good balance but lacks some depth.\n- Version A is the most basic but still covers essential steps.\n\n## Step 7: Rank the Versions\nBased on the evaluation, Version E is the most advanced and robust. Version D and Version B follow closely due to their clarity, completeness, and practical insights. Version C is a solid implementation, and Version A, while basic, still provides a good foundation."}, {"model": "anthropic/claude-3-5-haiku", "display_ranking": "B > E > D > C > A", "original_ranking": "A > B > C > D > E", "reasoning": "Evaluation of Versions:\n\nVersion B (Excellent):\n- Very strong overall implementation with clear structure, comprehensive explanation\n- Covers all evaluation criteria thoroughly: correctness, completeness, clarity, code quality, and depth\n- Provides robust error handling, git versioning, and thoughtful design choices\n- Includes advanced configuration options and future enhancement suggestions\n\nVersion E (Very Good):\n- Highly sophisticated approach with advanced architectural patterns\n- Strong on code quality and depth, with pluggable scoring strategies\n- Slightly more complex than needed, which might reduce clarity for target audience\n- Excellent exploration of design trade-offs and architectural flexibility\n\nVersion D (Good):\n- Solid implementation with clear explanations of design choices\n- Strong focus on systematic optimization and practical considerations\n- Slightly less comprehensive in error handling compared to B and E\n- Good balance of technical depth and readability\n\nVersion C (Solid):\n- Comprehensive tutorial with good explanations\n- Covers most key points but slightly less polished in implementation\n- Slightly more verbose than ideal, which might reduce readability\n- Good coverage of common pitfalls and design rationales\n\nVersion A (Basic):\n- Most basic implementation\n- Lacks some of the nuanced error handling and design considerations of other versions\n- Less depth in explaining design choices and trade-offs\n- Provides a foundational approach but misses some advanced features\n\nReasoning synthesis:\n- B stands out for its comprehensive, balanced approach\n- E is technically impressive but potentially over-engineered\n- D and C provide solid, practical implementations\n- A serves as a basic starting point but lacks sophistication"}, {"model": "google/gemini-3.1-flash-lite-preview", "display_ranking": "D > C > B > A > E", "original_ranking": "C > D > A > E > B", "reasoning": "The versions have been evaluated based on the criteria of correctness, completeness, clarity, code quality, and depth.\n\n*   **Version D** is the best because it provides a complete, well-structured, and highly readable implementation, includes thoughtful design justifications (why the subprocess pattern is used), and provides excellent, actionable advice on advanced strategies.\n*   **Version C** is very strong, offering a clean implementation with robust error handling, detailed explanations of design choices, and practical additions like TSV export and git safety checks.\n*   **Version B** is a solid, functional tutorial that is easy to follow, though it lacks the depth of design justification and the robustness of error handling found in C and D.\n*   **Version A** is functionally similar to B but slightly less polished, as it lacks the initial file check logic (it will crash if `artifact.txt` is missing) and is less comprehensive in its explanations.\n*   **Version E** is the worst for this specific prompt; while it technically implements the most \"advanced\" code, it fails the \"minimal\" constraint by introducing unnecessary complexity (protocols, custom classes, `structlog`) and leaves the most critical logic (the actual optimization loop) as empty `pass` placeholders, making it non-runnable.\n\nReasoning:\n*   **Version D:** Provides the best balance of clear prose, high-quality code, and insightful commentary on the \"why\" behind the implementation.\n*   **Version C:** Highly practical and robust, with excellent handling of file operations and git state.\n*   **Version B:** A good, standard tutorial that meets all requirements but offers less depth than C or D.\n*   **Version A:** Functional and clear, but lacks the file-existence safety checks present in other versions.\n*   **Version E:** Over-engineered for a \"minimal\" tutorial and incomplete, as the core logic is not implemented."}, {"model": "x-ai/grok-3-mini-beta", "display_ranking": "C > B > D > A > E", "original_ranking": "D > A > C > E > B", "reasoning": "Below is my ranking of the versions (A, B, C, D, and E) from best to worst based on the evaluation criteria. I judged each solely on quality, scoring them holistically across correctness, completeness, clarity, code quality, and depth. Here's a brief one-sentence reasoning for each:\n\n- **Version C**: This version excels in completeness and clarity with enhanced features like TSV saving, robust error handling, and a worked example, while maintaining solid code quality and depth in explaining design decisions.  \n- **Version B**: It offers a well-structured and clear tutorial with good code quality, completeness in tracking costs and git versioning, and sufficient depth, though it could improve on advanced error handling.  \n- **Version D**: The implementation is modular and provides strong depth in discussing pitfalls and strategies, but it falls short in completeness and code quality due to potential bugs and less robust error handling.  \n- **Version A**: It covers the essentials with decent clarity and basic depth, but lacks completeness in areas like advanced error handling and result saving, making it less polished overall.  \n- **Version E**: While it shows ambition with advanced features like retry mechanisms and pluggable strategies, its incompleteness (e.g., placeholder functions) undermines correctness and practicality, reducing its overall quality."}], "model_names": {"A": "meta-llama/llama-4-maverick", "B": "anthropic/claude-3-5-haiku", "C": "google/gemini-3.1-flash-lite-preview", "D": "x-ai/grok-3-mini-beta"}}
{"type": "stage3_complete", "winner": "C", "winner_model": "google/gemini-3.1-flash-lite-preview", "council_score": 92, "sub_scores": {"CORRECTNESS": 20, "COMPLETENESS": 18, "CLARITY": 19, "CODE_QUALITY": 18, "DEPTH": 17}, "critique": "Proposal C effectively lays out a systematic approach to LLM prompt optimization, with clear instructions and well-structured code. The explanation of the greedy hill-climbing approach is insightful, providing context for design decisions. However, it could benefit from a more robust discussion of potential pitfalls and alternative strategies for exploring the solution space. Overall, the proposal is strong, but additional depth in certain areas could enhance its educational value. Future iterations might explore integrating more advanced optimization techniques or expanding on the implications of the scoring metrics used.", "chairman_full_response": "WINNER: C\nSCORE_CORRECTNESS: 20\nSCORE_COMPLETENESS: 18\nSCORE_CLARITY: 19\nSCORE_CODE_QUALITY: 18\nSCORE_DEPTH: 17\nCOUNCIL_SCORE: 92\n\nCRITIQUE:\nProposal C effectively lays out a systematic approach to LLM prompt optimization, with clear instructions and well-structured code. The explanation of the greedy hill-climbing approach is insightful, providing context for design decisions. However, it could benefit from a more robust discussion of potential pitfalls and alternative strategies for exploring the solution space. Overall, the proposal is strong, but additional depth in certain areas could enhance its educational value. Future iterations might explore integrating more advanced optimization techniques or expanding on the implications of the scoring metrics used.", "chairman_model": "openai/gpt-4o-mini", "model_names": {"A": "meta-llama/llama-4-maverick", "B": "anthropic/claude-3-5-haiku", "C": "google/gemini-3.1-flash-lite-preview", "D": "x-ai/grok-3-mini-beta"}}
{"type": "iteration_result", "iteration": 10, "status": "DISCARD", "council_score": 92, "winner": "C", "best_score": 94, "commit": "ebb51dd", "spent_usd": 0.300232, "timestamp": "2026-04-03T14:41:53.172411Z"}
