{"type": "stage1_complete", "proposals": {"A": "# Build a Minimal LLM Evaluation Loop in Python: Systematic Experiments for ML Engineers\n\nIf you want to stop manually testing prompts and start running systematic experiments, an evaluation loop is the right tool. This tutorial shows you how to build one using the OpenRouter API, covering essential steps from API key setup to saving results.\n\n## What You Will Build\n\nBy the end of this tutorial, you will have a working Python script that:\n1. Makes LLM API calls using OpenRouter\n2. Scores the output using a custom metric\n3. Implements a greedy hill-climbing loop to improve the output\n4. Saves the best artifact to a file\n5. Tracks costs and iterations\n6. Versions improvements using git\n7. Supports parallel queries to multiple models for comparison\n\n## Understanding the Evaluation Loop\n\nBefore diving into the code, let's outline the key components and flow of the evaluation loop:\n- **API Setup**: Configuring the OpenRouter API key and endpoint.\n- **Metric Definition**: Creating a function to score the LLM outputs.\n- **Hill-Climbing Loop**: Iteratively improving the artifact based on the scores.\n- **Version Control**: Using git to track improvements.\n- **Cost Tracking**: Monitoring the cost of API calls.\n\n## Step 1: Setup API Key and Constants\n\nFirst, create a `.env` file in your project root with your OpenRouter API key:\n```plaintext\nOPENROUTER_API_KEY=sk-or-your-key-here\n```\n\n```python\nimport os\nimport httpx\nfrom dotenv import load_dotenv\nimport asyncio\nimport json\nimport subprocess\nfrom typing import List, Dict\n\nload_dotenv()  # Load environment variables from .env\n\nAPI_KEY = os.getenv(\"OPENROUTER_API_KEY\")\nAPI_URL = \"https://openrouter.ai/api/v1/chat/completions\"\nMODELS = [\"openai/gpt-4o-mini\", \"meta-llama/llama-3.1-8b-instruct\"]\nMAX_ITERATIONS = 20\nCOST_PER_TOKEN = 0.000002  # Example cost, check OpenRouter pricing\n\nasync def call_llm(model: str, prompt: str) -> str:\n    \"\"\"\n    Makes an asynchronous call to the LLM API.\n\n    Args:\n    - model (str): The model to use for the LLM call.\n    - prompt (str): The prompt to send to the LLM.\n\n    Returns:\n    - str: The response from the LLM.\n    \"\"\"\n    try:\n        async with httpx.AsyncClient() as client:\n            response = await client.post(\n                API_URL,\n                headers={\"Authorization\": f\"Bearer {API_KEY}\"},\n                json={\n                    \"model\": model,\n                    \"messages\": [{\"role\": \"user\", \"content\": prompt}]\n                },\n                timeout=10.0\n            )\n            response.raise_for_status()\n            data = response.json()\n            return data[\"choices\"][0][\"message\"][\"content\"]\n    except httpx.RequestError as e:\n        print(f\"API request failed: {e}\")\n        return \"\"\n\ndef score(text: str) -> float:\n    \"\"\"\n    Scores the given text based on length and coherence.\n\n    Args:\n    - text (str): The text to score.\n\n    Returns:\n    - float: The score of the text.\n    \"\"\"\n    words = len(text.split())\n    length_score = min(words / 200, 1.0)\n    coherence_score = len(set(text.split())) / words if words > 0 else 0\n    return 0.5 * length_score + 0.5 * coherence_score\n\nasync def main():\n    best_score = 0.0\n    artifact = open(\"artifact.txt\").read().strip()\n    total_cost = 0.0\n    results: List[Dict] = []\n\n    try:\n        subprocess.run([\"git\", \"rev-parse\"], check=True, capture_output=True)\n    except subprocess.CalledProcessError:\n        subprocess.run([\"git\", \"init\"], check=True)\n        subprocess.run([\"git\", \"add\", \"artifact.txt\"], check=True)\n        subprocess.run([\"git\", \"commit\", \"-m\", \"Initial artifact\"], check=True)\n\n    for i in range(MAX_ITERATIONS):\n        prompt = f\"Improve this text:\\n\\n{artifact}\"\n        tasks = [call_llm(model, prompt) for model in MODELS]\n        candidates = await asyncio.gather(*tasks)\n        \n        best_candidate = None\n        best_model_score = 0.0\n        \n        for model, candidate in zip(MODELS, candidates):\n            if not candidate:  \n                continue\n            \n            new_score = score(candidate)\n            total_cost += COST_PER_TOKEN * (len(prompt) + len(candidate))  \n            \n            if new_score > best_model_score:\n                best_model_score = new_score\n                best_candidate = candidate\n        \n        if best_candidate and best_model_score > best_score:\n            best_score = best_model_score\n            artifact = best_candidate.strip()\n            with open(\"artifact.txt\", \"w\") as f:\n                f.write(artifact)\n            subprocess.run([\"git\", \"add\", \"artifact.txt\"], check=True)\n            subprocess.run([\"git\", \"commit\", \"-m\", f\"Iter {i}: Improved artifact\"], check=True)\n            print(f\"Iter {i}: KEEP  score={best_model_score:.2f}\")\n            results.append({\"iteration\": i, \"score\": best_model_score, \"action\": \"KEEP\", \"cost\": total_cost})\n        else:\n            print(f\"Iter {i}: DISCARD  best_score={best_score:.2f}\")\n            results.append({\"iteration\": i, \"score\": best_model_score if best_candidate else 0, \"action\": \"DISCARD\", \"cost\": total_cost})\n\n    with open(\"results.json\", \"w\") as f:\n        json.dump(results, f, indent=2)\n\nif __name__ == \"__main__\":\n    asyncio.run(main())\n```\n\n## Step 2: Run Your Evaluation Loop\n\n```bash\npython loop.py\n```\n\nYou should see output like:\n\n```\nIter 0: KEEP  score=0.85\nIter 1: DISCARD  best_score=0.85\nIter 2: KEEP  score=0.91\nIter 3: DISCARD  best_score=0.91\n```\n\nThe artifact file is updated and committed to git whenever a better version is found, and results are saved to `results.json`.\n\n## Why Greedy Hill-Climbing with Parallel Model Queries?\n\nGreedy hill-climbing is simple and effective for many optimization tasks. By querying multiple models in parallel, you can compare their performance directly within the same loop, providing valuable insights into model selection for your specific task. This approach helps in identifying the most suitable model while optimizing the output.\n\n## Tradeoffs and Limitations\n\nWhile greedy hill-climbing with parallel queries is straightforward and effective, it may still get stuck in local optima. Consider adding randomness or more sophisticated optimization techniques for complex tasks. Additionally, be mindful of the cost implications of querying multiple models.\n\n## Common Pitfalls\n\n1. **Metric Gaming**: Ensure your metric accurately reflects the desired outcome. A poorly designed metric can lead to suboptimal or misleading results.\n2. **Circular Feedback**: Be cautious when using LLM outputs to evaluate other LLM outputs. This can create feedback loops that degrade performance over time.\n3. **Runaway Costs**: Always track costs and consider implementing a budget constraint to prevent unexpected expenses.\n\n## Advanced Tips for Optimization\n\nTo further enhance your evaluation loop, consider the following strategies:\n- **Simulated Annealing**: Introduce randomness into the hill-climbing process to avoid local optima.\n- **Multi-Objective Optimization**: Use multiple metrics to evaluate the LLM outputs, providing a more comprehensive assessment.\n- **Model Selection**: Dynamically select the best performing model based on the scores obtained during the iterations.\n\n## Worked Example\n\nLet's say you start with a simple artifact: \"The quick brown fox jumps over the lazy dog.\" After running the evaluation loop, the artifact might improve to: \"The quick brown fox jumps over the lazy dog, demonstrating a classic example of a pangram that uses all the letters of the alphabet efficiently.\" The score improves from 0.4 to 0.8 as the output becomes more coherent and contextually relevant.\n\n## Visualizing Results\n\nTo better understand the progress of your evaluation loop, you can visualize the scores and costs over iterations using a plotting library like `matplotlib`.\n\n```python\nimport matplotlib.pyplot as plt\nimport json\n\nwith open(\"results.json\", \"r\") as f:\n    results = json.load(f)\n\nscores = [result[\"score\"] for result in results]\ncosts = [result[\"cost\"] for result in results]\n\nplt.figure(figsize=(10, 5))\nplt.subplot(1, 2, 1)\nplt.plot(scores)\nplt.title(\"Scores Over Iterations\")\nplt.xlabel(\"Iteration\")\nplt.ylabel(\"Score\")\n\nplt.subplot(1, 2, 2)\nplt.plot(costs)\nplt.title(\"Costs Over Iterations\")\nplt.xlabel(\"Iteration\")\nplt.ylabel(\"Cost\")\n\nplt.tight_layout()\nplt.show()\n```\n\n## What's Next\n\nThis basic loop works, but you can enhance it further:\n- Implement more sophisticated optimization strategies like simulated annealing\n- Add more comprehensive error handling and logging mechanisms\n- Experiment with different model combinations to find the best fit for your task\n\nBy following this tutorial, you've built a systematic evaluation loop for LLM experiments that not only optimizes your prompts but also versions your improvements using git and compares multiple models. This foundation allows you to scale your experiments, track progress, and optimize your prompts effectively.", "B": "# Build a Minimal LLM Evaluation Loop in Python: Systematic Experiments for ML Engineers\n\nIf you want to stop manually testing prompts and start running systematic experiments, an evaluation loop is the right tool. This tutorial shows you how to build one using the OpenRouter API, covering essential steps from API key setup to saving results.\n\n## What You Will Build\n\nBy the end of this tutorial, you will have a working Python script that:\n1. Makes LLM API calls using OpenRouter\n2. Scores the output using a custom metric\n3. Implements an adaptive optimization loop with multiple strategies\n4. Saves the best artifact to a file\n5. Tracks costs and iterations\n6. Versions improvements using git\n7. Supports parallel queries to multiple models for comparison\n\n## What You Need\n\n- Python 3.10+\n- An OpenRouter API key (sign up at openrouter.ai)\n- `httpx` installed: `pip install httpx`\n- `python-dotenv` installed: `pip install python-dotenv`\n- Git installed and configured\n\n## Step 1: Setup API Key and Constants\n\nFirst, create a `.env` file in your project root with your OpenRouter API key:\n```plaintext\nOPENROUTER_API_KEY=sk-or-your-key-here\n```\n\n```python\nimport os\nimport httpx\nfrom dotenv import load_dotenv\nimport asyncio\nimport json\nimport subprocess\nimport random\nfrom typing import List, Dict, Optional\n\nload_dotenv()  # Load environment variables from .env\n\nAPI_KEY = os.getenv(\"OPENROUTER_API_KEY\")\nAPI_URL = \"https://openrouter.ai/api/v1/chat/completions\"\nMODELS = [\"openai/gpt-4o-mini\", \"meta-llama/llama-3.1-8b-instruct\"]\nMAX_ITERATIONS = 20\nCOST_PER_TOKEN = 0.000002  # Example cost, check OpenRouter pricing\nOPTIMIZATION_STRATEGIES = [\"temperature\", \"top_p\", \"presence_penalty\"]\n\nasync def call_llm(model: str, prompt: str, strategy_params: Optional[Dict] = None) -> str:\n    try:\n        async with httpx.AsyncClient() as client:\n            request_params = {\n                \"model\": model,\n                \"messages\": [{\"role\": \"user\", \"content\": prompt}],\n                **(strategy_params or {})\n            }\n            response = await client.post(\n                API_URL,\n                headers={\"Authorization\": f\"Bearer {API_KEY}\"},\n                json=request_params,\n                timeout=10.0\n            )\n            response.raise_for_status()\n            data = response.json()\n            return data[\"choices\"][0][\"message\"][\"content\"]\n    except httpx.RequestError as e:\n        print(f\"API request failed: {e}\")\n        return \"\"\n\ndef score(text: str) -> float:\n    words = len(text.split())\n    length_score = min(words / 200, 1.0)\n    coherence_score = len(set(text.split())) / words if words > 0 else 0\n    semantic_diversity = len(set(text.lower().split())) / words if words > 0 else 0\n    return 0.4 * length_score + 0.3 * coherence_score + 0.3 * semantic_diversity\n\nasync def main():\n    best_score = 0.0\n    artifact = open(\"artifact.txt\").read().strip()\n    total_cost = 0.0\n    results = []\n    current_strategy = random.choice(OPTIMIZATION_STRATEGIES)\n\n    try:\n        subprocess.run([\"git\", \"rev-parse\"], check=True, capture_output=True)\n    except subprocess.CalledProcessError:\n        subprocess.run([\"git\", \"init\"], check=True)\n        subprocess.run([\"git\", \"add\", \"artifact.txt\"], check=True)\n        subprocess.run([\"git\", \"commit\", \"-m\", \"Initial artifact\"], check=True)\n\n    for i in range(MAX_ITERATIONS):\n        strategy_params = {\n            \"temperature\": random.uniform(0.5, 1.0) if current_strategy == \"temperature\" else 0.7,\n            \"top_p\": random.uniform(0.7, 0.9) if current_strategy == \"top_p\" else 0.9,\n            \"presence_penalty\": random.uniform(0.1, 0.5) if current_strategy == \"presence_penalty\" else 0.2\n        }\n\n        prompt = f\"Improve this text with {current_strategy} variation:\\n\\n{artifact}\"\n        tasks = [call_llm(model, prompt, strategy_params) for model in MODELS]\n        candidates = await asyncio.gather(*tasks)\n        \n        best_candidate = None\n        best_model_score = 0.0\n        \n        for model, candidate in zip(MODELS, candidates):\n            if not candidate:  \n                continue\n            \n            new_score = score(candidate)\n            total_cost += COST_PER_TOKEN * (len(prompt) + len(candidate))  \n            \n            if new_score > best_model_score:\n                best_model_score = new_score\n                best_candidate = candidate\n        \n        if best_candidate and best_model_score > best_score:\n            best_score = best_model_score\n            artifact = best_candidate.strip()\n            with open(\"artifact.txt\", \"w\") as f:\n                f.write(artifact)\n            subprocess.run([\"git\", \"add\", \"artifact.txt\"], check=True)\n            subprocess.run([\"git\", \"commit\", \"-m\", f\"Iter {i}: Improved artifact via {current_strategy}\"], check=True)\n            print(f\"Iter {i}: KEEP  score={best_model_score:.2f}\")\n            results.append({\"iteration\": i, \"score\": best_model_score, \"action\": \"KEEP\", \"cost\": total_cost, \"strategy\": current_strategy})\n        else:\n            print(f\"Iter {i}: DISCARD  best_score={best_score:.2f}\")\n            results.append({\"iteration\": i, \"score\": best_model_score if best_candidate else 0, \"action\": \"DISCARD\", \"cost\": total_cost, \"strategy\": current_strategy})\n        \n        current_strategy = random.choice(OPTIMIZATION_STRATEGIES)\n\n    with open(\"results.json\", \"w\") as f:\n        json.dump(results, f, indent=2)\n\nif __name__ == \"__main__\":\n    asyncio.run(main())\n```\n\n## Step 2: Run Your Evaluation Loop\n\n```bash\npython loop.py\n```\n\n## Why Adaptive Optimization?\n\nTraditional greedy hill-climbing can get stuck in local optima. By dynamically varying generation parameters like temperature, top_p, and presence penalty, we introduce controlled randomness that helps explore the solution space more effectively.\n\n## Tradeoffs and Limitations\n\nAdaptive optimization increases computational complexity and potential costs. Use this approach judiciously, monitoring total expenses and setting appropriate constraints.\n\n## Common Pitfalls\n\n1. **Metric Gaming**: Design metrics that genuinely reflect output quality\n2. **Circular Feedback**: Avoid recursive LLM evaluations\n3. **Runaway Costs**: Implement budget tracking mechanisms\n\n## Worked Example\n\nStarting with a simple artifact, the loop now explores multiple generation strategies, potentially discovering more nuanced improvements by varying model parameters systematically.\n\n## What's Next\n\n- Implement more sophisticated exploration strategies\n- Add comprehensive logging and visualization\n- Develop domain-specific scoring functions\n\nBy following this tutorial, you've built an adaptive evaluation loop that goes beyond simple hill-climbing, providing a flexible framework for systematic LLM prompt optimization.", "D": "# Build a Minimal LLM Evaluation Loop in Python: Systematic Experiments for ML Engineers\n\nIf you're an ML engineer tired of manual prompt testing, building an evaluation loop can automate and optimize your experiments using the OpenRouter API. This tutorial walks you through creating a lean, runnable Python script that evaluates and improves LLM outputs step by step, focusing on practicality for those with intermediate Python skills.\n\n## What You Will Build\n\nBy the end of this tutorial, you'll have a functional Python script that:\n1. Sets up API calls with secure key handling.\n2. Generates LLM responses from multiple models in parallel.\n3. Evaluates outputs using a custom metric.\n4. Applies greedy hill-climbing to decide on improvements.\n5. Saves results, tracks costs, and versions changes via Git.\n6. Includes mechanisms to monitor and control the process, ensuring it's efficient and extendable.\n\nThis setup helps transition from one-off tests to automated workflows, all while keeping things simple and understandable in under 10 minutes.\n\n## What You Need\n\n- Python 3.10 or higher\n- An OpenRouter API key (obtain one at openrouter.ai)\n- Install dependencies: `pip install httpx python-dotenv`\n- Git installed and configured for version control\n\n## Step 1: Setup API Key and Constants\n\nStart by creating a `.env` file in your project directory with your API key:\n```plaintext\nOPENROUTER_API_KEY=sk-or-your-key-here\n```\n\n```python\nimport os\nimport httpx\nfrom dotenv import load_dotenv\nimport asyncio\nimport json\nimport subprocess\n\nload_dotenv()  # Load environment variables from .env file\n\nAPI_KEY: str = os.getenv(\"OPENROUTER_API_KEY\")\nAPI_URL: str = \"https://openrouter.ai/api/v1/chat/completions\"\nMODELS: list[str] = [\"openai/gpt-4o-mini\", \"meta-llama/llama-3.1-8b-instruct\"]\nMAX_ITERATIONS: int = 20\nCOST_PER_TOKEN: float = 0.000002  # Approximate cost; verify with OpenRouter pricing\n\nasync def call_llm(model: str, prompt: str) -> str:\n    \"\"\"Asynchronously calls the OpenRouter API to get a response from the specified model.\"\"\"\n    try:\n        async with httpx.AsyncClient() as client:\n            response = await client.post(\n                API_URL,\n                headers={\"Authorization\": f\"Bearer {API_KEY}\"},\n                json={\n                    \"model\": model,\n                    \"messages\": [{\"role\": \"user\", \"content\": prompt}]\n                },\n                timeout=10.0  # Prevents indefinite waits\n            )\n            response.raise_for_status()\n            data = response.json()\n            return data[\"choices\"][0][\"message\"][\"content\"]\n    except httpx.RequestError as e:\n        print(f\"API request failed: {e}\")\n        return \"\"\n\ndef score(text: str) -> float:\n    \"\"\"Calculates a simple score based on text length and coherence.\"\"\"\n    words: int = len(text.split())\n    length_score: float = min(words / 200, 1.0)  # Normalizes length up to 200 words\n    coherence_score: float = len(set(text.split())) / words if words > 0 else 0  # Uniqueness ratio\n    return 0.5 * length_score + 0.5 * coherence_score\n\nasync def main() -> None:\n    best_score: float = 0.0\n    artifact: str = open(\"artifact.txt\", \"r\").read().strip()  # Initial artifact from file\n    total_cost: float = 0.0\n    results: list[dict[str, any]] = []  # List to store iteration results\n\n    # Initialize Git if not already set up\n    try:\n        subprocess.run([\"git\", \"rev-parse\"], check=True, capture_output=True)\n    except subprocess.CalledProcessError:\n        subprocess.run([\"git\", \"init\"], check=True)\n        subprocess.run([\"git\", \"add\", \"artifact.txt\"], check=True)\n        subprocess.run([\"git\", \"commit\", \"-m\", \"Initial artifact\"], check=True)\n\n    for i in range(MAX_ITERATIONS):\n        prompt: str = f\"Improve this text:\\n\\n{artifact}\"\n        tasks: list[asyncio.Task[str]] = [call_llm(model, prompt) for model in MODELS]\n        candidates: list[str] = await asyncio.gather(*tasks)\n        \n        best_candidate: str | None = None\n        best_model_score: float = 0.0\n        \n        for model, candidate in zip(MODELS, candidates):\n            if not candidate:\n                continue\n            \n            new_score: float = score(candidate)\n            total_cost += COST_PER_TOKEN * (len(prompt) + len(candidate))  # Accumulate cost\n            \n            if new_score > best_model_score:\n                best_model_score = new_score\n                best_candidate = candidate\n        \n        if best_candidate and best_model_score > best_score:\n            best_score = best_model_score\n            artifact = best_candidate.strip()\n            with open(\"artifact.txt\", \"w\") as f:\n                f.write(artifact)\n            subprocess.run([\"git\", \"add\", \"artifact.txt\"], check=True)\n            subprocess.run([\"git\", \"commit\", \"-m\", f\"Iter {i}: Improved artifact\"], check=True)\n            print(f\"Iter {i}: KEEP  score={best_model_score:.2f}\")\n            results.append({\"iteration\": i, \"score\": best_model_score, \"action\": \"KEEP\", \"cost\": total_cost})\n        else:\n            print(f\"Iter {i}: DISCARD  best_score={best_score:.2f}\")\n            results.append({\"iteration\": i, \"score\": best_model_score if best_candidate else 0, \"action\": \"DISCARD\", \"cost\": total_cost})\n\n    with open(\"results.json\", \"w\") as