{"type": "stage2_complete", "rankings": [{"letter": "D", "display_letter": "E", "avg_position": 0.5, "votes": 4}, {"letter": "A", "display_letter": "B", "avg_position": 1.0, "votes": 4}, {"letter": "B", "display_letter": "C", "avg_position": 2.5, "votes": 4}, {"letter": "C", "display_letter": "A", "avg_position": 3.0, "votes": 4}, {"letter": "E", "display_letter": "D", "avg_position": 3.0, "votes": 4}], "shuffle_map": {"B": "A", "C": "B", "A": "C", "E": "D", "D": "E"}, "votes": [{"model": "meta-llama/llama-4-maverick", "display_ranking": "E > B > D > A > C", "original_ranking": "D > A > E > C > B", "reasoning": "Here are my evaluations of the versions:\n\n- Version A: Provides a clear structure and explanation, but lacks some essential details like cost tracking and comprehensive error handling.\n- Version B: Improves upon Version A by including cost tracking, git versioning, and a more detailed explanation, making it a more comprehensive tutorial.\n- Version C: Takes a different approach by introducing a probabilistic exploration strategy and adaptive scoring, which is more advanced but may be less suitable for the target audience.\n- Version D: Similar to Version B but with some minor differences in code and explanation, still providing a solid foundation for the evaluation loop.\n- Version E: Strikes a balance between simplicity and depth, providing clear explanations, comprehensive code, and discussing tradeoffs and limitations.\n\nMy final ranking is based on the evaluation criteria, focusing on correctness, completeness, clarity, code quality, and depth."}, {"model": "anthropic/claude-3-5-haiku", "display_ranking": "B > E > C > A > D", "original_ranking": "A > D > B > C > E", "reasoning": "I'll evaluate each version based on the specified criteria and provide reasoning:\n\nVersion B: Strong tutorial with comprehensive coverage. Excellent balance of technical depth, clarity, and practical insights. Well-structured with clear code examples and thoughtful explanations of optimization strategies.\n\nVersion C: Innovative approach with advanced probabilistic exploration. Strong technical depth but slightly less accessible to intermediate Python developers. Introduces sophisticated concepts but might overwhelm beginners.\n\nVersion E: Highly detailed tutorial with extensive explanations and nuanced discussion of implementation tradeoffs. Extremely comprehensive but slightly verbose, which might make it harder to follow for quick learners.\n\nVersion A: Lean and direct approach with a clear, no-nonsense style. Good technical content but less comprehensive in explaining underlying concepts compared to other versions.\n\nVersion D: Very similar to Version B, but slightly less engaging and with fewer advanced insights. Covers basics competently but lacks the depth and nuance of the top-ranked versions.\n\nDetailed evaluation across criteria:\n\n1. Correctness: B \u2248 C > E > A > D\n2. Completeness: B > E > C > D > A\n3. Clarity: B > A > E > D > C\n4. Code Quality: C > B > E > A > D\n5. Depth: E > C > B > A > D\n\nComprehensive consideration of all factors leads me to the following ranking:"}, {"model": "google/gemini-3.1-flash-lite-preview", "display_ranking": "E > C > A > B > D", "original_ranking": "D > B > C > A > E", "reasoning": "The evaluation criteria focused on correctness, completeness, code quality, and depth.\n\n*   **Version E** is the strongest because it provides a complete, robust, and well-explained tutorial. It addresses the \"why\" behind design decisions (like the subprocess pattern and stopping conditions), includes a concrete worked example, and handles code quality best by providing specific error handling and budget checks.\n*   **Version C** is excellent but slightly less aligned with the \"minimalist\" requirement as it introduces class-based structures and simulated annealing, which might overwhelm a reader looking for a \"10-minute\" lean loop. However, its use of `asyncio` is superior for real-world ML engineering.\n*   **Version A** is a solid, practical guide. It is clear and concise, though it lacks the depth of the \"why\" behind certain patterns (like the subprocess/Git integration) compared to Version E.\n*   **Version B** and **Version D** are largely identical. They are functional and follow the instructions well, but they lack the deeper insights, robust error handling, and sophisticated explanations found in the top three versions. Version B is ranked slightly higher than D only because it includes a visualization section, providing more value to the reader.\n\n**Reasoning:**\n*   **Version E:** Provides the most comprehensive coverage, excellent code quality, and deep explanations of design trade-offs.\n*   **Version C:** Highly professional and technically sound, though perhaps slightly more complex than a \"minimalist\" tutorial requires.\n*   **Version A:** Very clear and focused, with good practical advice on common pitfalls, though less architectural depth than E.\n*   **Version B:** A solid, standard tutorial that meets all requirements but lacks the advanced depth of the top versions.\n*   **Version D:** Nearly identical to B but misses the useful visualization section, making it the least comprehensive."}, {"model": "x-ai/grok-3-mini-beta", "display_ranking": "B > E > D > C > A", "original_ranking": "A > D > E > B > C", "reasoning": "Below is my evaluation and ranking of the versions (A, B, C, D, and E) based on the specified criteria: Correctness, Completeness, Clarity, Code Quality, and Depth. I judged each version solely on its quality, scoring them holistically out of 100 points (with each criterion weighted equally at 0-20 points). Here's a brief summary of my assessment for each:\n\n- **Version A**: This version scores around 65/100; it's correct and clear for basics but lacks completeness in features like robust cost tracking and saving results, with moderate code quality and limited depth in explaining tradeoffs.\n- **Version B**: This version scores around 90/100; it's highly complete and correct, with excellent clarity, strong code quality (e.g., type hints and error handling), and good depth in justifying decisions and discussing pitfalls, making it a well-rounded tutorial.\n- **Version C**: This version scores around 80/100; it's correct and has good depth with advanced strategies, but its completeness and clarity suffer from over-engineering (e.g., async and probabilistic elements), which may overwhelm the target audience seeking a minimal implementation.\n- **Version D**: This version scores around 85/100; it's complete and correct with solid clarity and code quality, though its depth is slightly less than B in fully exploring tradeoffs, making it a reliable but not exceptional choice.\n- **Version E**: This version scores around 88/100; it excels in correctness, completeness (with safeguards like budget limits), and depth (e.g., explaining subprocess and stopping conditions), with good code quality, though it's marginally less polished than B in overall structure."}], "model_names": {"A": "meta-llama/llama-4-maverick", "B": "anthropic/claude-3-5-haiku", "C": "google/gemini-3.1-flash-lite-preview", "D": "x-ai/grok-3-mini-beta"}}
{"type": "stage3_complete", "winner": "D", "winner_model": "x-ai/grok-3-mini-beta", "council_score": 94, "sub_scores": {"CORRECTNESS": 19, "COMPLETENESS": 20, "CLARITY": 18, "CODE_QUALITY": 19, "DEPTH": 18}, "critique": "Proposal D excels in providing a comprehensive and structured tutorial for building a minimal LLM evaluation loop, covering all essential components and including robust error handling. The depth of explanation regarding key concepts, like greedy hill-climbing and stopping conditions, enhances the reader's understanding, although some areas could benefit from further elaboration on trade-offs. The clarity is generally high, but there are minor areas where additional inline comments could help guide the reader more smoothly. Overall, this version stands out as the most complete and functional guide, setting a strong foundation for ML engineers looking to automate LLM experiments.", "chairman_full_response": "WINNER: D\nSCORE_CORRECTNESS: 19\nSCORE_COMPLETENESS: 20\nSCORE_CLARITY: 18\nSCORE_CODE_QUALITY: 19\nSCORE_DEPTH: 18\nCOUNCIL_SCORE: 94\n\nCRITIQUE:\nProposal D excels in providing a comprehensive and structured tutorial for building a minimal LLM evaluation loop, covering all essential components and including robust error handling. The depth of explanation regarding key concepts, like greedy hill-climbing and stopping conditions, enhances the reader's understanding, although some areas could benefit from further elaboration on trade-offs. The clarity is generally high, but there are minor areas where additional inline comments could help guide the reader more smoothly. Overall, this version stands out as the most complete and functional guide, setting a strong foundation for ML engineers looking to automate LLM experiments.", "chairman_model": "openai/gpt-4o-mini", "model_names": {"A": "meta-llama/llama-4-maverick", "B": "anthropic/claude-3-5-haiku", "C": "google/gemini-3.1-flash-lite-preview", "D": "x-ai/grok-3-mini-beta"}}
{"type": "iteration_result", "iteration": 6, "status": "DISCARD", "council_score": 94, "winner": "D", "best_score": 94, "commit": "ebb51dd", "spent_usd": 0.148149, "timestamp": "2026-04-03T14:36:44.652039Z"}
