{"type": "stage2_complete", "rankings": [{"letter": "A", "display_letter": "D", "avg_position": 0.25, "votes": 4}, {"letter": "D", "display_letter": "C", "avg_position": 1.25, "votes": 4}, {"letter": "B", "display_letter": "E", "avg_position": 2.25, "votes": 4}, {"letter": "E", "display_letter": "A", "avg_position": 3.0, "votes": 4}, {"letter": "C", "display_letter": "B", "avg_position": 3.25, "votes": 4}], "shuffle_map": {"D": "A", "E": "B", "B": "C", "C": "D", "A": "E"}, "votes": [{"model": "meta-llama/llama-4-maverick", "display_ranking": "D > E > C > B > A", "original_ranking": "A > B > D > C > E", "reasoning": "## Step 1: Evaluate Version D\nVersion D is strong in completeness, clarity, and code quality, as it covers all essential steps, is easy to follow, and has well-structured code with proper error handling and meaningful variable names.\n\n## Step 2: Evaluate Version E\nVersion E improves upon Version D by introducing stochastic hill-climbing and multi-model support, enhancing depth and completeness, but its advanced metric function and complex logic might reduce clarity for some readers.\n\n## Step 3: Evaluate Version C\nVersion C is clear, complete, and has good code quality, providing a well-structured tutorial with a simple yet effective evaluation loop, but it lacks the advanced features and depth seen in Versions D and E.\n\n## Step 4: Evaluate Version B\nVersion B is concise and covers the basics well, but it lacks some completeness in terms of cost tracking and advanced features, and its code quality could be improved with more robust error handling.\n\n## Step 5: Evaluate Version A\nVersion A is a basic implementation that lacks some completeness and depth, as it doesn't cover advanced topics or provide as much clarity on design decisions as other versions.\n\n## Step 6: Compare All Versions\nComparing all versions, Version D stands out for its balance of completeness, clarity, and code quality, along with its coverage of essential steps and advanced features like parallel model queries. Version E is close, offering more sophisticated optimization techniques. Version C is a solid, straightforward implementation. Versions B and A are more basic, with B being more concise and A lacking in several areas.\n\n## Step 7: Final Ranking\nBased on the evaluation criteria, the ranking from best to worst is determined by considering correctness, completeness, clarity, code quality, and depth."}, {"model": "anthropic/claude-3-5-haiku", "display_ranking": "D > E > C > B > A", "original_ranking": "A > B > D > C > E", "reasoning": "Analysis of Versions:\n\nVersion D: Strongest overall implementation. Provides the most comprehensive approach with parallel model queries, advanced error handling, clear explanations of tradeoffs, and a robust implementation that covers all evaluation criteria comprehensively.\n\nVersion E: Innovative approach with stochastic hill-climbing and advanced metric design. Introduces probabilistic exploration and multi-dimensional scoring, but slightly less clear and complete than Version D.\n\nVersion B: Solid foundational implementation with good explanations. Lacks some of the advanced features of D and E, but provides a clear, straightforward approach that would be easy for beginners to understand.\n\nVersion C: Very similar to Version B, with slightly more depth in explanations and a bit more sophisticated implementation. Provides good context and reasoning behind design choices.\n\nVersion A: Most basic implementation. Covers the core concepts but lacks the depth, error handling, and advanced features of the other versions. Serves as a good starting point but feels the most rudimentary.\n\nReasoning per version:\n- D: Comprehensive, multi-model, advanced error handling, clear explanations\n- E: Innovative stochastic approach with sophisticated scoring\n- B: Clear foundational implementation with good explanatory content\n- C: Slightly more advanced than B, with deeper contextual explanations\n- A: Basic implementation lacking advanced features and depth"}, {"model": "google/gemini-3.1-flash-lite-preview", "display_ranking": "C > D > A > B > E", "original_ranking": "D > A > E > C > B", "reasoning": "To evaluate these versions, I assessed them based on technical correctness, adherence to the OpenRouter API constraints, the depth of the explanation, and the quality of the provided Python code.\n\n*   **Version C** is the strongest. It provides the most comprehensive explanation of the \"why\" (specifically regarding the subprocess pattern and stopping criteria), includes robust error handling, and offers a clear, well-structured tutorial that is highly actionable for the target audience.\n*   **Version D** is excellent for its inclusion of parallel model queries and a multi-model comparison strategy, which adds significant value for an ML engineer, though the explanation of the \"why\" is slightly less thorough than Version C.\n*   **Version A** is a solid, clean, and correct implementation that follows all instructions perfectly, but it is less \"deep\" than the C and D versions regarding the architectural decisions.\n*   **Version B** is good but relies on a non-standard `httpx.Client` usage pattern (creating a new client inside a function rather than using a single session) and includes a slightly confusing \"refine the prompt itself\" loop that may lead to prompt drift rather than artifact optimization.\n*   **Version E** contains logical errors (using `math` without importing it, potentially problematic `nltk` dependency management for a \"minimal\" tutorial, and a stochastic acceptance logic that is under-explained for an introductory tutorial) that make it the weakest in terms of correctness and clarity.\n\n**Reasoning:**\n*   **Version C:** Best balance of technical depth, clear code, and helpful explanations on \"why\" design decisions were made.\n*   **Version D:** Very strong technical approach with parallel model queries, though slightly less detailed explanations than C.\n*   **Version A:** Correct, clean, and follows all constraints perfectly, though it lacks the advanced architectural depth found in C and D.\n*   **Version B:** Good tutorial but includes a slightly less standard API implementation and a prompt-refinement loop that is harder to control than the artifact-refinement loop.\n*   **Version E:** Contains missing imports (`math`), assumes heavy external dependencies (`nltk`, `textstat`), and implements complex stochastic logic that undermines the \"minimal\" requirement."}, {"model": "x-ai/grok-3-mini-beta", "display_ranking": "D > C > A > E > B", "original_ranking": "A > D > E > B > C", "reasoning": "Below is my evaluation and ranking of the versions based on the specified criteria (Correctness, Completeness, Clarity, Code Quality, and Depth, each scored out of 20 for a total of 100). I'll provide a brief score breakdown for each version, followed by a one-sentence reasoning note. The rankings are based solely on quality, without considering authorship.\n\n- **Version D**: Scores: Correctness (18/20, code is valid and handles errors well), Completeness (19/20, covers all essentials plus parallel queries and git), Clarity (18/20, well-structured with overviews and examples), Code Quality (18/20, idiomatic with async and error handling), Depth (17/20, justifies decisions and discusses tradeoffs). *Reasoning: Version D stands out for its comprehensive features like parallel model queries and detailed explanations, making it highly practical and extensible for the target audience.*\n  \n- **Version C**: Scores: Correctness (17/20, code runs reliably with basic error handling), Completeness (18/20, includes all key steps and git integration), Clarity (17/20, step-by-step with good explanations), Code Quality (17/20, uses safe practices like env variables), Depth (16/20, explains why to stop the loop and tradeoffs). *Reasoning: Version C offers a solid, balanced tutorial with practical depth on limitations and stopping criteria, though it lacks the advanced features of D.*\n  \n- **Version A**: Scores: Correctness (16/20, code is valid but lacks robust error handling), Completeness (16/20, covers essentials but misses advanced tracking), Clarity (16/20, straightforward steps), Code Quality (15/20, basic and safe but not highly extensible), Depth (14/20, touches on why greedy but doesn't explore tradeoffs deeply). *Reasoning: Version A provides a correct and clear baseline implementation, but it's less complete and deep compared to C and D, feeling more introductory.*\n  \n- **Version E**: Scores: Correctness (14/20, has potential bugs like missing imports and synchronous calls), Completeness (17/20, includes stochastic elements and advanced scoring), Clarity (15/20, somewhat confusing in code structure), Code Quality (15/20, introduces randomness but with inconsistencies), Depth (16/20, discusses exploration but not always clearly). *Reasoning: Version E innovates with stochastic methods for added depth, but correctness issues and unclear implementation make it less reliable overall.*\n  \n- **Version B**: Scores: Correctness (15/20, code works but has logical flaws in prompt handling), Completeness (14/20, misses async and full tracking), Clarity (14/20, concise but jumps in logic), Code Quality (14/20, basic safety but poor structure), Depth (13/20, briefly covers pitfalls but lacks justification). *Reasoning: Version B is the simplest and most error-prone, with incomplete features and shallow depth, making it the weakest for systematic use.*"}], "model_names": {"A": "meta-llama/llama-4-maverick", "B": "anthropic/claude-3-5-haiku", "C": "google/gemini-3.1-flash-lite-preview", "D": "x-ai/grok-3-mini-beta"}}
{"type": "stage3_complete", "winner": "A", "winner_model": "meta-llama/llama-4-maverick", "council_score": 92, "sub_scores": {"CORRECTNESS": 20, "COMPLETENESS": 20, "CLARITY": 18, "CODE_QUALITY": 18, "DEPTH": 16}, "critique": "Proposal A successfully outlines a minimal LLM evaluation loop with clear and runnable code, ensuring correctness and completeness throughout the tutorial. The clarity is strong, although a few sections could benefit from further inline commentary for less experienced readers. The code quality is good, with appropriate error handling and no hardcoded secrets. However, the depth could be enhanced by providing more explicit justification for design decisions and discussing potential tradeoffs. Overall, this proposal serves as a robust foundation for systematic experimentation with LLMs, effectively balancing functionality and simplicity.", "chairman_full_response": "WINNER: A\nSCORE_CORRECTNESS: 20\nSCORE_COMPLETENESS: 20\nSCORE_CLARITY: 18\nSCORE_CODE_QUALITY: 18\nSCORE_DEPTH: 16\nCOUNCIL_SCORE: 92\n\nCRITIQUE:\nProposal A successfully outlines a minimal LLM evaluation loop with clear and runnable code, ensuring correctness and completeness throughout the tutorial. The clarity is strong, although a few sections could benefit from further inline commentary for less experienced readers. The code quality is good, with appropriate error handling and no hardcoded secrets. However, the depth could be enhanced by providing more explicit justification for design decisions and discussing potential tradeoffs. Overall, this proposal serves as a robust foundation for systematic experimentation with LLMs, effectively balancing functionality and simplicity.", "chairman_model": "openai/gpt-4o-mini", "model_names": {"A": "meta-llama/llama-4-maverick", "B": "anthropic/claude-3-5-haiku", "C": "google/gemini-3.1-flash-lite-preview", "D": "x-ai/grok-3-mini-beta"}}
{"type": "iteration_result", "iteration": 37, "status": "DISCARD", "council_score": 92, "winner": "A", "best_score": 94, "commit": "ebb51dd", "spent_usd": 0.491269, "timestamp": "2026-04-03T15:45:43.503986Z"}
