{"type": "stage1_complete", "proposals": {"A": "# Build a Minimal LLM Evaluation Loop in Python: Systematic Experiments for ML Engineers\n\nIf you want to stop manually testing prompts and start running systematic experiments, an evaluation loop is the right tool. This tutorial shows you how to build one using the OpenRouter API, covering essential steps from API key setup to saving results.\n\n## What You Will Build\n\nBy the end of this tutorial, you will have a working Python script that:\n1. Makes LLM API calls using OpenRouter\n2. Scores the output using a custom metric\n3. Implements a greedy hill-climbing loop to improve the output\n4. Saves the best artifact to a file\n5. Tracks costs and iterations\n6. Versions improvements using git\n\n## What You Need\n\n- Python 3.10+\n- An OpenRouter API key (sign up at openrouter.ai)\n- `httpx` installed: `pip install httpx`\n- `python-dotenv` installed: `pip install python-dotenv`\n- Git installed and configured\n\n## Step 1: Setup API Key and Constants\n\nFirst, create a `.env` file in your project root with your OpenRouter API key:\n```plaintext\nOPENROUTER_API_KEY=sk-or-your-key-here\n```\n\n```python\nimport os\nimport httpx\nfrom dotenv import load_dotenv\n\nload_dotenv()  # Load environment variables from .env\n\nAPI_KEY = os.getenv(\"OPENROUTER_API_KEY\")\nAPI_URL = \"https://openrouter.ai/api/v1/chat/completions\"\nMODEL = \"openai/gpt-4o-mini\"\nMAX_ITERATIONS = 20\nCOST_PER_TOKEN = 0.000002  # Example cost, check OpenRouter pricing\n\ndef call_llm(prompt: str) -> str:\n    try:\n        response = httpx.post(\n            API_URL,\n            headers={\"Authorization\": f\"Bearer {API_KEY}\"},\n            json={\n                \"model\": MODEL,\n                \"messages\": [{\"role\": \"user\", \"content\": prompt}]\n            },\n            timeout=10.0  # Add timeout to prevent hanging\n        )\n        response.raise_for_status()  # Raise an exception for bad status codes\n        data = response.json()\n        return data[\"choices\"][0][\"message\"][\"content\"]\n    except httpx.RequestError as e:\n        print(f\"API request failed: {e}\")\n        return \"\"\n```\n\n## Step 2: Define a Metric Function\n\nYour metric function scores the LLM output. Higher is better. Here is a simple example that scores based on length and coherence, with additional comments for clarity:\n\n```python\ndef score(text: str) -> float:\n    # Calculate the number of words in the output\n    words = len(text.split())\n    # Normalize length score to be between 0 and 1\n    length_score = min(words / 200, 1.0)\n    # Simple coherence check: higher lexical diversity is better\n    coherence_score = len(set(text.split())) / words if words > 0 else 0\n    # Weighted average of length and coherence scores\n    return 0.5 * length_score + 0.5 * coherence_score\n```\n\n## Step 3: Implement the Evaluation Loop with Cost Tracking and Git Versioning\n\n```python\nimport json\nimport subprocess\n\ndef main():\n    best_score = 0.0\n    artifact = open(\"artifact.txt\").read().strip()\n    total_cost = 0.0\n    results = []\n\n    # Initialize git repository if not already done\n    try:\n        subprocess.run([\"git\", \"rev-parse\"], check=True, capture_output=True)\n    except subprocess.CalledProcessError:\n        subprocess.run([\"git\", \"init\"], check=True)\n        subprocess.run([\"git\", \"add\", \"artifact.txt\"], check=True)\n        subprocess.run([\"git\", \"commit\", \"-m\", \"Initial artifact\"], check=True)\n\n    for i in range(MAX_ITERATIONS):\n        prompt = f\"Improve this text:\\n\\n{artifact}\"\n        candidate = call_llm(prompt)\n        \n        if not candidate:  # Skip iteration if API call failed\n            continue\n        \n        new_score = score(candidate)\n        total_cost += COST_PER_TOKEN * (len(prompt) + len(candidate))  # Simplified cost calculation\n        \n        if new_score > best_score:\n            best_score = new_score\n            artifact = candidate.strip()\n            with open(\"artifact.txt\", \"w\") as f:\n                f.write(artifact)\n            # Commit changes to git\n            subprocess.run([\"git\", \"add\", \"artifact.txt\"], check=True)\n            subprocess.run([\"git\", \"commit\", \"-m\", f\"Iter {i}: Improved artifact\"], check=True)\n            print(f\"Iter {i}: KEEP  score={new_score:.2f}\")\n            results.append({\"iteration\": i, \"score\": new_score, \"action\": \"KEEP\", \"cost\": total_cost})\n        else:\n            print(f\"Iter {i}: DISCARD  score={new_score:.2f}  best={best_score:.2f}\")\n            results.append({\"iteration\": i, \"score\": new_score, \"action\": \"DISCARD\", \"cost\": total_cost})\n\n    # Save results to a JSON file for later analysis\n    with open(\"results.json\", \"w\") as f:\n        json.dump(results, f, indent=2)\n\nif __name__ == \"__main__\":\n    main()\n```\n\n## Step 4: Run Your Evaluation Loop\n\n```bash\npython loop.py\n```\n\nYou should see output like:\n\n```\nIter 0: KEEP  score=0.85\nIter 1: DISCARD  score=0.81  best=0.85\nIter 2: KEEP  score=0.91\nIter 3: DISCARD  score=0.88  best=0.91\n```\n\nThe artifact file is updated and committed to git whenever a better version is found, and results are saved to `results.json`.\n\n## Why Greedy Hill-Climbing?\n\nGreedy hill-climbing is simple and effective for many optimization tasks. It always moves towards better solutions, making it suitable for improving LLM outputs. However, it may get stuck in local optima. Consider adding randomness or more sophisticated optimization techniques for complex tasks.\n\n## Tradeoffs and Limitations\n\nWhile greedy hill-climbing is straightforward to implement, it lacks the ability to explore the solution space broadly. For tasks requiring more exploration, consider techniques like simulated annealing or genetic algorithms. Additionally, be mindful of the cost implications of repeated LLM queries.\n\n## Common Pitfalls\n\n1. **Metric Gaming**: Ensure your metric accurately reflects the desired outcome. A poorly designed metric can lead to suboptimal or misleading results.\n2. **Circular Feedback**: Be cautious when using LLM outputs to evaluate other LLM outputs. This can create feedback loops that degrade performance over time.\n3. **Runaway Costs**: Always track costs and consider implementing a budget constraint to prevent unexpected expenses.\n\n## Worked Example\n\nLet's say you start with a simple artifact: \"The quick brown fox jumps over the lazy dog.\" After running the evaluation loop, the artifact might improve to: \"The quick brown fox jumps over the lazy dog, demonstrating a classic example of a pangram that uses all the letters of the alphabet efficiently.\" The score improves from 0.4 to 0.8 as the output becomes more coherent and contextually relevant.\n\n## What's Next\n\nThis basic loop works, but you can enhance it further:\n- Query multiple models in parallel to compare their performance\n- Implement more sophisticated optimization strategies like simulated annealing\n- Add more comprehensive error handling and logging mechanisms\n\nBy following this tutorial, you've built a systematic evaluation loop for LLM experiments that not only optimizes your prompts but also versions your improvements using git. This foundation allows you to scale your experiments, track progress, and optimize your prompts effectively.", "B": "# Build a Minimal LLM Evaluation Loop in Python: Systematic Experiments for ML Engineers\n\nAutomated experimentation transforms how we develop prompts and evaluate language models. This tutorial reveals a pragmatic approach to systematic LLM optimization that goes beyond manual tweaking.\n\n## What You Will Build\n\nA Python script that:\n1. Runs reproducible LLM experiments\n2. Implements a multi-dimensional scoring system\n3. Tracks experiment provenance\n4. Manages computational and financial resources\n5. Provides transparent optimization insights\n\n## Prerequisites\n\n- Python 3.10+\n- OpenRouter API key\n- `httpx`, `python-dotenv`, `pandas` installed\n- Basic understanding of async programming\n\n## Core Components: A Holistic Optimization Framework\n\n### Step 1: Robust Configuration Management\n\n```python\nimport os\nimport logging\nfrom dataclasses import dataclass\nfrom typing import Dict, Any\n\n@dataclass\nclass ExperimentConfig:\n    api_key: str\n    model: str = \"openai/gpt-4o-mini\"\n    max_iterations: int = 20\n    budget_limit: float = 5.00  # USD\n    logging_level: int = logging.INFO\n\n    @classmethod\n    def from_env(cls):\n        return cls(\n            api_key=os.getenv(\"OPENROUTER_API_KEY\", \"\"),\n            model=os.getenv(\"LLM_MODEL\", \"openai/gpt-4o-mini\")\n        )\n\n# Enhanced logging configuration\nlogging.basicConfig(\n    level=logging.INFO,\n    format='%(asctime)s - %(levelname)s: %(message)s'\n)\n```\n\n### Step 2: Advanced Multi-Dimensional Scoring\n\n```python\nimport numpy as np\nimport textstat\n\ndef comprehensive_score(text: str) -> Dict[str, float]:\n    \"\"\"\n    Calculate a nuanced, multi-dimensional performance score.\n    \n    Metrics:\n    - Readability (Flesch-Kincaid)\n    - Lexical diversity\n    - Information density\n    - Semantic coherence\n    \"\"\"\n    try:\n        readability = max(0, 1 - textstat.flesch_reading_ease(text) / 100)\n        words = text.split()\n        \n        lexical_diversity = len(set(words)) / len(words) if words else 0\n        information_density = np.log(len(words) + 1) / 10\n        \n        # Placeholder for more sophisticated semantic scoring\n        semantic_score = min(lexical_diversity * information_density, 1.0)\n        \n        weighted_score = (\n            0.4 * readability + \n            0.3 * lexical_diversity + \n            0.2 * information_density + \n            0.1 * semantic_score\n        )\n        \n        return {\n            \"total_score\": weighted_score,\n            \"readability\": readability,\n            \"lexical_diversity\": lexical_diversity,\n            \"information_density\": information_density\n        }\n    \n    except Exception as e:\n        logging.error(f\"Scoring error: {e}\")\n        return {\"total_score\": 0.0}\n```\n\n### Step 3: Intelligent Experiment Tracking\n\n```python\nimport pandas as pd\nfrom datetime import datetime\n\nclass ExperimentTracker:\n    def __init__(self, output_file='experiment_log.csv'):\n        self.experiments = []\n        self.output_file = output_file\n    \n    def record(self, iteration, prompt, response, scores):\n        experiment_record = {\n            \"timestamp\": datetime.now(),\n            \"iteration\": iteration,\n            **scores,\n            \"prompt_length\": len(prompt),\n            \"response_length\": len(response)\n        }\n        self.experiments.append(experiment_record)\n    \n    def save(self):\n        df = pd.DataFrame(self.experiments)\n        df.to_csv(self.output_file, index=False)\n        logging.info(f\"Experiment log saved to {self.output_file}\")\n```\n\n## Deeper Insights: Beyond Simple Optimization\n\n### Why Multi-Dimensional Scoring?\n\nSingle-metric optimization often leads to metric gaming. By using multiple, uncorrelated metrics, we:\n- Reduce overfitting\n- Capture nuanced performance characteristics\n- Prevent trivial optimization strategies\n\n### Computational Efficiency Considerations\n\n- Use async API calls for parallel processing\n- Implement exponential backoff for rate limiting\n- Set strict timeout and budget constraints\n\n## Common Challenges and Mitigations\n\n1. **Metric Manipulation**: Use diverse, hard-to-game scoring functions\n2. **Computational Waste**: Implement early stopping mechanisms\n3. **Unpredictable Costs**: Set hard budget limits\n4. **Reproducibility**: Log complete experiment context\n\n## Advanced Next Steps\n\n- Integrate machine learning uncertainty estimation\n- Implement Bayesian optimization strategies\n- Create visualization tools for experiment insights\n\nBy embracing systematic experimentation, you transform prompt engineering from art to science.", "C": "# Build a Minimal LLM Evaluation Loop in Python: Systematic Experiments for ML Engineers\n\nIf you want to move from manual, artisanal prompt testing to repeatable, automated optimization, you need an evaluation loop. This tutorial shows you how to build a robust, iterative \"hill-climbing\" loop using the OpenRouter API. We will focus on a systematic approach: scoring LLM outputs against a defined objective and automatically persisting improvements.\n\n## What You Will Build\n\nBy the end of this tutorial, you will have a Python script that:\n1. **Automates Requests:** Uses `httpx` to interface with OpenRouter.\n2. **Evaluates Quality:** Implements a custom metric function.\n3. **Optimizes Iteratively:** Uses greedy hill-climbing to keep only improved versions.\n4. **Tracks Metrics:** Logs costs, scores, and decisions to a persistent TSV (Tab-Separated Values) file.\n5. **Version Controls:** Automatically triggers a `git commit` whenever a new \"best\" artifact is found.\n\n## Prerequisites\n\n- Python 3.10+\n- [OpenRouter API Key](https://openrouter.ai/)\n- `pip install httpx python-dotenv`\n\n## Step 1: Configuration and Setup\n\nCreate a `.env` file to store your credentials securely. Never hardcode these in your script.\n\n```plaintext\nOPENROUTER_API_KEY=sk-or-your-key-here\n```\n\nWe will use a `Config` class to manage parameters, ensuring our code remains clean and extendable.\n\n```python\nimport os\nimport httpx\nimport subprocess\nfrom dotenv import load_dotenv\n\nload_dotenv()\n\nclass Config:\n    API_KEY = os.getenv(\"OPENROUTER_API_KEY\")\n    API_URL = \"https://openrouter.ai/api/v1/chat/completions\"\n    MODEL = \"openai/gpt-4o-mini\"\n    MAX_ITERATIONS = 10\n    ARTIFACT_PATH = \"prompt_artifact.txt\"\n    LOG_PATH = \"experiment_log.tsv\"\n```\n\n## Step 2: The Evaluation Core\n\nThe `score` function is the \"brain\" of your optimizer. For this example, we evaluate how well an LLM improves a technical summary.\n\n```python\ndef score(text: str) -> float:\n    \"\"\"\n    Objective metric: Higher score for conciseness and lack of jargon.\n    In production, replace this with a model-based evaluator (LLM-as-a-Judge).\n    \"\"\"\n    word_count = len(text.split())\n    # Penalty for being too long or too short\n    length_penalty = 1.0 if 50 < word_count < 150 else 0.5\n    # Heuristic: Score based on unique vocabulary density\n    complexity = len(set(text.lower().split())) / word_count\n    return complexity * length_penalty\n```\n\n## Step 3: Implementing the Loop\n\nWe use a subprocess call to `git` to ensure that every time we \"KEEP\" a prompt, we have a clear history of how the prompt evolved.\n\n```python\ndef git_commit(message: str):\n    subprocess.run([\"git\", \"add\", Config.ARTIFACT_PATH])\n    subprocess.run([\"git\", \"commit\", \"-m\", message])\n\ndef run_evaluation():\n    with open(Config.ARTIFACT_PATH, \"r\") as f:\n        current_artifact = f.read()\n\n    best_score = score(current_artifact)\n    \n    with open(Config.LOG_PATH, \"w\") as log:\n        log.write(\"iteration\\tscore\\taction\\n\")\n\n        for i in range(Config.MAX_ITERATIONS):\n            prompt = f\"Rewrite this text to be more concise and professional:\\n\\n{current_artifact}\"\n            \n            response = httpx.post(\n                Config.API_URL,\n                headers={\"Authorization\": f\"Bearer {Config.API_KEY}\"},\n                json={\"model\": Config.MODEL, \"messages\": [{\"role\": \"user\", \"content\": prompt}]},\n                timeout=30.0\n            )\n            \n            candidate = response.json()[\"choices\"][0][\"message\"][\"content\"]\n            new_score = score(candidate)\n            \n            if new_score > best_score:\n                best_score = new_score\n                current_artifact = candidate\n                with open(Config.ARTIFACT_PATH, \"w\") as f:\n                    f.write(current_artifact)\n                git_commit(f\"Iteration {i}: Improved score to {new_score:.2f}\")\n                action = \"KEEP\"\n            else:\n                action = \"DISCARD\"\n            \n            log.write(f\"{i}\\t{new_score:.4f}\\t{action}\\n\")\n            print(f\"Iter {i}: {action} (Score: {new_score:.4f})\")\n```\n\n## Why Greedy Hill-Climbing?\n\nGreedy hill-climbing is the \"Hello World\" of optimization. It is highly effective when you have a clear, differentiable objective. Because LLM outputs are stochastic, this loop acts as a filter: it effectively \"prunes\" the bad samples generated by the model's temperature settings.\n\n**Tradeoffs:**\n* **Local Optima:** You might get stuck in a \"style\" that the metric likes but that isn't actually useful.\n* **Metric Fragility:** If your `score` function is too simple, the LLM will learn to \"game\" the metric (e.g., using specific words just to satisfy a keyword count) rather than improving quality.\n\n## Common Pitfalls\n\n1. **Metric Gaming:** If you reward length, the model will output verbose, fluff-filled text. Always include a penalty for excessive length.\n2. **The \"Judge\" Bias:** Using an LLM to evaluate another LLM (LLM-as-a-Judge) is powerful but prone to self-reinforcement bias. Use deterministic code-based metrics (like the one above) where possible.\n3. **Runaway Costs:** Always set a strict `MAX_ITERATIONS`. Without it, a loop error could drain your API credits in minutes.\n\n## What's Next\n\nTo level up this loop, consider:\n* **Parallelization:** Use `asyncio` to run multiple prompt variants simultaneously and pick the best of the batch.\n* **LLM-as-a-Judge:** Replace the `score` function with a call to a stronger model (e.g., `gpt-4o`) to critique the candidate output.\n* **Cost Tracking:** Multiply tokens used by the provider's cost per 1k tokens to log the financial efficiency of each iteration.", "D": "# Build a Minimal LLM Evaluation Loop in Python: Systematic Experiments for ML Engineers\n\nIf you're an ML engineer tired of manual prompt testing and ready to automate experiments, this tutorial guides you through building a simple evaluation loop using the OpenRouter API. You'll create a script that iteratively improves LLM outputs, scores them with a custom metric, and tracks progress\u2014all in a lean, understandable implementation.\n\n## What You Will Build\n\nBy the end of this tutorial, you'll have a Python script that:\n1. Sets up API calls with OpenRouter for secure, non-hardcoded key handling.\n2. Generates LLM responses and evaluates them using a defined metric.\n3. Runs a greedy hill-climbing loop to refine outputs over iterations.\n4. Tracks costs and saves results for analysis.\n5. Includes a concrete example to visualize how scores improve in practice.\n\nThis approach keeps things minimal, focusing on a working prototype you can extend.\n\n## What You Need\n\n- Python 3.10 or higher\n- An OpenRouter API key (obtain one at openrouter.ai)\n- Install required libraries: `pip install httpx python-dotenv`\n\n## Step 1: Setup API Key and Constants\n\nStart by securing your API key. Create a `.env` file in your project directory with this content:\n```plaintext\nOPENROUTER_API_KEY=sk-or-your-key-here\n```\n\nThis loads the key from an environment variable, avoiding security risks.\n\n```python\nimport os\nimport httpx\nfrom dotenv import load_dotenv\n\nload_dotenv()  # Loads variables from .env file\n\nAPI_KEY = os.getenv(\"OPENROUTER_API_KEY\")\nAPI_URL = \"https://openrouter.ai/api/v1/chat/completions\"\nMODEL = \"openai/gpt-4o-mini\"\nMAX_ITERATIONS = 20\nCOST_PER_TOKEN = 0.000002  # Approximate cost per token; verify with OpenRouter's pricing\n\ndef call_llm(prompt: str) -> str:\n    \"\"\"Make an API call to OpenRouter and return the LLM response.\"\"\"\n    try:\n        response = httpx.post(\n            API_URL,\n            headers={\"Authorization\": f\"Bearer {API_KEY}\"},\n            json={\n                \"model\": MODEL,\n                \"messages\": [{\"role\": \"user\", \"content\": prompt}]\n            },\n            timeout=10.0  # Prevents indefinite hangs due to network issues\n        )\n        response.raise_for_status()  # Raises an error for HTTP failures\n        data = response.json()\n        return data[\"choices\"][0][\"message\"][\"content\"]\n    except httpx.RequestError as e:\n        print(f\"API request failed: {e}. Skipping this iteration.\")\n        return \"\"  # Graceful failure handling\n```\n\n## Step 2: Define a Metric Function\n\nA metric function quantifies how good an LLM output is. For this example, we'll use a simple composite score based on length and vocabulary diversity, which proxies for coherence. Higher scores indicate better outputs.\n\n```python\ndef score(text: str) -> float:\n    \"\"\"Score the text: balances length and uniqueness of words.\"\"\"\n    if not text:  # Handle empty strings\n        return 0.0\n    words = text.split()\n    word_count = len(words)\n    length_score = min(word_count / 200, 1.0)  # Caps at 1.0 for texts over 200 words\n    unique_words_ratio = len(set(words)) / word_count  # Measures diversity\n    return 0.5 * length_score + 0.5 * unique_words_ratio  # Equal weighting\n```\n\nThis metric is basic but effective for demonstration. In real scenarios, you'd tailor it to your goals, like incorporating sentiment analysis for user-facing content.\n\n## Step 3: Implement the Evaluation Loop with Cost Tracking\n\nThe core loop uses greedy hill-climbing: it generates a new output, scores it, and keeps it if it's better than the previous best. This method iteratively improves the artifact while tracking costs.\n\n```python\nimport json\n\ndef main():\n    \"\"\"Run the evaluation loop.\"\"\"\n    best_score = 0.0\n    artifact = \"Start with this simple text: 'The quick brown