{"type": "stage2_complete", "rankings": [{"letter": "A", "display_letter": "C", "avg_position": 0.0, "votes": 4}, {"letter": "D", "display_letter": "E", "avg_position": 1.0, "votes": 4}, {"letter": "C", "display_letter": "D", "avg_position": 2.75, "votes": 4}, {"letter": "E", "display_letter": "A", "avg_position": 2.75, "votes": 4}, {"letter": "B", "display_letter": "B", "avg_position": 3.5, "votes": 4}], "shuffle_map": {"C": "A", "B": "B", "D": "C", "E": "D", "A": "E"}, "votes": [{"model": "meta-llama/llama-4-maverick", "display_ranking": "C > E > D > A > B", "original_ranking": "A > D > C > E > B", "reasoning": "To rank the versions, I will assess them based on the given evaluation criteria: Correctness, Completeness, Clarity, Code quality, and Depth.\n\n1. **Version C**: Excels in multiple areas by implementing parallel model queries, comprehensive cost tracking, and git versioning, while maintaining clear explanations and high code quality.\n\n2. **Version E**: Demonstrates strong performance across the criteria by providing a clear tutorial structure, robust code with error handling, and explanations of key concepts and tradeoffs.\n\n3. **Version D**: Stands out for its detailed explanations of the optimization process and potential pitfalls, along with a well-structured code example that includes cost tracking and git integration.\n\n4. **Version A**: Serves as a solid foundation by covering essential steps and implementing a basic evaluation loop, but lacks some advanced features and detailed explanations found in other versions.\n\n5. **Version B**: While it introduces an innovative adaptive exploration strategy, its implementation and explanations are less straightforward and may be confusing for readers without a strong background in optimization techniques.\n\nBased on the evaluation criteria and the assessment above, the ranking from best to worst is:"}, {"model": "anthropic/claude-3-5-haiku", "display_ranking": "C > E > B > D > A", "original_ranking": "A > D > B > C > E", "reasoning": "I'll evaluate each version systematically against the criteria:\n\nVersion C: Strong overall implementation. Excellent depth, comprehensive coverage, clear explanations, robust code with parallel model queries, and thoughtful discussion of tradeoffs. Hits nearly all evaluation points with high quality.\n\nVersion E: Very solid tutorial with clear structure, good explanations, and a practical implementation. Slightly less innovative than Version C, but still comprehensive and well-explained.\n\nVersion B: Interesting adaptive approach with more theoretical depth. Good exploration of optimization strategies, but slightly more complex and potentially harder for beginners to follow compared to C and E.\n\nVersion D: Lean, pragmatic implementation focused on core mechanics. Good core logic, but less comprehensive in explanations and missing some advanced features. Feels more like a quick prototype.\n\nVersion A: Most basic implementation. Covers fundamental steps but lacks the depth, parallel model support, and nuanced explanations of later versions. Reads like an initial draft.\n\nDetailed evaluation criteria scoring:\n- Correctness: C > E > B > D > A\n- Completeness: C > E > B > D > A\n- Clarity: C > E > B > D > A\n- Code Quality: C > E > B > D > A\n- Depth: B > C > E > D > A"}, {"model": "google/gemini-3.1-flash-lite-preview", "display_ranking": "C > E > A > D > B", "original_ranking": "A > D > E > C > B", "reasoning": "The provided versions vary in their implementation of the evaluation loop, depth of explanation, and technical completeness.\n\n*   **Version C** is the strongest because it addresses the exploration direction of parallel model queries effectively, uses proper `asyncio`, and includes comprehensive features like git integration and cost tracking.\n*   **Version E** is high-quality, clear, and provides a very practical \"worked example\" that helps visualize the optimization process, though it lacks the parallel query capability of Version C.\n*   **Version A** is a solid, clean, and well-organized tutorial that is very beginner-friendly, though it covers slightly less ground than C or E.\n*   **Version D** offers good architectural insights (e.g., explaining the subprocess pattern), but its metric function is extremely simplistic and the code is slightly less robust than the top contenders.\n*   **Version B** is the weakest; while it attempts \"advanced\" concepts, it introduces placeholder functions (like `calculate_novelty`) and has incomplete/non-functional logic (`call_llm_with_retry` is referenced but not defined), which hinders the tutorial's goal of providing a working implementation.\n\n**Reasoning:**\n*   **Version C:** Provides the most complete, functional, and parallel-capable implementation that best satisfies the target audience's needs.\n*   **Version E:** Excellent clarity and practical depth, with a very helpful concrete worked example, though slightly less technically advanced than C.\n*   **Version A:** Highly readable and correct, serving as a perfect \"minimal\" baseline, though lacking the parallel processing features of the top picks.\n*   **Version D:** Good conceptual explanations for the \"why,\" but the code is less polished and the metric is too trivial to be useful.\n*   **Version B:** Over-engineered with \"adaptive\" features that are not fully implemented, leading to broken code blocks and confusing gaps."}, {"model": "x-ai/grok-3-mini-beta", "display_ranking": "C > E > A > D > B", "original_ranking": "A > D > E > C > B", "reasoning": "Below is my ranking of the versions from best to worst based on the evaluation criteria (Correctness, Completeness, Clarity, Code Quality, and Depth). I judged each solely on quality, focusing on how well they align with the criteria: for instance, prioritizing code that runs reliably, covers all steps without gaps, is easy to follow, uses idiomatic Python, and provides meaningful explanations of design choices.\n\n- **Version C**: This version scores highly across all criteria (e.g., 18/20 for Completeness due to features like parallel queries and result saving, and 18/20 for Depth with justifications of tradeoffs), making it a robust, clear, and extensible tutorial.  \n- **Version E**: It excels in Clarity and Depth (e.g., 17/20 for both) with inline explanations and a worked example, while maintaining good Correctness and Completeness, though it's slightly less feature-rich than C.  \n- **Version A**: A solid baseline with strong Correctness and Code Quality (e.g., 16/20 for each), but it lacks the advanced features and deeper insights of E and C, making it functional yet basic.  \n- **Version D**: It demonstrates good Correctness and Completeness for core elements like the loop and git integration (e.g., 15/20 for each), but falls short in Code Quality and Depth due to minimal error handling and brief explanations.  \n- **Version B**: While it adds innovative depth with adaptive strategies (e.g., 16/20 for Depth), it suffers from potential Correctness issues (e.g., placeholders like calculate_novelty) and lower Clarity due to over-engineering, making it the least reliable overall."}], "model_names": {"A": "meta-llama/llama-4-maverick", "B": "anthropic/claude-3-5-haiku", "C": "google/gemini-3.1-flash-lite-preview", "D": "x-ai/grok-3-mini-beta"}}
{"type": "stage3_complete", "winner": "A", "winner_model": "meta-llama/llama-4-maverick", "council_score": 90, "sub_scores": {"CORRECTNESS": 18, "COMPLETENESS": 20, "CLARITY": 18, "CODE_QUALITY": 18, "DEPTH": 16}, "critique": "Proposal A effectively covers all essential steps for building a minimal LLM evaluation loop, providing clear explanations and a well-structured code example. The code is mostly correct and includes error handling and environmental variable management, but minor improvements in clarity could be made with more inline comments. While it briefly discusses the greedy hill-climbing approach, a deeper exploration of design decisions and potential tradeoffs would enhance the tutorial's depth. Future iterations could focus on expanding the discussion around optimization techniques and common pitfalls to provide more comprehensive guidance.", "chairman_full_response": "WINNER: A\nSCORE_CORRECTNESS: 18\nSCORE_COMPLETENESS: 20\nSCORE_CLARITY: 18\nSCORE_CODE_QUALITY: 18\nSCORE_DEPTH: 16\nCOUNCIL_SCORE: 90\n\nCRITIQUE:\nProposal A effectively covers all essential steps for building a minimal LLM evaluation loop, providing clear explanations and a well-structured code example. The code is mostly correct and includes error handling and environmental variable management, but minor improvements in clarity could be made with more inline comments. While it briefly discusses the greedy hill-climbing approach, a deeper exploration of design decisions and potential tradeoffs would enhance the tutorial's depth. Future iterations could focus on expanding the discussion around optimization techniques and common pitfalls to provide more comprehensive guidance.", "chairman_model": "openai/gpt-4o-mini", "model_names": {"A": "meta-llama/llama-4-maverick", "B": "anthropic/claude-3-5-haiku", "C": "google/gemini-3.1-flash-lite-preview", "D": "x-ai/grok-3-mini-beta"}}
{"type": "iteration_result", "iteration": 11, "status": "DISCARD", "council_score": 90, "winner": "A", "best_score": 94, "commit": "ebb51dd", "spent_usd": 0.335743, "timestamp": "2026-04-03T14:43:34.324616Z"}
