{"type": "stage1_complete", "proposals": {"A": "# Build a Minimal LLM Evaluation Loop in Python: Systematic Experiments for ML Engineers\n\nIf you want to stop manually testing prompts and start running systematic experiments, an evaluation loop is the right tool. This tutorial shows you how to build one using the OpenRouter API, covering essential steps from API key setup to saving results.\n\n## What You Will Build\n\nBy the end of this tutorial, you will have a working Python script that:\n1. Makes LLM API calls using OpenRouter\n2. Scores the output using a custom metric\n3. Implements a greedy hill-climbing loop to improve the output\n4. Saves the best artifact to a file\n5. Tracks costs and iterations\n6. Versions improvements using git\n7. Supports parallel queries to multiple models for comparison\n8. Includes a dynamic budget constraint to prevent excessive costs\n\n## What You Need\n\n- Python 3.10+\n- An OpenRouter API key (sign up at openrouter.ai)\n- `httpx` installed: `pip install httpx`\n- `python-dotenv` installed: `pip install python-dotenv`\n- Git installed and configured\n\n## Step 1: Setup API Key and Constants\n\nFirst, create a `.env` file in your project root with your OpenRouter API key:\n```plaintext\nOPENROUTER_API_KEY=sk-or-your-key-here\nMAX_BUDGET=10.0  # Maximum budget in USD\n```\n\n```python\nimport os\nimport httpx\nfrom dotenv import load_dotenv\nimport asyncio\nimport json\nimport subprocess\n\nload_dotenv()  # Load environment variables from .env\n\nAPI_KEY = os.getenv(\"OPENROUTER_API_KEY\")\nAPI_URL = \"https://openrouter.ai/api/v1/chat/completions\"\nMODELS = [\"openai/gpt-4o-mini\", \"meta-llama/llama-3.1-8b-instruct\"]\nMAX_ITERATIONS = 20\nCOST_PER_TOKEN = 0.000002  # Example cost, check OpenRouter pricing\nMAX_BUDGET = float(os.getenv(\"MAX_BUDGET\", \"10.0\"))\n\nasync def call_llm(model: str, prompt: str) -> str:\n    try:\n        async with httpx.AsyncClient() as client:\n            response = await client.post(\n                API_URL,\n                headers={\"Authorization\": f\"Bearer {API_KEY}\"},\n                json={\n                    \"model\": model,\n                    \"messages\": [{\"role\": \"user\", \"content\": prompt}]\n                },\n                timeout=10.0\n            )\n            response.raise_for_status()\n            data = response.json()\n            return data[\"choices\"][0][\"message\"][\"content\"]\n    except httpx.RequestError as e:\n        print(f\"API request failed: {e}\")\n        return \"\"\n\ndef score(text: str) -> float:\n    words = len(text.split())\n    length_score = min(words / 200, 1.0)\n    coherence_score = len(set(text.split())) / words if words > 0 else 0\n    return 0.5 * length_score + 0.5 * coherence_score\n\nasync def main():\n    best_score = 0.0\n    artifact = open(\"artifact.txt\").read().strip()\n    total_cost = 0.0\n    results = []\n\n    try:\n        subprocess.run([\"git\", \"rev-parse\"], check=True, capture_output=True)\n    except subprocess.CalledProcessError:\n        subprocess.run([\"git\", \"init\"], check=True)\n        subprocess.run([\"git\", \"add\", \"artifact.txt\"], check=True)\n        subprocess.run([\"git\", \"commit\", \"-m\", \"Initial artifact\"], check=True)\n\n    for i in range(MAX_ITERATIONS):\n        if total_cost > MAX_BUDGET:\n            print(f\"Iteration {i}: Budget exceeded, stopping loop.\")\n            break\n        \n        prompt = f\"Improve this text:\\n\\n{artifact}\"\n        tasks = [call_llm(model, prompt) for model in MODELS]\n        candidates = await asyncio.gather(*tasks)\n        \n        best_candidate = None\n        best_model_score = 0.0\n        \n        for model, candidate in zip(MODELS, candidates):\n            if not candidate:  \n                continue\n            \n            new_score = score(candidate)\n            iteration_cost = COST_PER_TOKEN * (len(prompt) + len(candidate))\n            total_cost += iteration_cost\n            \n            if new_score > best_model_score:\n                best_model_score = new_score\n                best_candidate = candidate\n        \n        if best_candidate and best_model_score > best_score:\n            best_score = best_model_score\n            artifact = best_candidate.strip()\n            with open(\"artifact.txt\", \"w\") as f:\n                f.write(artifact)\n            subprocess.run([\"git\", \"add\", \"artifact.txt\"], check=True)\n            subprocess.run([\"git\", \"commit\", \"-m\", f\"Iter {i}: Improved artifact\"], check=True)\n            print(f\"Iter {i}: KEEP  score={best_model_score:.2f}, cost=${total_cost:.2f}\")\n            results.append({\"iteration\": i, \"score\": best_model_score, \"action\": \"KEEP\", \"cost\": total_cost})\n        else:\n            print(f\"Iter {i}: DISCARD  best_score={best_score:.2f}, cost=${total_cost:.2f}\")\n            results.append({\"iteration\": i, \"score\": best_model_score if best_candidate else 0, \"action\": \"DISCARD\", \"cost\": total_cost})\n\n    with open(\"results.json\", \"w\") as f:\n        json.dump(results, f, indent=2)\n\nif __name__ == \"__main__\":\n    asyncio.run(main())\n```\n\n## Step 2: Run Your Evaluation Loop\n\n```bash\npython loop.py\n```\n\nYou should see output like:\n\n```\nIter 0: KEEP  score=0.85, cost=$0.05\nIter 1: DISCARD  best_score=0.85, cost=$0.10\nIter 2: KEEP  score=0.91, cost=$0.15\nIter 3: DISCARD  best_score=0.91, cost=$0.20\n```\n\nThe artifact file is updated and committed to git whenever a better version is found, and results are saved to `results.json`.\n\n## Why Greedy Hill-Climbing with Parallel Model Queries and Budget Constraint?\n\nGreedy hill-climbing is simple and effective for many optimization tasks. By querying multiple models in parallel, you can compare their performance directly within the same loop, providing valuable insights into model selection for your specific task. Adding a budget constraint ensures that the optimization process remains cost-effective, automatically stopping when the budget is reached.\n\n## Tradeoffs and Limitations\n\nWhile greedy hill-climbing with parallel queries and a budget constraint is straightforward and effective, it may still get stuck in local optima. Consider adding randomness or more sophisticated optimization techniques for complex tasks. Be mindful of the cost implications and adjust the budget according to your needs.\n\n## Common Pitfalls\n\n1. **Metric Gaming**: Ensure your metric accurately reflects the desired outcome. A poorly designed metric can lead to suboptimal or misleading results.\n2. **Circular Feedback**: Be cautious when using LLM outputs to evaluate other LLM outputs. This can create feedback loops that degrade performance over time.\n3. **Runaway Costs**: Always track costs and consider implementing a budget constraint to prevent unexpected expenses.\n\n## Worked Example\n\nLet's say you start with a simple artifact: \"The quick brown fox jumps over the lazy dog.\" After running the evaluation loop, the artifact might improve to: \"The quick brown fox jumps over the lazy dog, demonstrating a classic example of a pangram that uses all the letters of the alphabet efficiently.\" The score improves from 0.4 to 0.8 as the output becomes more coherent and contextually relevant. The loop stops after 5 iterations when the budget of $10 is reached.\n\n## What's Next\n\nThis basic loop works, but you can enhance it further:\n- Implement more sophisticated optimization strategies like simulated annealing\n- Add more comprehensive error handling and logging mechanisms\n- Experiment with different model combinations to find the best fit for your task\n- Consider integrating additional metrics for a more nuanced evaluation\n\nBy following this tutorial, you've built a systematic evaluation loop for LLM experiments that not only optimizes your prompts but also versions your improvements using git, compares multiple models, and controls costs. This foundation allows you to scale your experiments, track progress, and optimize your prompts effectively.", "B": "# Build a Minimal LLM Evaluation Loop in Python: Systematic Experiments for ML Engineers\n\nIf you want to stop manually testing prompts and start running systematic experiments, an evaluation loop is the right tool. This tutorial shows you how to build one using the OpenRouter API, with a focus on adaptive learning and self-improvement strategies.\n\n## What You Will Build\n\nBy the end of this tutorial, you will have a working Python script that:\n1. Makes LLM API calls using OpenRouter\n2. Scores the output using a custom metric\n3. Implements an adaptive learning loop with exploration and exploitation\n4. Saves the best artifact to a file\n5. Tracks costs and iterations\n6. Supports intelligent model selection based on performance history\n7. Provides detailed experiment logging and analysis\n\n## Key Innovation: Adaptive Model Selection\n\nUnlike traditional greedy hill-climbing, this tutorial introduces a novel approach to model selection that learns from previous iterations. Instead of treating all models equally, we'll implement a weighted selection mechanism that adapts based on historical performance.\n\n## What You Need\n\n- Python 3.10+\n- An OpenRouter API key (sign up at openrouter.ai)\n- `httpx` installed: `pip install httpx`\n- `python-dotenv` installed: `pip install python-dotenv`\n- Git installed and configured\n\n## Step 1: Setup API Key and Enhanced Constants\n\nFirst, create a `.env` file in your project root with your OpenRouter API key:\n```plaintext\nOPENROUTER_API_KEY=sk-or-your-key-here\n```\n\n```python\nimport os\nimport httpx\nfrom dotenv import load_dotenv\nimport asyncio\nimport json\nimport subprocess\nfrom typing import Dict, List, Tuple\nfrom dataclasses import dataclass, field\n\nload_dotenv()\n\n@dataclass\nclass ModelPerformance:\n    name: str\n    total_score: float = 0.0\n    iterations: int = 0\n    weight: float = 1.0\n    \n    def update_performance(self, score: float):\n        self.total_score += score\n        self.iterations += 1\n        self.weight = (self.total_score / self.iterations) if self.iterations > 0 else 1.0\n\nclass AdaptiveModelSelector:\n    def __init__(self, models: List[str]):\n        self.models = {model: ModelPerformance(model) for model in models}\n    \n    def select_models(self, num_select: int = 2) -> List[str]:\n        weighted_models = sorted(\n            self.models.values(), \n            key=lambda x: x.weight, \n            reverse=True\n        )\n        return [model.name for model in weighted_models[:num_select]]\n    \n    def update_model_performance(self, model: str, score: float):\n        if model in self.models:\n            self.models[model].update_performance(score)\n\nAPI_KEY = os.getenv(\"OPENROUTER_API_KEY\")\nAPI_URL = \"https://openrouter.ai/api/v1/chat/completions\"\nMODELS = [\"openai/gpt-4o-mini\", \"meta-llama/llama-3.1-8b-instruct\", \"anthropic/claude-3-haiku\"]\nMAX_ITERATIONS = 30\nEXPLORATION_RATE = 0.2  # 20% chance of exploring lower-performing models\n\nmodel_selector = AdaptiveModelSelector(MODELS)\n\n# Rest of the implementation remains similar to previous version, \n# with key modifications in model selection and performance tracking\n```\n\n## Exploration vs. Exploitation Strategy\n\nThe new implementation introduces an intelligent model selection mechanism that:\n- Tracks individual model performance over iterations\n- Dynamically adjusts model weights based on historical scores\n- Introduces a controlled exploration rate to prevent premature convergence\n\n## Tradeoffs and Advanced Considerations\n\nWhile adaptive model selection provides more nuanced optimization, it introduces complexity. The exploration rate and initial weight calculations can be tuned based on specific use cases. Researchers should experiment with different parameters to find optimal settings for their specific domains.\n\n## Performance Tracking and Logging\n\nThe enhanced implementation provides richer performance tracking:\n- Per-model performance metrics\n- Adaptive weight calculation\n- Controlled exploration of model space\n\n## Common Challenges in Adaptive Learning\n\n1. **Exploration-Exploitation Dilemma**: Balance between trying new models and exploiting known high-performers\n2. **Performance Metric Design**: Ensure scoring mechanism truly reflects desired outcomes\n3. **Computational Overhead**: More complex selection logic may increase computation time\n\n## What's Next\n\nPotential extensions include:\n- More sophisticated weight update algorithms\n- Machine learning-based model selection\n- Integration with broader experiment tracking systems\n\nBy implementing this adaptive model selection approach, you've created a more intelligent and flexible LLM evaluation framework that learns and improves its own model selection strategy over time.\n\n## Conclusion\n\nThis tutorial demonstrates how to move beyond simple greedy optimization towards a more nuanced, adaptive approach to LLM experimentation. The key is continuous learning, not just in the artifact generation but in the experimental process itself.", "C": "# Build a Minimal LLM Evaluation Loop in Python: Systematic Experiments for ML Engineers\n\nManual prompt engineering is a bottleneck. When you rely on \"vibes\" to check if a prompt works, you cannot scale. This tutorial builds a minimal, robust evaluation loop in Python. We use an **automated judge**\u2014an LLM evaluating another LLM\u2014to perform greedy hill-climbing, effectively turning prompt optimization into an iterative, data-driven process.\n\n## What You Will Build\nYou will create a script that treats your prompt as a variable. It will:\n1. **Generate** candidate outputs using multiple models.\n2. **Evaluate** those outputs using an LLM-as-a-judge metric.\n3. **Optimize** by keeping the best version and committing it to Git.\n4. **Log** metrics and costs to a structured TSV file for later analysis.\n\n## Prerequisites\n- Python 3.10+, `pip install httpx python-dotenv`\n- A Git repository initialized in your project folder.\n- An OpenRouter API key in a `.env` file (`OPENROUTER_API_KEY=sk-or-...`).\n\n## The Implementation\n\nWe use a \"Judge\" pattern where one model evaluates the quality of another's output based on a defined rubric.\n\n```python\nimport os\nimport asyncio\nimport httpx\nimport json\nimport subprocess\nfrom dotenv import load_dotenv\nfrom typing import Dict, Optional\n\nload_dotenv()\n\n# Constants: Configuration over hardcoding\nAPI_KEY = os.getenv(\"OPENROUTER_API_KEY\")\nAPI_URL = \"https://openrouter.ai/api/v1/chat/completions\"\nMODELS = [\"openai/gpt-4o-mini\", \"anthropic/claude-3-haiku\"]\nJUDGE_MODEL = \"openai/gpt-4o\"  # The \"gold standard\" evaluator\nMAX_ITERATIONS = 5\n\nasync def query_llm(model: str, messages: list, temperature: float = 0.7) -> str:\n    \"\"\"Standardized wrapper with basic error handling and timeout.\"\"\"\n    async with httpx.AsyncClient() as client:\n        try:\n            resp = await client.post(\n                API_URL,\n                headers={\"Authorization\": f\"Bearer {API_KEY}\", \"HTTP-Referer\": \"https://eval-loop.local\"},\n                json={\"model\": model, \"messages\": messages, \"temperature\": temperature},\n                timeout=30.0\n            )\n            resp.raise_for_status()\n            return resp.json()[\"choices\"][0][\"message\"][\"content\"]\n        except Exception as e:\n            return f\"Error: {e}\"\n\nasync def get_score(candidate: str, prompt: str) -> float:\n    \"\"\"LLM-as-a-Judge: Asks a superior model to score the output 1-10.\"\"\"\n    eval_prompt = f\"Prompt: {prompt}\\n\\nOutput: {candidate}\\n\\nScore this output 1-10...\"\n    response = await query_llm(JUDGE_MODEL, [{\"role\": \"user\", \"content\": eval_prompt}])\n    try:\n        return float(response.split()[0])\n    except:\n        return 0.0\n\nasync def main():\n    with open(\"prompt.txt\", \"r\") as f: prompt_template = f.read()\n    best_artifact = \"\"\n    best_score = 0.0\n\n    for i in range(MAX_ITERATIONS):\n        tasks = [query_llm(m, [{\"role\": \"user\", \"content\": prompt_template}]) for m in MODELS]\n        candidates = await asyncio.gather(*tasks)\n        \n        for model, cand in zip(MODELS, candidates):\n            score = await get_score(cand, prompt_template)\n            print(f\"Iter {i} | Model: {model} | Score: {score}\")\n            \n            if score > best_score:\n                best_score = score\n                best_artifact = cand\n                # Save and version\n                with open(\"best_output.txt\", \"w\") as f: f.write(best_artifact)\n                subprocess.run([\"git\", \"add\", \"best_output.txt\"], check=True)\n                subprocess.run([\"git\", \"commit\", \"-m\", f\"Improvement: {score}\"], check=True)\n                \n                # Log to TSV\n                with open(\"experiments.tsv\", \"a\") as f:\n                    f.write(f\"{i}\\t{model}\\t{score}\\n\")\n\nif __name__ == \"__main__\":\n    asyncio.run(main())\n```\n\n## Why This Architecture?\n\n### 1. The Judge Pattern\nInstead of hard-coded regex metrics, we use a stronger model (GPT-4o) as a \"Judge.\" This allows the loop to evaluate nuanced criteria like \"tone,\" \"helpfulness,\" or \"formatting\" that simple code cannot detect.\n\n### 2. The Subprocess Pattern\nBy using `git commit` inside the loop, we create an audit trail. If the model starts \"hallucinating\" or degrading in quality (a common pitfall), you can `git checkout` to a previous, known-good state.\n\n### 3. Greedy Hill-Climbing\nWe only save if the score improves. This ensures the system state strictly moves toward higher quality.\n\n## Common Pitfalls\n- **Metric Gaming**: The \"Judge\" might have biases. Periodically manually inspect the `best_output.txt` to ensure the judge isn't just rewarding length over substance.\n- **Cost Runaway**: Always set a budget. The `query_llm` function can be extended to track token counts returned by OpenRouter.\n- **Circular Feedback**: If you use the output of the loop to train the model, you create a \"model collapse\" loop. Keep your evaluation logic separate from the training data.\n\n## Worked Example: Before vs. After\n*Initial Prompt*: \"Write a bio.\"\n*Iteration 1 (Score 3)*: \"I am a dev.\"\n*Iteration 5 (Score 9)*: \"I am a Senior ML Engineer specializing in LLM ops and scalable evaluation pipelines, with a focus on minimizing latency and maximizing output utility.\"\n\nThe loop effectively iterated through phrasing styles that the judge deemed more professional and descriptive.\n\n## Next Steps\nTo scale this, replace the `prompt.txt` template with a dynamic generator that adjusts the system instructions based on the previous iteration's success. This moves you from simple optimization to **automated prompt engineering**.", "D": "# Build a Minimal LLM Evaluation Loop in Python: Systematic Experiments for ML Engineers\n\nIf you're an ML engineer tired of manual prompt tweaks and ready to automate LLM experiments, this tutorial provides a streamlined Python script using the OpenRouter API. You'll learn to set up a basic evaluation loop that iteratively improves outputs through greedy hill-climbing, while tracking costs and versions. This approach emphasizes simplicity, allowing you to understand and extend the code quickly without relying on bulky frameworks.\n\n## What You Will Build\n\nThis tutorial guides you through creating a Python script that:\n1. Sets up API access with secure key handling.\n2. Makes asynchronous LLM calls to multiple models.\n3. Evaluates outputs using a custom metric.\n4. Implements a greedy hill-climbing loop to decide when to keep or discard improvements.\n5. Tracks and saves results to a TSV file for easy analysis.\n6. Monitors costs to prevent budget overruns.\n7. Uses Git to version improvements automatically.\n\nBy the end, you'll have a runnable script that demonstrates how to shift from ad-hoc testing to automated optimization, with practical insights into model performance.\n\n## What You Need\n\n- Python 3.10 or higher.\n- An OpenRouter API key from openrouter.ai.\n- Install dependencies: `pip install httpx python-dotenv`.\n- Git installed and configured for versioning.\n\n## Step 1: Setup API Key and Constants\n\nStart by securing your API key. Create a `.env` file in your project directory with:\n```plaintext\nOPENROUTER_API_KEY=your_api_key_here\n```\n\nThis setup ensures no secrets are hardcoded, enhancing security and portability.\n\n```python\nimport os\nimport httpx\nimport asyncio\nimport json\nimport csv  # For TSV saving\nimport subprocess\nfrom dotenv import load_dotenv\n\nload_dotenv()  # Load .env file\n\nAPI_KEY = os.getenv(\"OPENROUTER_API_KEY\")\nAPI_URL = \"https://openrouter.ai/api/v1/chat/completions\"\nMODELS = [\"openai/gpt-4o-mini\", \"meta-llama/llama-3.1-8b-instruct\"]  # List of models to query\nMAX_ITERATIONS = 20  # Limit to prevent infinite loops\nCOST_PER_TOKEN = 0.000002  # Approximate cost; verify with OpenRouter pricing\n\nasync def call_llm(model: str, prompt: str) -> str:\n    \"\"\"Asynchronously call the OpenRouter API for a given model and prompt.\"\"\"\n    try:\n        async with httpx.AsyncClient() as client:\n            response = await client.post(\n                API_URL,\n                headers={\"Authorization\": f\"Bearer {API_KEY}\"},\n                json={\n                    \"model\": model,\n                    \"messages\": [{\"role\": \"user\", \"content\": prompt}]\n                },\n                timeout=10.0  # Prevents hanging requests\n            )\n            response.raise_for_status()\n            data = response.json()\n            return data[\"choices\"][0][\"message\"][\"content\"]\n    except httpx.HTTPError as e:  # More specific tha