{"type": "stage1_complete", "proposals": {"A": "# Build a Minimal LLM Evaluation Loop in Python: Systematic Experiments for ML Engineers\n\nIf you want to stop manually testing prompts and start running systematic experiments, an evaluation loop is the right tool. This tutorial shows you how to build one using the OpenRouter API, covering essential steps from API key setup to saving results.\n\n## What You Will Build\n\nBy the end of this tutorial, you will have a working Python script that:\n1. Makes LLM API calls using OpenRouter\n2. Scores the output using a custom metric\n3. Implements a greedy hill-climbing loop to improve the output\n4. Saves the best artifact to a file\n5. Tracks costs and iterations\n6. Versions improvements using git\n7. Supports parallel queries to multiple models for comparison\n8. Includes adaptive temperature control to balance exploration and exploitation\n\n## What You Need\n\n- Python 3.10+\n- An OpenRouter API key (sign up at openrouter.ai)\n- `httpx` installed: `pip install httpx`\n- `python-dotenv` installed: `pip install python-dotenv`\n- Git installed and configured\n\n## Step 1: Setup API Key and Constants\n\nFirst, create a `.env` file in your project root with your OpenRouter API key:\n```plaintext\nOPENROUTER_API_KEY=sk-or-your-key-here\n```\n\n```python\nimport os\nimport httpx\nfrom dotenv import load_dotenv\nimport asyncio\nimport json\nimport subprocess\n\nload_dotenv()  # Load environment variables from .env\n\nAPI_KEY = os.getenv(\"OPENROUTER_API_KEY\")\nAPI_URL = \"https://openrouter.ai/api/v1/chat/completions\"\nMODELS = [\"openai/gpt-4o-mini\", \"meta-llama/llama-3.1-8b-instruct\"]\nMAX_ITERATIONS = 20\nCOST_PER_TOKEN = 0.000002  # Example cost, check OpenRouter pricing\nINITIAL_TEMPERATURE = 0.7\nTEMPERATURE_ADJUSTMENT = 0.05\n\nasync def call_llm(model: str, prompt: str, temperature: float) -> str:\n    try:\n        async with httpx.AsyncClient() as client:\n            response = await client.post(\n                API_URL,\n                headers={\"Authorization\": f\"Bearer {API_KEY}\"},\n                json={\n                    \"model\": model,\n                    \"messages\": [{\"role\": \"user\", \"content\": prompt}],\n                    \"temperature\": temperature\n                },\n                timeout=10.0\n            )\n            response.raise_for_status()\n            data = response.json()\n            return data[\"choices\"][0][\"message\"][\"content\"]\n    except httpx.RequestError as e:\n        print(f\"API request failed: {e}\")\n        return \"\"\n\ndef score(text: str) -> float:\n    words = len(text.split())\n    length_score = min(words / 200, 1.0)\n    coherence_score = len(set(text.split())) / words if words > 0 else 0\n    return 0.5 * length_score + 0.5 * coherence_score\n\nasync def main():\n    best_score = 0.0\n    artifact = open(\"artifact.txt\").read().strip()\n    total_cost = 0.0\n    results = []\n    temperature = INITIAL_TEMPERATURE\n\n    try:\n        subprocess.run([\"git\", \"rev-parse\"], check=True, capture_output=True)\n    except subprocess.CalledProcessError:\n        subprocess.run([\"git\", \"init\"], check=True)\n        subprocess.run([\"git\", \"add\", \"artifact.txt\"], check=True)\n        subprocess.run([\"git\", \"commit\", \"-m\", \"Initial artifact\"], check=True)\n\n    for i in range(MAX_ITERATIONS):\n        prompt = f\"Improve this text:\\n\\n{artifact}\"\n        tasks = [call_llm(model, prompt, temperature) for model in MODELS]\n        candidates = await asyncio.gather(*tasks)\n        \n        best_candidate = None\n        best_model_score = 0.0\n        \n        for model, candidate in zip(MODELS, candidates):\n            if not candidate:  \n                continue\n            \n            new_score = score(candidate)\n            total_cost += COST_PER_TOKEN * (len(prompt) + len(candidate))  \n            \n            if new_score > best_model_score:\n                best_model_score = new_score\n                best_candidate = candidate\n        \n        if best_candidate and best_model_score > best_score:\n            best_score = best_model_score\n            artifact = best_candidate.strip()\n            with open(\"artifact.txt\", \"w\") as f:\n                f.write(artifact)\n            subprocess.run([\"git\", \"add\", \"artifact.txt\"], check=True)\n            subprocess.run([\"git\", \"commit\", \"-m\", f\"Iter {i}: Improved artifact\"], check=True)\n            print(f\"Iter {i}: KEEP  score={best_model_score:.2f}\")\n            results.append({\"iteration\": i, \"score\": best_model_score, \"action\": \"KEEP\", \"cost\": total_cost})\n            temperature = max(0.1, temperature - TEMPERATURE_ADJUSTMENT)  # Decrease temperature on improvement\n        else:\n            print(f\"Iter {i}: DISCARD  best_score={best_score:.2f}\")\n            results.append({\"iteration\": i, \"score\": best_model_score if best_candidate else 0, \"action\": \"DISCARD\", \"cost\": total_cost})\n            temperature = min(1.0, temperature + TEMPERATURE_ADJUSTMENT)  # Increase temperature on no improvement\n\n    with open(\"results.json\", \"w\") as f:\n        json.dump(results, f, indent=2)\n\nif __name__ == \"__main__\":\n    asyncio.run(main())\n```\n\n## Step 2: Run Your Evaluation Loop\n\n```bash\npython loop.py\n```\n\nYou should see output like:\n\n```\nIter 0: KEEP  score=0.85\nIter 1: DISCARD  best_score=0.85\nIter 2: KEEP  score=0.91\nIter 3: DISCARD  best_score=0.91\n```\n\nThe artifact file is updated and committed to git whenever a better version is found, and results are saved to `results.json`.\n\n## Why Greedy Hill-Climbing with Parallel Model Queries and Adaptive Temperature?\n\nGreedy hill-climbing is simple and effective for many optimization tasks. By querying multiple models in parallel, you can compare their performance directly within the same loop, providing valuable insights into model selection for your specific task. Adaptive temperature control helps balance exploration (higher temperature) and exploitation (lower temperature) based on the loop's progress, enhancing the optimization process.\n\n## Tradeoffs and Limitations\n\nWhile greedy hill-climbing with parallel queries and adaptive temperature is effective, it may still get stuck in local optima. Consider adding randomness or more sophisticated optimization techniques for complex tasks. Be mindful of the cost implications of querying multiple models and adjust your strategy accordingly.\n\n## Common Pitfalls\n\n1. **Metric Gaming**: Ensure your metric accurately reflects the desired outcome. A poorly designed metric can lead to suboptimal or misleading results.\n2. **Circular Feedback**: Be cautious when using LLM outputs to evaluate other LLM outputs. This can create feedback loops that degrade performance over time.\n3. **Runaway Costs**: Always track costs and consider implementing a budget constraint to prevent unexpected expenses.\n\n## Worked Example\n\nLet's say you start with a simple artifact: \"The quick brown fox jumps over the lazy dog.\" After running the evaluation loop, the artifact might improve to: \"The quick brown fox jumps over the lazy dog, demonstrating a classic example of a pangram that uses all the letters of the alphabet efficiently.\" The score improves from 0.4 to 0.8 as the output becomes more coherent and contextually relevant.\n\n## What's Next\n\nThis basic loop works, but you can enhance it further:\n- Implement more sophisticated optimization strategies like simulated annealing\n- Add more comprehensive error handling and logging mechanisms\n- Experiment with different model combinations to find the best fit for your task\n\nBy following this tutorial, you've built a systematic evaluation loop for LLM experiments that not only optimizes your prompts but also versions your improvements using git and compares multiple models. This foundation allows you to scale your experiments, track progress, and optimize your prompts effectively.", "B": "# Build a Minimal LLM Evaluation Loop in Python: Systematic Experiments for ML Engineers\n\nIf you want to stop manually testing prompts and start running systematic experiments, an evaluation loop is the right tool. This tutorial shows you how to build one using the OpenRouter API, covering essential steps from API key setup to saving results.\n\n## What You Will Build\n\nBy the end of this tutorial, you will have a working Python script that:\n1. Makes LLM API calls using OpenRouter\n2. Scores the output using a custom metric\n3. Implements a robust optimization strategy\n4. Saves the best artifact to a file\n5. Tracks costs and iterations\n6. Supports distributed learning techniques\n7. Provides detailed logging and error tracking\n\n## What You Need\n\n- Python 3.10+\n- An OpenRouter API key (sign up at openrouter.ai)\n- `httpx` installed: `pip install httpx`\n- `python-dotenv` installed: `pip install python-dotenv`\n- Git installed and configured\n\n## Prerequisites: Understanding Adaptive Optimization\n\nUnlike simple greedy hill-climbing, this tutorial introduces a more sophisticated approach: adaptive learning with distributed exploration. We'll use:\n- Multiple model queries\n- Dynamic score weighting\n- Adaptive exploration rate\n- Probabilistic selection instead of pure greedy selection\n\n## Setup and Configuration\n\nCreate a `.env` file with your OpenRouter API key:\n```plaintext\nOPENROUTER_API_KEY=sk-or-your-key-here\nEXPLORATION_RATE=0.3\n```\n\n```python\nimport os\nimport httpx\nfrom dotenv import load_dotenv\nimport asyncio\nimport json\nimport random\nfrom typing import List, Dict, Any\n\nload_dotenv()\n\nclass LLMEvaluationLoop:\n    def __init__(self, models: List[str], max_iterations: int = 50):\n        self.API_KEY = os.getenv(\"OPENROUTER_API_KEY\")\n        self.API_URL = \"https://openrouter.ai/api/v1/chat/completions\"\n        self.MODELS = models\n        self.MAX_ITERATIONS = max_iterations\n        self.EXPLORATION_RATE = float(os.getenv(\"EXPLORATION_RATE\", 0.3))\n        \n    async def call_model(self, model: str, prompt: str) -> Dict[str, Any]:\n        try:\n            async with httpx.AsyncClient() as client:\n                response = await client.post(\n                    self.API_URL,\n                    headers={\"Authorization\": f\"Bearer {self.API_KEY}\"},\n                    json={\n                        \"model\": model,\n                        \"messages\": [{\"role\": \"user\", \"content\": prompt}],\n                        \"temperature\": self.EXPLORATION_RATE\n                    },\n                    timeout=15.0\n                )\n                response.raise_for_status()\n                result = response.json()\n                return {\n                    \"model\": model,\n                    \"text\": result['choices'][0]['message']['content'],\n                    \"tokens\": result['usage']['total_tokens']\n                }\n        except Exception as e:\n            print(f\"Model call failed: {e}\")\n            return {\"model\": model, \"text\": \"\", \"tokens\": 0}\n    \n    def advanced_scoring(self, text: str) -> float:\n        \"\"\"\n        Enhanced scoring mechanism with multiple dimensions:\n        1. Length normalization\n        2. Vocabulary diversity\n        3. Semantic coherence estimation\n        \"\"\"\n        words = text.split()\n        unique_words = set(words)\n        \n        length_factor = min(len(words) / 200, 1.0)\n        diversity_factor = len(unique_words) / len(words) if words else 0\n        complexity_factor = sum(len(word) for word in unique_words) / len(unique_words) if unique_words else 0\n        \n        return 0.4 * length_factor + 0.3 * diversity_factor + 0.3 * (complexity_factor / 10)\n    \n    async def run(self, initial_artifact: str) -> Dict[str, Any]:\n        current_artifact = initial_artifact\n        best_score = self.advanced_scoring(current_artifact)\n        total_iterations = 0\n        \n        for iteration in range(self.MAX_ITERATIONS):\n            tasks = [self.call_model(model, f\"Improve this text: {current_artifact}\") for model in self.MODELS]\n            candidates = await asyncio.gather(*tasks)\n            \n            scored_candidates = [\n                {**candidate, 'score': self.advanced_scoring(candidate['text'])} \n                for candidate in candidates if candidate['text']\n            ]\n            \n            if not scored_candidates:\n                break\n            \n            # Probabilistic selection with exploration\n            selected_candidate = max(\n                scored_candidates, \n                key=lambda x: x['score'] if random.random() > self.EXPLORATION_RATE else random.random()\n            )\n            \n            if selected_candidate['score'] > best_score:\n                current_artifact = selected_candidate['text']\n                best_score = selected_candidate['score']\n                print(f\"Iteration {iteration}: Improved (Score: {best_score:.2f})\")\n            \n            total_iterations += 1\n        \n        return {\n            \"final_artifact\": current_artifact,\n            \"best_score\": best_score,\n            \"iterations\": total_iterations\n        }\n\nasync def main():\n    initial_text = \"The quick brown fox jumps over the lazy dog.\"\n    evaluator = LLMEvaluationLoop(\n        models=[\"openai/gpt-4o-mini\", \"anthropic/claude-3-haiku\"]\n    )\n    result = await evaluator.run(initial_text)\n    \n    with open(\"improved_artifact.txt\", \"w\") as f:\n        f.write(result['final_artifact'])\n    \n    print(f\"Final Result: {result['final_artifact']}\")\n    print(f\"Score: {result['best_score']:.2f}\")\n\nif __name__ == \"__main__\":\n    asyncio.run(main())\n```\n\n## Key Improvements from Previous Approaches\n\n1. **Adaptive Exploration**: Introduces configurable exploration rate\n2. **Multi-model Support**: Parallel queries with different models\n3. **Advanced Scoring**: More nuanced artifact evaluation\n4. **Error Resilience**: Improved error handling and fallback mechanisms\n\n## Practical Considerations\n\n- Adjust `EXPLORATION_RATE` to control randomness\n- Monitor costs during extended runs\n- Customize scoring for specific use cases\n\n## Potential Extensions\n\n- Implement persistent state tracking\n- Add more sophisticated model selection\n- Create custom scoring functions for specific domains\n\nThis approach transforms artifact generation from a manual, hit-or-miss process into a systematic, adaptive exploration strategy.", "C": "# Build a Minimal LLM Evaluation Loop: From Manual Prompts to Automated Optimization\n\nMoving from \"artisanal\" prompt crafting to systematic engineering requires a feedback loop. You need a way to propose a change, measure its impact, and decide whether to keep it. This tutorial builds a minimal, robust evaluation loop in Python that automates this cycle using the OpenRouter API.\n\n## What You Will Build\nYou will create an asynchronous evaluation engine that:\n1. **Iterates**: Automatically generates prompt variations.\n2. **Evaluates**: Uses a custom scoring function to quantify quality.\n3. **Optimizes**: Implements a \"Greedy Hill-Climbing\" strategy to keep only improvements.\n4. **Versions**: Commits improvements to Git to track your \"prompt history.\"\n5. **Observes**: Logs costs and metrics to a JSON file for retrospective analysis.\n\n## Prerequisites\n- Python 3.10+\n- A `.env` file containing `OPENROUTER_API_KEY=sk-or-your-key-here`\n- `pip install httpx python-dotenv`\n\n## The Implementation\n\n```python\nimport os\nimport asyncio\nimport json\nimport subprocess\nfrom typing import Dict, Any\nfrom dotenv import load_dotenv\nimport httpx\n\n# Configuration\nload_dotenv()\nAPI_KEY = os.getenv(\"OPENROUTER_API_KEY\")\nAPI_URL = \"https://openrouter.ai/api/v1/chat/completions\"\n# Using a small, fast model for iterative refinement\nMODEL = \"openai/gpt-4o-mini\" \nMAX_ITERATIONS = 10\n\nasync def get_llm_response(prompt: str) -> str:\n    \"\"\"Sends prompt to OpenRouter and returns the text response.\"\"\"\n    async with httpx.AsyncClient() as client:\n        response = await client.post(\n            API_URL,\n            headers={\"Authorization\": f\"Bearer {API_KEY}\", \"HTTP-Referer\": \"https://eval-loop.local\"},\n            json={\"model\": MODEL, \"messages\": [{\"role\": \"user\", \"content\": prompt}]},\n            timeout=30.0\n        )\n        response.raise_for_status()\n        return response.json()[\"choices\"][0][\"message\"][\"content\"]\n\ndef evaluate_artifact(text: str) -> float:\n    \"\"\"\n    Custom metric: A simple heuristic. \n    Replace this with an LLM-as-a-judge or regex-based test.\n    \"\"\"\n    # Example: Penalize brevity, reward specific keywords\n    score = len(text) / 1000\n    if \"crucial\" in text.lower():\n        score += 0.2\n    return min(score, 1.0)\n\nasync def run_optimization_loop():\n    # Load initial state\n    current_artifact = open(\"artifact.txt\", \"r\").read()\n    best_score = evaluate_artifact(current_artifact)\n    \n    for i in range(MAX_ITERATIONS):\n        print(f\"--- Iteration {i+1} ---\")\n        \n        # 1. Propose improvement\n        refinement_prompt = f\"Refine this text to be more professional and concise:\\n{current_artifact}\"\n        candidate = await get_llm_response(refinement_prompt)\n        \n        # 2. Evaluate\n        score = evaluate_artifact(candidate)\n        \n        # 3. Decision Logic (Greedy Hill-Climbing)\n        if score > best_score:\n            print(f\"Improvement found! Score: {score:.2f} > {best_score:.2f}\")\n            best_score = score\n            current_artifact = candidate\n            \n            # Persist and version control\n            with open(\"artifact.txt\", \"w\") as f:\n                f.write(current_artifact)\n            \n            subprocess.run([\"git\", \"add\", \"artifact.txt\"], check=True)\n            subprocess.run([\"git\", \"commit\", \"-m\", f\"Iter {i}: Score {score:.2f}\"], check=True)\n        else:\n            print(f\"Rejected. Score: {score:.2f}\")\n\nif __name__ == \"__main__\":\n    asyncio.run(run_optimization_loop())\n```\n\n## Why Greedy Hill-Climbing?\nIn prompt engineering, we often seek a local optimum. Greedy hill-climbing is the simplest algorithm for this: you only accept a change if it performs strictly better than your current best. It avoids the complexity of reinforcement learning while providing an immediate, verifiable path to better outputs.\n\n## Critical Design Decisions\n- **Subprocess Git Integration**: By treating your `artifact.txt` as code, you gain the ability to `git revert` if a series of \"improvements\" actually causes model degradation.\n- **Asynchronous IO**: Using `httpx.AsyncClient` ensures that if you decide to expand this to parallel model testing (querying three models at once), your script won't block while waiting for network responses.\n- **Fail-Fast Metrics**: Your `evaluate_artifact` function acts as the \"unit test.\" If this function is poorly defined, your loop will \"game\" the metric rather than improve the quality. \n\n## Common Pitfalls\n1. **Metric Gaming**: LLMs are excellent at exploiting loopholes. If your metric rewards length, the model will output verbose, low-quality text. Keep your metrics rigid and test-driven.\n2. **Circular Feedback**: If your metric is another LLM prompt, ensure it is significantly more capable than the model being tested. Otherwise, you are measuring the \"opinion\" of a weaker model.\n3. **Runaway Costs**: Always monitor your OpenRouter dashboard. Start with small, cheap models (like `gpt-4o-mini`) before scaling to larger, more expensive ones.\n\n## How to Scale\nOnce this loop is running, you can extend it by:\n- **Adding a \"Golden Dataset\"**: Instead of testing one artifact, test a list of 10 inputs and calculate the *mean* score.\n- **Temperature Sweeping**: Run the same prompt with different temperatures to see which produces the most stable, high-scoring output.\n- **Cost Tracking**: Parse the `usage` field from the OpenRouter response to log the exact USD cost per iteration, ensuring your optimization budget stays under control.\n\nBy automating the evaluation loop, you shift your role from \"guessing prompts\" to \"designing evaluation systems.\" This is the fundamental transition from amateur AI usage to professional ML engineering.", "D": "# Build a Minimal LLM Evaluation Loop in Python: Systematic Experiments for ML Engineers\n\nIf you're an ML engineer tired of manual prompt testing and ready to automate experiments, this tutorial guides you through building a minimal evaluation loop using the OpenRouter API. It focuses on a lean, understandable implementation that emphasizes greedy hill-climbing optimization while addressing practical concerns like cost tracking and version control.\n\n## What You Will Build\n\nThis tutorial results in a Python script that automates LLM output improvement through a loop. Specifically, it:\n1. Sets up API calls with secure key handling.\n2. Evaluates outputs using a custom metric.\n3. Runs a greedy hill-climbing algorithm to iteratively refine outputs.\n4. Queries multiple models in parallel for comparisons.\n5. Tracks costs, saves results to a file, and commits improvements to Git.\n6. Handles errors gracefully to prevent disruptions.\n\nThis approach keeps things simple, avoiding over-engineered frameworks, so you can grasp and extend it quickly.\n\n## What You Need\n\n- Python 3.10 or higher\n- An OpenRouter API key from openrouter.ai\n- Install dependencies: `pip install httpx python-dotenv`\n- Git installed and configured for version control\n\n## Step 1: Setup API Key and Constants\n\nStart by creating a `.env` file in your project directory with your API key:\n```plaint