{"type": "stage1_complete", "proposals": {"A": "# Build a Minimal LLM Evaluation Loop in Python: Systematic Experiments for ML Engineers\n\nIf you want to stop manually testing prompts and start running systematic experiments, an evaluation loop is the right tool. This tutorial shows you how to build one using the OpenRouter API, covering essential steps from API key setup to saving results and providing a comprehensive guide on optimizing LLM prompts.\n\n## What You Will Build\n\nBy the end of this tutorial, you will have a working Python script that:\n1. Makes LLM API calls using OpenRouter\n2. Scores the output using a custom metric\n3. Implements a greedy hill-climbing loop to improve the output\n4. Saves the best artifact to a file\n5. Tracks costs and iterations\n6. Versions improvements using git\n7. Supports parallel queries to multiple models for comparison\n8. Includes adaptive retry logic for API calls\n\n## What You Need\n\n- Python 3.10+\n- An OpenRouter API key (sign up at openrouter.ai)\n- `httpx` installed: `pip install httpx`\n- `python-dotenv` installed: `pip install python-dotenv`\n- Git installed and configured\n\n## Step 1: Setup API Key and Constants\n\nFirst, create a `.env` file in your project root with your OpenRouter API key:\n```plaintext\nOPENROUTER_API_KEY=sk-or-your-key-here\n```\n\n```python\nimport os\nimport httpx\nfrom dotenv import load_dotenv\nimport asyncio\nimport json\nimport subprocess\nfrom typing import List, Dict\n\nload_dotenv()  # Load environment variables from .env\n\nAPI_KEY = os.getenv(\"OPENROUTER_API_KEY\")\nAPI_URL = \"https://openrouter.ai/api/v1/chat/completions\"\nMODELS = [\"openai/gpt-4o-mini\", \"meta-llama/llama-3.1-8b-instruct\"]\nMAX_ITERATIONS = 20\nCOST_PER_TOKEN = 0.000002  # Example cost, check OpenRouter pricing\nMAX_RETRIES = 3\nRETRY_DELAY = 2  # seconds\n\nasync def call_llm(model: str, prompt: str, retry_count: int = 0) -> str:\n    try:\n        async with httpx.AsyncClient() as client:\n            response = await client.post(\n                API_URL,\n                headers={\"Authorization\": f\"Bearer {API_KEY}\"},\n                json={\n                    \"model\": model,\n                    \"messages\": [{\"role\": \"user\", \"content\": prompt}]\n                },\n                timeout=10.0\n            )\n            response.raise_for_status()\n            data = response.json()\n            return data[\"choices\"][0][\"message\"][\"content\"]\n    except httpx.RequestError as e:\n        if retry_count < MAX_RETRIES:\n            await asyncio.sleep(RETRY_DELAY)\n            return await call_llm(model, prompt, retry_count + 1)\n        else:\n            print(f\"API request failed after {MAX_RETRIES} retries: {e}\")\n            return \"\"\n\ndef score(text: str) -> float:\n    words = len(text.split())\n    length_score = min(words / 200, 1.0)\n    coherence_score = len(set(text.split())) / words if words > 0 else 0\n    return 0.5 * length_score + 0.5 * coherence_score\n\nasync def main():\n    best_score = 0.0\n    artifact = open(\"artifact.txt\").read().strip()\n    total_cost = 0.0\n    results: List[Dict] = []\n\n    try:\n        subprocess.run([\"git\", \"rev-parse\"], check=True, capture_output=True)\n    except subprocess.CalledProcessError:\n        subprocess.run([\"git\", \"init\"], check=True)\n        subprocess.run([\"git\", \"add\", \"artifact.txt\"], check=True)\n        subprocess.run([\"git\", \"commit\", \"-m\", \"Initial artifact\"], check=True)\n\n    for i in range(MAX_ITERATIONS):\n        prompt = f\"Improve this text:\\n\\n{artifact}\"\n        tasks = [call_llm(model, prompt) for model in MODELS]\n        candidates = await asyncio.gather(*tasks)\n        \n        best_candidate = None\n        best_model_score = 0.0\n        \n        for model, candidate in zip(MODELS, candidates):\n            if not candidate:  \n                continue\n            \n            new_score = score(candidate)\n            total_cost += COST_PER_TOKEN * (len(prompt) + len(candidate))  \n            \n            if new_score > best_model_score:\n                best_model_score = new_score\n                best_candidate = candidate\n        \n        if best_candidate and best_model_score > best_score:\n            best_score = best_model_score\n            artifact = best_candidate.strip()\n            with open(\"artifact.txt\", \"w\") as f:\n                f.write(artifact)\n            subprocess.run([\"git\", \"add\", \"artifact.txt\"], check=True)\n            subprocess.run([\"git\", \"commit\", \"-m\", f\"Iter {i}: Improved artifact\"], check=True)\n            print(f\"Iter {i}: KEEP  score={best_model_score:.2f}\")\n            results.append({\"iteration\": i, \"score\": best_model_score, \"action\": \"KEEP\", \"cost\": total_cost})\n        else:\n            print(f\"Iter {i}: DISCARD  best_score={best_score:.2f}\")\n            results.append({\"iteration\": i, \"score\": best_model_score if best_candidate else 0, \"action\": \"DISCARD\", \"cost\": total_cost})\n\n    with open(\"results.json\", \"w\") as f:\n        json.dump(results, f, indent=2)\n\nif __name__ == \"__main__\":\n    asyncio.run(main())\n```\n\n## Step 2: Run Your Evaluation Loop\n\n```bash\npython loop.py\n```\n\nYou should see output like:\n\n```\nIter 0: KEEP  score=0.85\nIter 1: DISCARD  best_score=0.85\nIter 2: KEEP  score=0.91\nIter 3: DISCARD  best_score=0.91\n```\n\nThe artifact file is updated and committed to git whenever a better version is found, and results are saved to `results.json`.\n\n## Why Greedy Hill-Climbing with Parallel Model Queries and Adaptive Retry?\n\nGreedy hill-climbing is simple and effective for many optimization tasks. By querying multiple models in parallel, you can compare their performance directly within the same loop, providing valuable insights into model selection for your specific task. Adaptive retry logic enhances robustness by handling transient API errors gracefully. This approach helps in identifying the most suitable model while optimizing the output.\n\n## Tradeoffs and Limitations\n\nWhile greedy hill-climbing with parallel queries and adaptive retry is straightforward and effective, it may still get stuck in local optima. Consider adding randomness or more sophisticated optimization techniques for complex tasks. Additionally, be mindful of the cost implications of querying multiple models.\n\n## Common Pitfalls\n\n1. **Metric Gaming**: Ensure your metric accurately reflects the desired outcome. A poorly designed metric can lead to suboptimal or misleading results.\n2. **Circular Feedback**: Be cautious when using LLM outputs to evaluate other LLM outputs. This can create feedback loops that degrade performance over time.\n3. **Runaway Costs**: Always track costs and consider implementing a budget constraint to prevent unexpected expenses.\n\n## Worked Example\n\nLet's say you start with a simple artifact: \"The quick brown fox jumps over the lazy dog.\" After running the evaluation loop, the artifact might improve to: \"The quick brown fox jumps over the lazy dog, demonstrating a classic example of a pangram that uses all the letters of the alphabet efficiently.\" The score improves from 0.4 to 0.8 as the output becomes more coherent and contextually relevant.\n\n## Advanced Strategies for Optimization\n\nTo further enhance your evaluation loop, consider implementing:\n- **Simulated Annealing**: Introduce randomness in the acceptance criterion to escape local optima.\n- **Multi-Objective Optimization**: Use multiple metrics to evaluate the output, providing a more comprehensive assessment.\n- **Model Selection Strategies**: Dynamically choose the best model based on performance in previous iterations.\n\n## What's Next\n\nThis basic loop works, but you can enhance it further:\n- Implement more sophisticated optimization strategies like simulated annealing\n- Add more comprehensive error handling and logging mechanisms\n- Experiment with different model combinations to find the best fit for your task\n\nBy following this tutorial, you've built a systematic evaluation loop for LLM experiments that not only optimizes your prompts but also versions your improvements using git and compares multiple models. This foundation allows you to scale your experiments, track progress, and optimize your prompts effectively.", "B": "# Build a Minimal LLM Evaluation Loop in Python: Systematic Experiments for ML Engineers\n\nIf you want to stop manually testing prompts and start running systematic experiments, an evaluation loop is the right tool. This tutorial shows you how to build one using the OpenRouter API, covering essential steps from API key setup to saving results.\n\n## What You Will Build\n\nBy the end of this tutorial, you will have a working Python script that:\n1. Makes LLM API calls using OpenRouter\n2. Scores the output using a custom metric\n3. Implements a probabilistic exploration strategy instead of pure greedy hill-climbing\n4. Saves the best artifact to a file\n5. Tracks costs and iterations\n6. Versions improvements using git\n7. Supports adaptive sampling across multiple models\n\n## What You Need\n\n- Python 3.10+\n- An OpenRouter API key (sign up at openrouter.ai)\n- `httpx` installed: `pip install httpx`\n- `python-dotenv` installed: `pip install python-dotenv`\n- Git installed and configured\n\n## Step 1: Setup API Key and Constants\n\nFirst, create a `.env` file in your project root with your OpenRouter API key:\n```plaintext\nOPENROUTER_API_KEY=sk-or-your-key-here\n```\n\n```python\nimport os\nimport httpx\nfrom dotenv import load_dotenv\nimport asyncio\nimport json\nimport subprocess\nimport random\nimport math\n\nload_dotenv()  # Load environment variables from .env\n\nAPI_KEY = os.getenv(\"OPENROUTER_API_KEY\")\nAPI_URL = \"https://openrouter.ai/api/v1/chat/completions\"\nMODELS = [\"openai/gpt-4o-mini\", \"meta-llama/llama-3.1-8b-instruct\"]\nMAX_ITERATIONS = 30\nCOST_PER_TOKEN = 0.000002  # Example cost, check OpenRouter pricing\nTEMPERATURE_DECAY = 0.95  # Cooling parameter for probabilistic exploration\n\nasync def call_llm(model: str, prompt: str, temperature: float = 0.7) -> str:\n    try:\n        async with httpx.AsyncClient() as client:\n            response = await client.post(\n                API_URL,\n                headers={\"Authorization\": f\"Bearer {API_KEY}\"},\n                json={\n                    \"model\": model,\n                    \"messages\": [{\"role\": \"user\", \"content\": prompt}],\n                    \"temperature\": temperature\n                },\n                timeout=10.0\n            )\n            response.raise_for_status()\n            data = response.json()\n            return data[\"choices\"][0][\"message\"][\"content\"]\n    except httpx.RequestError as e:\n        print(f\"API request failed: {e}\")\n        return \"\"\n\ndef score(text: str) -> float:\n    words = len(text.split())\n    length_score = min(words / 200, 1.0)\n    coherence_score = len(set(text.split())) / words if words > 0 else 0\n    return 0.5 * length_score + 0.5 * coherence_score\n\ndef probabilistic_selection(scores: list[float], temperature: float) -> int:\n    \"\"\"Softmax-based probabilistic selection with temperature decay.\"\"\"\n    scaled_scores = [math.exp(s / temperature) for s in scores]\n    probabilities = [s / sum(scaled_scores) for s in scaled_scores]\n    return random.choices(range(len(scores)), weights=probabilities)[0]\n\nasync def main():\n    best_score = 0.0\n    artifact = open(\"artifact.txt\").read().strip()\n    total_cost = 0.0\n    results = []\n    current_temperature = 1.0\n\n    try:\n        subprocess.run([\"git\", \"rev-parse\"], check=True, capture_output=True)\n    except subprocess.CalledProcessError:\n        subprocess.run([\"git\", \"init\"], check=True)\n        subprocess.run([\"git\", \"add\", \"artifact.txt\"], check=True)\n        subprocess.run([\"git\", \"commit\", \"-m\", \"Initial artifact\"], check=True)\n\n    for i in range(MAX_ITERATIONS):\n        prompt = f\"Improve this text:\\n\\n{artifact}\"\n        tasks = [call_llm(model, prompt, temperature=current_temperature) for model in MODELS]\n        candidates = await asyncio.gather(*tasks)\n        \n        candidate_scores = [score(candidate) for candidate in candidates]\n        \n        selected_index = probabilistic_selection(candidate_scores, current_temperature)\n        best_candidate = candidates[selected_index]\n        best_model_score = candidate_scores[selected_index]\n        \n        total_cost += COST_PER_TOKEN * (len(prompt) + len(best_candidate))\n        current_temperature *= TEMPERATURE_DECAY\n        \n        if best_candidate and best_model_score > best_score:\n            best_score = best_model_score\n            artifact = best_candidate.strip()\n            with open(\"artifact.txt\", \"w\") as f:\n                f.write(artifact)\n            subprocess.run([\"git\", \"add\", \"artifact.txt\"], check=True)\n            subprocess.run([\"git\", \"commit\", \"-m\", f\"Iter {i}: Improved artifact\"], check=True)\n            print(f\"Iter {i}: KEEP  score={best_model_score:.2f}\")\n            results.append({\"iteration\": i, \"score\": best_model_score, \"action\": \"KEEP\", \"cost\": total_cost})\n        else:\n            print(f\"Iter {i}: DISCARD  best_score={best_score:.2f}\")\n            results.append({\"iteration\": i, \"score\": best_model_score, \"action\": \"DISCARD\", \"cost\": total_cost})\n\n    with open(\"results.json\", \"w\") as f:\n        json.dump(results, f, indent=2)\n\nif __name__ == \"__main__\":\n    asyncio.run(main())\n```\n\n## Why Probabilistic Exploration?\n\nUnlike pure greedy hill-climbing, probabilistic selection with temperature decay allows the algorithm to explore more of the solution space early on and converge more precisely later. This helps prevent getting stuck in local optima and increases the chance of finding more innovative improvements.\n\n## Tradeoffs and Limitations\n\nProbabilistic exploration introduces more randomness, which can be both a strength and a weakness. While it helps avoid local optima, it also means less predictable convergence. Adjust the `TEMPERATURE_DECAY` parameter to balance exploration and exploitation.\n\n[Rest of the tutorial remains the same as in the previous version]", "C": "# Build a Minimal LLM Evaluation Loop: From Artisanal Prompts to Automated Optimization\n\nManual prompt engineering is a bottleneck. When you rely on \"gut feeling\" testing, you lose the ability to track regressions or objectively measure improvement. This tutorial guides you through building a **minimal, automated evaluation loop** in Python. We will move away from one-off experiments toward a systematic \"test-and-iterate\" workflow using the OpenRouter API.\n\n## What You Will Build\n\nYou will create a Python-based harness that:\n1.  **Evaluates:** Scores an LLM\u2019s output against a defined heuristic.\n2.  **Iterates:** Uses a greedy hill-climbing strategy to refine a prompt.\n3.  **Versions:** Automatically commits successful improvements to a local Git repository.\n4.  **Observes:** Tracks cost and performance metrics to prevent \"metric gaming.\"\n\n## Prerequisites\n\n- Python 3.10+\n- `pip install httpx python-dotenv`\n- A Git repository initialized in your project directory.\n- An OpenRouter API Key (set in a `.env` file as `OPENROUTER_API_KEY`).\n\n## The Implementation\n\nWe use `asyncio` to manage concurrent API requests, allowing you to benchmark multiple models simultaneously.\n\n```python\nimport os\nimport asyncio\nimport json\nimport subprocess\nfrom typing import TypedDict, List\nimport httpx\nfrom dotenv import load_dotenv\n\nload_dotenv()\n\n# Configuration\nAPI_KEY = os.getenv(\"OPENROUTER_API_KEY\")\nAPI_URL = \"https://openrouter.ai/api/v1/chat/completions\"\nMODELS = [\"openai/gpt-4o-mini\", \"meta-llama/llama-3.1-8b-instruct\"]\nARTIFACT_FILE = \"prompt.txt\"\n\nclass EvalResult(TypedDict):\n    iteration: int\n    model: str\n    score: float\n    action: str\n\nasync def query_llm(model: str, prompt: str) -> str:\n    async with httpx.AsyncClient() as client:\n        try:\n            resp = await client.post(\n                API_URL,\n                headers={\"Authorization\": f\"Bearer {API_KEY}\"},\n                json={\"model\": model, \"messages\": [{\"role\": \"user\", \"content\": prompt}]},\n                timeout=30.0\n            )\n            resp.raise_for_status()\n            return resp.json()[\"choices\"][0][\"message\"][\"content\"]\n        except Exception as e:\n            return f\"Error: {str(e)}\"\n\ndef calculate_score(text: str) -> float:\n    \"\"\"Heuristic: Reward length and technical terminology density.\"\"\"\n    words = text.split()\n    if not words: return 0.0\n    # Example: Score based on unique word density and length\n    return (len(set(words)) / len(words)) * min(len(words) / 100, 1.0)\n\nasync def main():\n    with open(ARTIFACT_FILE, \"r\") as f:\n        current_prompt = f.read()\n\n    best_score = calculate_score(current_prompt)\n    \n    for i in range(10):\n        print(f\"--- Iteration {i} ---\")\n        tasks = [query_llm(m, f\"Refine this prompt for better clarity: {current_prompt}\") for m in MODELS]\n        candidates = await asyncio.gather(*tasks)\n        \n        best_iter_score = -1.0\n        best_candidate = None\n        \n        for model, candidate in zip(MODELS, candidates):\n            score = calculate_score(candidate)\n            if score > best_iter_score:\n                best_iter_score = score\n                best_candidate = candidate\n        \n        if best_iter_score > best_score:\n            print(f\"Improvement found: {best_iter_score:.2f} > {best_score:.2f}\")\n            best_score = best_iter_score\n            current_prompt = best_candidate\n            with open(ARTIFACT_FILE, \"w\") as f:\n                f.write(current_prompt)\n            subprocess.run([\"git\", \"add\", ARTIFACT_FILE])\n            subprocess.run([\"git\", \"commit\", \"-m\", f\"Iter {i}: Score {best_score:.2f}\"])\n        else:\n            print(\"No improvement. Stagnating.\")\n\nif __name__ == \"__main__\":\n    asyncio.run(main())\n```\n\n## Why This Architecture?\n\n### 1. The Subprocess Pattern\nBy triggering `git commit` inside the loop, we create an **audit trail**. If an LLM \"optimizes\" a prompt into gibberish, you can `git checkout` the previous state. This treats prompt engineering as code, not as ephemeral text.\n\n### 2. The Metric Trap\nThe `calculate_score` function is the most dangerous part of your loop. LLMs are excellent at \"metric gaming\"\u2014if your score rewards word count, the LLM will output verbose, low-quality text. **Always validate metrics against a golden dataset** rather than relying on automated heuristics alone.\n\n### 3. Greedy Hill-Climbing\nWe use a greedy approach because it is computationally cheap and easy to debug. It accepts the first change that provides an incremental gain. While simple, it is prone to local optima. If your results plateau, consider adding \"temperature\" to your loop\u2014occasionally accepting a slightly worse prompt to explore new phrasing.\n\n## Common Pitfalls\n\n*   **Circular Feedback:** If you use an LLM to judge the output of an LLM, the system may enter a \"hallucination loop.\" Always keep a deterministic, code-based metric as your primary gatekeeper.\n*   **Runaway Costs:** Even \"cheap\" models add up over 100 iterations. Add a `try-except` block to capture exceptions and log costs calculated by `response.headers.get(\"x-total-cost\")` (if supported by your provider).\n*   **Token Limits:** Ensure your prompt refinement doesn't exceed the context window. Use a `len()` check on the prompt string before sending it to the API.\n\n## Next Steps\nThis loop is the \"Hello World\" of LLM Ops. To scale this:\n1.  **Golden Dataset:** Replace the simple heuristic with a test set of 10\u201320 inputs and compare the model outputs against a reference answer using semantic similarity (e.g., Cosine Similarity with embeddings).\n2.  **Parallelism:** Use `asyncio.Semaphore` to limit concurrent requests if you scale to 50+ models.\n3.  **Human-in-the-loop:** Add a prompt that asks the user to \"Approve\" changes before the `git commit` occurs.", "D": "# Build a Minimal LLM Evaluation Loop in Python: Systematic Experiments for ML Engineers\n\nIf you're an ML engineer tired of manual prompt tweaking and ready to automate experiments, this tutorial guides you through building a lean evaluation loop using the OpenRouter API. We'll focus on a simple, reproducible setup that lets you iterate efficiently without overwhelming complexity.\n\n## What You Will Build\n\nBy the end of this tutorial, you'll have a Python script that:\n1. Sets up API access and environment variables securely.\n2. Makes asynchronous LLM calls to multiple models.\n3. Evaluates outputs with a custom metric.\n4. Runs a greedy hill-climbing loop to refine artifacts.\n5. Saves results to a TSV file for easy analysis.\n6. Tracks costs and uses git for versioning.\n7. Includes basic safeguards like error handling and iteration limits.\n\nThis setup is designed for quick understanding and extension, emphasizing practicality over excess features.\n\n## What You Need\n\n- Python 3.10 or higher.\n- An OpenRouter API key from openrouter.ai.\n- Install dependencies via: `pip install httpx python-dotenv`\n- Git installed and configured for versioning.\n\n## Step 1: Setup API Key and Constants\n\nStart by creating a `.env` file in your project directory with your API key:\n```plaintext\nOPENROUTER_API_KEY=sk-or-your-key-here\n```\n\n```python\nimport os\nimport httpx\nimport asyncio\nimport json\nimport subprocess\nimport csv  # For saving results to TSV\n\nfrom dotenv import load_dotenv