{"type": "stage1_complete", "proposals": {"A": "# Build a Minimal LLM Evaluation Loop in Python: Systematic Experiments for ML Engineers\n\nIf you want to stop manually testing prompts and start running systematic experiments, an evaluation loop is the right tool. This tutorial shows you how to build one using the OpenRouter API, covering essential steps from API key setup to saving results.\n\n## What You Will Build\n\nBy the end of this tutorial, you will have a working Python script that:\n1. Makes LLM API calls using OpenRouter\n2. Scores the output using a custom metric\n3. Implements a greedy hill-climbing loop to improve the output\n4. Saves the best artifact to a file\n5. Tracks costs and iterations\n6. Versions improvements using git\n7. Supports parallel model queries for comparison\n\n## What You Need\n\n- Python 3.10+\n- An OpenRouter API key (sign up at openrouter.ai)\n- `httpx` installed: `pip install httpx`\n- `python-dotenv` installed: `pip install python-dotenv`\n- Git installed and configured\n- `concurrent.futures` for parallel queries\n\n## Step 1: Setup API Key and Constants\n\nFirst, create a `.env` file in your project root with your OpenRouter API key:\n```plaintext\nOPENROUTER_API_KEY=sk-or-your-key-here\n```\n\n```python\nimport os\nimport httpx\nfrom dotenv import load_dotenv\nimport json\nimport subprocess\nfrom concurrent.futures import ThreadPoolExecutor\n\nload_dotenv()  # Load environment variables from .env\n\nAPI_KEY = os.getenv(\"OPENROUTER_API_KEY\")\nAPI_URL = \"https://openrouter.ai/api/v1/chat/completions\"\nMODELS = [\"openai/gpt-4o-mini\", \"meta-llama/llama-3.1-8b-instruct:free\"]\nMAX_ITERATIONS = 20\nCOST_PER_TOKEN = {\"openai/gpt-4o-mini\": 0.000002, \"meta-llama/llama-3.1-8b-instruct:free\": 0.000001}  # Example costs, check OpenRouter pricing\n\ndef call_llm(model: str, prompt: str) -> str:\n    try:\n        response = httpx.post(\n            API_URL,\n            headers={\"Authorization\": f\"Bearer {API_KEY}\"},\n            json={\n                \"model\": model,\n                \"messages\": [{\"role\": \"user\", \"content\": prompt}]\n            },\n            timeout=10.0  # Add timeout to prevent hanging\n        )\n        response.raise_for_status()  # Raise an exception for bad status codes\n        data = response.json()\n        return data[\"choices\"][0][\"message\"][\"content\"]\n    except httpx.RequestError as e:\n        print(f\"API request failed for {model}: {e}\")\n        return \"\"\n```\n\n## Step 2: Define a Metric Function\n\nYour metric function scores the LLM output. Higher is better. Here is a simple example that scores based on length and coherence, with additional comments for clarity:\n\n```python\ndef score(text: str) -> float:\n    # Calculate the number of words in the output\n    words = len(text.split())\n    # Normalize length score to be between 0 and 1\n    length_score = min(words / 200, 1.0)\n    # Simple coherence check: higher lexical diversity is better\n    coherence_score = len(set(text.split())) / words if words > 0 else 0\n    # Weighted average of length and coherence scores\n    return 0.5 * length_score + 0.5 * coherence_score\n```\n\n## Step 3: Implement the Evaluation Loop with Cost Tracking, Git Versioning, and Parallel Model Queries\n\n```python\ndef main():\n    best_score = 0.0\n    artifact = open(\"artifact.txt\").read().strip()\n    total_cost = 0.0\n    results = []\n\n    # Initialize git repository if not already done\n    try:\n        subprocess.run([\"git\", \"rev-parse\"], check=True, capture_output=True)\n    except subprocess.CalledProcessError:\n        subprocess.run([\"git\", \"init\"], check=True)\n        subprocess.run([\"git\", \"add\", \"artifact.txt\"], check=True)\n        subprocess.run([\"git\", \"commit\", \"-m\", \"Initial artifact\"], check=True)\n\n    for i in range(MAX_ITERATIONS):\n        prompt = f\"Improve this text:\\n\\n{artifact}\"\n        \n        # Query multiple models in parallel\n        with ThreadPoolExecutor() as executor:\n            candidates = list(executor.map(lambda model: call_llm(model, prompt), MODELS))\n        \n        # Process results\n        for model, candidate in zip(MODELS, candidates):\n            if not candidate:  # Skip iteration if API call failed\n                continue\n            \n            new_score = score(candidate)\n            cost = COST_PER_TOKEN[model] * (len(prompt) + len(candidate))  # Simplified cost calculation\n            total_cost += cost\n            \n            if new_score > best_score:\n                best_score = new_score\n                artifact = candidate.strip()\n                with open(\"artifact.txt\", \"w\") as f:\n                    f.write(artifact)\n                # Commit changes to git\n                subprocess.run([\"git\", \"add\", \"artifact.txt\"], check=True)\n                subprocess.run([\"git\", \"commit\", \"-m\", f\"Iter {i}: Improved artifact\"], check=True)\n                print(f\"Iter {i}: KEEP  score={new_score:.2f}  model={model}\")\n                results.append({\"iteration\": i, \"score\": new_score, \"action\": \"KEEP\", \"model\": model, \"cost\": total_cost})\n            else:\n                print(f\"Iter {i}: DISCARD  score={new_score:.2f}  best={best_score:.2f}  model={model}\")\n                results.append({\"iteration\": i, \"score\": new_score, \"action\": \"DISCARD\", \"model\": model, \"cost\": total_cost})\n\n    # Save results to a JSON file for later analysis\n    with open(\"results.json\", \"w\") as f:\n        json.dump(results, f, indent=2)\n\nif __name__ == \"__main__\":\n    main()\n```\n\n## Step 4: Run Your Evaluation Loop\n\n```bash\npython loop.py\n```\n\nYou should see output like:\n\n```\nIter 0: KEEP  score=0.85  model=openai/gpt-4o-mini\nIter 1: DISCARD  score=0.81  best=0.85  model=meta-llama/llama-3.1-8b-instruct:free\nIter 2: KEEP  score=0.91  model=openai/gpt-4o-mini\nIter 3: DISCARD  score=0.88  best=0.91  model=meta-llama/llama-3.1-8b-instruct:free\n```\n\nThe artifact file is updated and committed to git whenever a better version is found, and results are saved to `results.json`.\n\n## Why Greedy Hill-Climbing?\n\nGreedy hill-climbing is simple and effective for many optimization tasks. It always moves towards better solutions, making it suitable for improving LLM outputs. However, it may get stuck in local optima. Consider adding randomness or more sophisticated optimization techniques for complex tasks.\n\n## Tradeoffs and Limitations\n\nWhile greedy hill-climbing is straightforward to implement, it lacks the ability to explore the solution space broadly. For tasks requiring more exploration, consider techniques like simulated annealing or genetic algorithms. Additionally, be mindful of the cost implications of repeated LLM queries.\n\n## Common Pitfalls\n\n1. **Metric Gaming**: Ensure your metric accurately reflects the desired outcome. A poorly designed metric can lead to suboptimal or misleading results.\n2. **Circular Feedback**: Be cautious when using LLM outputs to evaluate other LLM outputs. This can create feedback loops that degrade performance over time.\n3. **Runaway Costs**: Always track costs and consider implementing a budget constraint to prevent unexpected expenses.\n\n## Worked Example\n\nLet's say you start with a simple artifact: \"The quick brown fox jumps over the lazy dog.\" After running the evaluation loop, the artifact might improve to: \"The quick brown fox jumps over the lazy dog, demonstrating a classic example of a pangram that uses all the letters of the alphabet efficiently.\" The score improves from 0.4 to 0.8 as the output becomes more coherent and contextually relevant.\n\n## What's Next\n\nThis basic loop works, but you can enhance it further:\n- Implement more sophisticated optimization strategies like simulated annealing\n- Add more comprehensive error handling and logging mechanisms\n- Experiment with different scoring metrics to better suit your specific use case\n\nBy following this tutorial, you've built a systematic evaluation loop for LLM experiments that not only optimizes your prompts but also versions your improvements using git and supports parallel model queries. This foundation allows you to scale your experiments, track progress, and optimize your prompts effectively.", "B": "# Build a Minimal LLM Evaluation Loop in Python: Systematic Experiments for ML Engineers\n\nSystematic LLM experimentation requires more than manual prompt tweaking. This tutorial introduces a robust, extensible evaluation loop that transforms experimental workflows from artisanal guesswork to principled optimization.\n\n## What You Will Build\n\nBy the end of this tutorial, you'll create a Python script that:\n1. Dynamically explores prompt variations\n2. Uses probabilistic exploration to prevent local optima\n3. Implements multi-armed bandit optimization\n4. Tracks performance across model variants\n5. Manages experimental budget intelligently\n\n## Prerequisites\n\n- Python 3.10+\n- OpenRouter API key\n- `httpx`, `python-dotenv`, `numpy` installed\n- Basic understanding of probabilistic algorithms\n\n## Step 1: Enhanced Setup with Probabilistic Configuration\n\n```python\nimport os\nimport httpx\nimport numpy as np\nfrom dotenv import load_dotenv\nfrom typing import List, Dict, Optional\n\nload_dotenv()\n\nclass LLMExperimentConfig:\n    API_KEY = os.getenv(\"OPENROUTER_API_KEY\")\n    API_URL = \"https://openrouter.ai/api/v1/chat/completions\"\n    MODELS = [\n        \"openai/gpt-4o-mini\", \n        \"anthropic/claude-3-haiku\",\n        \"mistralai/mistral-7b\"\n    ]\n    MAX_ITERATIONS = 50\n    EXPLORATION_RATE = 0.2  # Epsilon for exploration\n    INITIAL_TEMPERATURE = 1.0  # For softmax exploration\n```\n\n## Step 2: Probabilistic Metric with Uncertainty Quantification\n\n```python\ndef probabilistic_score(text: str) -> Dict[str, float]:\n    \"\"\"\n    Advanced scoring function that returns multiple metrics\n    with uncertainty estimates.\n    \"\"\"\n    words = text.split()\n    metrics = {\n        'length': len(words) / 200,\n        'diversity': len(set(words)) / len(words) if words else 0,\n        'complexity': np.std([len(word) for word in words]) / 10\n    }\n    \n    # Compute confidence interval\n    confidence = {\n        k: {\n            'mean': v,\n            'std_error': np.random.uniform(0.05, 0.15)\n        } for k, v in metrics.items()\n    }\n    \n    # Weighted composite score with uncertainty\n    composite_score = sum(\n        confidence[metric]['mean'] * (1 / confidence[metric]['std_error'])\n        for metric in confidence\n    )\n    \n    return {\n        'score': composite_score,\n        'metrics': confidence\n    }\n```\n\n## Step 3: Multi-Armed Bandit Optimization Loop\n\n```python\ndef multi_armed_bandit_experiment(initial_artifact: str):\n    models = LLMExperimentConfig.MODELS\n    model_scores = {model: [] for model in models}\n    temperature = LLMExperimentConfig.INITIAL_TEMPERATURE\n    \n    def select_model(model_scores):\n        # Thompson sampling with softmax exploration\n        if np.random.random() < LLMExperimentConfig.EXPLORATION_RATE:\n            return np.random.choice(models)\n        \n        mean_scores = [np.mean(model_scores[model]) if model_scores[model] else 0 \n                       for model in models]\n        probabilities = np.exp(np.array(mean_scores) / temperature) \n        probabilities /= probabilities.sum()\n        return np.random.choice(models, p=probabilities)\n    \n    # Experimental implementation details follow similar logic to previous artifact\n    # with added multi-model exploration and probabilistic selection\n```\n\n## Advanced Considerations: Exploration vs Exploitation\n\nThe multi-armed bandit approach balances exploring new models and exploiting known high-performers. By using softmax exploration with a temperature parameter, we create a dynamic strategy that adapts to emerging performance characteristics.\n\n## Risks and Mitigations\n\n1. **Model Variance**: Different models have inherent variability\n2. **Budget Constraints**: Implement hard stops on total API spend\n3. **Metric Instability**: Use robust, multi-dimensional scoring\n\n## Worked Example: Complexity Navigation\n\nImagine improving a technical description. Instead of deterministic hill-climbing, this approach probabilistically explores model strengths, potentially discovering unexpected optimization paths.\n\n## Next Horizons\n\n- Implement Bayesian optimization techniques\n- Add adaptive learning rate for exploration\n- Create visualization tools for experimental insights\n\nBy embracing probabilistic exploration, you transform LLM experimentation from a linear process to an adaptive, intelligent workflow.", "C": "# Build a Minimal LLM Evaluation Loop: From Manual Prompts to Systematic Optimization\n\nManual prompt engineering is a bottleneck. If you are still copy-pasting outputs into a spreadsheet, you are working too hard. This tutorial demonstrates how to build a robust, repeatable evaluation loop using Python and OpenRouter, moving you from \"artisanal\" prompt tuning to systematic, automated experimentation.\n\n## What You Will Build\nYou will create a **Greedy Hill-Climbing Loop**. This script takes an initial prompt, generates an output, scores it against a custom metric, and iterates\u2014keeping the \"best\" version found so far. You will also implement cost tracking and automated Git versioning to ensure you never lose a winning prompt configuration.\n\n## Prerequisites\n- **Python 3.10+** and `pip`\n- An [OpenRouter](https://openrouter.ai/) account and API key\n- `pip install httpx python-dotenv`\n\n## Step 1: The Configuration Layer\nHardcoding secrets is a recipe for disaster. We use a `.env` file to manage environment variables securely. Create a file named `.env` in your project root:\n```plaintext\nOPENROUTER_API_KEY=sk-or-...\n```\n\n## Step 2: Designing the Engine\nWe prioritize robustness. The following implementation uses `httpx` for async-ready HTTP requests, includes basic error handling for API timeouts, and uses type hints for clarity.\n\n```python\nimport os\nimport httpx\nfrom dotenv import load_dotenv\nfrom typing import Optional\n\nload_dotenv()\n\nAPI_KEY = os.getenv(\"OPENROUTER_API_KEY\")\nAPI_URL = \"https://openrouter.ai/api/v1/chat/completions\"\nMODEL = \"openai/gpt-4o-mini\"\n\ndef call_llm(prompt: str) -> Optional[str]:\n    \"\"\"Sends a prompt to OpenRouter with a strict 15s timeout.\"\"\"\n    try:\n        response = httpx.post(\n            API_URL,\n            headers={\"Authorization\": f\"Bearer {API_KEY}\", \"HTTP-Referer\": \"https://eval.loop\"},\n            json={\"model\": MODEL, \"messages\": [{\"role\": \"user\", \"content\": prompt}]},\n            timeout=15.0\n        )\n        response.raise_for_status()\n        return response.json()[\"choices\"][0][\"message\"][\"content\"]\n    except (httpx.RequestError, httpx.HTTPStatusError) as e:\n        print(f\"API Error: {e}\")\n        return None\n```\n\n## Step 3: Defining the Metric (The \"Judge\")\nAn evaluation loop is only as good as its scoring function. For this example, we measure \"Instruction Adherence\" and \"Conciseness.\" In production, consider using a separate, stronger LLM as a judge.\n\n```python\ndef score(text: str) -> float:\n    \"\"\"A heuristic score: higher is better.\"\"\"\n    # Penalty for excessive length (e.g., > 1000 chars)\n    length_penalty = max(0, (len(text) - 1000) / 1000)\n    # Reward for specific professional keywords\n    keywords = [\"solution\", \"efficient\", \"robust\"]\n    keyword_score = sum(1 for word in keywords if word in text.lower())\n    \n    return float(keyword_score - length_penalty)\n```\n\n## Step 4: The Loop Logic\nWe use a **Greedy Hill-Climbing** strategy. It is \"greedy\" because it only keeps changes that improve the current score. This ensures monotonic improvement.\n\n```python\nimport json\nimport subprocess\nfrom datetime import datetime\n\ndef run_experiment(start_prompt: str, iterations: int = 10):\n    best_artifact = start_prompt\n    best_score = score(start_prompt)\n    \n    for i in range(iterations):\n        print(f\"--- Iteration {i+1} ---\")\n        # Attempt to improve the current best\n        improvement_prompt = f\"Rewrite this prompt to be more effective: {best_artifact}\"\n        candidate = call_llm(improvement_prompt)\n        \n        if not candidate: continue\n            \n        new_score = score(candidate)\n        \n        if new_score > best_score:\n            print(f\"Improvement found! Score: {new_score:.2f}\")\n            best_score = new_score\n            best_artifact = candidate\n            \n            # Persist and version\n            with open(\"best_prompt.txt\", \"w\") as f: f.write(best_artifact)\n            subprocess.run([\"git\", \"add\", \"best_prompt.txt\"])\n            subprocess.run([\"git\", \"commit\", \"-m\", f\"Improvement at iter {i}\"])\n        else:\n            print(\"No improvement. Discarding.\")\n\nrun_experiment(\"Write a python script to fetch data from an API.\")\n```\n\n## Why Greedy Hill-Climbing?\nThis pattern is the \"Hello World\" of LLM optimization. By committing to Git, we create an audit trail of prompt evolution. The primary tradeoff is **local optima**: the loop might get stuck in a \"pleasant-sounding\" prompt that isn't actually the most effective for your specific task.\n\n## Common Pitfalls\n1. **Metric Gaming**: If your metric rewards length, the LLM will become verbose. Ensure your score penalizes undesirable traits as much as it rewards good ones.\n2. **The \"Judge\" Bias**: If you use an LLM to score another LLM, they may develop a shared \"linguistic style\" that masks actual logic errors.\n3. **Runaway Costs**: Always monitor your OpenRouter dashboard. A tight loop with a high-cost model like `gpt-4o` can burn through credits quickly.\n\n## Worked Example: From Vague to Precise\n*   **Initial Prompt**: \"Write a python script to fetch data from an API.\" (Score: 1.0)\n*   **Iteration 3**: \"Create a robust Python script using `httpx` to fetch JSON data from a REST API, including error handling and type hints.\" (Score: 3.5)\n*   **Result**: Through iteration, the model naturally identifies the need for error handling and standard libraries to satisfy the \"robust\" and \"efficient\" requirements in our scoring function.\n\n## Next Steps\nTo evolve this beyond the basics, consider:\n- **Parallelization**: Use `asyncio.gather` to test 5 prompts in parallel.\n- **Dynamic Metrics**: Use a second LLM API call as a \"Judge\" to provide qualitative feedback (e.g., \"Rate this from 1\u201310 on clarity\").\n- **Budgeting**: Add a `total_tokens` counter to your loop to stop automatically if costs exceed a threshold.", "D": "# Build a Minimal LLM Evaluation Loop in Python: Systematic Experiments for ML Engineers\n\nIf you're an ML engineer tired of manual prompt testing, this tutorial guides you through building a streamlined LLM evaluation loop using the OpenRouter API. We'll create a simple, repeatable process that automates improvements, helping you transition to efficient experimentation without overkill frameworks.\n\n## What You Will Build\n\nBy the end of this tutorial, you'll have a Python script that:\n1. Sets up and securely handles API calls to OpenRouter.\n2. Evaluates LLM outputs with a custom metric.\n3. Runs a greedy hill-climbing loop to iteratively refine outputs.\n4. Tracks costs, saves results to a TSV file, and versions improvements via Git.\n5. Includes enhanced error handling and stopping conditions for practical use.\n\nThis setup ensures your experiments are lean, understandable, and ready to run in under 10 minutes.\n\n## What You Need\n\n- Python 3.10 or higher.\n- An OpenRouter API key (obtain one at openrouter.ai).\n- Install dependencies: `pip install httpx python-dotenv`.\n- Git installed and configured for versioning.\n\n## Step 1: Setup API Key and Constants\n\nStart by creating a `.env` file in your project directory with your API key:\n```plaintext\nOPENROUTER_API_KEY=sk-or-your-key-here\n```\n\nThis approach keeps secrets secure and out of your code. Here's the setup with improved structure:\n\n```python\nimport os\nimport httpx\nfrom dotenv import load_dotenv\nimport typing  # For type hints\n\nload_dotenv()  # Load environment variables\n\nAPI_KEY: str = os.getenv(\"OPENROUTER_API_KEY\")  # Fetches from .env\nAPI_URL: str = \"https://openrouter.ai/api/v1/chat/completions\"\nMODEL: str = \"openai/gpt-4o-mini\"\nMAX_ITERATIONS: int = 20\nCOST_PER_TOKEN: float = 0.000002  # Approximate; verify with OpenRouter pricing\n\ndef call_llm(prompt: str) -> str:\n    \"\"\"Make an API call to OpenRouter and return the response content.\"\"\"\n    try:\n        response = httpx.post(\n            API_URL,\n            headers={\"Authorization\": f\"Bearer {API_KEY}\"},\n            json={\n                \"model\": MODEL,\n                \"messages\": [{\"role\": \"user\", \"content\": prompt}]\n            },\n            timeout=10.0  # Prevents indefinite hangs\n        )\n        response.raise_for_status()  # Raises error for HTTP issues\n        data = response.json()\n        return data[\"choices\"][0][\"message\"][\"content\"]  # Extract response text\n    except httpx.HTTPError as e:  # More specific than general exceptions\n        print(f\"HTTP error occurred: {e}\")\n        return \"\"  # Graceful failure\n    except Exception as e:  # Catch-all for unexpected issues\n        print(f\"Unexpected error: {e}\")\n        return \"\"\n```\n\nWe've added type hints for better readability and maintainability, and refined error handling to distinguish between HTTP-specific and other errors.\n\n## Step 2: Define a Metric Function\n\nYour metric function quantifies output quality. Below, we