{"type": "stage1_complete", "proposals": {"A": "# Build a Minimal LLM Evaluation Loop in Python: Systematic Experiments for ML Engineers\n\nIf you want to stop manually testing prompts and start running systematic experiments, an evaluation loop is the right tool. This tutorial shows you how to build one using the OpenRouter API, covering essential steps from API key setup to saving results.\n\n## What You Will Build\n\nBy the end of this tutorial, you will have a working Python script that:\n1. Makes LLM API calls using OpenRouter\n2. Scores the output using a custom metric\n3. Implements a greedy hill-climbing loop to improve the output\n4. Saves the best artifact to a file\n5. Tracks costs and iterations\n6. Versions improvements using git\n7. Supports parallel queries to multiple models for comparison\n\n## What You Need\n\n- Python 3.10+\n- An OpenRouter API key (sign up at openrouter.ai)\n- `httpx` installed: `pip install httpx`\n- `python-dotenv` installed: `pip install python-dotenv`\n- Git installed and configured\n\n## Step 1: Setup API Key and Constants\n\nFirst, create a `.env` file in your project root with your OpenRouter API key:\n```plaintext\nOPENROUTER_API_KEY=sk-or-your-key-here\n```\n\n```python\nimport os\nimport httpx\nfrom dotenv import load_dotenv\nimport asyncio\nimport json\nimport subprocess\nfrom typing import Dict, List\n\nload_dotenv()  # Load environment variables from .env\n\nAPI_KEY = os.getenv(\"OPENROUTER_API_KEY\")\nAPI_URL = \"https://openrouter.ai/api/v1/chat/completions\"\nMODELS = [\"openai/gpt-4o-mini\", \"meta-llama/llama-3.1-8b-instruct\"]\nMAX_ITERATIONS = 20\nCOST_PER_TOKEN = 0.000002  # Example cost, check OpenRouter pricing\n\nasync def call_llm(model: str, prompt: str) -> str:\n    try:\n        async with httpx.AsyncClient() as client:\n            response = await client.post(\n                API_URL,\n                headers={\"Authorization\": f\"Bearer {API_KEY}\"},\n                json={\n                    \"model\": model,\n                    \"messages\": [{\"role\": \"user\", \"content\": prompt}]\n                },\n                timeout=10.0\n            )\n            response.raise_for_status()\n            data = response.json()\n            return data[\"choices\"][0][\"message\"][\"content\"]\n    except httpx.RequestError as e:\n        print(f\"API request failed: {e}\")\n        return \"\"\n\ndef score(text: str) -> float:\n    # Enhanced metric to reward both coherence and relevance\n    words = text.split()\n    length_score = min(len(words) / 200, 1.0)\n    coherence_score = len(set(words)) / len(words) if words else 0\n    relevance_score = 1.0 if \"example\" in text.lower() else 0.5  # Simple relevance check\n    return 0.4 * length_score + 0.3 * coherence_score + 0.3 * relevance_score\n\nasync def main():\n    best_score = 0.0\n    artifact = open(\"artifact.txt\").read().strip()\n    total_cost = 0.0\n    results: List[Dict] = []\n\n    try:\n        subprocess.run([\"git\", \"rev-parse\"], check=True, capture_output=True)\n    except subprocess.CalledProcessError:\n        subprocess.run([\"git\", \"init\"], check=True)\n        subprocess.run([\"git\", \"add\", \"artifact.txt\"], check=True)\n        subprocess.run([\"git\", \"commit\", \"-m\", \"Initial artifact\"], check=True)\n\n    for i in range(MAX_ITERATIONS):\n        prompt = f\"Improve this text:\\n\\n{artifact}\"\n        tasks = [call_llm(model, prompt) for model in MODELS]\n        candidates = await asyncio.gather(*tasks)\n        \n        best_candidate = None\n        best_model_score = 0.0\n        \n        for model, candidate in zip(MODELS, candidates):\n            if not candidate:  \n                continue\n            \n            new_score = score(candidate)\n            total_cost += COST_PER_TOKEN * (len(prompt) + len(candidate))  \n            \n            if new_score > best_model_score:\n                best_model_score = new_score\n                best_candidate = candidate\n        \n        if best_candidate and best_model_score > best_score:\n            best_score = best_model_score\n            artifact = best_candidate.strip()\n            with open(\"artifact.txt\", \"w\") as f:\n                f.write(artifact)\n            subprocess.run([\"git\", \"add\", \"artifact.txt\"], check=True)\n            subprocess.run([\"git\", \"commit\", \"-m\", f\"Iter {i}: Improved artifact\"], check=True)\n            print(f\"Iter {i}: KEEP  score={best_model_score:.2f}\")\n            results.append({\"iteration\": i, \"score\": best_model_score, \"action\": \"KEEP\", \"cost\": total_cost})\n        else:\n            print(f\"Iter {i}: DISCARD  best_score={best_score:.2f}\")\n            results.append({\"iteration\": i, \"score\": best_model_score if best_candidate else 0, \"action\": \"DISCARD\", \"cost\": total_cost})\n\n    with open(\"results.json\", \"w\") as f:\n        json.dump(results, f, indent=2)\n\n    # Save cost summary\n    with open(\"cost_summary.txt\", \"w\") as f:\n        f.write(f\"Total cost: ${total_cost:.2f}\\n\")\n        f.write(f\"Average cost per iteration: ${total_cost / MAX_ITERATIONS:.4f}\\n\")\n\nif __name__ == \"__main__\":\n    asyncio.run(main())\n```\n\n## Step 2: Run Your Evaluation Loop\n\n```bash\npython loop.py\n```\n\nYou should see output like:\n\n```\nIter 0: KEEP  score=0.85\nIter 1: DISCARD  best_score=0.85\nIter 2: KEEP  score=0.91\nIter 3: DISCARD  best_score=0.91\n```\n\nThe artifact file is updated and committed to git whenever a better version is found, and results are saved to `results.json`. A cost summary is also generated.\n\n## Why Greedy Hill-Climbing with Parallel Model Queries?\n\nGreedy hill-climbing is simple and effective for many optimization tasks. By querying multiple models in parallel, you can compare their performance directly within the same loop, providing valuable insights into model selection for your specific task. This approach helps in identifying the most suitable model while optimizing the output.\n\n## Tradeoffs and Limitations\n\nWhile greedy hill-climbing with parallel queries is straightforward and effective, it may still get stuck in local optima. Consider adding randomness or more sophisticated optimization techniques for complex tasks. Additionally, be mindful of the cost implications of querying multiple models.\n\n## Common Pitfalls\n\n1. **Metric Gaming**: Ensure your metric accurately reflects the desired outcome. A poorly designed metric can lead to suboptimal or misleading results.\n2. **Circular Feedback**: Be cautious when using LLM outputs to evaluate other LLM outputs. This can create feedback loops that degrade performance over time.\n3. **Runaway Costs**: Always track costs and consider implementing a budget constraint to prevent unexpected expenses.\n\n## Worked Example\n\nLet's say you start with a simple artifact: \"The quick brown fox jumps over the lazy dog.\" After running the evaluation loop, the artifact might improve to: \"The quick brown fox jumps over the lazy dog, demonstrating a classic example of a pangram that uses all the letters of the alphabet efficiently.\" The score improves from 0.4 to 0.8 as the output becomes more coherent and contextually relevant.\n\n## Advanced Considerations\n\nTo further enhance your evaluation loop, consider implementing:\n- Dynamic cost tracking and budget alerts\n- Integration with visualization tools to analyze results\n- Automated reporting of key metrics and insights\n\nBy following this tutorial, you've built a systematic evaluation loop for LLM experiments that not only optimizes your prompts but also versions your improvements using git and compares multiple models. This foundation allows you to scale your experiments, track progress, and optimize your prompts effectively.", "B": "# Build a Minimal LLM Evaluation Loop in Python: Systematic Experiments for ML Engineers\n\nIf you want to stop manually testing prompts and start running systematic experiments, an evaluation loop is the right tool. This tutorial shows you how to build one using the OpenRouter API, with a focus on robust, extensible design.\n\n## What You Will Build\n\nBy the end of this tutorial, you will have a working Python script that:\n1. Makes LLM API calls using OpenRouter\n2. Scores the output using a custom metric\n3. Implements a probabilistic hill-climbing loop to improve the output\n4. Saves the best artifact to a file\n5. Tracks costs and iterations\n6. Supports experiment tracking and logging\n7. Provides detailed performance insights\n\n## Prerequisites\n\n- Python 3.10+\n- An OpenRouter API key\n- `httpx`, `python-dotenv`, `structlog` installed\n- Git installed and configured\n\n## Step 1: Setup and Configuration\n\nCreate a `.env` file:\n```plaintext\nOPENROUTER_API_KEY=sk-or-your-key-here\nEXPERIMENT_NAME=llm-optimization-v1\n```\n\n```python\nimport os\nimport httpx\nimport asyncio\nimport json\nimport random\nimport structlog\nfrom dotenv import load_dotenv\nfrom typing import List, Dict, Optional\nfrom dataclasses import dataclass, asdict\n\nload_dotenv()\n\n@dataclass\nclass ExperimentConfig:\n    api_key: str\n    models: List[str]\n    max_iterations: int\n    temperature: float\n    exploration_rate: float\n\n    @classmethod\n    def default(cls):\n        return cls(\n            api_key=os.getenv(\"OPENROUTER_API_KEY\"),\n            models=[\"openai/gpt-4o-mini\", \"meta-llama/llama-3.1-8b-instruct\"],\n            max_iterations=25,\n            temperature=0.7,\n            exploration_rate=0.2\n        )\n\nlogger = structlog.get_logger()\n\nclass LLMEvaluator:\n    def __init__(self, config: ExperimentConfig):\n        self.config = config\n        self.total_cost = 0.0\n        self.experiment_results: List[Dict] = []\n\n    async def call_llm(self, model: str, prompt: str) -> Optional[str]:\n        try:\n            async with httpx.AsyncClient() as client:\n                response = await client.post(\n                    \"https://openrouter.ai/api/v1/chat/completions\",\n                    headers={\"Authorization\": f\"Bearer {self.config.api_key}\"},\n                    json={\n                        \"model\": model,\n                        \"messages\": [{\"role\": \"user\", \"content\": prompt}],\n                        \"temperature\": self.config.temperature\n                    },\n                    timeout=15.0\n                )\n                response.raise_for_status()\n                return response.json()[\"choices\"][0][\"message\"][\"content\"]\n        except Exception as e:\n            logger.error(\"LLM call failed\", model=model, error=str(e))\n            return None\n\n    def advanced_score(self, text: str) -> float:\n        \"\"\"More sophisticated scoring mechanism\"\"\"\n        if not text:\n            return 0.0\n        \n        words = text.split()\n        unique_words = len(set(words))\n        total_words = len(words)\n        \n        length_factor = min(total_words / 150, 1.0)\n        diversity_factor = unique_words / total_words if total_words > 0 else 0\n        coherence_factor = 1 - (abs(total_words - 100) / 100)  # Penalize extreme lengths\n        \n        return 0.4 * length_factor + 0.3 * diversity_factor + 0.3 * coherence_factor\n\n    async def run_experiment(self, initial_artifact: str) -> str:\n        current_artifact = initial_artifact\n        best_score = self.advanced_score(current_artifact)\n\n        for iteration in range(self.config.max_iterations):\n            # Probabilistic exploration\n            if random.random() < self.config.exploration_rate:\n                logger.info(f\"Exploration step {iteration}\")\n                # Add random mutation or completely new generation strategy\n                current_artifact = await self._generate_variant(current_artifact)\n            else:\n                current_artifact = await self._optimize_artifact(current_artifact)\n\n            new_score = self.advanced_score(current_artifact)\n            \n            if new_score > best_score:\n                best_score = new_score\n                logger.info(f\"Improvement in iteration {iteration}\", score=new_score)\n                \n                # Save and version improvement\n                with open(\"artifact.txt\", \"w\") as f:\n                    f.write(current_artifact)\n\n                self.experiment_results.append({\n                    \"iteration\": iteration,\n                    \"score\": new_score,\n                    \"action\": \"IMPROVE\"\n                })\n\n        return current_artifact\n\n    async def _generate_variant(self, artifact: str) -> str:\n        # Implement a more advanced variant generation\n        tasks = [self.call_llm(model, f\"Creatively transform this text: {artifact}\") \n                 for model in self.config.models]\n        variants = await asyncio.gather(*tasks)\n        return max(variants, key=self.advanced_score) or artifact\n\n    async def _optimize_artifact(self, artifact: str) -> str:\n        tasks = [self.call_llm(model, f\"Refine and improve: {artifact}\") \n                 for model in self.config.models]\n        optimized_variants = await asyncio.gather(*tasks)\n        return max(optimized_variants, key=self.advanced_score) or artifact\n\nasync def main():\n    config = ExperimentConfig.default()\n    evaluator = LLMEvaluator(config)\n    \n    with open(\"artifact.txt\", \"r\") as f:\n        initial_artifact = f.read().strip()\n    \n    final_artifact = await evaluator.run_experiment(initial_artifact)\n    \n    with open(\"experiment_log.json\", \"w\") as f:\n        json.dump(evaluator.experiment_results, f, indent=2)\n\nif __name__ == \"__main__\":\n    asyncio.run(main())\n```\n\n## Key Improvements\n\n1. **Probabilistic Exploration**: Introduces an exploration rate to prevent getting stuck in local optima\n2. **Advanced Scoring**: More nuanced metric considering length, diversity, and coherence\n3. **Structured Logging**: Uses `structlog` for better observability\n4. **Dataclass Configuration**: Centralizes experiment parameters\n5. **Flexible Variant Generation**: Supports multiple generation strategies\n\n## Tradeoffs and Considerations\n\n- Increased complexity compared to greedy hill-climbing\n- Higher computational cost due to parallel model queries\n- Requires careful tuning of exploration parameters\n\n## Common Pitfalls to Avoid\n\n1. Over-optimizing for the metric at the expense of meaningful output\n2. Runaway computational costs\n3. Circular feedback in self-improvement loops\n\n## Next Steps\n\n- Implement more sophisticated optimization strategies\n- Add persistent experiment tracking\n- Create visualization tools for experiment results\n\nBy following this approach, you've built a flexible, extensible LLM evaluation framework that goes beyond simple prompt optimization.", "C": "# Build a Minimal LLM Evaluation Loop in Python: Systematic Experiments for ML Engineers\n\nIf you want to stop manually testing prompts and start running systematic experiments, an evaluation loop is your best investment. This tutorial shows you how to build a lean, automated \"evaluation-in-the-loop\" system using Python and OpenRouter.\n\n## What You Will Build\n\nYou will create a Python script that acts as a local \"Prompt Optimizer.\" It performs:\n1. **Automated Generation**: Queries models via OpenRouter to refine a target artifact.\n2. **Programmatic Scoring**: Uses a custom metric function to assign a numerical value to model outputs.\n3. **Greedy Hill-Climbing**: Automatically commits only the outputs that outperform the current best version.\n4. **Versioning**: Uses Git to track the history of your prompt evolution.\n\n## Prerequisites\n\n- Python 3.10+\n- An OpenRouter API key (get one at [openrouter.ai](https://openrouter.ai))\n- `pip install httpx python-dotenv`\n- A file named `artifact.txt` in your directory containing your initial prompt or text.\n\n## The Implementation\n\nCreate a file named `optimizer.py`. We use `asyncio` to handle concurrent API calls, as multiple model comparisons can be slow.\n\n```python\nimport os\nimport asyncio\nimport json\nimport subprocess\nfrom typing import TypedDict, List\nfrom dotenv import load_dotenv\nimport httpx\n\nload_dotenv()\n\n# Configuration\nAPI_KEY = os.getenv(\"OPENROUTER_API_KEY\")\nAPI_URL = \"https://openrouter.ai/api/v1/chat/completions\"\nMODELS = [\"openai/gpt-4o-mini\", \"anthropic/claude-3-haiku\"]\nMAX_ITERATIONS = 10\n\nclass EvalResult(TypedDict):\n    iteration: int\n    model: str\n    score: float\n    action: str\n\ndef score_artifact(text: str) -> float:\n    \"\"\"\n    Define your custom evaluation logic here.\n    Example: Reward length and absence of common weak phrases.\n    \"\"\"\n    if not text: return 0.0\n    length_score = min(len(text.split()) / 100, 1.0)\n    penalty = -0.5 if \"I apologize\" in text else 0.0\n    return length_score + penalty\n\nasync def query_model(model: str, prompt: str, client: httpx.AsyncClient) -> str:\n    try:\n        response = await client.post(\n            API_URL,\n            headers={\"Authorization\": f\"Bearer {API_KEY}\", \"Content-Type\": \"application/json\"},\n            json={\"model\": model, \"messages\": [{\"role\": \"user\", \"content\": prompt}]},\n            timeout=15.0\n        )\n        response.raise_for_status()\n        return response.json()[\"choices\"][0][\"message\"][\"content\"]\n    except Exception as e:\n        print(f\"Error calling {model}: {e}\")\n        return \"\"\n\nasync def run_optimization():\n    with open(\"artifact.txt\", \"r\") as f:\n        current_artifact = f.read().strip()\n    \n    best_score = score_artifact(current_artifact)\n    \n    async with httpx.AsyncClient() as client:\n        for i in range(MAX_ITERATIONS):\n            print(f\"--- Iteration {i+1} ---\")\n            prompt = f\"Refine the following text to be more concise and professional:\\n\\n{current_artifact}\"\n            \n            tasks = [query_model(m, prompt, client) for m in MODELS]\n            results = await asyncio.gather(*tasks)\n            \n            best_iter_score = -99.0\n            best_iter_text = \"\"\n            best_model = \"\"\n\n            for model, output in zip(MODELS, results):\n                if not output: continue\n                s = score_artifact(output)\n                if s > best_iter_score:\n                    best_iter_score, best_iter_text, best_model = s, output, model\n\n            if best_iter_score > best_score:\n                best_score = best_iter_score\n                current_artifact = best_iter_text\n                with open(\"artifact.txt\", \"w\") as f:\n                    f.write(current_artifact)\n                subprocess.run([\"git\", \"add\", \"artifact.txt\"], check=True)\n                subprocess.run([\"git\", \"commit\", \"-m\", f\"Iter {i+1}: Improved score to {best_score:.2f} using {best_model}\"], check=True)\n                print(f\"KEEP: {best_model} achieved score {best_score:.2f}\")\n            else:\n                print(f\"DISCARD: No improvement over {best_score:.2f}\")\n\nif __name__ == \"__main__\":\n    asyncio.run(run_optimization())\n```\n\n## Why This Architecture?\n\n### The Subprocess Pattern\nWe use `subprocess` to call Git because it transforms your filesystem into a database. By committing on every \"KEEP,\" you gain a free audit log. If an LLM hallucinates or destroys your prompt structure, you can `git checkout` to a previous working iteration instantly.\n\n### Greedy Hill-Climbing\nThis approach is \"greedy\" because it only keeps changes that improve the immediate score. It is the most robust starting point for prompt engineering because it prevents \"prompt drift\"\u2014where the model gradually loses the original intent of the prompt due to unconstrained iterations.\n\n## Common Pitfalls to Avoid\n\n1. **The \"Reward Hacking\" Trap**: If your metric rewards length, the model will eventually generate endless, repetitive text. Always include a penalty for verbosity or specific stop-tokens.\n2. **Async Collisions**: When running many models, set a `timeout` parameter in your `httpx` client. Without it, one slow model can hang your entire experiment loop.\n3. **Circular Evaluation**: Avoid using an LLM to score its own outputs in the same loop without a static, rule-based baseline. Self-evaluation is prone to \"sycophancy,\" where the model gives itself high scores regardless of objective quality.\n\n## Moving Beyond the Loop\n\nOnce you are comfortable with this script, consider these next steps:\n- **Human-in-the-loop**: Add a prompt that asks you to approve the `KEEP` action before the `git commit`.\n- **Golden Dataset**: Instead of refining one string, run the loop against a JSON file of 10\u201320 test cases. Calculate the *average* score across the set to ensure your improvements are generalizable and not just overfitting to one example.\n- **Cost Tracking**: Parse the `usage` field in the OpenRouter JSON response to log the exact dollar cost of each iteration, ensuring your experiments don't exceed your budget.", "D": "# Build a Minimal LLM Evaluation Loop in Python: Systematic Experiments for ML Engineers\n\nIf you're an ML engineer tired of manual prompt tweaks and ready to automate experiments, this tutorial guides you through building a lean LLM evaluation loop using the OpenRouter API. We'll focus on a greedy hill-climbing approach for simple, repeatable optimization, ensuring you can understand and extend the code in under 10 minutes.\n\n## What You Will Build\n\nBy the end of this tutorial, you'll have a streamlined Python script that:\n1. Sets up API access securely.\n2. Makes asynchronous LLM calls to multiple models.\n3. Evaluates outputs with a custom metric.\n4. Uses greedy hill-climbing to decide on improvements (KEEP or DISCARD).\n5. Tracks cos