{"type": "stage1_complete", "proposals": {"A": "# Build a Minimal LLM Evaluation Loop in Python: Systematic Experiments for ML Engineers\n\nIf you want to stop manually testing prompts and start running systematic experiments, an evaluation loop is the right tool. This tutorial shows you how to build one using the OpenRouter API, covering essential steps from API key setup to saving results.\n\n## What You Will Build\n\nBy the end of this tutorial, you will have a working Python script that:\n1. Makes LLM API calls using OpenRouter\n2. Scores the output using a custom metric\n3. Implements a greedy hill-climbing loop to improve the output\n4. Saves the best artifact to a file\n5. Tracks costs and iterations\n6. Versions improvements using git\n7. Supports parallel queries to multiple models for comparison\n\n## What You Need\n\n- Python 3.10+\n- An OpenRouter API key (sign up at openrouter.ai)\n- `httpx` installed: `pip install httpx`\n- `python-dotenv` installed: `pip install python-dotenv`\n- Git installed and configured\n\n## Step 1: Setup API Key and Constants\n\nFirst, create a `.env` file in your project root with your OpenRouter API key:\n```plaintext\nOPENROUTER_API_KEY=sk-or-your-key-here\n```\n\n```python\nimport os\nimport httpx\nfrom dotenv import load_dotenv\nimport asyncio\nimport json\nimport subprocess\n\nload_dotenv()  # Load environment variables from .env\n\nAPI_KEY = os.getenv(\"OPENROUTER_API_KEY\")\nAPI_URL = \"https://openrouter.ai/api/v1/chat/completions\"\nMODELS = [\"openai/gpt-4o-mini\", \"anthropic/claude-3-haiku\"]\nMAX_ITERATIONS = 20\nCOST_PER_TOKEN = {\"openai/gpt-4o-mini\": 0.000002, \"anthropic/claude-3-haiku\": 0.0000015}  # Check OpenRouter pricing\n\nasync def call_llm(model: str, prompt: str) -> str:\n    try:\n        async with httpx.AsyncClient()  as client:\n            response = await client.post(\n                API_URL,\n                headers={\"Authorization\": f\"Bearer {API_KEY}\"},\n                json={\n                    \"model\": model,\n                    \"messages\": [{\"role\": \"user\", \"content\": prompt}]\n                },\n                timeout=10.0  # Add timeout to prevent hanging\n            )\n            response.raise_for_status()  # Raise an exception for bad status codes\n            data = response.json()\n            return data[\"choices\"][0][\"message\"][\"content\"]\n    except httpx.RequestError as e:\n        print(f\"API request failed: {e}\")\n        return \"\"\n```\n\n## Step 2: Define a Metric Function\n\nYour metric function scores the LLM output. Higher is better. Here is a simple example that scores based on length and coherence, with additional comments for clarity:\n\n```python\ndef score(text: str) -> float:\n    # Calculate the number of words in the output\n    words = len(text.split())\n    # Normalize length score to be between 0 and 1\n    length_score = min(words / 200, 1.0)\n    # Simple coherence check: higher lexical diversity is better\n    coherence_score = len(set(text.split())) / words if words > 0 else 0\n    # Weighted average of length and coherence scores\n    return 0.5 * length_score + 0.5 * coherence_score\n```\n\n## Step 3: Implement the Evaluation Loop with Parallel Model Queries\n\n```python\nasync def main():\n    best_score = 0.0\n    artifact = open(\"artifact.txt\").read().strip()\n    total_cost = 0.0\n    results = []\n\n    # Initialize git repository if not already done\n    try:\n        subprocess.run([\"git\", \"rev-parse\"], check=True, capture_output=True)\n    except subprocess.CalledProcessError:\n        subprocess.run([\"git\", \"init\"], check=True)\n        subprocess.run([\"git\", \"add\", \"artifact.txt\"], check=True)\n        subprocess.run([\"git\", \"commit\", \"-m\", \"Initial artifact\"], check=True)\n\n    for i in range(MAX_ITERATIONS):\n        prompt = f\"Improve this text:\\n\\n{artifact}\"\n        \n        # Query multiple models in parallel\n        tasks = [call_llm(model, prompt) for model in MODELS]\n        candidates = await asyncio.gather(*tasks)\n        \n        best_candidate = None\n        best_model_score = 0.0\n        \n        for model, candidate in zip(MODELS, candidates):\n            if not candidate:  # Skip if API call failed\n                continue\n            new_score = score(candidate)\n            total_cost += COST_PER_TOKEN[model] * (len(prompt) + len(candidate))  # Simplified cost calculation\n            \n            if new_score > best_model_score:\n                best_model_score = new_score\n                best_candidate = candidate\n        \n        if best_model_score > best_score:\n            best_score = best_model_score\n            artifact = best_candidate.strip()\n            with open(\"artifact.txt\", \"w\") as f:\n                f.write(artifact)\n            # Commit changes to git\n            subprocess.run([\"git\", \"add\", \"artifact.txt\"], check=True)\n            subprocess.run([\"git\", \"commit\", \"-m\", f\"Iter {i}: Improved artifact\"], check=True)\n            print(f\"Iter {i}: KEEP  score={best_model_score:.2f}\")\n            results.append({\"iteration\": i, \"score\": best_model_score, \"action\": \"KEEP\", \"cost\": total_cost})\n        else:\n            print(f\"Iter {i}: DISCARD  best_score={best_score:.2f}\")\n            results.append({\"iteration\": i, \"score\": best_model_score, \"action\": \"DISCARD\", \"cost\": total_cost})\n\n    # Save results to a JSON file for later analysis\n    with open(\"results.json\", \"w\") as f:\n        json.dump(results, f, indent=2)\n\nif __name__ == \"__main__\":\n    asyncio.run(main())\n```\n\n## Step 4: Run Your Evaluation Loop\n\n```bash\npython loop.py\n```\n\nYou should see output like:\n\n```\nIter 0: KEEP  score=0.85\nIter 1: DISCARD  best_score=0.85\nIter 2: KEEP  score=0.91\nIter 3: DISCARD  best_score=0.91\n```\n\nThe artifact file is updated and committed to git whenever a better version is found, and results are saved to `results.json`.\n\n## Why Greedy Hill-Climbing with Parallel Model Queries?\n\nGreedy hill-climbing is simple and effective for many optimization tasks. By querying multiple models in parallel, you can compare their performance directly within the same loop, allowing for more informed model selection. This approach is particularly useful for tasks where different models may excel under different conditions.\n\n## Tradeoffs and Limitations\n\nWhile greedy hill-climbing with parallel queries is a powerful approach, it may still get stuck in local optima. Consider adding randomness or more sophisticated optimization techniques for complex tasks. Additionally, be mindful of the cost implications of querying multiple models simultaneously.\n\n## Common Pitfalls\n\n1. **Metric Gaming**: Ensure your metric accurately reflects the desired outcome. A poorly designed metric can lead to suboptimal or misleading results.\n2. **Circular Feedback**: Be cautious when using LLM outputs to evaluate other LLM outputs. This can create feedback loops that degrade performance over time.\n3. **Runaway Costs**: Always track costs and consider implementing a budget constraint to prevent unexpected expenses.\n\n## Worked Example\n\nLet's say you start with a simple artifact: \"The quick brown fox jumps over the lazy dog.\" After running the evaluation loop with parallel model queries, the artifact might improve to: \"The quick brown fox jumps over the lazy dog, demonstrating a classic example of a pangram that uses all the letters of the alphabet efficiently.\" The score improves from 0.4 to 0.8 as the output becomes more coherent and contextually relevant.\n\n## What's Next\n\nThis enhanced loop works, but you can further improve it by:\n- Implementing more sophisticated optimization strategies like simulated annealing or genetic algorithms\n- Adding more comprehensive error handling and logging mechanisms\n- Exploring different model combinations for parallel queries to optimize performance across various tasks\n\nBy following this tutorial, you've built a systematic evaluation loop for LLM experiments that not only optimizes your prompts but also versions your improvements using git and compares multiple models in parallel. This foundation allows you to scale your experiments, track progress, and optimize your prompts effectively.", "B": "# Build a Minimal LLM Evaluation Loop in Python: Systematic Experiments for ML Engineers\n\nIf you want to stop manually testing prompts and start running systematic experiments, an evaluation loop is the right tool. This tutorial shows you how to build one using the OpenRouter API, covering essential steps from API key setup to saving results.\n\n## What You Will Build\n\nBy the end of this tutorial, you will have a working Python script that:\n1. Makes LLM API calls using OpenRouter\n2. Scores the output using a custom metric\n3. Implements a stochastic hill-climbing loop to improve the output\n4. Saves the best artifact to a file\n5. Tracks costs and iterations\n6. Versions improvements using git\n7. Prevents getting stuck in local optima through probabilistic selection\n\n## What You Need\n\n- Python 3.10+\n- An OpenRouter API key (sign up at openrouter.ai)\n- `httpx` installed: `pip install httpx`\n- `python-dotenv` installed: `pip install python-dotenv`\n- Git installed and configured\n\n## Step 1: Setup API Key and Constants\n\nFirst, create a `.env` file in your project root with your OpenRouter API key:\n```plaintext\nOPENROUTER_API_KEY=sk-or-your-key-here\n```\n\n```python\nimport os\nimport httpx\nimport random\nfrom dotenv import load_dotenv\n\nload_dotenv()  # Load environment variables from .env\n\nAPI_KEY = os.getenv(\"OPENROUTER_API_KEY\")\nAPI_URL = \"https://openrouter.ai/api/v1/chat/completions\"\nMODELS = [\"openai/gpt-4o-mini\", \"anthropic/claude-3-haiku\"]\nMAX_ITERATIONS = 30\nTEMPERATURE = 0.7  # Introduces exploration\nCOST_PER_TOKEN = 0.000002  # Example cost, check OpenRouter pricing\n\ndef call_llm(prompt: str, model: str) -> str:\n    try:\n        response = httpx.post(\n            API_URL,\n            headers={\n                \"Authorization\": f\"Bearer {API_KEY}\",\n                \"Content-Type\": \"application/json\"\n            },\n            json={\n                \"model\": model,\n                \"messages\": [{\"role\": \"user\", \"content\": prompt}],\n                \"temperature\": TEMPERATURE\n            },\n            timeout=15.0  # Increased timeout for robustness\n        )\n        response.raise_for_status()\n        data = response.json()\n        return data[\"choices\"][0][\"message\"][\"content\"]\n    except httpx.RequestError as e:\n        print(f\"API request failed for {model}: {e}\")\n        return \"\"\n```\n\n## Step 2: Advanced Metric Function with Multi-Dimensional Scoring\n\n```python\nimport nltk\nfrom textstat import flesch_reading_ease\n\nnltk.download('punkt')\n\ndef advanced_score(text: str) -> float:\n    \"\"\"\n    Multi-dimensional scoring that considers:\n    1. Lexical diversity\n    2. Readability\n    3. Information density\n    4. Grammatical complexity\n    \"\"\"\n    if not text:\n        return 0.0\n\n    # Lexical diversity (unique words / total words)\n    words = text.split()\n    lexical_diversity = len(set(words)) / len(words) if words else 0\n\n    # Readability score (higher is better)\n    readability = flesch_reading_ease(text) / 100.0\n\n    # Sentence complexity (average sentence length)\n    sentences = nltk.sent_tokenize(text)\n    sentence_complexity = min(len(words) / len(sentences) / 20.0, 1.0)\n\n    # Weighted scoring\n    return (\n        0.3 * lexical_diversity +\n        0.3 * readability +\n        0.4 * sentence_complexity\n    )\n```\n\n## Step 3: Stochastic Hill-Climbing with Multi-Model Exploration\n\n```python\nimport json\nimport subprocess\n\ndef main():\n    best_score = 0.0\n    with open(\"artifact.txt\", \"r\") as f:\n        artifact = f.read().strip()\n    \n    total_cost = 0.0\n    results = []\n\n    # Git initialization with error handling\n    subprocess.run([\"git\", \"init\"], capture_output=True, text=True)\n    subprocess.run([\"git\", \"add\", \"artifact.txt\"], capture_output=True, text=True)\n    subprocess.run([\"git\", \"commit\", \"-m\", \"Initial artifact\"], capture_output=True, text=True)\n\n    for i in range(MAX_ITERATIONS):\n        # Probabilistic model and prompt strategy\n        current_model = random.choice(MODELS)\n        prompt_strategies = [\n            f\"Refine and improve this text, making it more engaging: {artifact}\",\n            f\"Rewrite this text to enhance its clarity and impact: {artifact}\",\n            f\"Transform this text to be more sophisticated and nuanced: {artifact}\"\n        ]\n        prompt = random.choice(prompt_strategies)\n\n        candidate = call_llm(prompt, current_model)\n        \n        if not candidate:\n            continue\n        \n        new_score = advanced_score(candidate)\n        \n        # Probabilistic acceptance with simulated annealing-like approach\n        acceptance_probability = min(\n            1.0, \n            math.exp((new_score - best_score) / (1 + i/10))\n        )\n\n        if new_score > best_score or random.random() < acceptance_probability:\n            best_score = new_score\n            artifact = candidate.strip()\n            \n            with open(\"artifact.txt\", \"w\") as f:\n                f.write(artifact)\n            \n            subprocess.run([\"git\", \"add\", \"artifact.txt\"], capture_output=True, text=True)\n            subprocess.run([\"git\", \"commit\", \"-m\", f\"Iter {i}: Improved artifact\"], capture_output=True, text=True)\n            \n            print(f\"Iter {i}: KEEP  score={new_score:.2f}  model={current_model}\")\n            results.append({\n                \"iteration\": i, \n                \"score\": new_score, \n                \"model\": current_model, \n                \"action\": \"KEEP\"\n            })\n\n    with open(\"results.json\", \"w\") as f:\n        json.dump(results, f, indent=2)\n\nif __name__ == \"__main__\":\n    main()\n```\n\n## Key Improvements\n\n1. **Stochastic Exploration**: Introduced probabilistic selection to prevent local optima\n2. **Multi-Model Support**: Randomly select between different models\n3. **Advanced Scoring**: Multi-dimensional metric considering readability, complexity\n4. **Flexible Prompt Strategies**: Multiple prompt templates for diverse exploration\n\n## Tradeoffs and Limitations\n\nWhile more sophisticated than basic hill-climbing, this approach still has limitations. The stochastic method might occasionally accept lower-quality solutions. For complex optimization, consider more advanced techniques like genetic algorithms or Bayesian optimization.\n\n## Conclusion\n\nThis tutorial demonstrates a robust, flexible approach to systematic LLM experimentation, balancing exploration and exploitation through intelligent design choices.", "C": "# Build a Minimal LLM Evaluation Loop in Python: Systematic Experiments for ML Engineers\n\nManual prompt engineering is a bottleneck. If you are still pasting outputs into a chat window to see if they \"feel\" better, you are missing out on the power of programmatic evaluation. This tutorial guides you through building a minimal, automated evaluation loop using the OpenRouter API. We will move from artisanal testing to a systematic, greedy hill-climbing process that versions your prompts automatically.\n\n## What You Will Build\nYou will create a Python script that treats your prompt as a \"candidate\" and your evaluation logic as a \"judge.\" The script will:\n1. **Iterate:** Send prompts to an LLM.\n2. **Evaluate:** Score the output based on custom logic.\n3. **Optimize:** Keep the output only if it improves the score (Greedy Hill-Climbing).\n4. **Version:** Use Git to snapshot every improvement.\n\n## Prerequisites\n- Python 3.10+\n- `pip install httpx python-dotenv`\n- A Git repository initialized in your project folder.\n- An [OpenRouter API Key](https://openrouter.ai/).\n\n## The Implementation\n\n### 1. Configuration and API Client\nWe use `httpx` for asynchronous-ready requests. Always use environment variables for secrets.\n\n```python\nimport os\nimport httpx\nfrom dotenv import load_dotenv\nfrom typing import Dict, Any\n\nload_dotenv()\n\nAPI_KEY = os.getenv(\"OPENROUTER_API_KEY\")\nAPI_URL = \"https://openrouter.ai/api/v1/chat/completions\"\n# Using a model known for instruction following\nMODEL = \"meta-llama/llama-3-8b-instruct\" \n\ndef call_llm(prompt: str) -> str:\n    payload = {\n        \"model\": MODEL,\n        \"messages\": [{\"role\": \"user\", \"content\": prompt}]\n    }\n    headers = {\"Authorization\": f\"Bearer {API_KEY}\", \"HTTP-Referer\": \"https://eval.loop\"}\n    \n    with httpx.Client(timeout=30.0) as client:\n        response = client.post(API_URL, json=payload, headers=headers)\n        response.raise_for_status()\n        return response.json()[\"choices\"][0][\"message\"][\"content\"]\n```\n\n### 2. The Metric: Defining \"Good\"\nA metric is a function that maps a string to a float. For this example, let's optimize for **conciseness and specific keyword inclusion**.\n\n```python\ndef score_output(text: str, target_keywords: list[str]) -> float:\n    # Penalty for excessive length\n    length_penalty = max(0, (len(text.split()) - 50) / 100)\n    # Reward for keyword density\n    keyword_hits = sum(1 for word in target_keywords if word.lower() in text.lower())\n    \n    return float(keyword_hits) - length_penalty\n```\n\n### 3. The Evaluation Loop\nThis loop implements the \"Greedy\" strategy: we only accept a new version if it strictly outperforms the current best.\n\n```python\nimport subprocess\n\ndef run_loop(initial_prompt: str, iterations: int = 5):\n    best_prompt = initial_prompt\n    best_score = float('-inf')\n    \n    for i in range(iterations):\n        print(f\"--- Iteration {i} ---\")\n        # Ask LLM to refine the prompt itself\n        refinement_request = f\"Refine this prompt to be more effective: {best_prompt}\"\n        candidate_prompt = call_llm(refinement_request)\n        \n        # Test the candidate\n        result = call_llm(candidate_prompt)\n        current_score = score_output(result, [\"data\", \"systematic\"])\n        \n        if current_score > best_score:\n            print(f\"Improvement found! Score: {current_score:.2f}\")\n            best_score = current_score\n            best_prompt = candidate_prompt\n            \n            # Version Control\n            with open(\"best_prompt.txt\", \"w\") as f: f.write(best_prompt)\n            subprocess.run([\"git\", \"add\", \"best_prompt.txt\"])\n            subprocess.run([\"git\", \"commit\", \"-m\", f\"Improvement: {current_score}\"])\n        else:\n            print(f\"Discarded. Score: {current_score:.2f}\")\n\nif __name__ == \"__main__\":\n    run_loop(\"Write a summary of data science.\")\n```\n\n## Why Greedy Hill-Climbing?\nGreedy hill-climbing is the \"Hello World\" of optimization. It is highly effective when your search space is defined by prompt tweaks. Because LLMs are stochastic, a small change in the prompt can lead to a significantly better result. By \"committing\" only improvements, you ensure your project folder acts as a living history of your optimization progress.\n\n## Common Pitfalls\n1. **Metric Gaming:** If your score is too simple (e.g., word count), the LLM will \"hack\" the metric by repeating words. Always add negative constraints to your scoring function.\n2. **Local Optima:** The model may settle on a prompt that is \"good enough\" but not optimal. If your loop plateaus, manually introduce a \"mutation\" (e.g., tell the model to use a different persona) to jump to a new area of the solution space.\n3. **Cost Management:** Every iteration costs money. Use a cheaper model (e.g., `gpt-4o-mini`) for the evaluation loop and only use expensive models for the final production generation.\n\n## Advanced Strategy: The \"Judge\" Pattern\nIn this tutorial, we used a hardcoded scoring function. For more complex tasks, replace `score_output` with a call to a stronger LLM (e.g., Claude 3.5 Sonnet) and ask it to provide a score from 1-10 based on a rubric. This \"LLM-as-a-Judge\" pattern allows you to evaluate subjective qualities like tone, style, and logical consistency.\n\nBy adopting this loop, you stop guessing and start measuring. Start with this minimal script, and as your needs grow, add logging, parallel execution, and LLM-based judges to build a robust experimentation pipeline.", "D": "# Build a Minimal LLM Evaluation Loop in Python: Systematic Experiments for ML Engineers\n\nIf you're tired of manual prompt testing and want to automate your LLM experiments, this tutorial guides you through building a simple evaluation loop in Python. Using the OpenRouter API, we'll create a script that iteratively improves outputs via greedy hill-climbing, while emphasizing efficiency and transparency for ML engineers familiar with Python and LLM APIs.\n\n## What You Will Build\n\nBy the end of this tutorial, you'll have a functional Python script that:\n1. Sets up and secures your OpenRouter API key.\n2. Makes LLM calls to generate improved outputs.\n3. Evaluates outputs with a custom metric.\n4. Runs a greedy hill-climbing loop to select better versions.\n5. Tracks costs and saves results for analysis.\n6. Integrates basic version control with Git to track improvements.\n\nThis lean implementation avoids bloated frameworks, focusing on a quick, understandable setup you can adapt in under 10 minutes.\n\n## What You Need\n\n- Python 3.10 or higher\n- An OpenRouter API key (obtain one at openrouter.ai)\n- Install dependencies: `pip install httpx python-dotenv`\n- Git installed and configured on your system\n\n## Step 1: Setup API Key and Constants\n\nStart by s