{"type": "stage2_complete", "rankings": [{"letter": "A", "display_letter": "A", "avg_position": 0.25, "votes": 4}, {"letter": "D", "display_letter": "E", "avg_position": 1.0, "votes": 4}, {"letter": "C", "display_letter": "B", "avg_position": 2.25, "votes": 4}, {"letter": "B", "display_letter": "C", "avg_position": 2.75, "votes": 4}, {"letter": "E", "display_letter": "D", "avg_position": 3.75, "votes": 4}], "shuffle_map": {"A": "A", "C": "B", "B": "C", "E": "D", "D": "E"}, "votes": [{"model": "meta-llama/llama-4-maverick", "display_ranking": "A > E > C > B > D", "original_ranking": "A > D > B > C > E", "reasoning": "## Step 1: Evaluate Version A\nVersion A is comprehensive, covering all essential steps, including cost tracking, git versioning, and parallel model queries, with clear explanations and a worked example.\n\n## Step 2: Evaluate Version C\nVersion C introduces a multi-objective scoring system and comprehensive logging but lacks a step-by-step tutorial structure and immediate git versioning feedback.\n\n## Step 3: Evaluate Version B\nVersion B provides a clear, step-by-step guide to building an evaluation loop with greedy hill-climbing, cost tracking, and git versioning, but it doesn't include parallel model queries.\n\n## Step 4: Evaluate Version E\nVersion E enhances the evaluation loop with parallel model queries, improving exploration and efficiency, and saves results to a TSV file, making it a strong candidate.\n\n## Step 5: Evaluate Version D\nVersion D covers the basics of the evaluation loop, including cost tracking and git versioning, but lacks parallel model queries and saving results to a TSV file.\n\n## Step 6: Compare All Versions\nComparing all versions based on the evaluation criteria: correctness, completeness, clarity, code quality, and depth.\n\n## Step 7: Rank the Versions\n- Version A is highly complete and clear, with parallel queries and git versioning.\n- Version E is also complete, with the added benefit of parallel model queries and TSV saving.\n- Version C is innovative with its multi-objective scoring but lacks tutorial clarity.\n- Version B is clear and complete in its tutorial structure but lacks parallel queries.\n- Version D is basic but correct and clear.\n\n## Step 8: Final Ranking\nBased on the evaluation criteria, the ranking from best to worst is determined by considering completeness, clarity, and the incorporation of advanced features like parallel model queries."}, {"model": "anthropic/claude-3-5-haiku", "display_ranking": "A > B > E > C > D", "original_ranking": "A > C > D > B > E", "reasoning": "Analysis of Versions:\n\nVersion A:\nStrengths: Comprehensive, clear structure, good depth of explanation\nWeaknesses: Slightly verbose, some repeated concepts\nOverall: Very solid implementation with strong educational value\n\nVersion B:\nStrengths: Lean, practical approach, good focus on real-world constraints\nWeaknesses: Less comprehensive than A, slightly less detailed explanations\nOverall: Excellent pragmatic tutorial with clear engineering focus\n\nVersion C:\nStrengths: Advanced multi-objective scoring, sophisticated design philosophy\nWeaknesses: More complex, potentially overwhelming for beginners\nOverall: Most academically rigorous but potentially less approachable\n\nVersion D:\nStrengths: Clean, straightforward implementation\nWeaknesses: Feels like a slightly less refined version of Version A\nOverall: Serviceable but lacks the nuance of the top versions\n\nVersion E:\nStrengths: Enhanced parallel query approach, comprehensive worked example\nWeaknesses: Slightly more verbose, some repetition with other versions\nOverall: Strong technical depth with good practical insights\n\nDetailed scoring across criteria:\n- Correctness: A \u2248 B > E > C > D\n- Completeness: A > E > B > C > D\n- Clarity: B > A > E > D > C\n- Code Quality: C > A > E > B > D\n- Depth: C > A > E > B > D"}, {"model": "google/gemini-3.1-flash-lite-preview", "display_ranking": "E > A > B > D > C", "original_ranking": "D > A > C > E > B", "reasoning": "To evaluate these versions, I prioritized the specific constraints (OpenRouter API, environment variables, async usage, git versioning, and cost tracking) and the quality of the technical implementation.\n\n*   **Version E** is the strongest because it effectively implements parallel model queries, integrates `pandas` for TSV logging, and uses proper `asyncio` patterns throughout, which matches the target audience's needs for modern ML engineering practices.\n*   **Version A** is very strong and feature-rich (parallel queries, git integration, JSON logging), but it includes a slightly confusing mix of synchronous/asynchronous logic in its setup and structure compared to the streamlined Version E.\n*   **Version B** is excellent from a prose and \"best practice\" standpoint (mentioning rate limiting, clear pitfalls, and clean code), though it lacks the parallel query feature which provides higher value for this specific evaluation loop task.\n*   **Version D** is a solid, standard implementation that meets all core requirements, but it lacks the more advanced exploration features (like parallel queries or robust data logging) found in the higher-ranked versions.\n*   **Version C** uses `pydantic` and a multi-objective scoring class, which is architecturally impressive, but the implementation of the \"multi-objective\" logic (using `all()`) is flawed, as it would likely cause the loop to discard almost every candidate that doesn't improve on *every* dimension simultaneously, making it practically unusable for iterative optimization.\n\nReasoning:\n- **Version E**: Best balance of advanced features (parallelism), robust logging (TSV/Pandas), and clear, idiomatic code.\n- **Version A**: Very good feature set including git and parallel queries, though slightly less polished in code structure than E.\n- **Version B**: Exceptional prose and educational value regarding pitfalls, but misses the parallel query exploration direction.\n- **Version D**: A clean, correct, and functional tutorial that covers all basics but lacks the \"extra mile\" features of the top versions.\n- **Version C**: While architecturally sound, the `all()` logic in the optimization loop is a major functional flaw that would prevent the script from actually improving the artifact."}, {"model": "x-ai/grok-3-mini-beta", "display_ranking": "A > E > C > B > D", "original_ranking": "A > D > B > C > E", "reasoning": "Below is my ranking of the versions from best to worst based on the evaluation criteria (Correctness, Completeness, Clarity, Code Quality, and Depth). I judged each version solely on how well it meets the criteria, focusing on aspects like code validity, coverage of essential steps, ease of understanding, idiomatic Python practices, and explanatory depth.\n\n- **Version A**: This version scores highly overall (around 90/100) due to its strong correctness with robust async code, excellent completeness including parallel queries and git versioning, clear step-by-step explanations, high code quality with error handling, and good depth in justifying design choices.\n- **Version E**: Scoring about 88/100, it excels in correctness and completeness with async parallel queries and TSV saving, offers clear inline comments and structure, maintains good code quality with type hints, but has slightly less depth in tradeoffs compared to A.\n- **Version C**: At around 83/100, it's correct and complete with multi-objective scoring, but its clarity suffers from overly abstract language and potential over-engineering, with solid code quality and strong depth in philosophical explanations.\n- **Version B**: Scoring roughly 80/100, it has good correctness and clarity in its straightforward approach, but it's less complete without parallel queries and has moderate code quality and depth, making it feel basic.\n- **Version D**: This version scores about 79/100, as it's correct but lacks completeness (e.g., no async for efficiency), has decent clarity, average code quality without advanced features, and limited depth in explanations."}], "model_names": {"A": "meta-llama/llama-4-maverick", "B": "anthropic/claude-3-5-haiku", "C": "google/gemini-3.1-flash-lite-preview", "D": "x-ai/grok-3-mini-beta"}}
{"type": "stage3_complete", "winner": "A", "winner_model": "meta-llama/llama-4-maverick", "council_score": 91, "sub_scores": {"CORRECTNESS": 20, "COMPLETENESS": 18, "CLARITY": 18, "CODE_QUALITY": 18, "DEPTH": 17}, "critique": "Proposal A presents a well-structured, clear, and concise tutorial that effectively guides readers through building a minimal LLM evaluation loop. The code is correct and complete, covering all essential steps with good inline comments, making it easy for intermediate Python users to follow. However, it could benefit from a deeper exploration of design decisions and potential pitfalls associated with greedy hill-climbing, as well as additional error handling in the evaluation loop. For future iterations, consider enhancing clarity with a more thorough explanation of the scoring metrics used and how they impact the overall process.", "chairman_full_response": "WINNER: A\nSCORE_CORRECTNESS: 20\nSCORE_COMPLETENESS: 18\nSCORE_CLARITY: 18\nSCORE_CODE_QUALITY: 18\nSCORE_DEPTH: 17\nCOUNCIL_SCORE: 91\n\nCRITIQUE:\nProposal A presents a well-structured, clear, and concise tutorial that effectively guides readers through building a minimal LLM evaluation loop. The code is correct and complete, covering all essential steps with good inline comments, making it easy for intermediate Python users to follow. However, it could benefit from a deeper exploration of design decisions and potential pitfalls associated with greedy hill-climbing, as well as additional error handling in the evaluation loop. For future iterations, consider enhancing clarity with a more thorough explanation of the scoring metrics used and how they impact the overall process.", "chairman_model": "openai/gpt-4o-mini", "model_names": {"A": "meta-llama/llama-4-maverick", "B": "anthropic/claude-3-5-haiku", "C": "google/gemini-3.1-flash-lite-preview", "D": "x-ai/grok-3-mini-beta"}}
{"type": "iteration_result", "iteration": 8, "status": "DISCARD", "council_score": 91, "winner": "A", "best_score": 94, "commit": "ebb51dd", "spent_usd": 0.222987, "timestamp": "2026-04-03T14:38:38.836031Z"}
