{"type": "stage1_complete", "proposals": {"A": "# Build a Minimal LLM Evaluation Loop in Python: Systematic Experiments for ML Engineers\n\nIf you want to stop manually testing prompts and start running systematic experiments, an evaluation loop is the right tool. This tutorial shows you how to build one using the OpenRouter API, covering essential steps from API key setup to saving results.\n\n## What You Will Build\n\nBy the end of this tutorial, you will have a working Python script that:\n1. Makes LLM API calls using OpenRouter\n2. Scores the output using a custom metric\n3. Implements a greedy hill-climbing loop to improve the output\n4. Saves the best artifact to a file\n5. Tracks costs and iterations\n6. Versions improvements using git\n\n## What You Need\n\n- Python 3.10+\n- An OpenRouter API key (sign up at openrouter.ai)\n- `httpx` installed: `pip install httpx`\n- `python-dotenv` installed: `pip install python-dotenv`\n- Git installed and configured\n\n## Step 1: Setup API Key and Constants\n\nFirst, create a `.env` file in your project root with your OpenRouter API key:\n```plaintext\nOPENROUTER_API_KEY=sk-or-your-key-here\n```\n\n```python\nimport os\nimport httpx\nfrom dotenv import load_dotenv\nfrom typing import Optional\n\nload_dotenv()  # Load environment variables from .env\n\nAPI_KEY = os.getenv(\"OPENROUTER_API_KEY\")\nif not API_KEY:\n    raise ValueError(\"OPENROUTER_API_KEY not found in environment variables\")\n\nAPI_URL = \"https://openrouter.ai/api/v1/chat/completions\"\nMODEL = \"openai/gpt-4o-mini\"\nMAX_ITERATIONS = 20\nCOST_PER_TOKEN = 0.000002  # Example cost, check OpenRouter pricing\n\ndef call_llm(prompt: str, timeout: float = 10.0) -> Optional[str]:\n    try:\n        response = httpx.post(\n            API_URL,\n            headers={\"Authorization\": f\"Bearer {API_KEY}\"},\n            json={\n                \"model\": MODEL,\n                \"messages\": [{\"role\": \"user\", \"content\": prompt}]\n            },\n            timeout=timeout\n        )\n        response.raise_for_status()  # Raise an exception for bad status codes\n        data = response.json()\n        return data[\"choices\"][0][\"message\"][\"content\"]\n    except httpx.RequestError as e:\n        print(f\"API request failed: {e}\")\n        return None\n    except KeyError as e:\n        print(f\"Unexpected API response format: {e}\")\n        return None\n```\n\n## Step 2: Define a Metric Function\n\nYour metric function scores the LLM output. Higher is better. Here is a simple example that scores based on length and coherence, with additional comments for clarity:\n\n```python\ndef score(text: str) -> float:\n    # Calculate the number of words in the output\n    words = len(text.split())\n    # Normalize length score to be between 0 and 1\n    length_score = min(words / 200, 1.0)\n    # Simple coherence check: higher lexical diversity is better\n    coherence_score = len(set(text.split())) / words if words > 0 else 0\n    # Weighted average of length and coherence scores\n    return 0.5 * length_score + 0.5 * coherence_score\n```\n\n## Step 3: Implement the Evaluation Loop with Cost Tracking and Git Versioning\n\n```python\nimport json\nimport subprocess\n\ndef main():\n    best_score = 0.0\n    try:\n        with open(\"artifact.txt\", \"r\") as f:\n            artifact = f.read().strip()\n    except FileNotFoundError:\n        artifact = \"Initial artifact text\"\n        with open(\"artifact.txt\", \"w\") as f:\n            f.write(artifact)\n\n    total_cost = 0.0\n    results = []\n\n    # Initialize git repository if not already done\n    try:\n        subprocess.run([\"git\", \"rev-parse\"], check=True, capture_output=True)\n    except subprocess.CalledProcessError:\n        subprocess.run([\"git\", \"init\"], check=True)\n        subprocess.run([\"git\", \"add\", \"artifact.txt\"], check=True)\n        subprocess.run([\"git\", \"commit\", \"-m\", \"Initial artifact\"], check=True)\n\n    for i in range(MAX_ITERATIONS):\n        prompt = f\"Improve this text:\\n\\n{artifact}\"\n        candidate = call_llm(prompt)\n        \n        if candidate is None:  # Skip iteration if API call failed\n            continue\n        \n        new_score = score(candidate)\n        total_cost += COST_PER_TOKEN * (len(prompt) + len(candidate))  # Simplified cost calculation\n        \n        if new_score > best_score:\n            best_score = new_score\n            artifact = candidate.strip()\n            with open(\"artifact.txt\", \"w\") as f:\n                f.write(artifact)\n            # Commit changes to git\n            subprocess.run([\"git\", \"add\", \"artifact.txt\"], check=True)\n            subprocess.run([\"git\", \"commit\", \"-m\", f\"Iter {i}: Improved artifact\"], check=True)\n            print(f\"Iter {i}: KEEP  score={new_score:.2f}\")\n            results.append({\"iteration\": i, \"score\": new_score, \"action\": \"KEEP\", \"cost\": total_cost})\n        else:\n            print(f\"Iter {i}: DISCARD  score={new_score:.2f}  best={best_score:.2f}\")\n            results.append({\"iteration\": i, \"score\": new_score, \"action\": \"DISCARD\", \"cost\": total_cost})\n\n    # Save results to a JSON file for later analysis\n    with open(\"results.json\", \"w\") as f:\n        json.dump(results, f, indent=2)\n\n    # Save final artifact to a timestamped file\n    with open(f\"final_artifact_{os.getpid()}.txt\", \"w\") as f:\n        f.write(artifact)\n\nif __name__ == \"__main__\":\n    main()\n```\n\n## Step 4: Run Your Evaluation Loop\n\n```bash\npython loop.py\n```\n\nYou should see output like:\n\n```\nIter 0: KEEP  score=0.85\nIter 1: DISCARD  score=0.81  best=0.85\nIter 2: KEEP  score=0.91\nIter 3: DISCARD  score=0.88  best=0.91\n```\n\nThe artifact file is updated and committed to git whenever a better version is found, and results are saved to `results.json`.\n\n## Why Greedy Hill-Climbing?\n\nGreedy hill-climbing is simple and effective for many optimization tasks. It always moves towards better solutions, making it suitable for improving LLM outputs. However, it may get stuck in local optima. Consider adding randomness or more sophisticated optimization techniques for complex tasks.\n\n## Tradeoffs and Limitations\n\nWhile greedy hill-climbing is straightforward to implement, it lacks the ability to explore the solution space broadly. For tasks requiring more exploration, consider techniques like simulated annealing or genetic algorithms. Additionally, be mindful of the cost implications of repeated LLM queries.\n\n## Common Pitfalls\n\n1. **Metric Gaming**: Ensure your metric accurately reflects the desired outcome. A poorly designed metric can lead to suboptimal or misleading results.\n2. **Circular Feedback**: Be cautious when using LLM outputs to evaluate other LLM outputs. This can create feedback loops that degrade performance over time.\n3. **Runaway Costs**: Always track costs and consider implementing a budget constraint to prevent unexpected expenses.\n\n## Advanced Considerations\n\nTo further enhance your evaluation loop, consider implementing:\n- **Early Stopping**: Stop the loop if no improvement is seen after a certain number of iterations.\n- **Multiple Model Comparison**: Run the loop with different models to compare their performance.\n- **Hyperparameter Tuning**: Experiment with different hyperparameters (e.g., temperature, max tokens) for the LLM.\n\n## Worked Example\n\nLet's say you start with a simple artifact: \"The quick brown fox jumps over the lazy dog.\" After running the evaluation loop, the artifact might improve to: \"The quick brown fox jumps over the lazy dog, demonstrating a classic example of a pangram that uses all the letters of the alphabet efficiently.\" The score improves from 0.4 to 0.8 as the output becomes more coherent and contextually relevant.\n\n## What's Next\n\nThis basic loop works, but you can enhance it further:\n- Query multiple models in parallel to compare their performance\n- Implement more sophisticated optimization strategies like simulated annealing\n- Add more comprehensive error handling and logging mechanisms\n\nBy following this tutorial, you've built a systematic evaluation loop for LLM experiments that not only optimizes your prompts but also versions your improvements using git. This foundation allows you to scale your experiments, track progress, and optimize your prompts effectively.", "B": "# Build a Minimal LLM Evaluation Loop in Python: Systematic Experiments for ML Engineers\n\nIf you want to stop manually testing prompts and start running systematic experiments, an evaluation loop is the right tool. This tutorial shows you how to build a robust, extensible system using the OpenRouter API that goes beyond simple iterations to create a flexible experimental framework.\n\n## What You Will Build\n\nBy the end of this tutorial, you will have a Python script that:\n1. Makes LLM API calls using OpenRouter\n2. Implements a multi-strategy optimization approach\n3. Tracks experiment metadata and performance\n4. Supports pluggable evaluation strategies\n5. Provides extensible error handling and logging\n6. Generates comprehensive experimental reports\n\n## What You Need\n\n- Python 3.10+\n- An OpenRouter API key (sign up at openrouter.ai)\n- `httpx` installed: `pip install httpx`\n- `python-dotenv` installed: `pip install python-dotenv`\n- Git installed and configured\n\n## Core Implementation: Flexible Evaluation Framework\n\n```python\nfrom dataclasses import dataclass, asdict\nfrom enum import Enum, auto\nfrom typing import Callable, List, Optional\nimport os\nimport json\nimport httpx\nfrom dotenv import load_dotenv\n\nload_dotenv()\n\nclass ExperimentStrategy(Enum):\n    HILL_CLIMBING = auto()\n    RANDOM_WALK = auto()\n    SIMULATED_ANNEALING = auto()\n\n@dataclass\nclass ExperimentResult:\n    iteration: int\n    prompt: str\n    response: str\n    score: float\n    strategy: ExperimentStrategy\n    cost: float\n    timestamp: str\n\nclass LLMEvaluationLoop:\n    def __init__(\n        self, \n        api_key: str, \n        model: str = \"openai/gpt-4o-mini\",\n        max_iterations: int = 30,\n        strategies: List[ExperimentStrategy] = None\n    ):\n        self.api_key = api_key\n        self.model = model\n        self.max_iterations = max_iterations\n        self.strategies = strategies or [ExperimentStrategy.HILL_CLIMBING]\n        self.results: List[ExperimentResult] = []\n        \n    def _call_llm(self, prompt: str) -> Optional[str]:\n        try:\n            response = httpx.post(\n                \"https://openrouter.ai/api/v1/chat/completions\",\n                headers={\"Authorization\": f\"Bearer {self.api_key}\"},\n                json={\n                    \"model\": self.model,\n                    \"messages\": [{\"role\": \"user\", \"content\": prompt}]\n                },\n                timeout=15.0\n            )\n            response.raise_for_status()\n            return response.json()[\"choices\"][0][\"message\"][\"content\"]\n        except Exception as e:\n            print(f\"LLM Call Error: {e}\")\n            return None\n\n    def evaluate(\n        self, \n        initial_artifact: str, \n        metric_fn: Callable[[str], float],\n        improvement_prompt: Callable[[str], str]\n    ) -> str:\n        current_artifact = initial_artifact\n        best_score = metric_fn(current_artifact)\n\n        for iteration in range(self.max_iterations):\n            for strategy in self.strategies:\n                prompt = improvement_prompt(current_artifact)\n                response = self._call_llm(prompt)\n                \n                if not response:\n                    continue\n\n                score = metric_fn(response)\n                \n                result = ExperimentResult(\n                    iteration=iteration,\n                    prompt=prompt,\n                    response=response,\n                    score=score,\n                    strategy=strategy,\n                    cost=0.0,  # Placeholder for actual cost calculation\n                    timestamp=datetime.now().isoformat()\n                )\n                self.results.append(result)\n\n                if score > best_score:\n                    current_artifact = response\n                    best_score = score\n                    print(f\"Improved artifact (Strategy: {strategy.name})\")\n\n        self._save_results()\n        return current_artifact\n\n    def _save_results(self):\n        with open(\"experiment_log.json\", \"w\") as f:\n            json.dump([asdict(result) for result in self.results], f, indent=2)\n\ndef default_metric(text: str) -> float:\n    \"\"\"Comprehensive metric considering length, diversity, and coherence.\"\"\"\n    words = text.split()\n    unique_words = set(words)\n    length_factor = min(len(words) / 150, 1.0)\n    diversity_factor = len(unique_words) / len(words) if words else 0\n    return 0.6 * length_factor + 0.4 * diversity_factor\n\ndef default_improvement_prompt(current: str) -> str:\n    return f\"Refine and improve this text, maintaining its core meaning:\\n\\n{current}\"\n\ndef main():\n    api_key = os.getenv(\"OPENROUTER_API_KEY\")\n    initial_text = \"The quick brown fox jumps over the lazy dog.\"\n    \n    experiment = LLMEvaluationLoop(\n        api_key=api_key, \n        strategies=[\n            ExperimentStrategy.HILL_CLIMBING, \n            ExperimentStrategy.RANDOM_WALK\n        ]\n    )\n    \n    final_artifact = experiment.evaluate(\n        initial_artifact=initial_text,\n        metric_fn=default_metric,\n        improvement_prompt=default_improvement_prompt\n    )\n    \n    print(\"Final Artifact:\", final_artifact)\n\nif __name__ == \"__main__\":\n    main()\n```\n\n## Key Innovations\n\n### Multi-Strategy Optimization\nUnlike traditional single-strategy approaches, this implementation supports multiple optimization strategies simultaneously, allowing more comprehensive exploration of the solution space.\n\n### Comprehensive Metadata Tracking\nEach experiment result is a rich, structured object capturing not just the output, but the entire experimental context, enabling deeper post-experiment analysis.\n\n### Pluggable Components\nThe design allows easy replacement of core components like metric functions and improvement prompts, making the framework highly adaptable to different use cases.\n\n## Experimental Extensions\n\n1. Implement custom `metric_fn` for domain-specific evaluation\n2. Create specialized improvement prompts\n3. Add more exotic optimization strategies\n4. Integrate cost tracking and budget constraints\n\n## Potential Pitfalls and Mitigations\n\n- **Metric Gaming**: Design metrics that capture nuanced quality\n- **Circular Feedback**: Validate metrics against human judgment\n- **Runaway Costs**: Implement strict budget and timeout controls\n\n## Conclusion\n\nThis framework transforms LLM experimentation from a manual, artisanal process to a systematic, reproducible methodology. By providing flexibility, comprehensive tracking, and extensible design, it empowers ML engineers to conduct more rigorous and insightful experiments.", "C": "# Build a Minimal LLM Evaluation Loop: Systematic Optimization for ML Engineers\n\nManual prompt engineering is a bottleneck. If you are still pasting text into a chat window, clicking \"regenerate,\" and hoping for the best, you are relying on intuition rather than data. This tutorial shows you how to build a minimal, automated evaluation loop in Python. We will move from artisanal tinkering to a systematic \"Hill-Climbing\" pipeline that treats your prompts like code.\n\n## What You Will Build\nYou will create a Python-based experiment harness that:\n1. **Iterates:** Proposes prompt refinements using an LLM.\n2. **Evaluates:** Scores outputs against a programmable metric.\n3. **Optimizes:** Keeps the best version (Greedy Hill-Climbing).\n4. **Versions:** Commits successful prompts to Git for full auditability.\n\n## Setup\nYou need Python 3.10+ and a few dependencies.\n```bash\npip install httpx python-dotenv\n```\nCreate a `.env` file for your OpenRouter key:\n```plaintext\nOPENROUTER_API_KEY=sk-or-your-key-here\n```\n\n## The Evaluation Loop Implementation\n\nWe use a modular design: an **Optimizer** (the LLM proposing changes), an **Evaluator** (your metric), and the **Loop**.\n\n```python\nimport os\nimport httpx\nimport json\nimport subprocess\nfrom typing import TypedDict\nfrom dotenv import load_dotenv\n\nload_dotenv()\n\n# Constants\nAPI_URL = \"https://openrouter.ai/api/v1/chat/completions\"\nMODEL = \"openai/gpt-4o-mini\"\nMAX_ITERATIONS = 10\n\nclass ExperimentResult(TypedDict):\n    iteration: int\n    score: float\n    action: str\n\ndef call_llm(prompt: str, system_msg: str = \"You are a prompt optimizer.\") -> str:\n    try:\n        response = httpx.post(\n            API_URL,\n            headers={\"Authorization\": f\"Bearer {os.getenv('OPENROUTER_API_KEY')}\"},\n            json={\n                \"model\": MODEL,\n                \"messages\": [\n                    {\"role\": \"system\", \"content\": system_msg},\n                    {\"role\": \"user\", \"content\": prompt}\n                ]\n            },\n            timeout=30.0\n        )\n        response.raise_for_status()\n        return response.json()[\"choices\"][0][\"message\"][\"content\"]\n    except Exception as e:\n        print(f\"API Error: {e}\")\n        return \"\"\n\ndef score_output(text: str) -> float:\n    \"\"\"Implement your business logic here. \n    Example: Score based on presence of key requirements.\"\"\"\n    keywords = [\"professional\", \"concise\", \"accurate\"]\n    score = sum(1 for word in keywords if word.lower() in text.lower())\n    return float(score)\n\ndef main():\n    current_prompt = \"Write a professional summary for a software engineer.\"\n    best_score = -1.0\n    \n    for i in range(MAX_ITERATIONS):\n        print(f\"--- Iteration {i} ---\")\n        # 1. Propose change\n        proposal = call_llm(f\"Refine this prompt to be more effective: {current_prompt}\")\n        # 2. Test proposal\n        output = call_llm(proposal, system_msg=\"Follow the prompt accurately.\")\n        score = score_output(output)\n        \n        # 3. Decision Logic\n        if score > best_score:\n            print(f\"KEEPING: Score {score} (Previous: {best_score})\")\n            best_score = score\n            current_prompt = proposal\n            with open(\"best_prompt.txt\", \"w\") as f: f.write(current_prompt)\n            subprocess.run([\"git\", \"add\", \"best_prompt.txt\"])\n            subprocess.run([\"git\", \"commit\", \"-m\", f\"Improvement at iter {i}\"])\n        else:\n            print(f\"DISCARDING: Score {score}\")\n\nif __name__ == \"__main__\":\n    main()\n```\n\n## Why Greedy Hill-Climbing?\nIn this loop, we use **Greedy Hill-Climbing**. It is the \"Hello World\" of optimization. It works by making a small change, testing it, and accepting the change *only if* it improves the score. \n\n**Why this pattern?**\n*   **Low Complexity:** It requires no state management beyond the current \"best\" artifact.\n*   **Safety:** You never lose your best-known state.\n*   **Reproducibility:** By committing to Git, you create a perfect audit trail of how your prompt evolved.\n\n**The Trade-off:** The primary risk is reaching a **local optimum**\u2014where the LLM reaches a \"good enough\" prompt that it cannot figure out how to improve further. \n\n## Common Pitfalls\n1. **Metric Gaming:** LLMs are excellent at \"hacking\" simple metrics. If your `score_output` function looks for the word \"concise,\" the LLM will just add that word repeatedly. Use multi-factor metrics (e.g., length + tone + keyword density).\n2. **The \"LLM-as-a-Judge\" Loop:** Using an LLM to score another LLM is powerful but prone to bias. If the judge LLM has a preference for verbosity, your prompt will trend toward long, flowery, and potentially inaccurate responses.\n3. **Runaway Costs:** Always hard-cap your `MAX_ITERATIONS`. Without a limit, a runaway script can exhaust your API credits in minutes.\n\n## Advanced Strategies\nOnce you master this loop, consider these next steps:\n*   **Parallelism:** Use `asyncio` to run 5 variations of a prompt simultaneously and pick the best one. This allows you to explore the search space faster.\n*   **Simulated Annealing:** Occasionally \"KEEP\" a prompt that is *slightly worse* than the current best. This allows the system to escape local optima by exploring new linguistic structures.\n*   **External Benchmarks:** Replace the custom `score_output` function with a call to a library like `pytest` or a dedicated evaluation framework (like DeepEval or RAGAS) to move beyond keyword matching.\n\nBy automating your evaluation, you shift your role from \"guessing what works\" to \"curating the best strategy.\" You are no longer writing prompts; you are managing a system that discovers them for you.", "D": "# Build a Minimal LLM Evaluation Loop in Python: Systematic Experiments for ML Engineers\n\nIf you're an ML engineer tired of manual prompt testing and eager to automate your LLM experiments, this tutorial guides you through building a simple evaluation loop using the OpenRouter API. It emphasizes a lean, understandable implementation that you can adapt quickly, focusing on core concepts without unnecessary complexity.\n\n## What You Will Build\n\nBy the end of this tutorial, you'll have a Python script that automates LLM output improvement through a greedy hill-climbing loop. It will:\n- Handle API calls to OpenRouter for generating improved text.\n- Evaluate outputs with a custom scoring function.\n- Decide whether to keep or discard iterations based on scores.\n- Track costs and save results for analysis.\n- Use git for versioning improvements, ensuring your progress is tracked and reproducible.