{"type": "stage2_complete", "rankings": [{"letter": "A", "display_letter": "D", "avg_position": 0.0, "votes": 4}, {"letter": "C", "display_letter": "E", "avg_position": 1.0, "votes": 4}, {"letter": "B", "display_letter": "B", "avg_position": 2.5, "votes": 4}, {"letter": "D", "display_letter": "A", "avg_position": 2.75, "votes": 4}, {"letter": "E", "display_letter": "C", "avg_position": 3.75, "votes": 4}], "shuffle_map": {"D": "A", "B": "B", "E": "C", "A": "D", "C": "E"}, "votes": [{"model": "meta-llama/llama-4-maverick", "display_ranking": "D > E > B > A > C", "original_ranking": "A > C > B > D > E", "reasoning": "To rank the versions, let's analyze each based on the given criteria: Correctness, Completeness, Clarity, Code Quality, and Depth.\n\n## Version D\nThis version stands out for its comprehensive coverage of the tutorial's objectives, including a clear \"what you will build\" section, detailed code explanations, and a worked example. It effectively balances correctness, completeness, and clarity, making it a strong candidate.\n\n## Version B\nVersion B excels in depth and code quality, introducing advanced concepts like multi-dimensional scoring and experiment tracking. However, it assumes a slightly higher level of prior knowledge and doesn't follow the exact step-by-step tutorial structure as closely as some other versions.\n\n## Version E\nVersion E is notable for its clear structure, robust configuration management, and detailed explanations of key concepts like greedy hill-climbing and common pitfalls. It provides a comprehensive and well-structured tutorial.\n\n## Version A\nVersion A is clear and easy to follow, providing a straightforward implementation of the evaluation loop. It covers all essential steps and includes a worked example, making it accessible to the target audience.\n\n## Version C\nVersion C is a solid implementation that covers the basics of the evaluation loop. However, it lacks some of the additional features and explanations that make other versions more comprehensive.\n\n## Ranking\n\n- **Version D**: Strong in clarity, completeness, and correctness, with a good balance of code quality and depth.\n- **Version E**: Excellent in clarity and depth, with robust code quality, but slightly less comprehensive in some aspects.\n- **Version B**: Stands out in depth and code quality, but may be less accessible due to its advanced concepts and structure.\n- **Version A**: Clear and comprehensive, with a good balance of correctness, completeness, and clarity.\n- **Version C**: Covers the basics well but lacks the additional features and depth seen in other versions."}, {"model": "anthropic/claude-3-5-haiku", "display_ranking": "D > E > B > A > C", "original_ranking": "A > C > B > D > E", "reasoning": "I'll evaluate each version against the criteria:\n\nVersion D (Detailed Reasoning):\n- Correctness: Excellent, comprehensive code with error handling\n- Completeness: Most thorough, covers all major requirements\n- Clarity: Very clear, step-by-step explanations\n- Code Quality: Strong, uses type hints, environment variables\n- Depth: Exceptional, includes \"why\" explanations and tradeoffs\nBest overall version with the most comprehensive approach.\n\nVersion E (Detailed Reasoning):\n- Correctness: Solid implementation with good error handling\n- Completeness: Good coverage of core requirements\n- Clarity: Clear but slightly less detailed than Version D\n- Code Quality: Good, pragmatic approach\n- Depth: Strong technical insights, good discussion of pitfalls\nStrong contender, very practical implementation.\n\nVersion B (Detailed Reasoning):\n- Correctness: Technically sound but more abstract\n- Completeness: More conceptual, less concrete implementation\n- Clarity: More academic/theoretical tone\n- Code Quality: Advanced, uses dataclasses and logging\n- Depth: Excellent theoretical insights\nIntellectually sophisticated but less immediately practical.\n\nVersion A (Detailed Reasoning):\n- Correctness: Solid implementation\n- Completeness: Covers core requirements\n- Clarity: Good explanations, slightly verbose\n- Code Quality: Good, but less sophisticated than D or E\n- Depth: Decent technical explanations\nSolid tutorial, but lacks the depth of top versions.\n\nVersion C (Detailed Reasoning):\n- Correctness: Basic implementation\n- Completeness: Minimal coverage of requirements\n- Clarity: Straightforward but lacks depth\n- Code Quality: Functional but simplistic\n- Depth: Shallow technical insights\nMost basic version, lacks nuance of other implementations."}, {"model": "google/gemini-3.1-flash-lite-preview", "display_ranking": "D > E > A > C > B", "original_ranking": "A > C > D > E > B", "reasoning": "The tutorials were evaluated based on their adherence to the \"minimal but systematic\" prompt engineering workflow, code quality, and the inclusion of advanced features like version control and robust error handling.\n\n*   **Version D:** Provides the most comprehensive implementation; it successfully integrates Git versioning, proper error handling, cost tracking, and clear documentation, making it the most practical tool for an ML engineer.\n*   **Version E:** Very strong; it uses a `Config` class for clean code and includes Git integration, though Version D's inclusion of a `results.json` file alongside Git versioning makes for a slightly more robust data-tracking workflow.\n*   **Version A:** Well-written and clear, but lacks the automated Git versioning feature which is a significant value-add for \"systematic experimentation.\"\n*   **Version C:** A functional and simple implementation, but it lacks the version control integration and the slightly more polished structure found in the other versions.\n*   **Version B:** While it introduces advanced concepts like `pandas` and `textstat`, it fails to include a complete, runnable \"loop\" script, instead providing fragmented classes that would require significant effort for the user to assemble into a working tool."}, {"model": "x-ai/grok-3-mini-beta", "display_ranking": "D > E > B > A > C", "original_ranking": "A > C > B > D > E", "reasoning": "Below is my evaluation and ranking of the versions based on the specified criteria: Correctness, Completeness, Clarity, Code Quality, and Depth (each scored out of 20, with a total possible score of 100). I judged each version solely on its quality, focusing on how well it meets the tutorial's goals for ML engineers seeking a minimal, understandable implementation.\n\n### Brief Reasoning for Each Version:\n- **Version D**: This version excels in completeness by including git versioning, cost tracking, and result saving, while maintaining high clarity and code quality with inline explanations and error handling; its depth is strong due to justifications for design choices and a worked example, making it the most balanced and practical. (Total score: 90/100)\n- **Version E**: It provides a robust setup with a config class, TSV logging, and git integration, offering good completeness and code quality, though its depth on tradeoffs is somewhat limited compared to D. (Total score: 87/100)\n- **Version B**: This version stands out for its depth in multi-dimensional scoring and advanced tracking, but it overcomplicates the minimal approach with features like pandas and dataclasses, potentially reducing clarity for the target audience. (Total score: 86/100)\n- **Version A**: It delivers a clear, idiomatic implementation with a worked example and basic cost tracking, but lacks completeness in areas like git versioning, making it solid yet not as comprehensive as others. (Total score: 84/100)\n- **Version C**: While correct and straightforward, it falls short in completeness by omitting git versioning and advanced tracking, with weaker depth in explanations, resulting in a more basic tutorial. (Total score: 79/100)\n\n###"}], "model_names": {"A": "meta-llama/llama-4-maverick", "B": "anthropic/claude-3-5-haiku", "C": "google/gemini-3.1-flash-lite-preview", "D": "x-ai/grok-3-mini-beta"}}
{"type": "stage3_complete", "winner": "A", "winner_model": "meta-llama/llama-4-maverick", "council_score": 94, "sub_scores": {"CORRECTNESS": 20, "COMPLETENESS": 20, "CLARITY": 18, "CODE_QUALITY": 18, "DEPTH": 18}, "critique": "Proposal A thoroughly covers all essential elements of building a minimal LLM evaluation loop, presenting clear, runnable code that is logically sound and free from errors. The tutorial excels in completeness, including API setup, metric definition, and result storage, while maintaining a clear flow that intermediate Python users can follow. However, it could benefit from slightly more inline explanations to enhance clarity further. Additionally, incorporating a section on tradeoffs or potential pitfalls would deepen the reader's understanding of optimization strategies. Overall, A is a strong tutorial that meets the objectives well.", "chairman_full_response": "WINNER: A\nSCORE_CORRECTNESS: 20\nSCORE_COMPLETENESS: 20\nSCORE_CLARITY: 18\nSCORE_CODE_QUALITY: 18\nSCORE_DEPTH: 18\nCOUNCIL_SCORE: 94\n\nCRITIQUE:\nProposal A thoroughly covers all essential elements of building a minimal LLM evaluation loop, presenting clear, runnable code that is logically sound and free from errors. The tutorial excels in completeness, including API setup, metric definition, and result storage, while maintaining a clear flow that intermediate Python users can follow. However, it could benefit from slightly more inline explanations to enhance clarity further. Additionally, incorporating a section on tradeoffs or potential pitfalls would deepen the reader's understanding of optimization strategies. Overall, A is a strong tutorial that meets the objectives well.", "chairman_model": "openai/gpt-4o-mini", "model_names": {"A": "meta-llama/llama-4-maverick", "B": "anthropic/claude-3-5-haiku", "C": "google/gemini-3.1-flash-lite-preview", "D": "x-ai/grok-3-mini-beta"}}
{"type": "iteration_result", "iteration": 2, "status": "KEEP", "council_score": 94, "winner": "A", "best_score": 94, "commit": "ebb51dd", "spent_usd": 0.021467, "timestamp": "2026-04-03T14:31:18.344148Z"}
