{"type": "stage2_complete", "rankings": [{"letter": "A", "display_letter": "D", "avg_position": 0.5, "votes": 4}, {"letter": "D", "display_letter": "E", "avg_position": 0.5, "votes": 4}, {"letter": "C", "display_letter": "B", "avg_position": 2.5, "votes": 4}, {"letter": "B", "display_letter": "A", "avg_position": 2.75, "votes": 4}, {"letter": "E", "display_letter": "C", "avg_position": 3.75, "votes": 4}], "shuffle_map": {"D": "A", "A": "B", "B": "C", "E": "D", "C": "E"}, "votes": [{"model": "meta-llama/llama-4-maverick", "display_ranking": "E > D > B > C > A", "original_ranking": "D > A > C > E > B", "reasoning": "## Step 1: Evaluate Version D\nVersion D is comprehensive, covering all essential steps, and includes features like cost tracking, git versioning, and configurable model parameters, making it a strong candidate.\n\n## Step 2: Evaluate Version A\nVersion A introduces a probabilistic exploration strategy, which is an interesting approach, but its complexity and the use of additional libraries like NLTK might make it less straightforward for some readers.\n\n## Step 3: Evaluate Version B\nVersion B provides a clear and modular implementation, emphasizing the importance of measuring prompts and using a greedy hill-climbing algorithm, but it lacks some features like cost tracking and git versioning initially mentioned.\n\n## Step 4: Evaluate Version E\nVersion E enhances the evaluation loop by querying multiple models in parallel, which significantly improves efficiency, and it also saves results to a TSV file for easy analysis, making it highly practical.\n\n## Step 5: Evaluate Version C\nVersion C is a solid implementation of a minimal evaluation loop with a greedy hill-climbing strategy, cost tracking, and git versioning, but it lacks the parallel querying feature that enhances efficiency.\n\n## Step 6: Compare All Versions\nComparing all versions based on the evaluation criteria: correctness, completeness, clarity, code quality, and depth. Version D and Version E stand out for their completeness and practical enhancements.\n\n## Step 7: Rank the Versions\nVersion E is highly efficient and practical due to its parallel querying feature. Version D is comprehensive with its cost tracking, git versioning, and clear explanations. Version B is clear and modular but lacks some advanced features. Version C is a good basic implementation but misses some enhancements. Version A, while interesting, is more complex and less straightforward.\n\n## Step 8: Final Ranking\nConsidering all aspects, the ranking from best to worst is based on the balance of completeness, clarity, and practicality."}, {"model": "anthropic/claude-3-5-haiku", "display_ranking": "D > E > A > B > C", "original_ranking": "A > D > B > C > E", "reasoning": "I'll evaluate each version across the five criteria and provide a brief rationale:\n\nVersion D (0-20 points per category):\n- Correctness: 19/20 (Comprehensive, robust implementation with error handling)\n- Completeness: 20/20 (Covers all essential steps, very thorough)\n- Clarity: 19/20 (Excellent step-by-step explanation, clear code)\n- Code Quality: 18/20 (Strong typing, modular design, good practices)\n- Depth: 20/20 (Exceptional justifications, tradeoffs, and advanced considerations)\nTotal: 96/100\n\nVersion E (0-20 points per category):\n- Correctness: 17/20 (Good implementation, slightly more complex async approach)\n- Completeness: 18/20 (Adds parallel model querying, comprehensive but slightly less detailed)\n- Clarity: 17/20 (Clear, but slightly more technical language)\n- Code Quality: 17/20 (Good practices, async implementation adds complexity)\n- Depth: 18/20 (Strong explanations, good exploration of tradeoffs)\nTotal: 87/100\n\nVersion A (0-20 points per category):\n- Correctness: 16/20 (Probabilistic approach introduces some complexity)\n- Completeness: 16/20 (Covers core steps, but less systematically)\n- Clarity: 16/20 (Good explanations, but slightly more abstract)\n- Code Quality: 15/20 (Less robust error handling, more experimental approach)\n- Depth: 17/20 (Interesting probabilistic exploration rationale)\nTotal: 80/100\n\nVersion B (0-20 points per category):\n- Correctness: 15/20 (Functional, but less comprehensive error handling)\n- Completeness: 15/20 (Covers basics, but fewer advanced features)\n- Clarity: 16/20 (Conversational tone, good explanations)\n- Code Quality: 14/20 (Less type hinting, fewer best practices)\n- Depth: 16/20 (Good philosophical discussion of optimization)\nTotal: 76/100\n\nVersion C (0-20 points per category):\n- Correctness: 15/20 (Similar to Version B, basic implementation)\n- Completeness: 15/20 (Covers core steps, but less innovative)\n- Clarity: 15/20 (Clear but less engaging than others)\n- Code Quality: 14/20 (Basic implementation, fewer advanced practices)\n- Depth: 15/20 (Standard tradeoffs and explanations)\nTotal: 74/100\n\nReasoning summary:\n- Version D stands out for its comprehensive, well-explained, and robust implementation\n- Version E introduces interesting parallel query innovation\n- Versions A, B, and C are solid but less distinguished"}, {"model": "google/gemini-3.1-flash-lite-preview", "display_ranking": "E > D > A > B > C", "original_ranking": "D > A > B > C > E", "reasoning": "The evaluation of these tutorials centered on their ability to provide a robust, idiomatic, and educational codebase for ML engineers.\n\n*   **Version E** is the strongest because it utilizes `asyncio` for parallel model querying, providing a tangible performance benefit and demonstrating modern Python concurrency, while also including a clean TSV export and excellent documentation.\n*   **Version D** is highly competent, providing a very clear and robust implementation with good error handling, git integration, and a helpful \"worked example\" section, though it lacks the parallel execution found in Version E.\n*   **Version A** is ambitious with its \"probabilistic exploration\" approach (simulated annealing), which is a great concept, but it introduces heavy external dependencies like `nltk` which complicates a \"minimal\" 10-minute tutorial.\n*   **Version B** is well-written and concise, but its code quality is slightly hampered by using `NamedTuple` for configuration in a way that feels a bit forced, and the inclusion of `csv` logic is good but less clean than Version E.\n*   **Version C** is a solid, functional baseline, but it is the most basic of the bunch, lacking the advanced features (like parallel processing or robust config management) that distinguish the top entries.\n\nReasoning:\n*   **Version E**: Best balance of advanced features (async/parallelism), clean code, and practical utility.\n*   **Version D**: Excellent, readable code with comprehensive features like git versioning and clear explanations.\n*   **Version A**: Interesting approach to optimization, but the reliance on `nltk` makes it less \"minimal\" than requested.\n*   **Version B**: Good structure, but slightly less idiomatic than the top versions and less feature-rich than E.\n*   **Version C**: Perfectly functional and clear, but lacks the \"optimization\" depth of the other entries."}, {"model": "x-ai/grok-3-mini-beta", "display_ranking": "D > E > B > A > C", "original_ranking": "A > D > C > B > E", "reasoning": "Below is my ranking of the versions from best to worst based on the evaluation criteria (Correctness, Completeness, Clarity, Code Quality, and Depth). I judged each version holistically, assigning approximate scores out of 100 as follows: Version D (92/100), Version E (88/100), Version B (85/100), Version A (80/100), and Version C (75/100). My reasoning focuses on how well each meets the criteria without bias toward the author.\n\n- **Version D**: This version excels in completeness and depth by covering all essential steps, including cost tracking and git versioning, while providing clear explanations, justifications for design choices, and a worked example, making it highly suitable for the target audience.  \n- **Version E**: It improves on completeness and code quality with asynchronous parallel queries and TSV saving, enhancing efficiency and clarity, though the async elements add slight complexity that might overwhelm beginners.  \n- **Version B**: Strong in clarity and depth due to its modular structure, practical discussions of pitfalls, and effective use of tools like NamedTuple, but it's slightly less complete than D or E in advanced features.  \n- **Version A**: It offers good depth in explaining probabilistic exploration and has solid code quality with type hints, but its added complexity (e.g., randomness and NLTK dependencies) reduces clarity and completeness for a minimal tutorial.  \n- **Version C**: While correct and clear in basic implementation, it lacks depth in justifications and is less complete than others, missing advanced features like parallel queries or detailed tradeoffs, making it feel rudimentary."}], "model_names": {"A": "meta-llama/llama-4-maverick", "B": "anthropic/claude-3-5-haiku", "C": "google/gemini-3.1-flash-lite-preview", "D": "x-ai/grok-3-mini-beta"}}
{"type": "stage3_complete", "winner": "A", "winner_model": "meta-llama/llama-4-maverick", "council_score": 87, "sub_scores": {"CORRECTNESS": 18, "COMPLETENESS": 18, "CLARITY": 17, "CODE_QUALITY": 18, "DEPTH": 16}, "critique": "Proposal A is a strong choice due to its comprehensive coverage of essential steps, including API setup, metric definition, and the KEEP/DISCARD logic in the evaluation loop. The code is clear and well-structured, making it accessible for intermediate Python users, though some inline comments could enhance clarity further. While the tutorial adequately explains the greedy hill-climbing method, it could delve deeper into tradeoffs or alternative strategies for optimization. To improve, consider adding more detailed discussions about potential pitfalls and how to mitigate them in a systematic evaluation loop.", "chairman_full_response": "WINNER: A\nSCORE_CORRECTNESS: 18\nSCORE_COMPLETENESS: 18\nSCORE_CLARITY: 17\nSCORE_CODE_QUALITY: 18\nSCORE_DEPTH: 16\nCOUNCIL_SCORE: 87\n\nCRITIQUE:\nProposal A is a strong choice due to its comprehensive coverage of essential steps, including API setup, metric definition, and the KEEP/DISCARD logic in the evaluation loop. The code is clear and well-structured, making it accessible for intermediate Python users, though some inline comments could enhance clarity further. While the tutorial adequately explains the greedy hill-climbing method, it could delve deeper into tradeoffs or alternative strategies for optimization. To improve, consider adding more detailed discussions about potential pitfalls and how to mitigate them in a systematic evaluation loop.", "chairman_model": "openai/gpt-4o-mini", "model_names": {"A": "meta-llama/llama-4-maverick", "B": "anthropic/claude-3-5-haiku", "C": "google/gemini-3.1-flash-lite-preview", "D": "x-ai/grok-3-mini-beta"}}
{"type": "iteration_result", "iteration": 5, "status": "DISCARD", "council_score": 87, "winner": "A", "best_score": 94, "commit": "ebb51dd", "spent_usd": 0.110422, "timestamp": "2026-04-03T14:34:54.909593Z"}
