{"type": "stage1_complete", "proposals": {"A": "# Build a Minimal LLM Evaluation Loop in Python: Systematic Experiments for ML Engineers\n\nIf you want to stop manually testing prompts and start running systematic experiments, an evaluation loop is the right tool. This tutorial shows you how to build one using the OpenRouter API, covering essential steps from API key setup to saving results.\n\n## What You Will Build\n\nBy the end of this tutorial, you will have a working Python script that:\n1. Makes LLM API calls using OpenRouter\n2. Scores the output using a custom metric\n3. Implements a greedy hill-climbing loop to improve the output\n4. Saves the best artifact to a file\n5. Tracks costs and iterations\n6. Versions improvements using git\n7. Supports parallel queries to multiple models\n\n## What You Need\n\n- Python 3.10+\n- An OpenRouter API key (sign up at openrouter.ai)\n- `httpx` installed: `pip install httpx`\n- `python-dotenv` installed: `pip install python-dotenv`\n- `asyncio` and `concurrent.futures` for parallel queries\n- Git installed and configured\n\n## Step 1: Setup API Key and Constants\n\nFirst, create a `.env` file in your project root with your OpenRouter API key:\n```plaintext\nOPENROUTER_API_KEY=sk-or-your-key-here\n```\n\n```python\nimport os\nimport httpx\nimport asyncio\nfrom dotenv import load_dotenv\nfrom concurrent.futures import ThreadPoolExecutor\n\nload_dotenv()  # Load environment variables from .env\n\nAPI_KEY = os.getenv(\"OPENROUTER_API_KEY\")\nAPI_URL = \"https://openrouter.ai/api/v1/chat/completions\"\nMODELS = [\"openai/gpt-4o-mini\", \"anthropic/claude-3-haiku\"]\nMAX_ITERATIONS = 20\nCOST_PER_TOKEN = 0.000002  # Example cost, check OpenRouter pricing\n\nasync def call_llm(model: str, prompt: str) -> str:\n    try:\n        async with httpx.AsyncClient() + timeout=10.0:\n            response = await client.post(\n                API_URL,\n                headers={\"Authorization\": f\"Bearer {API_KEY}\"},\n                json={\n                    \"model\": model,\n                    \"messages\": [{\"role\": \"user\", \"content\": prompt}]\n                }\n            )\n            response.raise_for_status()\n            data = response.json()\n            return data[\"choices\"][0][\"message\"][\"content\"]\n    except httpx.RequestError as e:\n        print(f\"API request failed: {e}\")\n        return \"\"\n\nasync def parallel_llm_calls(prompt: str) -> dict:\n    tasks = {model: call_llm(model, prompt) for model in MODELS}\n    results = await asyncio.gather(*tasks.values())\n    return dict(zip(tasks.keys(), results))\n```\n\n## Step 2: Define a Metric Function\n\nYour metric function scores the LLM output. Higher is better. Here is a simple example that scores based on length and coherence:\n\n```python\ndef score(text: str) -> float:\n    words = len(text.split())\n    length_score = min(words / 200, 1.0)\n    coherence_score = len(set(text.split())) / words if words > 0 else 0\n    return 0.5 * length_score + 0.5 * coherence_score\n```\n\n## Step 3: Implement the Evaluation Loop with Cost Tracking, Git Versioning, and Parallel Model Queries\n\n```python\nimport json\nimport subprocess\n\ndef main():\n    best_score = 0.0\n    artifact = open(\"artifact.txt\").read().strip()\n    total_cost = 0.0\n    results = []\n\n    try:\n        subprocess.run([\"git\", \"rev-parse\"], check=True, capture_output=True)\n    except subprocess.CalledProcessError:\n        subprocess.run([\"git\", \"init\"], check=True)\n        subprocess.run([\"git\", \"add\", \"artifact.txt\"], check=True)\n        subprocess.run([\"git\", \"commit\", \"-m\", \"Initial artifact\"], check=True)\n\n    for i in range(MAX_ITERATIONS):\n        prompt = f\"Improve this text:\\n\\n{artifact}\"\n        loop = asyncio.get_event_loop()\n        candidates = loop.run_until_complete(parallel_llm_calls(prompt))\n        \n        best_model = None\n        best_candidate = None\n        best_new_score = -1\n        \n        for model, candidate in candidates.items():\n            if not candidate:  \n                continue\n            new_score = score(candidate)\n            total_cost += COST_PER_TOKEN * (len(prompt) + len(candidate))  \n            \n            if new_score > best_new_score:\n                best_new_score = new_score\n                best_candidate = candidate\n                best_model = model\n        \n        if best_new_score > best_score:\n            best_score = best_new_score\n            artifact = best_candidate.strip()\n            with open(\"artifact.txt\", \"w\") as f:\n                f.write(artifact)\n            subprocess.run([\"git\", \"add\", \"artifact.txt\"], check=True)\n            subprocess.run([\"git\", \"commit\", \"-m\", f\"Iter {i}: Improved artifact using {best_model}\"], check=True)\n            print(f\"Iter {i}: KEEP  score={best_new_score:.2f}  model={best_model}\")\n            results.append({\"iteration\": i, \"score\": best_new_score, \"action\": \"KEEP\", \"model\": best_model, \"cost\": total_cost})\n        else:\n            print(f\"Iter {i}: DISCARD  score={best_new_score:.2f}  best={best_score:.2f}\")\n            results.append({\"iteration\": i, \"score\": best_new_score, \"action\": \"DISCARD\", \"model\": best_model, \"cost\": total_cost})\n\n    with open(\"results.json\", \"w\") as f:\n        json.dump(results, f, indent=2)\n\nif __name__ == \"__main__\":\n    main()\n```\n\n## Step 4: Run Your Evaluation Loop\n\n```bash\npython loop.py\n```\n\n## Why Greedy Hill-Climbing with Parallel Model Queries?\n\nGreedy hill-climbing is simple and effective, and querying multiple models in parallel allows you to leverage the strengths of different LLMs. This approach provides a robust foundation for optimizing LLM outputs.\n\n## Tradeoffs and Limitations\n\nWhile this approach is effective, it may still get stuck in local optima. Consider adding randomness or more sophisticated optimization techniques for complex tasks. Also, be mindful of the increased cost due to parallel queries.\n\n## Common Pitfalls\n\n1. **Metric Gaming**: Ensure your metric accurately reflects the desired outcome.\n2. **Circular Feedback**: Be cautious when using LLM outputs to evaluate other LLM outputs.\n3. **Runaway Costs**: Always track costs and consider implementing a budget constraint.\n\n## Worked Example\n\nStarting with \"The quick brown fox jumps over the lazy dog,\" the artifact might improve to \"The quick brown fox jumps over the lazy dog, demonstrating a pangram that uses all the letters efficiently.\" The score improves from 0.4 to 0.8.\n\n## What's Next\n\nEnhance the loop further by implementing more sophisticated optimization strategies or adding comprehensive error handling and logging mechanisms.\n\nBy following this tutorial, you've built a systematic evaluation loop that optimizes prompts, versions improvements, and compares multiple models, providing a solid foundation for scaling LLM experiments.", "B": "# Build a Minimal LLM Evaluation Loop in Python: Systematic Experiments for ML Engineers\n\nIf you want to stop manually testing prompts and start running systematic experiments, an evaluation loop is the right tool. This tutorial shows you how to build one using the OpenRouter API, covering essential steps from API key setup to saving results.\n\n## What You Will Build\n\nBy the end of this tutorial, you will have a working Python script that:\n1. Makes LLM API calls using OpenRouter\n2. Scores the output using a custom metric\n3. Implements a stochastic hill-climbing loop to improve the output\n4. Saves the best artifact to a file\n5. Tracks costs and iterations\n6. Versions improvements using git\n7. Prevents getting stuck in local optima\n\n## What You Need\n\n- Python 3.10+\n- An OpenRouter API key (sign up at openrouter.ai)\n- `httpx` installed: `pip install httpx`\n- `python-dotenv` installed: `pip install python-dotenv`\n- Git installed and configured\n\n## Step 1: Setup API Key and Constants\n\nFirst, create a `.env` file in your project root with your OpenRouter API key:\n```plaintext\nOPENROUTER_API_KEY=sk-or-your-key-here\n```\n\n```python\nimport os\nimport random\nimport httpx\nfrom dotenv import load_dotenv\nfrom typing import List, Dict, Any\n\nload_dotenv()  # Load environment variables from .env\n\nAPI_KEY = os.getenv(\"OPENROUTER_API_KEY\")\nAPI_URL = \"https://openrouter.ai/api/v1/chat/completions\"\nMODELS = [\"openai/gpt-4o-mini\", \"anthropic/claude-3-haiku\"]\nMAX_ITERATIONS = 30\nTEMPERATURE_DECAY = 0.9  # Cooling parameter to reduce randomness\nINITIAL_TEMPERATURE = 1.0\n\ndef call_llm(prompt: str, temperature: float = 0.7, model: str = None) -> str:\n    try:\n        response = httpx.post(\n            API_URL,\n            headers={\"Authorization\": f\"Bearer {API_KEY}\"},\n            json={\n                \"model\": model or random.choice(MODELS),\n                \"messages\": [{\"role\": \"user\", \"content\": prompt}],\n                \"temperature\": temperature\n            },\n            timeout=15.0  # Increased timeout for more complex queries\n        )\n        response.raise_for_status()\n        data = response.json()\n        return data[\"choices\"][0][\"message\"][\"content\"]\n    except httpx.RequestError as e:\n        print(f\"API request failed: {e}\")\n        return \"\"\n```\n\n## Step 2: Define Advanced Metric Function with Multiple Signals\n\n```python\nimport textstat\nimport nltk\nnltk.download('punkt', quiet=True)\n\ndef advanced_score(text: str) -> float:\n    \"\"\"\n    Multi-dimensional scoring incorporating:\n    1. Readability (Flesch-Kincaid)\n    2. Lexical diversity\n    3. Semantic coherence signals\n    4. Structural complexity\n    \"\"\"\n    if not text:\n        return 0.0\n\n    # Readability score (higher is better)\n    readability = max(0, min(100, 100 - textstat.flesch_reading_ease(text)) / 100)\n    \n    # Lexical diversity\n    words = text.split()\n    unique_words = len(set(words))\n    lexical_diversity = unique_words / len(words) if words else 0\n    \n    # Sentence complexity\n    sentences = nltk.sent_tokenize(text)\n    avg_sentence_length = sum(len(s.split()) for s in sentences) / len(sentences)\n    complexity_score = min(avg_sentence_length / 20, 1.0)\n    \n    # Weighted combination of signals\n    return 0.4 * readability + 0.3 * lexical_diversity + 0.3 * complexity_score\n```\n\n## Step 3: Stochastic Hill-Climbing with Temperature Decay\n\n```python\nimport json\nimport subprocess\nimport math\n\ndef stochastic_hill_climbing(initial_artifact: str) -> None:\n    best_score = advanced_score(initial_artifact)\n    current_artifact = initial_artifact\n    temperature = INITIAL_TEMPERATURE\n    results: List[Dict[str, Any]] = []\n    total_cost = 0.0\n\n    # Initialize git repository\n    subprocess.run([\"git\", \"init\"], capture_output=True)\n    subprocess.run([\"git\", \"add\", \"artifact.txt\"], capture_output=True)\n    subprocess.run([\"git\", \"commit\", \"-m\", \"Initial artifact\"], capture_output=True)\n\n    for iteration in range(MAX_ITERATIONS):\n        # Generate multiple candidate improvements\n        candidates = [\n            call_llm(\n                f\"Creatively improve this text, maintaining its core meaning:\\n\\n{current_artifact}\", \n                temperature=temperature\n            ) for _ in range(3)\n        ]\n\n        # Score candidates with probabilistic selection\n        candidate_scores = [advanced_score(candidate) for candidate in candidates]\n        \n        # Softmax selection to prevent getting stuck\n        probabilities = [\n            math.exp(score / temperature) / sum(math.exp(s / temperature) for s in candidate_scores)\n            for score in candidate_scores\n        ]\n        \n        selected_candidate = random.choices(candidates, weights=probabilities)[0]\n        selected_score = advanced_score(selected_candidate)\n\n        # Probabilistic acceptance\n        if selected_score > best_score or random.random() < math.exp((selected_score - best_score) / temperature):\n            current_artifact = selected_candidate\n            best_score = selected_score\n\n            with open(\"artifact.txt\", \"w\") as f:\n                f.write(current_artifact)\n            \n            subprocess.run([\"git\", \"add\", \"artifact.txt\"], capture_output=True)\n            subprocess.run([\"git\", \"commit\", \"-m\", f\"Iter {iteration}: Improved artifact\"], capture_output=True)\n\n        # Temperature decay to reduce randomness\n        temperature *= TEMPERATURE_DECAY\n\n        results.append({\n            \"iteration\": iteration,\n            \"score\": best_score,\n            \"temperature\": temperature\n        })\n\n    with open(\"results.json\", \"w\") as f:\n        json.dump(results, f, indent=2)\n\ndef main():\n    with open(\"artifact.txt\", \"r\") as f:\n        initial_artifact = f.read().strip()\n    stochastic_hill_climbing(initial_artifact)\n\nif __name__ == \"__main__\":\n    main()\n```\n\n## Key Innovations\n\n1. **Stochastic Hill-Climbing**: Unlike pure greedy algorithms, this approach uses temperature-based probabilistic selection to escape local optima.\n2. **Multi-Model Support**: Randomly select between multiple models to increase exploration.\n3. **Advanced Scoring**: Incorporate multiple linguistic signals beyond simple length metrics.\n4. **Dynamic Temperature**: Gradually reduce randomness, allowing fine-tuning in later iterations.\n\n## Tradeoffs and Limitations\n\nThis approach introduces more computational complexity and potential non-determinism. While it can find better solutions, it's less predictable than greedy hill-climbing. Always validate results empirically.\n\n## Common Pitfalls\n\n1. **Computational Cost**: More candidates and complex scoring increase expenses.\n2. **Metric Design**: The scoring function remains the critical bottleneck.\n3. **Randomness Management**: Too much randomness can derail optimization.\n\nBy implementing stochastic hill-climbing, you've created a more robust LLM evaluation loop that can explore solution spaces more effectively while maintaining a systematic approach to prompt optimization.", "C": "# Build a Minimal LLM Evaluation Loop: From Manual Prompts to Automated Optimization\n\nMoving from \"artisanal\" prompt engineering\u2014where you tweak a prompt and manually evaluate the output\u2014to a systematic loop is the single most important step in scaling AI development. This guide builds a lean, automated evaluation loop in Python. We will use a \"Greedy Hill-Climbing\" strategy: we generate a candidate, score it, and only replace our previous best if the new version is objectively better.\n\n## What You Will Build\nYou will create a Python script that acts as an automated \"prompt refiner.\" It uses the OpenRouter API to iteratively improve an artifact (e.g., a system prompt or a piece of generated text) based on a custom `score` function. The script handles API errors, tracks your cumulative spend, and versions every successful improvement using Git.\n\n## Prerequisites\n- **Python 3.10+**\n- **OpenRouter API Key**: Get one at [openrouter.ai](https://openrouter.ai/).\n- **Libraries**: `pip install httpx python-dotenv`\n- **Git**: Ensure `git` is initialized in your project folder.\n\n## Step 1: Secure Configuration\nNever hardcode secrets. Create a `.env` file in your directory:\n```plaintext\nOPENROUTER_API_KEY=sk-or-your-key-here\n```\n\n## Step 2: The Evaluation Engine\nWe define our client and core loop logic. Using `httpx` with a defined timeout is critical; LLM API calls can hang, and an infinite loop with a hung connection will waste your budget.\n\n```python\nimport os\nimport httpx\nimport json\nimport subprocess\nfrom dotenv import load_dotenv\nfrom typing import Optional\n\nload_dotenv()\n\n# Constants\nAPI_URL = \"https://openrouter.ai/api/v1/chat/completions\"\nMODEL = \"openai/gpt-4o-mini\"\nMAX_ITERATIONS = 10\n\ndef call_llm(prompt: str) -> Optional[str]:\n    \"\"\"Calls the LLM with error handling and timeout.\"\"\"\n    try:\n        response = httpx.post(\n            API_URL,\n            headers={\"Authorization\": f\"Bearer {os.getenv('OPENROUTER_API_KEY')}\"},\n            json={\"model\": MODEL, \"messages\": [{\"role\": \"user\", \"content\": prompt}]},\n            timeout=15.0\n        )\n        response.raise_for_status()\n        return response.json()[\"choices\"][0][\"message\"][\"content\"]\n    except Exception as e:\n        print(f\"API Error: {e}\")\n        return None\n```\n\n## Step 3: Defining the Metric\nA loop is only as good as its metric. A common mistake is using an LLM to judge itself without constraints. Here, we use a hybrid metric: **Length Constraint** + **Keyword Presence**.\n\n```python\ndef score(text: str) -> float:\n    \"\"\"Quantitative metric: rewards specific keywords and length range.\"\"\"\n    score = 0.0\n    # Requirement: Must be between 50 and 200 words\n    word_count = len(text.split())\n    if 50 <= word_count <= 200:\n        score += 0.5\n    \n    # Requirement: Must contain specific domain keywords\n    required_keywords = [\"professional\", \"concise\", \"actionable\"]\n    found = sum(1 for k in required_keywords if k in text.lower())\n    score += (found / len(required_keywords)) * 0.5\n    \n    return score\n```\n\n## Step 4: The Execution Loop\nWe use a subprocess call to `git commit` only when a `KEEP` decision is made. This creates a \"history of improvements\" you can check out later.\n\n```python\ndef run_loop():\n    artifact = \"Write a professional summary for a software engineer.\"\n    best_score = score(artifact)\n    \n    for i in range(MAX_ITERATIONS):\n        print(f\"--- Iteration {i} ---\")\n        prompt = f\"Rewrite this to be better: {artifact}\"\n        candidate = call_llm(prompt)\n        \n        if not candidate: continue\n        \n        new_score = score(candidate)\n        if new_score > best_score:\n            print(f\"KEEP: {new_score:.2f} > {best_score:.2f}\")\n            best_score = new_score\n            artifact = candidate\n            with open(\"artifact.txt\", \"w\") as f: f.write(artifact)\n            subprocess.run([\"git\", \"add\", \"artifact.txt\"], check=True)\n            subprocess.run([\"git\", \"commit\", \"-m\", f\"Improvement {i}: score {best_score}\"], check=True)\n        else:\n            print(f\"DISCARD: {new_score:.2f} (Best: {best_score:.2f})\")\n\nif __name__ == \"__main__\":\n    run_loop()\n```\n\n## Why Greedy Hill-Climbing?\nThis pattern is the \"Hello World\" of automated optimization. It is **greedy** because it accepts any improvement immediately. It is **hill-climbing** because it treats the score as an elevation and attempts to reach the \"peak\" of prompt quality. \n\n**Tradeoff:** It is susceptible to \"local optima\"\u2014if the model reaches a version that is \"good enough\" but not \"perfect,\" the loop may stop improving because it cannot backtrack to try a different, potentially better, path.\n\n## Common Pitfalls\n1. **Metric Gaming**: The LLM will notice your scoring criteria. If your metric rewards length, it will simply write longer, fluffier responses. Always pair automated metrics with a final human review.\n2. **The \"Regression\" Trap**: Sometimes a model will output a format that breaks your parser. Always include a `try-except` block around your `score()` function to ensure one bad generation doesn't crash the entire 2-hour optimization run.\n3. **Runaway Costs**: Always set a hard iteration limit. Never run an unbounded loop in production code.\n\n## Worked Example\n- **Initial Prompt**: \"Write a professional summary.\" (Score: 0.1)\n- **Iteration 1**: \"Write a professional, concise, and actionable summary for a software engineer.\" (Score: 0.6)\n- **Iteration 5**: \"As a seasoned software engineer, I leverage my expertise to build scalable, professional systems that are both concise and actionable for stakeholders.\" (Score: 1.0)\n\nBy tracking the git history, you can now `git diff` your way through the evolution of your prompt, seeing exactly which words triggered the score increase. This is the difference between guessing and engineering.", "D": "# Build a Minimal LLM Evaluation Loop in Python: Systematic Experiments for ML Engineers\n\nIf you're an ML engineer tired of manual prompt testing and ready to automate your LLM experiments, this tutorial guides you through building a lean evaluation loop using the OpenRouter API. We'll focus on a greedy hill-climbing approach to iteratively improve outputs, while keeping the implementation simple and understandable in under 10 minutes. By the end, you'll have a script that not only optimizes artifacts but also incorporates parallel model queries to compare performance across models, enhancing efficiency without over-engineering.\n\n## What You Will Build\n\nThis tutorial results in a Python script that:\n1. Sets up API calls with OpenRouter.\n2. Defines a custom metric for scoring outputs.\n3. Runs a greedy hill-climbing loop, now with parallel queries to multiple models for better decision-making.\n4. Implements KEEP/DISCARD logic based on scores.\n5. Tracks costs, saves results to a TSV file, and versions improvements via git.\n6. Includes safeguards like error handling and stopping conditions to make it robust for real-world use.\n\nThis addition of parallel queries allows you to test variations across models in each iteration, helping you identify the most effective one quickly, which is a key step toward more reliable optimization.\n\n## What You Need\n\n- Python 3.10 or higher.\n- An OpenRouter API key (obtain one at openrouter.ai).\n- Install required libraries: `pip install httpx python-dotenv pandas` (pandas for TSV handling).\n- Git installed and configured for versioning.\n\n## Step 1: Setup API Key and Constants\n\