{"type": "stage2_complete", "rankings": [{"letter": "D", "display_letter": "A", "avg_position": 0.5, "votes": 4}, {"letter": "A", "display_letter": "E", "avg_position": 0.5, "votes": 4}, {"letter": "B", "display_letter": "B", "avg_position": 2.75, "votes": 4}, {"letter": "C", "display_letter": "C", "avg_position": 3.0, "votes": 4}, {"letter": "E", "display_letter": "D", "avg_position": 3.25, "votes": 4}], "shuffle_map": {"E": "A", "B": "B", "C": "C", "A": "D", "D": "E"}, "votes": [{"model": "meta-llama/llama-4-maverick", "display_ranking": "E > A > C > B > D", "original_ranking": "A > D > C > B > E", "reasoning": "To evaluate these versions, I considered the provided criteria: Correctness, Completeness, Clarity, Code quality, and Depth. Here's a brief assessment of each version:\n\n- Version E: Demonstrates a comprehensive evaluation loop with adaptive temperature control, parallel model queries, and git versioning, making it strong in Completeness and Depth.\n- Version B: Introduces an advanced scoring mechanism and adaptive exploration, showing improvements in Depth and Code quality, but its complexity might affect Clarity.\n- Version C: Provides a clear, minimal implementation with a focus on greedy hill-climbing and git integration, balancing Clarity, Correctness, and Completeness effectively.\n- Version A: Offers a well-rounded implementation with parallel model queries, cost tracking, and git versioning, scoring high on Completeness and Code quality.\n- Version D: Lacks some features present in other versions, such as adaptive temperature control, making it less comprehensive compared to Version E.\n\nRanking the versions based on the criteria:\n\n1. **Version E**: Excels in Completeness and Depth with its adaptive features and parallel queries.\n2. **Version A**: Strong in Completeness and Code quality, with a good balance across the criteria.\n3. **Version C**: Stands out for its Clarity and minimal yet effective implementation.\n4. **Version B**: Shows Depth with its advanced scoring and exploration but may be less clear due to its complexity.\n5. **Version D**: While correct and clear, it lacks some advanced features, making it less complete."}, {"model": "anthropic/claude-3-5-haiku", "display_ranking": "E > A > B > C > D", "original_ranking": "A > D > B > C > E", "reasoning": "I'll evaluate each version based on the 5 criteria and provide reasoning:\n\nVersion E (BEST):\n- Correctness: Comprehensive, well-structured code with robust error handling \u2713\n- Completeness: Most feature-rich, includes adaptive temperature, parallel queries, cost tracking \u2713\u2713\n- Clarity: Excellent step-by-step explanation, clear code comments \u2713\n- Code Quality: Strong type safety, environment variable loading, error handling \u2713\n- Depth: Deep exploration of design choices, tradeoffs, and potential extensions \u2713\u2713\nStandout features: Most sophisticated implementation, most thorough explanation\n\nVersion A (STRONG):\n- Correctness: Very solid implementation with type hints and error handling\n- Completeness: Covers core requirements, good parallel model support\n- Clarity: Clear explanations, good inline documentation\n- Code Quality: Robust, with thoughtful error management\n- Depth: Good discussion of tradeoffs, but slightly less comprehensive than E\n\nVersion B (GOOD):\n- Correctness: Solid implementation with adaptive learning approach\n- Completeness: Introduces more complex optimization strategies\n- Clarity: Good explanations, but slightly more abstract\n- Code Quality: Good, but slightly more complex than necessary\n- Depth: Strong on theoretical foundations, weaker on practical implementation details\n\nVersion C (ADEQUATE):\n- Correctness: Functional implementation\n- Completeness: Covers basic requirements\n- Clarity: Clear but more concise\n- Code Quality: Functional but less robust error handling\n- Depth: Lighter on theoretical justifications\n\nVersion D (WEAKEST):\n- Correctness: Very similar to A, but less detailed\n- Completeness: Covers basic requirements, but fewer advanced features\n- Clarity: Explanation feels more generic, less specific\n- Code Quality: Functional but less nuanced\n- Depth: Shallowest exploration of design choices"}, {"model": "google/gemini-3.1-flash-lite-preview", "display_ranking": "A > E > D > C > B", "original_ranking": "D > A > E > C > B", "reasoning": "The versions were evaluated based on their adherence to the \"minimal but systematic\" prompt engineering workflow, code quality, and the effectiveness of their explanations.\n\n*   **Version A** is the most professional and comprehensive; it includes type hints, robust error handling, a TSV output for data analysis, and a clear explanation of why specific design choices were made.\n*   **Version E** provides a highly functional and advanced implementation, including adaptive temperature control and git automation, though it is slightly more complex than the \"minimal\" requirement.\n*   **Version D** is a solid, clean, and straightforward implementation of the core requirements, serving as a very reliable baseline for the target audience.\n*   **Version C** is good but slightly less polished in its error handling and lacks the multi-model comparison feature that makes the others stand out.\n*   **Version B** is the weakest due to its shift toward a class-based structure that obscures the \"minimal/lean\" design philosophy and complicates the simple loop logic."}, {"model": "x-ai/grok-3-mini-beta", "display_ranking": "A > E > B > D > C", "original_ranking": "D > A > B > E > C", "reasoning": "Below is my evaluation and ranking of the versions based on the specified criteria: Correctness, Completeness, Clarity, Code Quality, and Depth (each scored out of 20, for a total of 100 points). I'll provide a brief one-sentence reasoning for each version, focusing on its strengths and weaknesses relative to the criteria.\n\n- **Version A**: Scores 88/100 (Correctness: 18, Completeness: 18, Clarity: 17, Code Quality: 18, Depth: 17) \u2013 This version is strong overall, with excellent code quality through type hints and error handling, clear explanations, and good depth in justifying design choices, making it highly practical and extensible for the target audience.  \n- **Version E**: Scores 87/100 (Correctness: 18, Completeness: 18, Clarity: 17, Code Quality: 17, Depth: 17) \u2013 It builds on completeness with features like adaptive temperature and parallel queries, but its similarity to Version D introduces redundancy, slightly reducing code quality innovation.  \n- **Version B**: Scores 86/100 (Correctness: 17, Completeness: 19, Clarity: 16, Code Quality: 17, Depth: 17) \u2013 While it offers advanced depth through adaptive optimization and multi-model support, its complexity may overwhelm intermediate users, lowering clarity.  \n- **Version D**: Scores 84/100 (Correctness: 17, Completeness: 17, Clarity: 17, Code Quality: 17, Depth: 16) \u2013 This version is competent in completeness and clarity with parallel queries and Git integration, but it lacks the depth and refinements of Versions A or E, making it feel somewhat basic.  \n- **Version C**: Scores 82/100 (Correctness: 16, Completeness: 15, Clarity: 18, Code Quality: 16, Depth: 17) \u2013 It emphasizes clarity and depth in explanations, but its limited completeness (e.g., no parallel queries or robust cost tracking) and basic code quality make it less practical for full automation."}], "model_names": {"A": "meta-llama/llama-4-maverick", "B": "anthropic/claude-3-5-haiku", "C": "google/gemini-3.1-flash-lite-preview", "D": "x-ai/grok-3-mini-beta"}}
{"type": "stage3_complete", "winner": "D", "winner_model": "x-ai/grok-3-mini-beta", "council_score": 87, "sub_scores": {"CORRECTNESS": 18, "COMPLETENESS": 18, "CLARITY": 17, "CODE_QUALITY": 18, "DEPTH": 16}, "critique": "Proposal D effectively provides a clear and structured tutorial. It covers all essential elements, including API setup, scoring, and version control, while incorporating error handling and parallel model querying. The use of type hints improves code quality and readability. However, it could benefit from a deeper exploration of design choices and potential trade-offs in more complex scenarios. The tutorial is well-written for intermediate Python users, but slight adjustments in clarity could enhance the overall understanding of the concepts.", "chairman_full_response": "WINNER: D\nSCORE_CORRECTNESS: 18\nSCORE_COMPLETENESS: 18\nSCORE_CLARITY: 17\nSCORE_CODE_QUALITY: 18\nSCORE_DEPTH: 16\nCOUNCIL_SCORE: 87\n\nCRITIQUE:\nProposal D effectively provides a clear and structured tutorial. It covers all essential elements, including API setup, scoring, and version control, while incorporating error handling and parallel model querying. The use of type hints improves code quality and readability. However, it could benefit from a deeper exploration of design choices and potential trade-offs in more complex scenarios. The tutorial is well-written for intermediate Python users, but slight adjustments in clarity could enhance the overall understanding of the concepts.", "chairman_model": "openai/gpt-4o-mini", "model_names": {"A": "meta-llama/llama-4-maverick", "B": "anthropic/claude-3-5-haiku", "C": "google/gemini-3.1-flash-lite-preview", "D": "x-ai/grok-3-mini-beta"}}
{"type": "iteration_result", "iteration": 46, "status": "DISCARD", "council_score": 87, "winner": "D", "best_score": 96, "commit": "de0e250", "spent_usd": 0.822054, "timestamp": "2026-04-03T16:02:10.936373Z"}
