{"type": "stage2_complete", "rankings": [{"letter": "A", "display_letter": "D", "avg_position": 0.25, "votes": 4}, {"letter": "D", "display_letter": "E", "avg_position": 1.5, "votes": 4}, {"letter": "C", "display_letter": "A", "avg_position": 1.75, "votes": 4}, {"letter": "B", "display_letter": "C", "avg_position": 3.0, "votes": 4}, {"letter": "E", "display_letter": "B", "avg_position": 3.5, "votes": 4}], "shuffle_map": {"D": "A", "C": "B", "A": "C", "E": "D", "B": "E"}, "votes": [{"model": "meta-llama/llama-4-maverick", "display_ranking": "D > E > C > B > A", "original_ranking": "A > D > B > E > C", "reasoning": "To rank the versions from best to worst based on the evaluation criteria, we need to assess each version's correctness, completeness, clarity, code quality, and depth.\n\n## Step 1: Evaluate Version D\nVersion D provides a comprehensive tutorial that covers all essential steps, including API key setup, making LLM calls, defining a metric function, implementing a greedy hill-climbing loop, and saving results. It also includes parallel model queries and git versioning, making it strong in completeness. The code is well-structured, and explanations are clear.\n\n## Step 2: Evaluate Version C\nVersion C introduces an advanced metric design and robust LLM interaction layer with comprehensive error handling. It prioritizes systematic exploration and comprehensive metric assessment. However, it lacks a clear, step-by-step guide for beginners and focuses more on advanced features.\n\n## Step 3: Evaluate Version E\nVersion E offers a detailed, step-by-step tutorial that covers setting up API access, making LLM calls, evaluating outputs, and implementing a greedy hill-climbing loop. It emphasizes practical implementation and includes cost tracking and git versioning. The explanations are clear, and the code is well-structured.\n\n## Step 4: Evaluate Version B\nVersion B provides a solid foundation for building an evaluation loop, covering API setup, LLM calls, metric definition, and a greedy hill-climbing loop. It includes cost tracking and git versioning. While it is comprehensive, it lacks some details in explanations and code comments compared to other versions.\n\n## Step 5: Evaluate Version A\nVersion A introduces the concept of an \"Evaluation-as-Code\" loop and covers the basics of building an evaluation loop. It includes a greedy hill-climbing strategy and git versioning. However, it has fewer details on cost tracking and parallel model queries compared to other versions.\n\n## Step 6: Compare All Versions\n- Version D is comprehensive, clear, and includes parallel model queries and detailed explanations.\n- Version C is advanced but may be less clear for beginners due to its focus on sophisticated features.\n- Version E is detailed and practical, with a good balance of clarity and comprehensiveness.\n- Version B is solid but lacks some details in explanations.\n- Version A covers the basics but is less comprehensive in certain areas.\n\n## Step 7: Rank the Versions\nBased on the evaluation criteria, the ranking from best to worst is determined by considering correctness, completeness, clarity, code quality, and depth."}, {"model": "anthropic/claude-3-5-haiku", "display_ranking": "D > E > A > C > B", "original_ranking": "A > D > C > B > E", "reasoning": "Let's evaluate each version systematically:\n\nVersion D: Strong overall implementation with excellent depth, clear structure, comprehensive error handling, and a well-explained architectural approach. Particularly strong in explaining tradeoffs and providing clear context for ML engineers.\n\nVersion C: Very sophisticated metric design with advanced statistical scoring. More academically oriented, with robust type hints and dataclass configuration. Slightly over-engineered compared to the tutorial's goal of simplicity.\n\nVersion E: Solid, pragmatic implementation with good balance between technical depth and readability. Slightly more verbose explanations, but maintains a clear tutorial flow. Strong error handling and cost tracking.\n\nVersion A: Lean and focused implementation with excellent commentary on pitfalls. Most opinionated about design choices, with sharp insights into subprocess patterns and metric design. Slightly less polished in code structure.\n\nVersion B: Very similar to Version D, but less comprehensive in explanations. Feels more like a standard tutorial template with less unique insight. Solid but not exceptional.\n\nDetailed reasoning:\n- D: Comprehensive, clear, technically robust\n- E: Pragmatic, well-explained, good balance\n- A: Opinionated, insightful, slightly rougher implementation\n- C: Academically sophisticated, slightly over-engineered\n- B: Standard, least distinctive"}, {"model": "google/gemini-3.1-flash-lite-preview", "display_ranking": "A > D > E > B > C", "original_ranking": "C > A > D > E > B", "reasoning": "The evaluation focused on technical correctness, adherence to the OpenRouter API constraints, and the quality of the tutorial prose.\n\n*   **Version A** is the strongest because it provides a highly practical, \"engineer-focused\" explanation of the subprocess pattern, correctly uses the OpenRouter endpoint, includes a TSV export, and offers the most insightful section on why specific architectural choices (like the subprocess pattern) were made.\n*   **Version D** is excellent for its inclusion of async parallel queries, though its code structure is slightly less polished in terms of error handling compared to A.\n*   **Version E** is very clear and provides a good balance of prose and code, though it relies on synchronous `httpx` calls in a script that would benefit more from the async patterns suggested in the prompt's exploration directions.\n*   **Version B** is a solid, standard tutorial that hits all the requirements but lacks the depth and \"pro-tips\" found in the higher-ranked versions.\n*   **Version C** is ranked lowest because it introduces unnecessary complexity (Pandas, SciPy, dataclasses) that conflicts with the \"minimal\" and \"10-minute\" constraint for the target audience of ML engineers who want to avoid over-engineered frameworks.\n\nReasoning:\n- **Version A**: Best combination of technical depth, concise prose, and practical \"real-world\" engineering advice.\n- **Version D**: Strong implementation of parallel queries and good overall structure.\n- **Version E**: Very clear, well-explained, and follows all instructions, though synchronous code is less ideal for this use case.\n- **Version B**: Competent and correct, but lacks the extra value and depth of the top three.\n- **Version C**: Over-engineered with unnecessary dependencies like Pandas and SciPy, violating the \"minimal\" constraint."}, {"model": "x-ai/grok-3-mini-beta", "display_ranking": "D > A > E > C > B", "original_ranking": "A > C > D > B > E", "reasoning": "Below is my ranking of the versions from best to worst based on the evaluation criteria (Correctness, Completeness, Clarity, Code Quality, and Depth). I scored each version out of 100 points, focusing on how well they align with the tutorial's goals for ML engineers, such as syntactic validity, comprehensive coverage, ease of understanding, idiomatic code, and explanatory depth.\n\n- **Version D**: This version excels in completeness and depth by including parallel model queries, cost tracking, Git versioning, and thorough justifications of design choices, though it could improve code quality with more type hints; overall score: 92/100.\n- **Version A**: It demonstrates strong correctness and clarity with modular code, effective error handling, and practical explanations of pitfalls and tradeoffs, making it highly extensible; overall score: 88/100.\n- **Version E**: The tutorial is clear and complete, with good error handling and cost tracking, but lacks depth in exploring advanced strategies; overall score: 88/100.\n- **Version C**: It offers solid code quality and completeness with advanced metrics and configuration, but its abstract architectural focus reduces clarity for the target audience; overall score: 86/100.\n- **Version B**: While correct and straightforward, it falls short in depth and code quality due to limited justifications of design decisions and fewer extensions like parallelization; overall score: 83/100."}], "model_names": {"A": "meta-llama/llama-4-maverick", "B": "anthropic/claude-3-5-haiku", "C": "google/gemini-3.1-flash-lite-preview", "D": "x-ai/grok-3-mini-beta"}}
{"type": "stage3_complete", "winner": "A", "winner_model": "meta-llama/llama-4-maverick", "council_score": 96, "sub_scores": {"CORRECTNESS": 20, "COMPLETENESS": 20, "CLARITY": 18, "CODE_QUALITY": 20, "DEPTH": 18}, "critique": "Proposal A presents a well-structured tutorial that effectively guides the reader through building an LLM evaluation loop. The code is syntactically correct, complete, and includes essential error handling and secure API key management. Clarity is mostly maintained, though some inline explanations could enhance understanding for readers at varying skill levels. The depth is commendable as it justifies the design choices made while acknowledging tradeoffs. To improve further, consider adding more detailed explanations of the scoring metrics and potential pitfalls in LLM optimization.", "chairman_full_response": "WINNER: A\nSCORE_CORRECTNESS: 20\nSCORE_COMPLETENESS: 20\nSCORE_CLARITY: 18\nSCORE_CODE_QUALITY: 20\nSCORE_DEPTH: 18\nCOUNCIL_SCORE: 96\n\nCRITIQUE:\nProposal A presents a well-structured tutorial that effectively guides the reader through building an LLM evaluation loop. The code is syntactically correct, complete, and includes essential error handling and secure API key management. Clarity is mostly maintained, though some inline explanations could enhance understanding for readers at varying skill levels. The depth is commendable as it justifies the design choices made while acknowledging tradeoffs. To improve further, consider adding more detailed explanations of the scoring metrics and potential pitfalls in LLM optimization.", "chairman_model": "openai/gpt-4o-mini", "model_names": {"A": "meta-llama/llama-4-maverick", "B": "anthropic/claude-3-5-haiku", "C": "google/gemini-3.1-flash-lite-preview", "D": "x-ai/grok-3-mini-beta"}}
{"type": "iteration_result", "iteration": 38, "status": "KEEP", "council_score": 96, "winner": "A", "best_score": 96, "commit": "de0e250", "spent_usd": 0.533692, "timestamp": "2026-04-03T15:46:29.423873Z"}
