{"type": "stage2_complete", "rankings": [{"letter": "A", "display_letter": "D", "avg_position": 0.5, "votes": 4}, {"letter": "D", "display_letter": "E", "avg_position": 1.0, "votes": 4}, {"letter": "C", "display_letter": "B", "avg_position": 2.0, "votes": 4}, {"letter": "B", "display_letter": "C", "avg_position": 2.75, "votes": 4}, {"letter": "E", "display_letter": "A", "avg_position": 3.75, "votes": 4}], "shuffle_map": {"D": "A", "C": "B", "B": "C", "E": "D", "A": "E"}, "votes": [{"model": "meta-llama/llama-4-maverick", "display_ranking": "D > E > C > B > A", "original_ranking": "A > D > B > C > E", "reasoning": "To rank the versions provided, let's analyze each based on the given evaluation criteria: Correctness, Completeness, Clarity, Code Quality, and Depth.\n\n## Version D\nThis version stands out for its comprehensive coverage of the tutorial's objectives, including a clear \"what you will build\" section and a detailed implementation that covers all essential steps. It demonstrates high correctness, completeness, and clarity. The code is well-structured and includes type hints, enhancing code quality. The discussion on tradeoffs and common pitfalls adds depth.\n\n## Version E\nVersion E is notable for its emphasis on simplicity and providing a lean, understandable implementation. It covers all necessary steps and includes practical insights into model performance and cost tracking. The code is idiomatic and safe, with good error handling. The tutorial is clear and easy to follow, making it strong in clarity and code quality.\n\n## Version C\nThis version introduces an innovative approach with adaptive model selection, enhancing the depth of the tutorial. It covers essential steps and includes a novel strategy for model selection based on historical performance. However, the added complexity might affect clarity for some readers. The code is generally well-structured, but the adaptive mechanism's introduction might require additional explanation for some.\n\n## Version B\nVersion B is strong in clarity and provides a clear implementation of the evaluation loop. It introduces the \"Judge\" pattern and subprocess pattern, which are valuable for understanding the design decisions. The code is generally correct and well-structured. However, it could benefit from more depth in explaining certain design choices and tradeoffs.\n\n## Version A\nThis version provides a solid foundation for the evaluation loop, covering essential steps and implementing a greedy hill-climbing strategy. While it is mostly correct and complete, it lacks some depth in explaining the rationale behind certain design decisions and does not include as many enhancements or discussions on tradeoffs as other versions.\n\n## Ranking\n\nBased on the analysis:\n- **Version D** is strong across all criteria, with excellent completeness and clarity.\n- **Version E** is a close second, emphasizing simplicity and practicality.\n- **Version C** offers significant depth with its adaptive model selection but may be slightly less clear due to its complexity.\n- **Version B** is clear and provides valuable insights into the design patterns but could be deeper in some explanations.\n- **Version A** is a good foundation but lacks the depth and some of the enhancements seen in other versions."}, {"model": "anthropic/claude-3-5-haiku", "display_ranking": "D > E > C > B > A", "original_ranking": "A > D > B > C > E", "reasoning": "Here's my evaluation of each version:\n\nVersion D: Comprehensive, well-structured, with the most complete implementation. Offers robust error handling, adaptive model selection, and clear explanations of design choices. Strong depth and practical insights.\n\nVersion E: Very solid, similar to D but slightly less innovative. Good balance of technical depth and clarity, with slightly more concise explanations and a straightforward implementation.\n\nVersion C: Introduces an interesting adaptive model selection approach, but feels slightly more theoretical and less immediately practical. Good innovation, but slightly more complex than necessary.\n\nVersion B: Introduces the innovative \"Judge\" pattern with a focus on LLM-as-a-judge evaluation. Unique approach, but slightly less comprehensive in implementation details compared to D and E.\n\nVersion A: Basic implementation that covers the core requirements but lacks the depth and nuanced insights of later versions. Most straightforward but least innovative.\n\nDetailed scoring breakdown:\n- Correctness: D > E > C > B > A\n- Completeness: D > E > C > B > A\n- Clarity: D > E > B > C > A\n- Code Quality: D > E > B > C > A\n- Depth: D > C > E > B > A"}, {"model": "google/gemini-3.1-flash-lite-preview", "display_ranking": "B > E > D > A > C", "original_ranking": "C > D > A > E > B", "reasoning": "The evaluation of these tutorials centered on their ability to provide a clean, robust, and educational implementation of an LLM evaluation loop for ML engineers.\n\n*   **Version B** is the clear winner; it introduces the \"Judge\" pattern (LLM-as-a-judge), which is the industry-standard approach for the described task, and its code is the most idiomatic and production-ready.\n*   **Version E** provides a very strong, well-structured tutorial that includes helpful features like CSV logging and good error handling, though it uses a simplistic scoring metric compared to B.\n*   **Version D** is technically sound and comprehensive, but it imports a massive list of features (like budget constraints and git initialization) that slightly clutter the \"minimal\" nature of the tutorial.\n*   **Version A** is a baseline implementation that is correct and clear but lacks the depth and professional polish (such as robust error handling and structured logging) found in the higher-ranked versions.\n*   **Version C** attempts an \"adaptive learning\" approach that is overly complex for a 10-minute \"minimal\" tutorial, and it fails to provide a fully runnable implementation, leaving significant portions of the code as \"remains similar to previous version.\"\n\nReasoning:\n- **Version B**: Best technical approach (LLM-as-a-Judge) and cleanest code structure.\n- **Version E**: Excellent, practical, and highly readable with good error handling.\n- **Version D**: Very complete, though slightly more \"feature-heavy\" than a strict minimal tutorial.\n- **Version A**: Solid, standard implementation, but lacks the refinements of the top versions.\n- **Version C**: Over-engineered for the topic and fails to provide a complete, standalone script."}, {"model": "x-ai/grok-3-mini-beta", "display_ranking": "D > E > B > C > A", "original_ranking": "A > D > C > B > E", "reasoning": "Below is my ranking of the versions (A, B, C, D, and E) from best to worst based on the evaluation criteria: Correctness, Completeness, Clarity, Code Quality, and Depth. I judged each version holistically, assigning approximate scores out of 100 (e.g., Version D scored around 91 due to its strong balance across all criteria, while Version A scored about 80 for its basic but incomplete execution). Here's a brief one-sentence reasoning for each:\n\n- **Version D**: This version excels with high correctness, completeness (including cost tracking and Git integration), clear explanations, idiomatic code with error handling, and strong depth in justifying decisions like parallel queries, making it the most comprehensive and practical.  \n- **Version E**: It offers good correctness, completeness with TSV logging and budget monitoring, solid clarity for intermediate users, high code quality with type hints and error handling, but slightly less depth than D in explaining tradeoffs.  \n- **Version B**: The innovative LLM-as-judge adds depth and completeness in evaluation logic, but potential correctness issues (e.g., circular feedback risks) and moderate clarity reduce its overall reliability.  \n- **Version C**: It provides excellent depth in adaptive learning and high code quality with dataclasses, but incomplete code snippets and lower clarity make it less complete and practical for immediate use.  \n- **Version A**: While correct and clear in basic implementation, it falls short in completeness (e.g., no budget constraint) and depth (limited justification of design choices), making it the least robust."}], "model_names": {"A": "meta-llama/llama-4-maverick", "B": "anthropic/claude-3-5-haiku", "C": "google/gemini-3.1-flash-lite-preview", "D": "x-ai/grok-3-mini-beta"}}
{"type": "stage3_complete", "winner": "A", "winner_model": "meta-llama/llama-4-maverick", "council_score": 94, "sub_scores": {"CORRECTNESS": 20, "COMPLETENESS": 20, "CLARITY": 18, "CODE_QUALITY": 18, "DEPTH": 18}, "critique": "Proposal A provides a comprehensive and well-structured tutorial that guides users through building a minimal LLM evaluation loop. The code is syntactically valid and logically correct, ensuring it can run without modifications. It covers all essential steps, including API setup, metric definition, and result saving. While clarity is mostly strong, some sections could benefit from additional inline comments for even better readability. Overall, the depth of explanation regarding design choices and trade-offs is commendable, making it a robust choice for ML engineers looking to enhance their experimentation processes. Future iterations could explore alternative optimization strategies or include a section on common pitfalls to further enrich the content.", "chairman_full_response": "WINNER: A\nSCORE_CORRECTNESS: 20\nSCORE_COMPLETENESS: 20\nSCORE_CLARITY: 18\nSCORE_CODE_QUALITY: 18\nSCORE_DEPTH: 18\nCOUNCIL_SCORE: 94\n\nCRITIQUE:\nProposal A provides a comprehensive and well-structured tutorial that guides users through building a minimal LLM evaluation loop. The code is syntactically valid and logically correct, ensuring it can run without modifications. It covers all essential steps, including API setup, metric definition, and result saving. While clarity is mostly strong, some sections could benefit from additional inline comments for even better readability. Overall, the depth of explanation regarding design choices and trade-offs is commendable, making it a robust choice for ML engineers looking to enhance their experimentation processes. Future iterations could explore alternative optimization strategies or include a section on common pitfalls to further enrich the content.", "chairman_model": "openai/gpt-4o-mini", "model_names": {"A": "meta-llama/llama-4-maverick", "B": "anthropic/claude-3-5-haiku", "C": "google/gemini-3.1-flash-lite-preview", "D": "x-ai/grok-3-mini-beta"}}
{"type": "iteration_result", "iteration": 40, "status": "DISCARD", "council_score": 94, "winner": "A", "best_score": 96, "commit": "de0e250", "spent_usd": 0.607418, "timestamp": "2026-04-03T15:50:54.808394Z"}
