{"type": "stage1_complete", "proposals": {"A": "# Build a Minimal LLM Evaluation Loop in Python: Systematic Experiments for ML Engineers\n\nIf you want to stop manually testing prompts and start running systematic experiments, an evaluation loop is the right tool. This tutorial shows you how to build one using the OpenRouter API, covering essential steps from API key setup to saving results.\n\n## What You Will Build\n\nBy the end of this tutorial, you will have a working Python script that:\n1. Makes LLM API calls using OpenRouter\n2. Scores the output using a custom metric\n3. Implements a greedy hill-climbing loop to improve the output\n4. Saves the best artifact to a file\n5. Tracks costs and iterations\n6. Versions improvements using git\n\n## What You Need\n\n- Python 3.10+\n- An OpenRouter API key (sign up at openrouter.ai)\n- `httpx` installed: `pip install httpx`\n- `python-dotenv` installed: `pip install python-dotenv`\n- Git installed and configured\n\n## Step 1: Setup API Key and Constants\n\nFirst, create a `.env` file in your project root with your OpenRouter API key:\n```plaintext\nOPENROUTER_API_KEY=sk-or-your-key-here\n```\n\n```python\nimport os\nimport httpx\nfrom dotenv import load_dotenv\nfrom typing import Optional\n\nload_dotenv()  # Load environment variables from .env\n\nAPI_KEY = os.getenv(\"OPENROUTER_API_KEY\")\nAPI_URL = \"https://openrouter.ai/api/v1/chat/completions\"\nMODEL = \"openai/gpt-4o-mini\"\nMAX_ITERATIONS = 20\nCOST_PER_TOKEN = 0.000002  # Example cost, check OpenRouter pricing\n\ndef call_llm(prompt: str, timeout: float = 10.0) -> Optional[str]:\n    \"\"\"\n    Makes a call to the LLM API with the given prompt.\n    \n    Args:\n    - prompt: The input prompt for the LLM.\n    - timeout: The timeout for the API call in seconds.\n    \n    Returns:\n    - The LLM response content if successful, None otherwise.\n    \"\"\"\n    try:\n        response = httpx.post(\n            API_URL,\n            headers={\"Authorization\": f\"Bearer {API_KEY}\"},\n            json={\n                \"model\": MODEL,\n                \"messages\": [{\"role\": \"user\", \"content\": prompt}]\n            },\n            timeout=timeout\n        )\n        response.raise_for_status()  # Raise an exception for bad status codes\n        data = response.json()\n        return data[\"choices\"][0][\"message\"][\"content\"]\n    except httpx.RequestError as e:\n        print(f\"API request failed: {e}\")\n        return None\n```\n\n## Step 2: Define a Metric Function\n\nYour metric function scores the LLM output. Higher is better. Here is a simple example that scores based on length and coherence:\n\n```python\ndef score(text: str) -> float:\n    \"\"\"\n    Scores the given text based on length and coherence.\n    \n    Args:\n    - text: The text to be scored.\n    \n    Returns:\n    - A score between 0 and 1, where higher is better.\n    \"\"\"\n    # Calculate the number of words in the output\n    words = len(text.split())\n    # Normalize length score to be between 0 and 1\n    length_score = min(words / 200, 1.0)\n    # Simple coherence check: higher lexical diversity is better\n    coherence_score = len(set(text.split())) / words if words > 0 else 0\n    # Weighted average of length and coherence scores\n    return 0.5 * length_score + 0.5 * coherence_score\n```\n\n## Step 3: Implement the Evaluation Loop with Cost Tracking and Git Versioning\n\n```python\nimport json\nimport subprocess\n\ndef main():\n    best_score = 0.0\n    artifact = open(\"artifact.txt\").read().strip()\n    total_cost = 0.0\n    results = []\n\n    # Initialize git repository if not already done\n    try:\n        subprocess.run([\"git\", \"rev-parse\"], check=True, capture_output=True)\n    except subprocess.CalledProcessError:\n        subprocess.run([\"git\", \"init\"], check=True)\n        subprocess.run([\"git\", \"add\", \"artifact.txt\"], check=True)\n        subprocess.run([\"git\", \"commit\", \"-m\", \"Initial artifact\"], check=True)\n\n    for i in range(MAX_ITERATIONS):\n        prompt = f\"Improve this text:\\n\\n{artifact}\"\n        candidate = call_llm(prompt)\n        \n        if candidate is None:  # Skip iteration if API call failed\n            continue\n        \n        new_score = score(candidate)\n        total_tokens = len(prompt) + len(candidate)\n        total_cost += COST_PER_TOKEN * total_tokens  # Simplified cost calculation\n        \n        if new_score > best_score:\n            best_score = new_score\n            artifact = candidate.strip()\n            with open(\"artifact.txt\", \"w\") as f:\n                f.write(artifact)\n            # Commit changes to git\n            subprocess.run([\"git\", \"add\", \"artifact.txt\"], check=True)\n            subprocess.run([\"git\", \"commit\", \"-m\", f\"Iter {i}: Improved artifact\"], check=True)\n            print(f\"Iter {i}: KEEP  score={new_score:.2f}\")\n            results.append({\"iteration\": i, \"score\": new_score, \"action\": \"KEEP\", \"cost\": total_cost})\n        else:\n            print(f\"Iter {i}: DISCARD  score={new_score:.2f}  best={best_score:.2f}\")\n            results.append({\"iteration\": i, \"score\": new_score, \"action\": \"DISCARD\", \"cost\": total_cost})\n\n    # Save results to a JSON file for later analysis\n    with open(\"results.json\", \"w\") as f:\n        json.dump(results, f, indent=2)\n\n    # Save final artifact and results to a timestamped file\n    import datetime\n    timestamp = datetime.datetime.now().strftime(\"%Y%m%d-%H%M%S\")\n    with open(f\"artifact_{timestamp}.txt\", \"w\") as f:\n        f.write(artifact)\n    with open(f\"results_{timestamp}.json\", \"w\") as f:\n        json.dump(results, f, indent=2)\n\nif __name__ == \"__main__\":\n    main()\n```\n\n## Step 4: Run Your Evaluation Loop\n\n```bash\npython loop.py\n```\n\nYou should see output like:\n\n```\nIter 0: KEEP  score=0.85\nIter 1: DISCARD  score=0.81  best=0.85\nIter 2: KEEP  score=0.91\nIter 3: DISCARD  score=0.88  best=0.91\n```\n\nThe artifact file is updated and committed to git whenever a better version is found, and results are saved to `results.json`.\n\n## Why Greedy Hill-Climbing?\n\nGreedy hill-climbing is simple and effective for many optimization tasks. It always moves towards better solutions, making it suitable for improving LLM outputs. However, it may get stuck in local optima. Consider adding randomness or more sophisticated optimization techniques for complex tasks.\n\n## Advanced Optimization Techniques\n\nFor tasks that require more than simple hill-climbing, consider techniques like simulated annealing or genetic algorithms. These methods allow for broader exploration of the solution space and can potentially yield better results.\n\n## Tradeoffs and Limitations\n\nWhile greedy hill-climbing is straightforward to implement, it lacks the ability to explore the solution space broadly. For tasks requiring more exploration, consider techniques like simulated annealing or genetic algorithms. Additionally, be mindful of the cost implications of repeated LLM queries.\n\n## Common Pitfalls\n\n1. **Metric Gaming**: Ensure your metric accurately reflects the desired outcome. A poorly designed metric can lead to suboptimal or misleading results.\n2. **Circular Feedback**: Be cautious when using LLM outputs to evaluate other LLM outputs. This can create feedback loops that degrade performance over time.\n3. **Runaway Costs**: Always track costs and consider implementing a budget constraint to prevent unexpected expenses.\n\n## Worked Example\n\nLet's say you start with a simple artifact: \"The quick brown fox jumps over the lazy dog.\" After running the evaluation loop, the artifact might improve to: \"The quick brown fox jumps over the lazy dog, demonstrating a classic example of a pangram that uses all the letters of the alphabet efficiently.\" The score improves from 0.4 to 0.8 as the output becomes more coherent and contextually relevant.\n\n## What's Next\n\nThis basic loop works, but you can enhance it further:\n- Query multiple models in parallel to compare their performance\n- Implement more sophisticated optimization strategies like simulated annealing\n- Add more comprehensive error handling and logging mechanisms\n\nBy following this tutorial, you've built a systematic evaluation loop for LLM experiments that not only optimizes your prompts but also versions your improvements using git. This foundation allows you to scale your experiments, track progress, and optimize your prompts effectively.", "B": "# Build a Minimal LLM Evaluation Loop in Python: Systematic Experiments for ML Engineers\n\nIn the rapidly evolving world of AI development, moving from manual prompt testing to systematic experimentation is crucial. This tutorial introduces a powerful yet minimal approach to creating an LLM evaluation loop that helps ML engineers transform artisanal prompt crafting into a structured, repeatable process.\n\n## Conceptual Architecture: The Optimization Flywheel\n\nBefore diving into code, let's understand the core architecture. Our evaluation loop is a feedback mechanism that:\n- Generates candidate solutions\n- Objectively scores each candidate\n- Selectively improves the best performing artifacts\n- Tracks computational and financial costs\n- Maintains a versioned history of improvements\n\nThis \"optimization flywheel\" turns subjective prompt engineering into a quantitative, iterative process.\n\n## Prerequisites\n\n- Python 3.10+\n- OpenRouter API account\n- Libraries: `httpx`, `python-dotenv`, `numpy`\n- Git for version tracking\n\n## Implementation Strategy\n\nOur implementation will focus on five critical components:\n1. Secure API interaction\n2. Objective scoring mechanism\n3. Iterative improvement loop\n4. Cost and performance tracking\n5. Automated versioning\n\n```python\nimport os\nimport httpx\nimport numpy as np\nfrom typing import List, Dict\nfrom dotenv import load_dotenv\nimport subprocess\nimport json\n\nload_dotenv()\n\nclass LLMEvaluationLoop:\n    def __init__(\n        self, \n        api_key: str, \n        model: str = \"openai/gpt-4o-mini\",\n        max_iterations: int = 25\n    ):\n        self.api_key = api_key\n        self.model = model\n        self.max_iterations = max_iterations\n        self.api_url = \"https://openrouter.ai/api/v1/chat/completions\"\n\n    def call_llm(self, prompt: str, temperature: float = 0.7) -> str:\n        try:\n            response = httpx.post(\n                self.api_url,\n                headers={\"Authorization\": f\"Bearer {self.api_key}\"},\n                json={\n                    \"model\": self.model,\n                    \"messages\": [{\"role\": \"user\", \"content\": prompt}],\n                    \"temperature\": temperature\n                },\n                timeout=15.0\n            )\n            response.raise_for_status()\n            return response.json()[\"choices\"][0][\"message\"][\"content\"]\n        except httpx.RequestError as e:\n            print(f\"API Error: {e}\")\n            return \"\"\n\n    def advanced_score(self, text: str) -> float:\n        \"\"\"\n        Multi-dimensional scoring using statistical techniques\n        \n        Scoring dimensions:\n        - Lexical diversity\n        - Semantic coherence\n        - Information density\n        \"\"\"\n        words = text.split()\n        word_count = len(words)\n        unique_words = len(set(words))\n        \n        lexical_diversity = unique_words / word_count if word_count > 0 else 0\n        length_normalization = np.tanh(word_count / 100)\n        complexity_bonus = np.log(unique_words + 1) / np.log(word_count + 1)\n        \n        return 0.4 * lexical_diversity + 0.3 * length_normalization + 0.3 * complexity_bonus\n\n    def run_evaluation(self, initial_artifact: str) -> Dict:\n        best_artifact = initial_artifact\n        best_score = self.advanced_score(best_artifact)\n        total_cost = 0\n        results = []\n\n        self._initialize_git_repo()\n\n        for iteration in range(self.max_iterations):\n            improvement_prompt = f\"Improve this text, maintaining its core meaning but enhancing clarity and depth:\\n\\n{best_artifact}\"\n            candidate = self.call_llm(improvement_prompt)\n            \n            if not candidate:\n                continue\n\n            candidate_score = self.advanced_score(candidate)\n            \n            if candidate_score > best_score:\n                best_artifact = candidate\n                best_score = candidate_score\n                self._save_and_commit_artifact(best_artifact, iteration)\n                \n                results.append({\n                    \"iteration\": iteration,\n                    \"score\": best_score,\n                    \"action\": \"IMPROVE\",\n                    \"text_length\": len(best_artifact)\n                })\n            else:\n                results.append({\n                    \"iteration\": iteration,\n                    \"score\": candidate_score,\n                    \"action\": \"MAINTAIN\",\n                    \"text_length\": len(candidate)\n                })\n\n        self._save_results(results)\n        return {\"best_artifact\": best_artifact, \"best_score\": best_score}\n\n    def _initialize_git_repo(self):\n        try:\n            subprocess.run([\"git\", \"rev-parse\"], check=True, capture_output=True)\n        except subprocess.CalledProcessError:\n            subprocess.run([\"git\", \"init\"], check=True)\n\n    def _save_and_commit_artifact(self, artifact: str, iteration: int):\n        with open(\"improved_artifact.txt\", \"w\") as f:\n            f.write(artifact)\n        subprocess.run([\"git\", \"add\", \"improved_artifact.txt\"], check=True)\n        subprocess.run([\"git\", \"commit\", \"-m\", f\"Iteration {iteration}: Improved artifact\"], check=True)\n\n    def _save_results(self, results: List[Dict]):\n        with open(\"evaluation_results.json\", \"w\") as f:\n            json.dump(results, f, indent=2)\n\ndef main():\n    api_key = os.getenv(\"OPENROUTER_API_KEY\")\n    initial_text = \"The quick brown fox jumps over the lazy dog.\"\n    \n    evaluator = LLMEvaluationLoop(api_key)\n    result = evaluator.run_evaluation(initial_text)\n    \n    print(f\"Best Artifact Score: {result['best_score']}\")\n    print(f\"Best Artifact: {result['best_artifact']}\")\n\nif __name__ == \"__main__\":\n    main()\n```\n\n## Advanced Considerations\n\n### Optimization Techniques\n- Uses a multi-dimensional scoring approach\n- Incorporates statistical techniques like normalization\n- Provides temperature control for LLM creativity\n\n### Cost and Performance Management\n- Tracks iterations and performance\n- Saves detailed evaluation results\n- Git-based versioning of improvements\n\n### Potential Extensions\n- Implement parallel model comparisons\n- Add more sophisticated scoring algorithms\n- Create visualization tools for evaluation metrics\n\n## Conclusion\n\nThis tutorial demonstrates a principled approach to systematic LLM prompt optimization. By transforming prompt engineering from an art to a science, developers can systematically improve their AI interactions.", "C": "# Build a Minimal LLM Evaluation Loop: From Artisanal Prompts to Systematic Optimization\n\nManual prompt engineering is a bottleneck. If you are still pasting outputs into a spreadsheet, you are losing time and consistency. This tutorial guides you through building a \"Hill-Climbing\" evaluation loop in Python. We will build a system that automatically iterates on a prompt, measures the output quality, and saves only the improvements.\n\n## What You Will Build\nYou will create an automated pipeline that:\n1.  **Iterates:** Uses an LLM to refine a target artifact.\n2.  **Evaluates:** Scores the output using a deterministic metric function.\n3.  **Optimizes:** Keeps only the versions that improve your score (Greedy Hill-Climbing).\n4.  **Versions:** Uses Git to track the evolution of your prompt/artifact.\n5.  **Observes:** Logs costs and metrics to a TSV file for analysis.\n\n## Prerequisites\n- Python 3.10+, `httpx`, and `python-dotenv`.\n- An OpenRouter API key.\n- A local Git repository initialized in your project folder.\n\n## The Implementation\n\nWe use `httpx` for asynchronous-ready HTTP requests and `python-dotenv` for security.\n\n```python\nimport os\nimport httpx\nimport json\nimport subprocess\nfrom typing import Final\nfrom dotenv import load_dotenv\n\n# Load configuration\nload_dotenv()\nAPI_KEY: Final = os.getenv(\"OPENROUTER_API_KEY\")\nAPI_URL: Final = \"https://openrouter.ai/api/v1/chat/completions\"\nMODEL: Final = \"openai/gpt-4o-mini\"\nLOG_FILE: Final = \"eval_results.tsv\"\n\ndef call_llm(prompt: str) -> str:\n    \"\"\"Sends a prompt to the model with basic error handling and timeout.\"\"\"\n    try:\n        with httpx.Client(timeout=30.0) as client:\n            response = client.post(\n                API_URL,\n                headers={\"Authorization\": f\"Bearer {API_KEY}\", \"HTTP-Referer\": \"https://localhost\"},\n                json={\"model\": MODEL, \"messages\": [{\"role\": \"user\", \"content\": prompt}]}\n            )\n            response.raise_for_status()\n            return response.json()[\"choices\"][0][\"message\"][\"content\"]\n    except Exception as e:\n        print(f\"API Error: {e}\")\n        return \"\"\n\ndef score_artifact(text: str) -> float:\n    \"\"\"\n    Example Metric: A simple heuristic for clarity and length.\n    In production, replace this with a model-based judge or regex.\n    \"\"\"\n    words = text.split()\n    if not words: return 0.0\n    # Score based on length (aiming for ~100 words) and vocabulary richness\n    length_penalty = abs(100 - len(words)) / 100\n    diversity = len(set(words)) / len(words)\n    return diversity - (length_penalty * 0.2)\n\ndef run_loop(initial_prompt: str, iterations: int = 10):\n    current_best = initial_prompt\n    best_score = score_artifact(current_best)\n    \n    with open(LOG_FILE, \"w\") as f:\n        f.write(\"iteration\\tscore\\tstatus\\n\")\n\n    for i in range(iterations):\n        print(f\"Running iteration {i+1}...\")\n        improvement_prompt = f\"Refine the following text to be more professional and clear:\\n\\n{current_best}\"\n        candidate = call_llm(improvement_prompt)\n        \n        if not candidate: continue\n        \n        new_score = score_artifact(candidate)\n        \n        if new_score > best_score:\n            best_score = new_score\n            current_best = candidate\n            with open(\"artifact.txt\", \"w\") as f: f.write(current_best)\n            subprocess.run([\"git\", \"add\", \"artifact.txt\"], check=True)\n            subprocess.run([\"git\", \"commit\", \"-m\", f\"Improvement: {i}\"], check=True)\n            status = \"KEEP\"\n        else:\n            status = \"DISCARD\"\n        \n        with open(LOG_FILE, \"a\") as f:\n            f.write(f\"{i}\\t{new_score:.4f}\\t{status}\\n\")\n        print(f\"Result: {status} (Score: {new_score:.4f})\")\n\nif __name__ == \"__main__\":\n    run_loop(\"Write a short intro about Python.\")\n```\n\n## Why Greedy Hill-Climbing?\nThis algorithm is the \"Hello World\" of optimization. It starts at a point, looks at the immediate neighborhood (the next LLM generation), and moves to the better solution. Its primary benefit is **monotonic improvement**\u2014the state of your artifact never gets worse. However, it is prone to local optima (getting stuck in a \"decent\" version because it cannot conceive of a radical, better transformation).\n\n## Common Pitfalls\n1.  **Metric Gaming**: If your metric is too simple (e.g., word count), the model will learn to pad the text with nonsense to inflate the score. Ensure your metric captures \"meaning\" or \"intent.\"\n2.  **The \"Drift\" Problem**: Without a \"Gold Standard\" or fixed inputs, the content might drift away from the original goal. Use a fixed evaluation dataset (a list of inputs) rather than just refining the same text.\n3.  **Cost Blindness**: Even cheap models add up. Always log your token usage.\n\n## Toward a Robust Pipeline\nThe script above is a starting point. To move toward professional-grade evaluation:\n- **Use a Judge Model**: Instead of a hardcoded `score_artifact` function, use a stronger model (e.g., Claude 3.5 Sonnet) to grade the candidate based on a rubric.\n- **Parallelize**: Use `asyncio` to run multiple perturbations of the prompt simultaneously to explore the solution space faster.\n- **Git Integration**: Using Git is not just for backup; it allows you to `git diff` your prompts to see exactly what syntactic changes led to better scores, effectively \"debugging\" your prompt engineering process.\n\nBy moving from manual \"poke and hope\" to this automated loop, you treat your prompts as code. You now have a history of changes, a data-backed metric, and a systematic way to quantify progress.", "D": "# Build a Minimal LLM Evaluation Loop in Python: Systematic Experiments for ML Engineers\n\nIf you're an ML engineer tired of manual prompt tweaking and ready to automate experiments, this tutorial guides you through creating a simple evaluation loop using the OpenRouter API. This approach shifts from ad-hoc testing to a repeatable process, helping you optimize LLM outputs efficiently while maintaining a lean implementation.\n\n## What You Will Build\n\nBy the end of this tutorial, you'll have a Python script that automates an evaluation loop for LLMs. It will make API calls, score outputs with a custom metric, use greedy hill-climbing to select improvements, track costs, save results to a file, and version changes with Git. This setup ensures you can run experiments systematically without overcomplicating the code.\n\n## What You Need\n\n- Python 3.10 or higher\n- An OpenRouter API key (obtain one at o