{"type": "stage1_complete", "proposals": {"A": "# Build a Minimal LLM Evaluation Loop in Python: Systematic Experiments for ML Engineers\n\nIf you want to stop manually testing prompts and start running systematic experiments, an evaluation loop is the right tool. This tutorial shows you how to build one using the OpenRouter API, covering essential steps from API key setup to saving results.\n\n## What You Will Build\n\nBy the end of this tutorial, you will have a working Python script that:\n1. Makes LLM API calls using OpenRouter\n2. Scores the output using a custom metric\n3. Implements a greedy hill-climbing loop to improve the output\n4. Saves the best artifact to a file\n5. Tracks costs and iterations\n6. Versions improvements using git\n7. Supports parallel model queries to compare performance\n\n## What You Need\n\n- Python 3.10+\n- An OpenRouter API key (sign up at openrouter.ai)\n- `httpx` installed: `pip install httpx`\n- `python-dotenv` installed: `pip install python-dotenv`\n- `asyncio` and `concurrent.futures` for parallel queries\n- Git installed and configured\n\n## Step 1: Setup API Key and Constants\n\nFirst, create a `.env` file in your project root with your OpenRouter API key:\n```plaintext\nOPENROUTER_API_KEY=sk-or-your-key-here\n```\n\n```python\nimport os\nimport httpx\nimport asyncio\nfrom dotenv import load_dotenv\nfrom concurrent.futures import ThreadPoolExecutor\n\nload_dotenv()  # Load environment variables from .env\n\nAPI_KEY = os.getenv(\"OPENROUTER_API_KEY\")\nAPI_URL = \"https://openrouter.ai/api/v1/chat/completions\"\nMODELS = [\"openai/gpt-4o-mini\", \"meta-llama/llama-3.1-8b-instruct\"]\nMAX_ITERATIONS = 20\nCOST_PER_TOKEN = 0.000002  # Example cost, check OpenRouter pricing\n\nasync def call_llm(model: str, prompt: str) -> str:\n    try:\n        async with httpx.AsyncClient() as client:\n            response = await client.post(\n                API_URL,\n                headers={\"Authorization\": f\"Bearer {API_KEY}\"},\n                json={\n                    \"model\": model,\n                    \"messages\": [{\"role\": \"user\", \"content\": prompt}]\n                },\n                timeout=10.0\n            )\n            response.raise_for_status()\n            data = response.json()\n            return data[\"choices\"][0][\"message\"][\"content\"]\n    except httpx.RequestError as e:\n        print(f\"API request failed: {e}\")\n        return \"\"\n```\n\n## Step 2: Define a Metric Function\n\nYour metric function scores the LLM output. Higher is better. Here is a simple example that scores based on length and coherence:\n\n```python\ndef score(text: str) -> float:\n    words = len(text.split())\n    length_score = min(words / 200, 1.0)\n    coherence_score = len(set(text.split())) / words if words > 0 else 0\n    return 0.5 * length_score + 0.5 * coherence_score\n```\n\n## Step 3: Implement the Evaluation Loop with Parallel Model Queries\n\n```python\nimport json\nimport subprocess\n\nasync def main():\n    best_score = 0.0\n    artifact = open(\"artifact.txt\").read().strip()\n    total_cost = 0.0\n    results = []\n\n    try:\n        subprocess.run([\"git\", \"rev-parse\"], check=True, capture_output=True)\n    except subprocess.CalledProcessError:\n        subprocess.run([\"git\", \"init\"], check=True)\n        subprocess.run([\"git\", \"add\", \"artifact.txt\"], check=True)\n        subprocess.run([\"git\", \"commit\", \"-m\", \"Initial artifact\"], check=True)\n\n    for i in range(MAX_ITERATIONS):\n        prompt = f\"Improve this text:\\n\\n{artifact}\"\n        \n        # Query models in parallel\n        tasks = [call_llm(model, prompt) for model in MODELS]\n        candidates = await asyncio.gather(*tasks)\n        \n        for model, candidate in zip(MODELS, candidates):\n            if not candidate:  \n                continue\n            \n            new_score = score(candidate)\n            total_cost += COST_PER_TOKEN * (len(prompt) + len(candidate))  \n            \n            if new_score > best_score:\n                best_score = new_score\n                artifact = candidate.strip()\n                with open(\"artifact.txt\", \"w\") as f:\n                    f.write(artifact)\n                subprocess.run([\"git\", \"add\", \"artifact.txt\"], check=True)\n                subprocess.run([\"git\", \"commit\", \"-m\", f\"Iter {i}: Improved artifact\"], check=True)\n                print(f\"Iter {i}: KEEP  score={new_score:.2f}  model={model}\")\n                results.append({\"iteration\": i, \"score\": new_score, \"action\": \"KEEP\", \"model\": model, \"cost\": total_cost})\n            else:\n                print(f\"Iter {i}: DISCARD  score={new_score:.2f}  best={best_score:.2f}  model={model}\")\n                results.append({\"iteration\": i, \"score\": new_score, \"action\": \"DISCARD\", \"model\": model, \"cost\": total_cost})\n\n    with open(\"results.json\", \"w\") as f:\n        json.dump(results, f, indent=2)\n\nif __name__ == \"__main__\":\n    asyncio.run(main())\n```\n\n## Step 4: Run Your Evaluation Loop\n\n```bash\npython loop.py\n```\n\n## Why Greedy Hill-Climbing with Parallel Model Queries?\n\nGreedy hill-climbing is simple and effective, while querying multiple models in parallel allows for direct comparison of their performance. This approach helps in selecting the best model for your specific task.\n\n## Tradeoffs and Limitations\n\nWhile this approach is straightforward, it may get stuck in local optima. Consider more sophisticated optimization techniques for complex tasks. Additionally, be mindful of the increased cost due to parallel queries.\n\n## Common Pitfalls\n\n1. **Metric Gaming**: Ensure your metric accurately reflects the desired outcome.\n2. **Circular Feedback**: Be cautious when using LLM outputs to evaluate other LLM outputs.\n3. **Runaway Costs**: Always track costs and consider implementing a budget constraint.\n\n## Worked Example\n\nStarting with \"The quick brown fox jumps over the lazy dog,\" the artifact might improve to \"The quick brown fox jumps over the lazy dog, demonstrating a classic pangram.\" The score improves from 0.4 to 0.8 as the output becomes more coherent.\n\n## What's Next\n\nEnhance the loop further by implementing more sophisticated optimization strategies or adding comprehensive error handling and logging mechanisms. Consider exploring other models and comparing their performance in your specific use case.\n\nBy following this tutorial, you've built a systematic evaluation loop that optimizes prompts, versions improvements, and compares model performance, providing a solid foundation for scaling your LLM experiments.", "B": "# Build a Minimal LLM Evaluation Loop in Python: Systematic Experiments for ML Engineers\n\nModern ML development demands more than manual prompt tweaking. This tutorial introduces a systematic approach to LLM experimentation using a flexible, extensible evaluation loop that transforms artisanal prompt engineering into a repeatable, data-driven process.\n\n## What You Will Build\n\nA Python script that:\n1. Queries LLMs through OpenRouter\n2. Implements a dynamic optimization strategy\n3. Tracks experiment metadata and performance\n4. Supports multiple optimization techniques\n5. Provides extensible framework for advanced experimentation\n\n## Prerequisites\n\n- Python 3.10+\n- OpenRouter API key\n- `httpx`, `python-dotenv`, `typing_extensions`\n- Basic understanding of async programming\n\n## Core Components: Modular Optimization Framework\n\n```python\nfrom typing import Protocol, List, Dict, Any\nfrom dataclasses import dataclass, asdict\nimport asyncio\nimport httpx\nimport json\nimport os\nfrom dotenv import load_dotenv\n\nload_dotenv()\n\nclass Optimizer(Protocol):\n    async def optimize(self, current: str) -> str:\n        \"\"\"Strategy for generating improved artifact\"\"\"\n\nclass MetricCalculator(Protocol):\n    def score(self, text: str) -> float:\n        \"\"\"Evaluate artifact quality\"\"\"\n\n@dataclass\nclass ExperimentResult:\n    iteration: int\n    initial_score: float\n    final_score: float\n    strategy: str\n    artifact: str\n    metadata: Dict[str, Any]\n\nclass LLMExperimentLoop:\n    def __init__(\n        self, \n        api_key: str, \n        metric_calculator: MetricCalculator,\n        optimizers: List[Optimizer],\n        max_iterations: int = 20\n    ):\n        self.api_key = api_key\n        self.metric = metric_calculator\n        self.optimizers = optimizers\n        self.max_iterations = max_iterations\n\n    async def run_experiment(self, initial_artifact: str) -> ExperimentResult:\n        current_artifact = initial_artifact\n        initial_score = self.metric.score(current_artifact)\n        best_score = initial_score\n        best_artifact = current_artifact\n\n        for iteration in range(self.max_iterations):\n            for optimizer in self.optimizers:\n                candidate = await optimizer.optimize(current_artifact)\n                candidate_score = self.metric.score(candidate)\n\n                if candidate_score > best_score:\n                    best_score = candidate_score\n                    best_artifact = candidate\n\n        return ExperimentResult(\n            iteration=iteration,\n            initial_score=initial_score,\n            final_score=best_score,\n            strategy=type(optimizer).__name__,\n            artifact=best_artifact,\n            metadata={}\n        )\n\nclass OpenRouterOptimizer:\n    def __init__(self, model: str = \"openai/gpt-4o-mini\"):\n        self.model = model\n        self.api_url = \"https://openrouter.ai/api/v1/chat/completions\"\n\n    async def optimize(self, current: str) -> str:\n        async with httpx.AsyncClient() as client:\n            response = await client.post(\n                self.api_url,\n                headers={\"Authorization\": f\"Bearer {os.getenv('OPENROUTER_API_KEY')}\"},\n                json={\n                    \"model\": self.model,\n                    \"messages\": [{\"role\": \"user\", \"content\": f\"Improve this text: {current}\"}]\n                }\n            )\n            return response.json()[\"choices\"][0][\"message\"][\"content\"]\n\nclass LengthAndCoherenceMetric:\n    def score(self, text: str) -> float:\n        words = text.split()\n        word_count = len(words)\n        unique_words = len(set(words))\n        \n        length_score = min(word_count / 200, 1.0)\n        coherence_score = unique_words / word_count if word_count > 0 else 0\n        \n        return 0.6 * length_score + 0.4 * coherence_score\n\nasync def main():\n    experiment = LLMExperimentLoop(\n        api_key=os.getenv(\"OPENROUTER_API_KEY\"),\n        metric_calculator=LengthAndCoherenceMetric(),\n        optimizers=[OpenRouterOptimizer()],\n        max_iterations=10\n    )\n\n    initial_text = \"The quick brown fox jumps over the lazy dog.\"\n    result = await experiment.run_experiment(initial_text)\n    \n    with open(\"experiment_results.json\", \"w\") as f:\n        json.dump(asdict(result), f, indent=2)\n\nif __name__ == \"__main__\":\n    asyncio.run(main())\n```\n\n## Key Innovations\n\n### Modular Design\n- Decoupled optimization strategies\n- Pluggable metric calculators\n- Support for multiple simultaneous optimization approaches\n\n### Advanced Features\n- Async execution for parallel processing\n- Comprehensive experiment tracking\n- Extensible architecture\n\n## Optimization Strategies\n\nThe framework supports multiple optimization techniques:\n1. Greedy hill-climbing\n2. Random mutation\n3. Simulated annealing (future extension)\n\n## Performance Considerations\n\n- Minimal overhead with async design\n- Configurable iteration limits\n- Low-cost API interactions\n\n## Common Challenges\n\n1. **Metric Design**: Metrics must genuinely reflect quality\n2. **Computational Costs**: Monitor API usage\n3. **Convergence**: Not all problems have clear optimization paths\n\n## Next Steps\n\n- Implement more sophisticated optimization strategies\n- Add cost tracking and budget constraints\n- Create visualization tools for experiment analysis\n\nBy embracing a systematic, programmatic approach to prompt engineering, you transform experimental AI development from an art into a repeatable, data-driven science.", "C": "# Build a Minimal LLM Evaluation Loop: From Manual Prompts to Systematic Optimization\n\nManual \"prompt engineering\" is a bottleneck. If you are still copy-pasting outputs into a spreadsheet, you are treating prompt development as an art rather than an engineering process. To scale, you need a closed-loop system: a script that generates, evaluates, and iterates.\n\nThis tutorial builds a minimal, robust evaluation loop in Python. We will use a **greedy hill-climbing algorithm** to refine an artifact based on a scoring function.\n\n## What You Will Build\nYou will create a Python-based harness that:\n1.  **Iterates** by sending prompts to the OpenRouter API.\n2.  **Scores** outputs using a programmable metric.\n3.  **Optimizes** by keeping only improvements (Greedy Hill-Climbing).\n4.  **Versions** every successful improvement via local Git commits.\n5.  **Tracks** costs to ensure experiments don't break your bank.\n\n## Prerequisites\n- Python 3.10+\n- `pip install httpx python-dotenv`\n- A Git-initialized directory.\n\n## Step 1: The API Client\nWe use `httpx` for its clean async support and robust error handling. We avoid hardcoding keys by fetching them from `.env`.\n\n```python\nimport os\nimport httpx\nfrom dotenv import load_dotenv\nfrom typing import Optional\n\nload_dotenv()\n\nclass LLMClient:\n    def __init__(self):\n        self.api_key = os.getenv(\"OPENROUTER_API_KEY\")\n        self.url = \"https://openrouter.ai/api/v1/chat/completions\"\n        self.model = \"openai/gpt-4o-mini\"\n\n    def query(self, prompt: str) -> Optional[str]:\n        try:\n            with httpx.Client(timeout=30.0) as client:\n                response = client.post(\n                    self.url,\n                    headers={\"Authorization\": f\"Bearer {self.api_key}\"},\n                    json={\"model\": self.model, \"messages\": [{\"role\": \"user\", \"content\": prompt}]}\n                )\n                response.raise_for_status()\n                return response.json()[\"choices\"][0][\"message\"][\"content\"]\n        except Exception as e:\n            print(f\"API Error: {e}\")\n            return None\n```\n\n## Step 2: The Evaluator (Metric)\nIn a real-world scenario, your metric might be an LLM-as-a-judge or a regex-based validator. Here, we implement a custom heuristic that rewards technical precision.\n\n```python\ndef evaluate_artifact(text: str) -> float:\n    \"\"\"Example metric: Score based on length and inclusion of required keywords.\"\"\"\n    required_keywords = [\"efficient\", \"robust\", \"scalable\"]\n    score = 0.0\n    # Length penalty/reward\n    score += min(len(text) / 500, 1.0) * 0.5\n    # Keyword density\n    found = sum(1 for kw in required_keywords if kw in text.lower())\n    score += (found / len(required_keywords)) * 0.5\n    return score\n```\n\n## Step 3: The Optimization Loop\nWe use **Greedy Hill-Climbing**. We start with a baseline, and in each iteration, we ask the LLM to \"improve\" the current best. If the new score exceeds the current best, we persist the change.\n\n```python\nimport subprocess\n\ndef run_experiment(iterations: int = 10):\n    client = LLMClient()\n    current_artifact = open(\"artifact.txt\", \"r\").read()\n    best_score = evaluate_artifact(current_artifact)\n    \n    for i in range(iterations):\n        print(f\"Iteration {i}: Current Best {best_score:.2f}\")\n        \n        prompt = f\"Improve the following text for clarity and impact:\\n\\n{current_artifact}\"\n        candidate = client.query(prompt)\n        \n        if not candidate: continue\n        \n        score = evaluate_artifact(candidate)\n        \n        if score > best_score:\n            print(f\"  -> Improvement found! Score: {score:.2f}\")\n            best_score = score\n            current_artifact = candidate\n            with open(\"artifact.txt\", \"w\") as f:\n                f.write(current_artifact)\n            subprocess.run([\"git\", \"add\", \"artifact.txt\"])\n            subprocess.run([\"git\", \"commit\", \"-m\", f\"Improvement: {score:.2f}\"])\n        else:\n            print(f\"  -> No improvement. Discarding.\")\n\nif __name__ == \"__main__\":\n    run_experiment()\n```\n\n## Why Greedy Hill-Climbing?\nThis pattern is the \"Hello World\" of automated optimization. It is **greedy** because it accepts any improvement immediately and **hill-climbing** because it attempts to reach a local maximum of quality. \n\n**The Tradeoff:** The primary risk is getting stuck in a \"local optimum\"\u2014where the model finds a version that meets your criteria well enough that it cannot figure out how to make it *even better*. If your results plateau, you may need to introduce \"temperature\" or randomness (e.g., allow a lower-scoring move occasionally) to escape the trap.\n\n## Common Pitfalls\n1.  **Metric Gaming**: The LLM will learn to exploit your scoring function. If you reward word count, it will become verbose. If you reward keywords, it will become repetitive. Ensure your metric is a proxy for human utility, not just a set of surface-level rules.\n2.  **Circular Feedback**: If you use the same model to improve the text and to grade it, you risk a \"model collapse\" where the evaluator becomes biased toward the generator\u2019s style.\n3.  **Dependency on Git**: While version control is excellent, ensure your `artifact.txt` is not massive, or your repository size will bloat quickly with constant commits.\n\n## Next Steps: Scaling Up\nOnce this loop is stable, consider these enhancements:\n*   **Parallelism**: Use `asyncio` to run 5\u201310 variations of the \"improvement\" prompt simultaneously and pick the best one (a \"Beam Search\" approach).\n*   **Cost Tracking**: Wrap the `LLMClient` in a proxy that logs token counts to a CSV file to monitor the burn rate of your API credits.\n*   **LLM-as-a-Judge**: Replace the `evaluate_artifact` function with a call to a stronger model (e.g., `gpt-4o`) to provide qualitative feedback instead of simple heuristic scores.\n\nBy automating the \"Generate -> Evaluate -> Commit\" cycle, you transform prompt engineering from a series of manual guesses into a data-backed, version-controlled engineering discipline.", "D": "# Build a Minimal LLM Evaluation Loop in Python: Systematic Experiments for ML Engineers\n\nIf you're an ML engineer tired of manual prompt testing, this tutorial guides you through building a lean evaluation loop using the OpenRouter API. It transitions you from ad-hoc experiments to automated optimization, focusing on simplicity and understandability in under 10 minutes.\n\n## What You Will Build\n\nBy the end of this tutorial, you'll have a Python script that:\n1. Sets up API calls with OpenRouter.\n2. Evaluates LLM outputs using a custom metric.\n3. Runs a greedy hill-climbing loop with parallel model queries for efficiency.\n4. Implements KEEP/DISCARD logic based on scores.\n5. Tracks costs and saves results to a TSV file.\n6. Versions improvements via git and discusses when to stop the loop.\n\nThis version enhances the loop by querying multiple models concurrently, speeding up iterations without overcomplicating the code.\n\n## What You Need\n\n- Python 3.10+.\n- An OpenRouter API key from openrouter.ai.\n- Install dependencies: `pip install httpx python-dotenv`.\n- Git installed and configured.\n\n## Step 1: Setup API Key and Constants\n\nStart by creating a `.env` file in your project root:\n```plaintext\nOPENROUTER_API_KEY=sk-or-your-key-here\n```\n\nThis loads your API key securely from an environment variable.\n\n```python\nimport os\nimport httpx\nimport asyncio  # For parallel queries\nfrom dotenv import load_dotenv\n\nload_dotenv()  # Load environment variables\n\nAPI_KEY = os.getenv(\"OPENROUTER_API_KEY\")\nAPI_URL = \"https://openrouter.ai/api/v1/chat/completions\"\nMODELS = [\"openai/gpt-4o-mini\", \"anthropic/claude-3-haiku\"]  # List of models to query in parallel\nMAX_ITERATIONS = 20\nCOST_PER_TOKEN = 0.000002  # Approximate cost; verify with OpenRouter\n\nasync def call_llm_async(prompt: str, model: str) -> tuple[str, float]:  # Returns content and estimated tokens\n    try:\n        async with httpx.AsyncClient() as client:\n            response = await client.post(\n                API_URL,\n                headers={\"Authorization\": f\"Bearer {API_KEY}\"},\n                json={\n                    \"model\": model,\n                    \"messages\": [{\"role\": \"user\", \"content\": prompt}]\n                },\n                timeout=10.0\n            )\n            response.raise_for_status()\n            data = response.json()\n            content = data[\"choices\"][0][\"message\"][\"content\"]\n            tokens_used = data.get(\"usage\", {}).get(\"total_tokens\", 0)  # Use actual tokens from response\n            return content, tokens_used\n    except httpx.RequestError as e:\n        print(f\"API request failed for {model}: {e}\")\n        return \"\", 0\n```\n\nThis async function allows for non-blocking API calls, enabling parallel queries.\n\n## Step 2: Define a Metric Function\n\nThe metric function scores LLM outputs. Here's an improved version with type hints and inline explanations:\n\n```python\ndef score(text: str) -> float:\n    \"\"\"Scores text based on length and lexical diversity. Higher scores indicate better coherence and completeness.\"\"\"\n    if not text:\n        return 0.0\n    words = len(text.split())  # Count words\n    length_score = min(words / 200, 1.0)  # Normalize length (cap at 200 words)\n    unique_words = len(set(text.split()))  # Calculate lexical diversity\n    coher