{"type": "stage2_complete", "rankings": [{"letter": "A", "display_letter": "B", "avg_position": 0.5, "votes": 4}, {"letter": "D", "display_letter": "D", "avg_position": 0.5, "votes": 4}, {"letter": "B", "display_letter": "A", "avg_position": 2.25, "votes": 4}, {"letter": "C", "display_letter": "C", "avg_position": 2.75, "votes": 4}, {"letter": "E", "display_letter": "E", "avg_position": 4.0, "votes": 4}], "shuffle_map": {"B": "A", "A": "B", "C": "C", "D": "D", "E": "E"}, "votes": [{"model": "meta-llama/llama-4-maverick", "display_ranking": "B > D > A > C > E", "original_ranking": "A > D > B > C > E", "reasoning": "To evaluate these versions, I'll go through each one and assess its quality based on the given criteria: Correctness, Completeness, Clarity, Code Quality, and Depth.\n\n## Version A\nVersion A is a strong submission with robust API handling, a flexible scoring system, and a clear evaluation loop. It effectively addresses several aspects of the task, including error handling and cost tracking. However, it uses async/await, which, while not incorrect, is not explicitly requested. The code is well-structured and readable.\n\n## Version B\nVersion B provides a comprehensive tutorial that covers all essential steps, including API key setup, making LLM calls, defining a metric, and saving results. It includes a complete, runnable example and explains key design decisions. The code is idiomatic, and the tutorial is clear and well-structured. It also discusses common pitfalls and provides a \"why\" explanation for the chosen approach.\n\n## Version C\nVersion C offers a lean implementation with a clear focus on the essential components of an evaluation loop. It includes robust API integration and a straightforward scoring mechanism. The tutorial explains the rationale behind the greedy hill-climbing approach and highlights potential pitfalls. However, it lacks some details on cost tracking and more sophisticated optimization strategies.\n\n## Version D\nVersion D is a well-rounded submission that includes a complete, runnable example and covers all the necessary steps. It provides a clear and concise explanation of the code and the reasoning behind the design choices. The tutorial is easy to follow, and the code is well-structured and maintainable. It also includes a worked example and discusses common pitfalls, enhancing its clarity and usefulness.\n\n## Version E\nVersion E is a basic implementation that covers the fundamental aspects of building an evaluation loop. However, it lacks depth in several areas, such as error handling, cost tracking, and more advanced optimization techniques. The code is straightforward but could be improved with better security practices (e.g., not hardcoding the API key).\n\n## Ranking\n\nBased on the evaluation criteria, here's a brief assessment of each version:\n- Version B stands out for its completeness, clarity, and the depth of explanation. It covers all essential steps and provides a well-structured tutorial.\n- Version D is also comprehensive, with a clear and well-structured tutorial, a complete example, and a discussion of common pitfalls.\n- Version A is strong in terms of code quality and robustness but may not be as straightforward for beginners due to its use of async/await.\n- Version C is lean and focused on the essentials but lacks some of the depth and additional features seen in other versions.\n- Version E is the most basic and lacks in several areas, including security, error handling, and depth of explanation."}, {"model": "anthropic/claude-3-5-haiku", "display_ranking": "D > B > C > A > E", "original_ranking": "D > A > C > B > E", "reasoning": "I'll evaluate each version systematically based on the 5 criteria:\n\nVersion D: STRONGEST OVERALL\n- Correctness: Robust error handling, clear API call implementation\n- Completeness: Includes comprehensive steps, error handling, logging\n- Clarity: Excellent step-by-step explanation, inline comments\n- Code Quality: Type hints, environment variable handling, graceful failures\n- Depth: Extensive discussion of pitfalls, design choices, and real-world considerations\n\nVersion B: SOLID ALTERNATIVE\n- Strong implementation with good error handling\n- Includes cost tracking and results logging\n- Clear explanations and worked example\n- Slightly less depth than Version D\n- Good balance of technical detail and accessibility\n\nVersion C: MIDDLE-TIER\n- Concise and focused implementation\n- Good discussion of hill-climbing strategy\n- Less comprehensive error handling\n- Fewer inline explanations compared to top versions\n- Solid core concept but less polished execution\n\nVersion A: TECHNICALLY COMPETENT\n- Async implementation adds sophistication\n- More complex metric and scoring function\n- Less beginner-friendly explanations\n- Some over-engineering in metric creation\n- Good technical approach but less approachable\n\nVersion E: MINIMAL/DRAFT VERSION\n- Bare-bones implementation\n- Lacks error handling\n- Minimal explanations\n- Hardcoded API key (security risk)\n- Serves more as a sketch than a tutorial"}, {"model": "google/gemini-3.1-flash-lite-preview", "display_ranking": "D > B > A > C > E", "original_ranking": "D > A > B > C > E", "reasoning": "Reasoning:\nVersion D is the most complete and professional, providing a robust, well-explained, and secure implementation that follows all instructions, including the use of TSV logging and comprehensive error handling.\nVersion B provides a very strong, well-structured guide that includes cost tracking and JSON logging, making it highly practical for the target audience.\nVersion A uses asynchronous calls and a more sophisticated, modular scoring system, but its code structure for the loop is slightly less intuitive for a \"10-minute\" tutorial than the others.\nVersion C is decent and includes useful tips, but its code is less robust (e.g., hardcoding a localhost referer) and the scoring function is quite rudimentary compared to the others.\nVersion E is poor because it explicitly ignores the core requirement to load the API key from an environment variable, hardcoding it directly instead."}, {"model": "x-ai/grok-3-mini-beta", "display_ranking": "B > D > A > C > E", "original_ranking": "A > D > B > C > E", "reasoning": "Below is my ranking of the versions (A, B, C, D, E) from best to worst based on the evaluation criteria: Correctness, Completeness, Clarity, Code Quality, and Depth. I scored each version holistically out of 100 points, focusing on how well they align with the target audience's needs for a minimal, understandable implementation.\n\n- **Version B**: This version excels in all areas with strong correctness (secure API handling), completeness (includes cost tracking and result saving), clear step-by-step explanations, high code quality (idiomatic Python with error handling), and good depth (justifies decisions like greedy hill-climbing and addresses tradeoffs), making it the most polished and audience-focused.  \n- **Version D**: It demonstrates high completeness (covers all steps plus a worked example and TSV logging) and clarity (well-structured with inline explanations), with solid correctness and code quality, though depth could be deeper in some justifications.  \n- **Version A**: The use of async calls and robust error handling ensures good correctness and code quality, and it covers essential steps completely, but clarity suffers slightly from complexity, and depth is moderate without extensive tradeoffs discussion.  \n- **Version C**: It provides a lean implementation with adequate correctness, completeness, and clarity, plus good depth in explaining pitfalls, but code quality is weakened by broad exception handling and less extensible structure.  \n- **Version E**: This version has major issues with correctness (hardcoded API key violates constraints) and code quality (lacks proper error handling), minimal completeness (missing features like result saving), and shallow depth, making it the least effective despite basic clarity."}], "model_names": {"A": "meta-llama/llama-4-maverick", "B": "anthropic/claude-3-5-haiku", "C": "google/gemini-3.1-flash-lite-preview", "D": "x-ai/grok-3-mini-beta"}}
{"type": "stage3_complete", "winner": "A", "winner_model": "meta-llama/llama-4-maverick", "council_score": 88, "sub_scores": {"CORRECTNESS": 19, "COMPLETENESS": 18, "CLARITY": 17, "CODE_QUALITY": 18, "DEPTH": 16}, "critique": "Proposal A effectively covers the essential steps for building a minimal LLM evaluation loop, with clear code examples and a logical flow. It includes robust error handling and avoids hardcoded secrets, but could benefit from slightly more clarity in its explanations of certain concepts, such as the metric definition. While it discusses greedy hill-climbing, it could delve deeper into the tradeoffs and potential issues with this approach. Overall, it provides a strong foundation for readers looking to automate their prompt testing. Future iterations could explore adding more sophisticated metrics or user feedback mechanisms.", "chairman_full_response": "WINNER: A\nSCORE_CORRECTNESS: 19\nSCORE_COMPLETENESS: 18\nSCORE_CLARITY: 17\nSCORE_CODE_QUALITY: 18\nSCORE_DEPTH: 16\nCOUNCIL_SCORE: 88\n\nCRITIQUE:\nProposal A effectively covers the essential steps for building a minimal LLM evaluation loop, with clear code examples and a logical flow. It includes robust error handling and avoids hardcoded secrets, but could benefit from slightly more clarity in its explanations of certain concepts, such as the metric definition. While it discusses greedy hill-climbing, it could delve deeper into the tradeoffs and potential issues with this approach. Overall, it provides a strong foundation for readers looking to automate their prompt testing. Future iterations could explore adding more sophisticated metrics or user feedback mechanisms.", "chairman_model": "openai/gpt-4o-mini", "model_names": {"A": "meta-llama/llama-4-maverick", "B": "anthropic/claude-3-5-haiku", "C": "google/gemini-3.1-flash-lite-preview", "D": "x-ai/grok-3-mini-beta"}}
{"type": "iteration_result", "iteration": 1, "status": "KEEP", "council_score": 88, "winner": "A", "best_score": 88, "commit": "666f95f", "spent_usd": 0.0, "timestamp": "2026-04-03T14:29:39.525938Z"}
