{"type": "stage2_complete", "rankings": [{"letter": "D", "display_letter": "E", "avg_position": 0.5, "votes": 4}, {"letter": "A", "display_letter": "A", "avg_position": 1.0, "votes": 4}, {"letter": "B", "display_letter": "C", "avg_position": 2.5, "votes": 4}, {"letter": "C", "display_letter": "B", "avg_position": 2.5, "votes": 4}, {"letter": "E", "display_letter": "D", "avg_position": 3.5, "votes": 4}], "shuffle_map": {"A": "A", "C": "B", "B": "C", "E": "D", "D": "E"}, "votes": [{"model": "meta-llama/llama-4-maverick", "display_ranking": "A > E > C > B > D", "original_ranking": "A > D > B > C > E", "reasoning": "## Step 1: Evaluate Version A\nVersion A is comprehensive, covering all essential steps, explaining key design decisions, and including a worked example, making it strong in completeness, clarity, and depth.\n\n## Step 2: Evaluate Version C\nVersion C presents a well-structured evaluation loop with advanced scoring and clear explanations, but its code organization and some explanations could be improved for better clarity and readability.\n\n## Step 3: Evaluate Version E\nVersion E provides a detailed tutorial with good explanations of the code and concepts, and it includes discussions on tradeoffs and common pitfalls, making it strong in clarity and depth.\n\n## Step 4: Evaluate Version B\nVersion B is concise and effectively communicates the core concepts, but it lacks some details and explanations that would enhance its completeness and depth.\n\n## Step 5: Evaluate Version D\nVersion D is similar to Version A but lacks some of the explanatory depth and examples that make Version A stronger, particularly in the areas of depth and clarity.\n\n## Step 6: Compare All Versions\nComparing all versions, Version A stands out for its comprehensive coverage and clear explanations. Version E is also strong due to its detailed discussions and clear code examples. Version C is notable for its advanced scoring mechanism but could be improved in terms of clarity. Version B is concise but lacks depth, and Version D is a solid implementation but misses some explanatory details.\n\n## Step 7: Rank the Versions\nBased on the evaluation criteria, the ranking from best to worst is determined by considering correctness, completeness, clarity, code quality, and depth.\n\n## Step 8: Final Ranking\nAfter evaluating each version against the criteria, the final ranking is: Version A > Version E > Version C > Version B > Version D."}, {"model": "anthropic/claude-3-5-haiku", "display_ranking": "A > E > C > B > D", "original_ranking": "A > D > B > C > E", "reasoning": "I'll evaluate each version against the 5 criteria and provide a brief rationale:\n\nVersion A: Strong implementation with good completeness, clear step-by-step explanation, solid code quality. Covers all key requirements comprehensively. Explains tradeoffs and limitations well.\n\nVersion C: Advanced scoring mechanism, good architectural explanation. More statistically sophisticated metric. Slightly over-engineered compared to the brief. Less beginner-friendly than Version A.\n\nVersion B: Lean and focused implementation. Good explanation of hill-climbing. Slightly less comprehensive documentation compared to A. Solid technical content.\n\nVersion E: Very thorough, with extensive explanations and deep dives into patterns and tradeoffs. Excellent depth and clarity. Slightly verbose, which might overwhelm beginners.\n\nVersion D: Almost identical to Version A, with minor structural differences. Slightly less crisp in explanation and code organization.\n\nDetailed Scoring Breakdown:\n- Correctness: A = C > B = E > D\n- Completeness: A > E > C > B > D\n- Clarity: A > B > E > C > D\n- Code Quality: C > A > B > E > D\n- Depth: E > A > C > B > D"}, {"model": "google/gemini-3.1-flash-lite-preview", "display_ranking": "E > B > C > A > D", "original_ranking": "D > C > B > A > E", "reasoning": "To evaluate these versions, I assessed them based on code quality (error handling, type hints), completeness (cost tracking, file I/O), and depth (explanations of the \"why\").\n\n*   **Version E** is the strongest because it incorporates comprehensive type hints, robust error handling, clear documentation of the \"why\" (subprocess/stopping conditions), and uses a TSV format which is more appropriate for simple logs than JSON.\n*   **Version B** is excellent for its concise, idiomatic Python and provides a very practical \"Toward a Robust Pipeline\" section that adds significant professional value.\n*   **Version C** uses an object-oriented approach which is very clean and extensible, though the \"advanced\" scoring logic is slightly more complex than a \"minimal\" tutorial might require.\n*   **Version A** is a solid, standard implementation that covers all requirements, though it lacks the polish and slightly more advanced error handling found in E and B.\n*   **Version D** is effectively identical to A but removes some of the supporting sections (like \"Advanced Optimization Techniques\"), making it slightly less complete in its educational scope.\n\n**Reasoning:**\n*   **Version E:** Best balance of professional coding practices (type hints, graceful failure), documentation, and practical logging.\n*   **Version B:** Very idiomatic and readable, with great advice on scaling the pipeline.\n*   **Version C:** Strong OO design, though the scoring function is slightly less \"minimal\" than requested.\n*   **Version A:** Clear and functional, meets all constraints, but less polished than the top three.\n*   **Version D:** Functional and correct, but less comprehensive than Version A regarding advanced considerations."}, {"model": "x-ai/grok-3-mini-beta", "display_ranking": "E > A > D > B > C", "original_ranking": "D > A > E > C > B", "reasoning": "Below is my ranking of the versions from best to worst based on the evaluation criteria (Correctness, Completeness, Clarity, Code Quality, and Depth). I scored each version out of 100 points, focusing on how well they meet the criteria for a minimal, understandable tutorial. Here's a brief summary of scores and one-sentence reasoning for each:\n\n- **Version E**: Score: 88/100. This version stands out for its strong clarity and code quality, with excellent explanations, type hints, and error handling, making it highly accessible and extensible while covering all essential steps.\n- **Version A**: Score: 85/100. It provides a well-rounded tutorial with good completeness and depth, justifying key decisions and including all required elements, though it could improve slightly in advanced error handling.\n- **Version D**: Score: 82/100. Very similar to Version A, it covers the essentials effectively but falls short in minor refinements like type hints, making it a solid but less polished option.\n- **Version B**: Score: 75/100. It is clear and complete for basic needs but has correctness issues in cost calculation and lacks depth in explanations, potentially leading to subtle bugs.\n- **Version C**: Score: 70/100. While it offers good depth in advanced techniques, its over-engineered structure and unnecessary dependencies reduce clarity and completeness for the target audience seeking a minimal implementation."}], "model_names": {"A": "meta-llama/llama-4-maverick", "B": "anthropic/claude-3-5-haiku", "C": "google/gemini-3.1-flash-lite-preview", "D": "x-ai/grok-3-mini-beta"}}
{"type": "stage3_complete", "winner": "D", "winner_model": "x-ai/grok-3-mini-beta", "council_score": 90, "sub_scores": {"CORRECTNESS": 18, "COMPLETENESS": 19, "CLARITY": 18, "CODE_QUALITY": 17, "DEPTH": 18}, "critique": "Proposal D provides a thorough and well-structured tutorial for building a minimal LLM evaluation loop. The code is mostly correct and follows good practices, including the use of environment variables for sensitive data. However, minor improvements could be made in the clarity of explanations, particularly around why certain choices were made. The depth of discussion regarding trade-offs and potential pitfalls is commendable but could benefit from including more advanced error handling examples. Overall, this proposal effectively balances simplicity with completeness, and minor adjustments could enhance its educational value further.", "chairman_full_response": "WINNER: D\nSCORE_CORRECTNESS: 18\nSCORE_COMPLETENESS: 19\nSCORE_CLARITY: 18\nSCORE_CODE_QUALITY: 17\nSCORE_DEPTH: 18\nCOUNCIL_SCORE: 90\n\nCRITIQUE:\nProposal D provides a thorough and well-structured tutorial for building a minimal LLM evaluation loop. The code is mostly correct and follows good practices, including the use of environment variables for sensitive data. However, minor improvements could be made in the clarity of explanations, particularly around why certain choices were made. The depth of discussion regarding trade-offs and potential pitfalls is commendable but could benefit from including more advanced error handling examples. Overall, this proposal effectively balances simplicity with completeness, and minor adjustments could enhance its educational value further.", "chairman_model": "openai/gpt-4o-mini", "model_names": {"A": "meta-llama/llama-4-maverick", "B": "anthropic/claude-3-5-haiku", "C": "google/gemini-3.1-flash-lite-preview", "D": "x-ai/grok-3-mini-beta"}}
{"type": "iteration_result", "iteration": 34, "status": "DISCARD", "council_score": 90, "winner": "D", "best_score": 94, "commit": "ebb51dd", "spent_usd": 0.392428, "timestamp": "2026-04-03T15:41:40.441992Z"}
