{"type": "stage2_complete", "rankings": [{"letter": "A", "display_letter": "A", "avg_position": 0.5, "votes": 4}, {"letter": "D", "display_letter": "E", "avg_position": 0.75, "votes": 4}, {"letter": "C", "display_letter": "D", "avg_position": 2.5, "votes": 4}, {"letter": "E", "display_letter": "C", "avg_position": 2.75, "votes": 4}, {"letter": "B", "display_letter": "B", "avg_position": 3.5, "votes": 4}], "shuffle_map": {"A": "A", "B": "B", "D": "C", "E": "D", "C": "E"}, "votes": [{"model": "meta-llama/llama-4-maverick", "display_ranking": "A > D > E > C > B", "original_ranking": "A > C > D > E > B", "reasoning": "To evaluate the given versions of the tutorial on building a minimal LLM evaluation loop in Python, I will assess each version based on the provided criteria: Correctness, Completeness, Clarity, Code quality, and Depth.\n\n## Version A\nVersion A provides a comprehensive tutorial that covers all essential steps, including API key setup, making LLM calls, scoring outputs, and saving results. It also includes a \"what you will build\" overview and explains key design decisions, making it clear and well-structured. The code is idiomatic, safe, and includes basic error handling. It achieves a good balance across the evaluation criteria.\n\n## Version B\nVersion B introduces advanced statistical methods and adaptive exploration strategies, enhancing the depth of the tutorial. However, it assumes a higher level of background knowledge in statistical optimization techniques, which might reduce its clarity for some readers. The code is complex and includes multi-dimensional scoring, making it a strong contender in terms of depth and code quality.\n\n## Version C\nVersion C is a more basic implementation that covers the essential steps but lacks some of the advanced features and explanations found in other versions. It is clear and easy to follow but does not delve as deeply into the rationale behind certain design choices or offer as many enhancements.\n\n## Version D\nVersion D strikes a good balance between clarity and depth, explaining the greedy hill-climbing strategy and its tradeoffs. It includes git versioning and cost tracking, enhancing its completeness and practicality. The code is well-structured, and the tutorial is easy to follow, making it strong in clarity and code quality.\n\n## Version E\nVersion E is very similar to Version C but includes additional details on stopping the loop and a worked example, enhancing its clarity and completeness. It maintains a good balance between simplicity and the depth of explanation, making it accessible to the target audience.\n\n## Ranking\n\n- **Version A**: Strong in completeness, clarity, and code quality, with a good balance across criteria.\n- **Version D**: Excellent in clarity, code quality, and depth, with a focus on practicality and explanations.\n- **Version E**: Similar to Version C but with additional enhancements in clarity and completeness.\n- **Version C**: A solid foundation but lacks some depth and advanced features compared to other versions.\n- **Version B**: While it excels in depth and introduces advanced concepts, its complexity might reduce clarity for some readers."}, {"model": "anthropic/claude-3-5-haiku", "display_ranking": "A > E > D > B > C", "original_ranking": "A > D > C > B > E", "reasoning": "I'll evaluate each version systematically against the 5 criteria:\n\nVersion A: Strong overall. Comprehensive tutorial with good code quality, clear explanations, and solid implementation of the core requirements. Covers all key aspects like API setup, metrics, and versioning. Minor weakness in depth of theoretical justification.\n\nVersion B: Advanced statistical approach with sophisticated scoring and exploration strategies. Impressive depth and nuanced implementation. Slightly over-engineered for the \"minimal\" tutorial goal. More academic in tone than practical.\n\nVersion C: Nearly identical to Version A, with very minor structural differences. Seems like a near-duplicate submission. Provides correct implementation but lacks distinctive features.\n\nVersion D: Lean, pragmatic implementation with strong focus on practical considerations. Excellent clarity, good error handling, and concise explanations. Strong emphasis on real-world constraints and pitfalls. Slightly less comprehensive than Version A.\n\nVersion E: Very solid implementation. Slightly more verbose explanations than Version D, with good depth and clear code. Strong error handling and thoughtful design. Slightly more pedagogical in approach compared to Version D.\n\nDetailed ranking criteria:\n1. Correctness: A \u2248 B > D = E > C\n2. Completeness: A > B > E > D > C\n3. Clarity: A = E > D > B > C\n4. Code Quality: B > A = E > D > C\n5. Depth: B > A = E > D > C\n\nSynthesizing these assessments, my final ranking prioritizes comprehensive, clear, and practically implementable solutions."}, {"model": "google/gemini-3.1-flash-lite-preview", "display_ranking": "E > A > C > D > B", "original_ranking": "D > A > E > C > B", "reasoning": "To evaluate these versions, I assessed them based on their adherence to the technical requirements, code quality, and the effectiveness of the tutorial as a pedagogical tool for ML engineers.\n\n**Reasoning:**\n\n*   **Version E:** This is the strongest implementation. It includes robust type hints, clear inline documentation, proper error handling, cost tracking, and a well-structured \"worked example.\" It balances technical depth with accessibility perfectly.\n*   **Version A:** This is very similar to E but slightly less polished in its presentation and lacks some of the refined annotations (like type hints on the `results` list). It is still a very high-quality submission.\n*   **Version C:** This is identical to A in logic but lacks the explicit TSV output and slightly cleaner formatting found in A. It is a solid, functional tutorial but lacks the extra polish of the top two.\n*   **Version D:** While the prose is excellent and captures the \"why\" of the architecture well, the code is less feature-rich than the others (it lacks the parallel model querying requested in the exploration directions) and uses a more basic approach.\n*   **Version B:** This version introduces unnecessary complexity (`numpy`, `scipy`) that contradicts the \"minimal/lean\" requirement of the prompt. While well-written, it over-engineers the solution for a reader looking for a \"10-minute\" startup guide."}, {"model": "x-ai/grok-3-mini-beta", "display_ranking": "E > A > C > B > D", "original_ranking": "D > A > E > B > C", "reasoning": "Below is my ranking of the versions from best to worst based on the evaluation criteria (Correctness, Completeness, Clarity, Code Quality, and Depth). I'll provide a brief one-sentence reasoning for each version, focusing on how well it aligns with the criteria overall.\n\n- **Version E**: This version excels in clarity and depth with excellent explanations, inline comments, and a worked example, while maintaining strong completeness and code quality through parallel queries and error handling, making it highly accessible and extensible for the target audience.\n- **Version A**: It demonstrates solid completeness and correctness by covering all essential steps with good structure and justifications, though it lacks some of the refined clarity and extensions seen in others.\n- **Version C**: Essentially identical to Version A, it performs equally well in completeness and correctness but offers no unique advantages or improvements.\n- **Version B**: While it scores high on depth with advanced statistical explanations, its over-engineered complexity reduces clarity and may alienate the audience seeking a minimal implementation.\n- **Version D**: It is clear and correct for a basic setup but falls short in completeness and code quality due to the absence of parallel queries and more robust features, limiting its extensibility."}], "model_names": {"A": "meta-llama/llama-4-maverick", "B": "anthropic/claude-3-5-haiku", "C": "google/gemini-3.1-flash-lite-preview", "D": "x-ai/grok-3-mini-beta"}}
{"type": "stage3_complete", "winner": "A", "winner_model": "meta-llama/llama-4-maverick", "council_score": 93, "sub_scores": {"CORRECTNESS": 20, "COMPLETENESS": 20, "CLARITY": 18, "CODE_QUALITY": 18, "DEPTH": 17}, "critique": "Proposal A provides a thorough and well-structured tutorial on building a minimal LLM evaluation loop. The code is syntactically valid and logically sound, with no apparent bugs, and it covers all essential steps comprehensively. Clarity is mostly high, although a few inline comments could enhance understanding for less experienced readers. The code quality is strong, featuring proper error handling and secure API key management, but could benefit from additional type hints. Depth is good, explaining the rationale behind certain design choices, but there's room for more discussion on trade-offs. Overall, this proposal is well-suited for the target audience and achieves its objectives effectively.", "chairman_full_response": "WINNER: A\nSCORE_CORRECTNESS: 20\nSCORE_COMPLETENESS: 20\nSCORE_CLARITY: 18\nSCORE_CODE_QUALITY: 18\nSCORE_DEPTH: 17\nCOUNCIL_SCORE: 93\n\nCRITIQUE:\nProposal A provides a thorough and well-structured tutorial on building a minimal LLM evaluation loop. The code is syntactically valid and logically sound, with no apparent bugs, and it covers all essential steps comprehensively. Clarity is mostly high, although a few inline comments could enhance understanding for less experienced readers. The code quality is strong, featuring proper error handling and secure API key management, but could benefit from additional type hints. Depth is good, explaining the rationale behind certain design choices, but there's room for more discussion on trade-offs. Overall, this proposal is well-suited for the target audience and achieves its objectives effectively.", "chairman_model": "openai/gpt-4o-mini", "model_names": {"A": "meta-llama/llama-4-maverick", "B": "anthropic/claude-3-5-haiku", "C": "google/gemini-3.1-flash-lite-preview", "D": "x-ai/grok-3-mini-beta"}}
{"type": "iteration_result", "iteration": 41, "status": "DISCARD", "council_score": 93, "winner": "A", "best_score": 96, "commit": "de0e250", "spent_usd": 0.631088, "timestamp": "2026-04-03T15:52:03.673122Z"}
