{"type": "stage2_complete", "rankings": [{"letter": "A", "display_letter": "E", "avg_position": 1.0, "votes": 4}, {"letter": "D", "display_letter": "B", "avg_position": 1.25, "votes": 4}, {"letter": "B", "display_letter": "C", "avg_position": 1.5, "votes": 4}, {"letter": "E", "display_letter": "D", "avg_position": 2.75, "votes": 4}, {"letter": "C", "display_letter": "A", "avg_position": 3.5, "votes": 4}], "shuffle_map": {"E": "A", "C": "B", "A": "C", "B": "D", "D": "E"}, "votes": [{"model": "meta-llama/llama-4-maverick", "display_ranking": "E > C > B > D > A", "original_ranking": "A > B > D > E > C", "reasoning": "## Step 1: Evaluate Version E\nVersion E is strong in completeness, clarity, and depth, covering all essential steps and explaining key design decisions, but it needs to be checked against other versions for relative quality.\n\n## Step 2: Evaluate Version C\nVersion C stands out for introducing Thompson Sampling, a sophisticated model selection strategy, enhancing depth and code quality, making it a potentially top contender.\n\n## Step 3: Evaluate Version A\nVersion A provides a clear, minimal implementation and effectively explains the \"why\" behind its design choices, scoring well on clarity and depth, but may lack some features present in other versions.\n\n## Step 4: Evaluate Version B\nVersion B is comprehensive, covering parallel model queries, cost tracking, and saving results to a TSV file, making it strong in completeness, and its code is idiomatic and safe.\n\n## Step 5: Evaluate Version D\nVersion D is similar to Version E but lacks some features like adaptive temperature control, making it slightly less complete and less deep in its optimization strategy.\n\n## Step 6: Compare All Versions\nComparing all versions:\n- Version E is comprehensive and clear, with a good balance of features and explanations.\n- Version C introduces a sophisticated optimization technique (Thompson Sampling), enhancing its depth.\n- Version A is minimal and clear but lacks some features.\n- Version B is comprehensive and has good code quality.\n- Version D is solid but lacks some advanced features present in Version E.\n\n## Step 7: Rank the Versions\nBased on the evaluation criteria, the ranking from best to worst is determined by considering correctness, completeness, clarity, code quality, and depth.\n\n## Step 8: Final Ranking\nAfter evaluating each version against the criteria, the final ranking is as follows:\n- Version E is highly comprehensive and clear.\n- Version C is strong due to its sophisticated model selection strategy.\n- Version B is a close third due to its completeness and code quality.\n- Version D follows as it is comprehensive but lacks some features.\n- Version A, while clear and minimal, lacks some advanced features and completeness."}, {"model": "anthropic/claude-3-5-haiku", "display_ranking": "E > C > B > D > A", "original_ranking": "A > B > D > E > C", "reasoning": "I'll evaluate each version based on the specified criteria:\n\nVersion E (Excellent):\n- Correctness: Robust implementation with comprehensive error handling\n- Completeness: Covers all aspects, including adaptive temperature and parallel queries\n- Clarity: Well-structured with clear explanations and inline comments\n- Code Quality: Strong type hints, secure key management, comprehensive error handling\n- Depth: Exceptional justification of design choices and tradeoffs\nBest overall version with the most sophisticated and well-explained approach.\n\nVersion C (Strong):\n- Correctness: Solid implementation with Thompson Sampling\n- Completeness: Covers key aspects with innovative model selection\n- Clarity: Good explanations, but slightly more complex than ideal\n- Code Quality: Good structure, but slightly more abstract\n- Depth: Excellent discussion of optimization strategies\nInnovative approach, but slightly more complex than the target audience might prefer.\n\nVersion B (Very Good):\n- Correctness: Clean, straightforward implementation\n- Completeness: Covers all core requirements\n- Clarity: Clear explanations, good step-by-step breakdown\n- Code Quality: Solid error handling, good use of async\n- Depth: Good discussion of tradeoffs and limitations\nWell-balanced approach that hits most tutorial objectives.\n\nVersion A (Good):\n- Correctness: Basic but functional implementation\n- Completeness: Covers core concepts but with fewer features\n- Clarity: Straightforward explanation, but less detailed\n- Code Quality: Minimal error handling, simpler implementation\n- Depth: Good philosophical discussion, but less technical depth\nFoundational approach, but lacks some of the sophistication of later versions.\n\nVersion D (Similar to E):\n- Correctness: Very similar to Version E\n- Completeness: Nearly identical to Version E\n- Clarity: Slightly less comprehensive than Version E\n- Code Quality: Very similar to Version E\n- Depth: Slightly less nuanced than Version E\nEssentially a slightly less refined version of Version E."}, {"model": "google/gemini-3.1-flash-lite-preview", "display_ranking": "B > C > A > D > E", "original_ranking": "D > B > C > E > A", "reasoning": "To evaluate these versions, I assessed them against the requirements of technical accuracy, code quality (especially error handling and idiomatic Python), and depth of explanation regarding the \"why\" of the design.\n\n*   **Version B** provides the most robust implementation, featuring proper `csv` library usage for data storage, clear error handling, and a thorough explanation of the \"when to stop\" logic, which is crucial for real-world ML engineering.\n*   **Version C** is highly sophisticated, introducing Thompson Sampling as an alternative to simple greedy hill-climbing, which aligns well with the \"exploration\" requirement, though its complexity might slightly exceed the \"10-minute\" goal.\n*   **Version A** is the most concise and focused, excelling in its explanation of the \"why\" behind the subprocess pattern and the pitfalls of LLM-as-a-judge, making it a very strong \"minimal\" tutorial.\n*   **Version D** is a solid, standard implementation that is easy to follow, but it lacks the polish of the TSV handling found in B or the conceptual depth of C.\n*   **Version E** adds \"adaptive temperature control,\" which is an interesting idea but lacks a clear theoretical justification for why temperature should be adjusted based on the success of the previous iteration, making the logic feel arbitrary compared to the other approaches.\n\n**Reasoning:**\n*   **Version B:** Best overall balance of practical features (TSV, error handling) and clear, professional guidance on evaluation lifecycle management.\n*   **Version C:** Excellent conceptual depth with the introduction of Thompson Sampling, providing a more advanced path for engineers.\n*   **Version A:** Extremely clear and well-written for a \"minimal\" implementation, with great advice on the pitfalls of automated evaluation.\n*   **Version D:** A perfectly functional and clean tutorial that serves as a solid middle-ground implementation.\n*   **Version E:** Includes an experimental \"adaptive temperature\" feature that feels slightly unproven and less standard than the other approaches."}, {"model": "x-ai/grok-3-mini-beta", "display_ranking": "E > B > D > C > A", "original_ranking": "A > D > E > B > C", "reasoning": "Below is my evaluation and ranking of the versions based on the specified criteria: Correctness, Completeness, Clarity, Code Quality, and Depth (each scored out of 20, for a total of 100). I judged each version solely on its quality, without knowing the source.\n\n- **Version E**: This version scores highly overall (90/100) due to its robust code with good error handling, comprehensive coverage of all essential steps plus extras like adaptive temperature, clear step-by-step explanations, and strong depth in justifying design choices and tradeoffs.\n- **Version C**: Scoring 86/100, it excels in depth with innovative use of Thompson Sampling and tradeoffs, but loses points for clarity due to its more advanced concepts that might overwhelm the target audience, despite solid code quality and completeness.\n- **Version A**: With a score of 82/100, it provides clear and engaging writing with good depth on pitfalls, but falls short in completeness (lacking parallel queries) and code quality (minimal error handling and no type hints), making it less extensible.\n- **Version B**: This version earns 87/100 for its balanced approach, including parallel queries and TSV saving for completeness, solid clarity and code quality, and adequate depth in discussing when to stop the loop, though it's slightly less innovative than others.\n- **Version D**: Scoring 87/100, it mirrors Version E closely with strong correctness and depth, but is slightly less complete (no adaptive temperature) and less clear in explanations compared to E, making it a solid but not standout option."}], "model_names": {"A": "meta-llama/llama-4-maverick", "B": "anthropic/claude-3-5-haiku", "C": "google/gemini-3.1-flash-lite-preview", "D": "x-ai/grok-3-mini-beta"}}
{"type": "stage3_complete", "winner": "A", "winner_model": "meta-llama/llama-4-maverick", "council_score": 94, "sub_scores": {"CORRECTNESS": 20, "COMPLETENESS": 20, "CLARITY": 18, "CODE_QUALITY": 18, "DEPTH": 18}, "critique": "Proposal A provides a thorough and effective tutorial that covers all essential steps for building an LLM evaluation loop, ensuring correctness and completeness. The code is syntactically valid, and the inclusion of temperature control adds depth, although the explanations could be more detailed in certain areas to enhance clarity. The overall structure is good, with meaningful variable names and appropriate error handling. For future improvements, consider adding more inline comments and explicitly discussing potential pitfalls to further guide users in avoiding common mistakes.", "chairman_full_response": "WINNER: A\nSCORE_CORRECTNESS: 20\nSCORE_COMPLETENESS: 20\nSCORE_CLARITY: 18\nSCORE_CODE_QUALITY: 18\nSCORE_DEPTH: 18\nCOUNCIL_SCORE: 94\n\nCRITIQUE:\nProposal A provides a thorough and effective tutorial that covers all essential steps for building an LLM evaluation loop, ensuring correctness and completeness. The code is syntactically valid, and the inclusion of temperature control adds depth, although the explanations could be more detailed in certain areas to enhance clarity. The overall structure is good, with meaningful variable names and appropriate error handling. For future improvements, consider adding more inline comments and explicitly discussing potential pitfalls to further guide users in avoiding common mistakes.", "chairman_model": "openai/gpt-4o-mini", "model_names": {"A": "meta-llama/llama-4-maverick", "B": "anthropic/claude-3-5-haiku", "C": "google/gemini-3.1-flash-lite-preview", "D": "x-ai/grok-3-mini-beta"}}
{"type": "iteration_result", "iteration": 45, "status": "DISCARD", "council_score": 94, "winner": "A", "best_score": 96, "commit": "de0e250", "spent_usd": 0.792837, "timestamp": "2026-04-03T15:58:35.641420Z"}
