{"type": "stage1_complete", "proposals": {"B": "# Build a Minimal LLM Evaluation Loop in Python: Systematic Experiments for ML Engineers\n\nSystematic prompt engineering requires more than manual tweaking\u2014it demands a structured, repeatable approach. This tutorial introduces a powerful yet lightweight evaluation loop that transforms experimental prompting into a rigorous optimization process.\n\n## What You Will Build\n\nA Python script that:\n1. Queries LLM models using OpenRouter\n2. Dynamically evaluates and improves outputs\n3. Implements adaptive prompt refinement\n4. Tracks experiment provenance and costs\n5. Generates reproducible optimization trails\n\n## Prerequisites\n\n- Python 3.10+\n- OpenRouter API key\n- `httpx`, `python-dotenv`, `pandas`\n- Git\n- Basic async/functional programming knowledge\n\n## Architectural Insights: Beyond Simple Iteration\n\nTraditional prompt engineering relies on intuition. Our approach introduces a principled, data-driven method:\n- Quantitative output evaluation\n- Systematic exploration of prompt space\n- Provenance tracking for each improvement\n- Cost-aware experimental design\n\n## Core Implementation Strategy\n\n```python\nimport os\nimport httpx\nimport pandas as pd\nfrom dotenv import load_dotenv\nfrom typing import Callable, Dict, Any\n\nclass LLMExperimentLoop:\n    def __init__(\n        self, \n        api_key: str, \n        model: str = \"openai/gpt-4o-mini\",\n        metric_fn: Callable[[str], float] = lambda x: len(x)\n    ):\n        self.api_key = api_key\n        self.model = model\n        self.metric_fn = metric_fn\n        self.experiment_log = []\n    \n    async def query_llm(\n        self, \n        prompt: str, \n        max_tokens: int = 1000\n    ) -> Dict[str, Any]:\n        \"\"\"\n        Robust, configurable LLM query with comprehensive error handling.\n        \n        Args:\n            prompt (str): Input prompt for LLM\n            max_tokens (int): Maximum response length\n        \n        Returns:\n            Dict containing response details\n        \"\"\"\n        async with httpx.AsyncClient() as client:\n            try:\n                response = await client.post(\n                    \"https://openrouter.ai/api/v1/chat/completions\",\n                    headers={\n                        \"Authorization\": f\"Bearer {self.api_key}\",\n                        \"Content-Type\": \"application/json\"\n                    },\n                    json={\n                        \"model\": self.model,\n                        \"messages\": [{\"role\": \"user\", \"content\": prompt}],\n                        \"max_tokens\": max_tokens\n                    },\n                    timeout=15.0\n                )\n                response.raise_for_status()\n                return response.json()\n            except httpx.RequestError as e:\n                print(f\"LLM Query Failed: {e}\")\n                return {}\n    \n    def evaluate_iteration(\n        self, \n        original: str, \n        candidate: str\n    ) -> Dict[str, Any]:\n        \"\"\"\n        Comprehensive iteration evaluation tracking multiple dimensions.\n        \n        Args:\n            original (str): Initial artifact\n            candidate (str): Proposed improvement\n        \n        Returns:\n            Detailed evaluation metrics\n        \"\"\"\n        original_score = self.metric_fn(original)\n        candidate_score = self.metric_fn(candidate)\n        \n        return {\n            \"original_score\": original_score,\n            \"candidate_score\": candidate_score,\n            \"improvement_ratio\": candidate_score / (original_score + 1e-10),\n            \"length_delta\": len(candidate) - len(original)\n        }\n    \n    async def run_experiment(\n        self, \n        initial_artifact: str, \n        max_iterations: int = 10\n    ) -> str:\n        \"\"\"\n        Adaptive prompt refinement loop with comprehensive tracking.\n        \n        Args:\n            initial_artifact (str): Starting prompt/text\n            max_iterations (int): Maximum exploration iterations\n        \n        Returns:\n            Optimized artifact\n        \"\"\"\n        current_artifact = initial_artifact\n        \n        for iteration in range(max_iterations):\n            refinement_prompt = (\n                f\"Systematically improve this text, focusing on clarity and precision:\\n\\n{current_artifact}\"\n            )\n            \n            response = await self.query_llm(refinement_prompt)\n            \n            if not response:\n                break\n            \n            candidate_artifact = response['choices'][0]['message']['content']\n            \n            evaluation = self.evaluate_iteration(\n                current_artifact, \n                candidate_artifact\n            )\n            \n            # Log experiment details\n            experiment_record = {\n                \"iteration\": iteration,\n                **evaluation,\n                \"original\": current_artifact,\n                \"candidate\": candidate_artifact\n            }\n            self.experiment_log.append(experiment_record)\n            \n            # Adaptive selection logic\n            if evaluation['improvement_ratio'] > 1.1:\n                current_artifact = candidate_artifact\n        \n        return current_artifact\n\n# Metric Function: Complexity-aware scoring\ndef advanced_metric(text: str) -> float:\n    \"\"\"\n    Multi-dimensional text quality metric.\n    \n    Considers:\n    - Lexical diversity\n    - Syntactic complexity\n    - Information density\n    \"\"\"\n    words = text.split()\n    unique_words = len(set(words))\n    avg_word_length = sum(len(word) for word in words) / len(words)\n    \n    return unique_words * avg_word_length\n\nasync def main():\n    load_dotenv()\n    \n    api_key = os.getenv(\"OPENROUTER_API_KEY\")\n    experiment = LLMExperimentLoop(\n        api_key=api_key, \n        metric_fn=advanced_metric\n    )\n    \n    initial_text = \"The quick brown fox jumps over the lazy dog.\"\n    result = await experiment.run_experiment(initial_text)\n    \n    # Save experiment log\n    pd.DataFrame(experiment.experiment_log).to_csv(\"experiment_log.csv\", index=False)\n    print(\"Optimized Artifact:\", result)\n\nif __name__ == \"__main__\":\n    import asyncio\n    asyncio.run(main())\n```\n\n## Key Innovations\n\n1. **Async Design**: Non-blocking LLM queries for efficiency\n2. **Adaptive Metric**: Multi-dimensional text quality scoring\n3. **Comprehensive Logging**: Detailed experiment tracking\n4. **Flexible Architecture**: Easily extensible evaluation strategy\n\n## Tradeoffs and Limitations\n\nWhile powerful, this approach has constraints:\n- Potential metric gaming\n- Computational and API cost overhead\n- Limited exploration compared to more sophisticated optimization techniques\n\n## When to Use\n\nIdeal for:\n- Systematic prompt engineering\n- Iterative content generation\n- Automated text refinement tasks\n\n## Future Extensions\n\n- Implement multi-model comparison\n- Add more sophisticated exploration strategies\n- Develop more nuanced evaluation metrics\n\nBy embracing a data-driven, programmatic approach, you transform prompt engineering from an art into a rigorous, repeatable science.", "C": "# Build a Minimal LLM Evaluation Loop: From Artisanal Prompts to Systematic Optimization\n\nManual prompt engineering is a bottleneck. If you are still copy-pasting outputs into a spreadsheet, you are working too hard. This tutorial demonstrates how to build a \"Greedy Hill-Climbing\" evaluation loop in Python. We will replace manual intuition with a quantitative, automated process that treats your prompt as a variable and your output quality as a measurable objective.\n\n## What You Will Build\nYou will create a Python-based experiment runner that:\n1.  **Defines an Objective Function**: A mathematical way to score LLM output.\n2.  **Implements Greedy Hill-Climbing**: An iterative process that only \"keeps\" changes that mathematically improve the output.\n3.  **Tracks State and Costs**: Persistent storage of results and token usage.\n4.  **Automates Versioning**: Automatically commits improved prompts to Git, creating a forensic trail of your optimization.\n\n## Prerequisites\n- Python 3.10+\n- `pip install httpx python-dotenv`\n- A Git repository initialized in your project folder\n- An OpenRouter API key in a `.env` file (`OPENROUTER_API_KEY=sk-or-...`)\n\n## Step 1: The Evaluation Engine\nWe use `httpx` for asynchronous-ready API calls and a structured schema for our logic.\n\n```python\nimport os\nimport httpx\nimport json\nimport subprocess\nfrom typing import Final\nfrom dotenv import load_dotenv\n\nload_dotenv()\n\n# Configuration constants\nAPI_KEY: Final = os.getenv(\"OPENROUTER_API_KEY\")\nAPI_URL: Final = \"https://openrouter.ai/api/v1/chat/completions\"\nMODEL: Final = \"openai/gpt-4o-mini\"\nMAX_ITERATIONS: Final = 15\n\ndef call_llm(prompt: str) -> str:\n    \"\"\"Invokes the LLM with error handling and timeout.\"\"\"\n    try:\n        with httpx.Client(timeout=20.0) as client:\n            response = client.post(\n                API_URL,\n                headers={\"Authorization\": f\"Bearer {API_KEY}\"},\n                json={\"model\": MODEL, \"messages\": [{\"role\": \"user\", \"content\": prompt}]}\n            )\n            response.raise_for_status()\n            return response.json()[\"choices\"][0][\"message\"][\"content\"]\n    except Exception as e:\n        print(f\"API Error: {e}\")\n        return \"\"\n```\n\n## Step 2: Defining the Metric\nAvoid \"vibe-based\" evaluation. Your metric must be deterministic. Here, we calculate a score based on a weighted combination of character length (for verbosity) and keyword density (for relevance).\n\n```python\ndef evaluate_output(text: str, target_keywords: list[str]) -> float:\n    \"\"\"\n    Deterministic score: 60% keyword coverage, 40% length target (e.g., ~300 chars).\n    \"\"\"\n    if not text: return 0.0\n    \n    # Coverage score\n    found = sum(1 for kw in target_keywords if kw.lower() in text.lower())\n    coverage = found / len(target_keywords)\n    \n    # Length penalty (target 300 chars)\n    length_score = 1.0 - abs(len(text) - 300) / 300\n    \n    return (0.6 * coverage) + (0.4 * max(0, length_score))\n```\n\n## Step 3: The Optimization Loop\nWe use a \"Greedy\" approach: If the iteration produces a higher score, we overwrite our `prompt.txt` and commit it to Git.\n\n```python\ndef run_optimization(initial_prompt: str, keywords: list[str]):\n    current_prompt = initial_prompt\n    best_score = 0.0\n\n    for i in range(MAX_ITERATIONS):\n        print(f\"--- Iteration {i} ---\")\n        \n        # 1. Mutate the prompt (LLM-assisted prompt engineering)\n        refinement_request = f\"Rewrite this prompt to be more effective at generating text containing {keywords}: {current_prompt}\"\n        new_prompt = call_llm(refinement_request)\n        \n        # 2. Test the new prompt\n        candidate_output = call_llm(new_prompt)\n        score = evaluate_output(candidate_output, keywords)\n        \n        # 3. Decision Logic\n        if score > best_score:\n            print(f\"Improvement found! Score: {score:.2f}\")\n            best_score = score\n            current_prompt = new_prompt\n            \n            with open(\"prompt.txt\", \"w\") as f: f.write(current_prompt)\n            subprocess.run([\"git\", \"add\", \"prompt.txt\"], check=True)\n            subprocess.run([\"git\", \"commit\", \"-m\", f\"Improvement iter {i}: score {score:.2f}\"], check=True)\n        else:\n            print(f\"No improvement (Score: {score:.2f}). Discarding.\")\n\nif __name__ == \"__main__\":\n    run_optimization(\"Write a summary about quantum computing.\", [\"qubit\", \"superposition\", \"entanglement\"])\n```\n\n## Why Greedy Hill-Climbing?\nThis pattern is the \"Hello World\" of automated optimization. It is **greedy** because it never looks back or explores parallel branches, and **hill-climbing** because it constantly moves toward a higher score. \n\n**Tradeoffs:**\n- **Pros**: Extremely low overhead; requires no external MLOps platforms.\n- **Cons**: Susceptible to \"local optima.\" The system might settle for a \"good enough\" prompt because it cannot jump to a radically different, potentially better strategy.\n\n## Common Pitfalls\n1. **Metric Gaming**: If your metric is too simple (e.g., word count), the model will learn to write \"fluff\" to boost its score. Always include semantic or task-specific constraints.\n2. **The \"Prompt Drift\" Problem**: Over time, the model may rewrite your prompt to be abstract, losing the original intent. Use a \"system prompt\" to lock in the core task and only optimize the \"instruction\" portion.\n3. **API Cost**: Without a budget cap, a recursive loop can deplete credits. Always implement a `MAX_ITERATIONS` guardrail.\n\n## Moving Beyond This Tutorial\nOnce you master this loop, consider these next steps:\n- **Parallelization**: Query the API with multiple \"mutations\" of the prompt at once and pick the best one.\n- **Validation Set**: Instead of testing against one output, test against a \"Golden Dataset\" of 5\u201310 inputs to ensure the prompt is robust across different scenarios.\n- **LLM-as-a-Judge**: Replace the `evaluate_output` function with a call to a stronger model (e.g., GPT-4o or Claude 3.5 Sonnet) and ask it to provide a score from 1\u201310 based on your rubric.", "D": "# Build a Minimal LLM Evaluation Loop in Python: Systematic Experiments for ML Engineers\n\nIf you're an ML engineer tired of manual prompt testing and ready to automate your experiments, this tutorial guides you through building a simple evaluation loop using the OpenRouter API. We'll focus on a lean, repeatable process that emphasizes correctness, clarity, and practical improvements, while avoiding over-engineering.\n\n## What You Will Build\n\nBy the end of this tutorial, you'll have a working Python script that implements a greedy hill-climbing loop. This loop will:\n1. Set up API calls with OpenRouter for generating LLM outputs.\n2. Evaluate outputs using a custom metric function.\n3. Decide whether to keep or discard each iteration based on score improvements.\n4. Track costs, save results to a file, and version changes with Git.\n5. Provide a foundation for scaling experiments, such as adding parallel queries or more advanced optimization.\n\nThis approach keeps things minimal, ensuring you can understand and run the code in under 10 minutes.\n\n## What You Need\n\n- Python 3.10 or higher\n- An OpenRouter API key (obtain one at openrouter.ai)\n- Install required libraries: `pip install httpx python-dotenv`\n- Git installed and configured for versioning\n\n## Step 1: Setup API Key and Constants\n\nStart by securing your API key. Create a `.env` file in your project root with the following:\n```plaintext\nOPENROUTER_API_KEY=sk-or-your-key-here\n```\n\nThis loads the key from an environment variable, avoiding hardcoding for security.\n\n```python\nimport os\nimport httpx\nfrom dotenv import load_dotenv\n\nload_dotenv()  # Loads variables from the .env file to keep secrets out of the code\n\nAPI_KEY = os.getenv(\"OPENROUTER_API_KEY\")  # Fetches the key; if missing, this will be None\nAPI_URL = \"https://openrouter.ai/api/v1/chat/completions\"  # Endpoint for OpenRouter API\nMODEL = \"openai/gpt-4o-mini\"  # Chosen model; you can swap this for others supported by OpenRouter\nMAX_ITERATIONS = 20  # Limits the loop to prevent infinite runs and control costs\nCOST_PER_TOKEN = 0.000002  # Approximate cost per token; always verify from OpenRouter's pricing page\n\ndef call_llm(prompt: str) -> str:\n    \"\"\"Makes an API call to OpenRouter to generate LLM output.\n       Includes a timeout to handle potential network issues and raises errors for failed requests.\"\"\"\n    try:\n        response = httpx.post(\n            API_URL,\n            headers={\"Authorization\": f\"Bearer {API_KEY}\"},  # Authenticates the request\n            json={\n                \"model\": MODEL,  # Specifies the model for the API call\n                \"messages\": [{\"role\": \"user\", \"content\": prompt}]  # Sends the user prompt\n            },\n            timeout=10.0  # Prevents the function from hanging indefinitely on slow responses\n        )\n        response.raise_for_status()  # Checks for HTTP errors like 4xx or 5xx\n        data = response.json()  # Parses the JSON response\n        return data[\"choices\"][0][\"message\"][\"content\"]  # Extracts and returns the generated text\n    except httpx.RequestError as e:  # Catches network-related errors\n        print(f\"API request failed: {e}\")  # Logs the error for debugging\n        return \"\"  # Returns an empty string to allow the loop to continue gracefully\n```\n\n## Step 2: Define a Metric Function\n\nThe metric function quantifies how good an LLM output is. Here's a simple one that scores based on length and lexical diversity\u2014higher scores indicate better coherence and completeness.\n\n```python\ndef score(text: str) -> float:\n    \"\"\"Calculates a score for the given text, combining length and coherence metrics.\n       Length is normalized to encourage outputs around 200 words, and coherence measures unique words.\n       Returns a value between 0 and 1 for easy comparison.\"\"\"\n    words = len(text.split())  # Splits the text into words and counts them\n    if words == 0:  # Edge case: empty text gets a score of 0\n        return 0.0\n    length_score = min(words / 200, 1.0)  # Normalizes length; caps at 1.0 to avoid rewarding overly long outputs\n    coherence_score = len(set(text.split())) / words  # Ratio of unique words to total words for diversity\n    return 0.5 * length_score + 0.5 * coherence_score  # Averages the two scores with equal weighting\n```\n\n## Step 3: Implement the Evaluation Loop with Cost Tracking and Git Versioning\n\nThe core loop runs iterations, scores outputs, and updates the artifact if improvements are found. It also tracks costs and uses Git for versioning.\n\n```python\nimport json\nimport subprocess\n\ndef main():\n    \"\"\"Runs the evaluation loop: generates candidates, scores them, and updates the artifact if better.\"\"\"\n    best_score = 0.0  # Initializes the best score; starts low to ensure the first valid output is kept\n    with open(\"artifact.txt\", \"r\") as f:  # Reads the initial artifact from file\n        artifact = f.read().strip()\n    total_cost = 0.0  # Tracks cumulative costs across iterations\n    results = []  # List to store results for later saving\n\n    # Ensure a Git repository exists for versioning\n    try:\n        subprocess.run([\"git\", \"rev-parse\"], check=True, capture_output=True)  # Checks if Git repo is initialized\n    except subprocess.CalledProcessError:\n        subprocess.run([\"git\", \"init\"], check=True)  # Initializes a new repo if needed\n        subprocess.run([\"git\", \"add\", \"artifact.txt\"], check=True)\n        subprocess.run([\"git\", \"commit\", \"-m\", \"Initial artifact\"], check=True)\n\n    for i in range(MAX_ITERATIONS):\n        prompt = f\"Improve this text:\\n\\n{artifact}\"  # Constructs a prompt for the LLM\n        candidate = call_llm(prompt)  # Calls the LLM to generate a new output\n        \n        if not candidate:  # Skips if the API call failed\n            print(f\"Iter {i}: Skipped due to API error\")\n            continue\n        \n        new_score = score(candidate)  # Evaluates the candidate's score\n        # Estimates cost based on token usage; this is a simplification and should be refined\n        total_cost += COST_PER_TOKEN * (len(prompt.split()) + len(candidate.split()))  \n        \n        if new_score > best_score:  # Greedy logic: keep if it's an improvement\n            best_score = new_score\n            artifact = candidate.strip()  # Updates the artifact\n            with open(\"artifact.txt\", \"w\") as f:\n                f.write(artifact)  # Saves the new artifact to file\n            subprocess.run([\"git\", \"add\", \"artifact.txt\"], check=True)\n            subprocess.run([\"git\", \"commit\", \"-m\", f\"Iter {i}: Improved artifact\"], check=True)\n            print(f\"Iter {i}: KEEP  score={new_score:.2f}\")\n            results.append({\"iteration\": i, \"score\": new_score, \"action\": \"KEEP\", \"cost\": total_cost})\n        else:\n            print(f\"Iter {i}: DISCARD  score={new_score:.2f}  best={best_score:.2f}\")\n            results.append({\"iteration\": i, \"score\": new_score, \"action\": \"DISCARD\", \"cost\": total_cost})\n    \n    # Saves all results to a JSON file for analysis and reproducibility\n    with open(\"results.json\", \"w\") as f:\n        json.dump(results, f, indent=2)\n\nif __name__ == \"__main__\":\n    main()\n```\n\n## Step 4: Run Your Evaluation Loop\n\nExecute the script with:  \n```bash\npython loop.py\n```\n\nYou'll see output indicating which iterations result in keeps or discards, such as:  \n```\nIter 0: KEEP  score=0.85\nIter 1: DISCARD  score=0.81  best=0.85\n```\n\nThe artifact file updates and commits to Git automatically, with results logged in `results.json`.\n\n## Why Greedy Hill-Climbing and When to Stop?\n\nGreedy hill-climbing works by always selecting the immediate best improvement, making it ideal for quick, iterative refinements in LLM outputs. It's simple to implement and computationally efficient, but it risks getting stuck in local optima if the solution space is complex. For instance, if early improvements lead to a dead end, the loop might not explore alternative paths.\n\nA key design decision is when to stop the loop. In this implementation, we use a fixed `MAX_ITERATIONS` to prevent runaway costs, but you might stop based on other criteria, like score plateaus (e.