{"type": "stage1_complete", "proposals": {"A": "# Build a Minimal LLM Evaluation Loop in Python: Systematic Experiments for ML Engineers\n\nIf you want to stop manually testing prompts and start running systematic experiments, an evaluation loop is the right tool. This tutorial shows you how to build one using the OpenRouter API, covering essential steps from API key setup to saving results and providing deeper insights into design decisions and potential pitfalls.\n\n## What You Will Build\n\nBy the end of this tutorial, you will have a working Python script that:\n1. Makes LLM API calls using OpenRouter\n2. Scores the output using a custom metric\n3. Implements a greedy hill-climbing loop to improve the output\n4. Saves the best artifact to a file\n5. Tracks costs and iterations\n6. Versions improvements using git\n7. Supports parallel queries to multiple models for comparison\n\n## What You Need\n\n- Python 3.10+\n- An OpenRouter API key (sign up at openrouter.ai)\n- `httpx` installed: `pip install httpx`\n- `python-dotenv` installed: `pip install python-dotenv`\n- Git installed and configured\n\n## Step 1: Setup API Key and Constants\n\nFirst, create a `.env` file in your project root with your OpenRouter API key:\n```plaintext\nOPENROUTER_API_KEY=sk-or-your-key-here\n```\n\n```python\nimport os\nimport httpx\nfrom dotenv import load_dotenv\nimport asyncio\nimport json\nimport subprocess\nfrom typing import List, Dict\n\nload_dotenv()  # Load environment variables from .env\n\nAPI_KEY = os.getenv(\"OPENROUTER_API_KEY\")\nAPI_URL = \"https://openrouter.ai/api/v1/chat/completions\"\nMODELS = [\"openai/gpt-4o-mini\", \"meta-llama/llama-3.1-8b-instruct\"]\nMAX_ITERATIONS = 20\nCOST_PER_TOKEN = 0.000002  # Example cost, check OpenRouter pricing\n\nasync def call_llm(model: str, prompt: str) -> str:\n    \"\"\"\n    Makes an asynchronous call to the LLM API.\n\n    Args:\n    - model (str): The model to use for the LLM call.\n    - prompt (str): The prompt to send to the LLM.\n\n    Returns:\n    - str: The response from the LLM.\n    \"\"\"\n    try:\n        async with httpx.AsyncClient() as client:\n            response = await client.post(\n                API_URL,\n                headers={\"Authorization\": f\"Bearer {API_KEY}\"},\n                json={\n                    \"model\": model,\n                    \"messages\": [{\"role\": \"user\", \"content\": prompt}]\n                },\n                timeout=10.0\n            )\n            response.raise_for_status()\n            data = response.json()\n            return data[\"choices\"][0][\"message\"][\"content\"]\n    except httpx.RequestError as e:\n        print(f\"API request failed: {e}\")\n        return \"\"\n\ndef score(text: str) -> float:\n    \"\"\"\n    Scores the given text based on length and coherence.\n\n    Args:\n    - text (str): The text to score.\n\n    Returns:\n    - float: The score of the text.\n    \"\"\"\n    words = len(text.split())\n    length_score = min(words / 200, 1.0)\n    coherence_score = len(set(text.split())) / words if words > 0 else 0\n    return 0.5 * length_score + 0.5 * coherence_score\n\nasync def main():\n    best_score = 0.0\n    artifact = open(\"artifact.txt\").read().strip()\n    total_cost = 0.0\n    results: List[Dict] = []\n\n    try:\n        subprocess.run([\"git\", \"rev-parse\"], check=True, capture_output=True)\n    except subprocess.CalledProcessError:\n        subprocess.run([\"git\", \"init\"], check=True)\n        subprocess.run([\"git\", \"add\", \"artifact.txt\"], check=True)\n        subprocess.run([\"git\", \"commit\", \"-m\", \"Initial artifact\"], check=True)\n\n    for i in range(MAX_ITERATIONS):\n        prompt = f\"Improve this text:\\n\\n{artifact}\"\n        tasks = [call_llm(model, prompt) for model in MODELS]\n        candidates = await asyncio.gather(*tasks)\n        \n        best_candidate = None\n        best_model_score = 0.0\n        \n        for model, candidate in zip(MODELS, candidates):\n            if not candidate:  \n                continue\n            \n            new_score = score(candidate)\n            total_cost += COST_PER_TOKEN * (len(prompt) + len(candidate))  \n            \n            if new_score > best_model_score:\n                best_model_score = new_score\n                best_candidate = candidate\n        \n        if best_candidate and best_model_score > best_score:\n            best_score = best_model_score\n            artifact = best_candidate.strip()\n            with open(\"artifact.txt\", \"w\") as f:\n                f.write(artifact)\n            subprocess.run([\"git\", \"add\", \"artifact.txt\"], check=True)\n            subprocess.run([\"git\", \"commit\", \"-m\", f\"Iter {i}: Improved artifact\"], check=True)\n            print(f\"Iter {i}: KEEP  score={best_model_score:.2f}\")\n            results.append({\"iteration\": i, \"score\": best_model_score, \"action\": \"KEEP\", \"cost\": total_cost})\n        else:\n            print(f\"Iter {i}: DISCARD  best_score={best_score:.2f}\")\n            results.append({\"iteration\": i, \"score\": best_model_score if best_candidate else 0, \"action\": \"DISCARD\", \"cost\": total_cost})\n\n    with open(\"results.json\", \"w\") as f:\n        json.dump(results, f, indent=2)\n\n    # Save cost summary\n    with open(\"cost_summary.txt\", \"w\") as f:\n        f.write(f\"Total cost: {total_cost:.4f}\\n\")\n\nif __name__ == \"__main__\":\n    asyncio.run(main())\n```\n\n## Step 2: Run Your Evaluation Loop\n\n```bash\npython loop.py\n```\n\nYou should see output like:\n\n```\nIter 0: KEEP  score=0.85\nIter 1: DISCARD  best_score=0.85\nIter 2: KEEP  score=0.91\nIter 3: DISCARD  best_score=0.91\n```\n\nThe artifact file is updated and committed to git whenever a better version is found, and results are saved to `results.json`. A cost summary is also saved to `cost_summary.txt`.\n\n## Why Greedy Hill-Climbing with Parallel Model Queries?\n\nGreedy hill-climbing is simple and effective for many optimization tasks. By querying multiple models in parallel, you can compare their performance directly within the same loop, providing valuable insights into model selection for your specific task. This approach helps in identifying the most suitable model while optimizing the output.\n\n## Tradeoffs and Limitations\n\nWhile greedy hill-climbing with parallel queries is straightforward and effective, it may still get stuck in local optima. Consider adding randomness or more sophisticated optimization techniques for complex tasks. Additionally, be mindful of the cost implications of querying multiple models.\n\n## Advanced Error Handling and Debugging\n\nTo improve robustness, consider implementing retry mechanisms for API calls and more detailed logging for debugging purposes. This can help in diagnosing issues and improving the overall reliability of the evaluation loop.\n\n## Common Pitfalls\n\n1. **Metric Gaming**: Ensure your metric accurately reflects the desired outcome. A poorly designed metric can lead to suboptimal or misleading results.\n2. **Circular Feedback**: Be cautious when using LLM outputs to evaluate other LLM outputs. This can create feedback loops that degrade performance over time.\n3. **Runaway Costs**: Always track costs and consider implementing a budget constraint to prevent unexpected expenses.\n\n## Worked Example\n\nLet's say you start with a simple artifact: \"The quick brown fox jumps over the lazy dog.\" After running the evaluation loop, the artifact might improve to: \"The quick brown fox jumps over the lazy dog, demonstrating a classic example of a pangram that uses all the letters of the alphabet efficiently.\" The score improves from 0.4 to 0.8 as the output becomes more coherent and contextually relevant.\n\n## Extending the Evaluation Loop\n\nTo further enhance the evaluation loop, consider adding support for more advanced optimization strategies, such as simulated annealing or genetic algorithms. Additionally, integrating more comprehensive logging and visualization tools can provide deeper insights into the optimization process.\n\nBy following this tutorial, you've built a systematic evaluation loop for LLM experiments that not only optimizes your prompts but also versions your improvements using git and compares multiple models. This foundation allows you to scale your experiments, track progress, and optimize your prompts effectively.", "B": "# Build a Minimal LLM Evaluation Loop in Python: Systematic Experiments for ML Engineers\n\nIterative prompt engineering is a powerful technique for improving AI outputs, but manual testing is time-consuming and inconsistent. This tutorial introduces a systematic approach to LLM optimization using a flexible, extensible Python framework.\n\n## What You Will Build\n\nA Python script that:\n1. Dynamically generates and evaluates LLM prompts\n2. Uses a multi-objective scoring system\n3. Implements adaptive optimization strategies\n4. Tracks experimental provenance\n5. Supports extensible evaluation metrics\n\n## Prerequisite Knowledge\n\n- Python 3.10+ with async programming experience\n- Familiarity with LLM APIs\n- Basic understanding of optimization techniques\n\n## Core Implementation: Adaptive Prompt Optimization Framework\n\n```python\nimport os\nimport asyncio\nimport httpx\nimport json\nimport subprocess\nfrom typing import List, Dict, Callable\nfrom dotenv import load_dotenv\n\nload_dotenv()\n\nclass LLMExperimentLoop:\n    def __init__(\n        self, \n        api_key: str, \n        models: List[str], \n        metric_functions: List[Callable[[str], float]]\n    ):\n        self.api_key = api_key\n        self.models = models\n        self.metric_functions = metric_functions\n        self.api_url = \"https://openrouter.ai/api/v1/chat/completions\"\n        self.max_iterations = 50\n        self.exploration_rate = 0.2\n\n    async def call_model(self, model: str, prompt: str) -> str:\n        try:\n            async with httpx.AsyncClient() as client:\n                response = await client.post(\n                    self.api_url,\n                    headers={\"Authorization\": f\"Bearer {self.api_key}\"},\n                    json={\n                        \"model\": model,\n                        \"messages\": [{\"role\": \"user\", \"content\": prompt}]\n                    },\n                    timeout=15.0\n                )\n                response.raise_for_status()\n                return response.json()[\"choices\"][0][\"message\"][\"content\"]\n        except httpx.RequestError as e:\n            print(f\"Model query failed: {model} - {e}\")\n            return \"\"\n\n    def compute_composite_score(self, text: str) -> float:\n        \"\"\"Calculate a multi-dimensional score using provided metric functions.\"\"\"\n        scores = [metric(text) for metric in self.metric_functions]\n        return sum(scores) / len(scores)\n\n    async def run_experiment(self, initial_artifact: str) -> Dict:\n        current_artifact = initial_artifact\n        best_score = self.compute_composite_score(current_artifact)\n        experiment_results = []\n\n        for iteration in range(self.max_iterations):\n            # Probabilistic exploration vs exploitation\n            if iteration == 0 or (iteration > 0 and random.random() < self.exploration_rate):\n                prompt = f\"Creatively transform and improve this text, maintaining its core essence:\\n\\n{current_artifact}\"\n            else:\n                prompt = f\"Systematically refine this text to maximize its quality:\\n\\n{current_artifact}\"\n\n            tasks = [self.call_model(model, prompt) for model in self.models]\n            candidates = await asyncio.gather(*tasks)\n\n            best_candidate = max(\n                candidates, \n                key=lambda x: self.compute_composite_score(x) if x else float('-inf')\n            )\n\n            new_score = self.compute_composite_score(best_candidate)\n\n            if new_score > best_score:\n                current_artifact = best_candidate\n                best_score = new_score\n                \n                # Version control integration\n                with open(\"artifact.txt\", \"w\") as f:\n                    f.write(current_artifact)\n                subprocess.run(\n                    [\"git\", \"add\", \"artifact.txt\"], \n                    check=True, capture_output=True\n                )\n                subprocess.run(\n                    [\"git\", \"commit\", \"-m\", f\"Iteration {iteration}: Score improvement\"], \n                    check=True, capture_output=True\n                )\n\n            experiment_results.append({\n                \"iteration\": iteration,\n                \"score\": new_score,\n                \"artifact_length\": len(current_artifact)\n            })\n\n        return {\n            \"best_artifact\": current_artifact,\n            \"best_score\": best_score,\n            \"results\": experiment_results\n        }\n\ndef length_metric(text: str) -> float:\n    \"\"\"Reward concise, focused text.\"\"\"\n    words = len(text.split())\n    return min(1.0, max(0.1, 1 - abs(words - 100) / 200))\n\ndef coherence_metric(text: str) -> float:\n    \"\"\"Assess text coherence and semantic consistency.\"\"\"\n    unique_words = len(set(text.split()))\n    total_words = len(text.split())\n    return unique_words / total_words if total_words > 0 else 0\n\nasync def main():\n    api_key = os.getenv(\"OPENROUTER_API_KEY\")\n    experiment = LLMExperimentLoop(\n        api_key=api_key,\n        models=[\"openai/gpt-4o-mini\", \"anthropic/claude-3-haiku\"],\n        metric_functions=[length_metric, coherence_metric]\n    )\n    \n    initial_text = \"Initial draft of an experimental text.\"\n    result = await experiment.run_experiment(initial_text)\n    \n    with open(\"experiment_log.json\", \"w\") as f:\n        json.dump(result, f, indent=2)\n\nif __name__ == \"__main__\":\n    asyncio.run(main())\n```\n\n## Key Innovations\n\n1. **Multi-Metric Scoring**: Uses multiple evaluation functions to create a more nuanced scoring system\n2. **Adaptive Exploration**: Dynamically adjusts exploration vs. exploitation strategy\n3. **Extensible Design**: Easy to add new models, metrics, and optimization strategies\n\n## Experimental Considerations\n\n- Metrics can be game-able; continuously validate their effectiveness\n- Monitor computational and API costs\n- Be prepared to adjust exploration parameters\n\n## Next Steps\n\n- Implement more sophisticated optimization algorithms\n- Add robust logging and error handling\n- Create visualization tools for experiment tracking\n\nBy mastering this framework, you'll transform ad-hoc prompt engineering into a systematic, data-driven process.", "D": "# Build a Minimal LLM Evaluation Loop in Python: Systematic Experiments for ML Engineers\n\nIf you're an ML engineer tired of manual prompt testing and ready to automate your LLM experiments, this tutorial provides a lean, step-by-step guide to building a minimal evaluation loop using the OpenRouter API. We'll focus on creating a script that systematically improves outputs through greedy hill-climbing, while keeping things simple and understandable in under 10 minutes.\n\n## What You Will Build\n\nBy the end of this tutorial, you'll have a Python script that:\n1. Sets up API calls with OpenRouter for multiple models.\n2. Evaluates outputs using a custom metric.\n3. Runs a greedy hill-climbing loop to iteratively improve an initial artifact.\n4. Decides whether to keep or discard each iteration based on score improvements.\n5. Tracks costs, saves results to a file, and uses Git for versioning.\n6. Queries models in parallel for efficient comparisons.\n7. Includes safeguards like error handling and cost monitoring.\n\nThis setup is designed for quick implementation, allowing you to adapt it to your workflows without overwhelming complexity.\n\n## What You Need\n\n- Python 3.10 or higher.\n- An OpenRouter API key (obtain one from openrouter.ai).\n- Install required libraries: `pip install httpx python-dotenv`.\n- Git installed and configured on your system.\n\n## Step 1: Setup API Key and Constants\n\nStart by creating a `.env` file in your project directory with your API key:\n\n```plaintext\nOPENROUTER_API_KEY=sk-or-your-key-here\n```\n\nThis loads your key securely from an environment variable, avoiding hardcoding risks.\n\nHere's the complete, runnable code example:\n\n```python\nimport os\nimport httpx\nfrom dotenv import load_dotenv\nimport asyncio\nimport json\nimport subprocess\n\nload_dotenv()  # Load environment variables from .env\n\nAPI_KEY: str = os.getenv(\"OPENROUTER_API_KEY\")\nAPI_URL: str = \"https://openrouter.ai/api/v1/chat/completions\"\nMODELS: list[str] = [\"openai/gpt-4o-mini\", \"meta-llama/llama-3.1-8b-instruct\"]\nMAX_ITERATIONS: int = 20\nCOST_PER_TOKEN: float = 0.000002  # Approximate cost; verify with OpenRouter's pricing\n\nasync def call_llm(model: str, prompt: str) -> str:\n    \"\"\"Make an asynchronous API call to OpenRouter and return the response content.\"\"\"\n    try:\n        async with httpx.AsyncClient() as client:\n            response = await client.post(\n                API_URL,\n                headers={\"Authorization\": f\"Bearer {API_KEY}\"},\n                json={\n                    \"model\": model,\n                    \"messages\": [{\"role\": \"user\", \"content\": prompt}]\n                },\n                timeout=10.0  # Prevents hangs from slow responses\n            )\n            response.raise_for_status()\n            data = response.json()\n            return data[\"choices\"][0][\"message\"][\"content\"]\n    except httpx.RequestError as e:\n        print(f\"API request failed: {e}\")\n        return \"\"  # Graceful failure handling\n\ndef score(text: str) -> float:\n    \"\"\"Calculate a simple score based on text length and coherence.\"\"\"\n    words = len(text.split())\n    if words == 0:\n        return 0.0\n    length_score = min(words / 200, 1.0)  # Penalizes overly long or short text\n    coherence_score = len(set(text.split())) / words  # Measures unique words vs. repetition\n    return 0.5 * length_score + 0.5 * coherence_score\n\nasync def main() -> None:\n    best_score: float = 0.0\n    artifact: str = open(\"artifact.txt\", \"r\").read().strip()  # Load initial artifact\n    total_cost: float = 0.0\n    results: list[dict] = []\n\n    # Initialize Git if not already a repository\n    try:\n        subprocess.run([\"git\", \"rev-parse\"], check=True, capture_output=True)\n    except subprocess.CalledProcessError:\n        subprocess.run([\"git\", \"init\"], check=True)\n        subprocess.run([\"git\", \"add\", \"artifact.txt\"], check=True)\n        subprocess.run([\"git\", \"commit\", \"-m\", \"Initial artifact\"], check=True)\n\n    for i in range(MAX_ITERATIONS):\n        prompt: str = f\"Improve this text:\\n\\n{artifact}\"\n        tasks = [call_llm(model, prompt) for model in MODELS]\n        candidates: list[str] = await asyncio.gather(*tasks)  # Parallel execution\n        \n        best_candidate: str | None = None\n        best_model_score: float = 0.0\n        \n        for model, candidate in zip(MODELS, candidates):\n            if not candidate:\n                continue  # Skip failed calls\n            new_score: float = score(candidate)\n            # Estimate cost based on tokens (prompt + response, simplified)\n            total_cost += COST_PER_TOKEN * (len(prompt.split()) + len(candidate.split()))\n            \n            if new_score > best_model_score:\n                best_model_score = new_score\n                best_candidate = candidate\n        \n        if best_candidate and best_model_score > best_score:\n            best_score = best_model_score\n            artifact = best_candidate.strip()\n            with open(\"artifact.txt\", \"w\") as f:\n                f.write(artifact)\n            subprocess.run([\"git\", \"add\", \"artifact.txt\"], check=True)\n            subprocess.run([\"git\", \"commit\", \"-m\", f\"Iter {i}: Improved artifact\"], check=True)\n            print(f\"Iter {i}: KEEP  score={best_model_score:.2f}\")\n            results.append({\"iteration\": i, \"score\": best_model_score, \"action\": \"KEEP\", \"cost\": total_cost})\n        else:\n            print(f\"Iter {i}: DISCARD  best_score={best_score:.2f}\")\n            results.append({\"iteration\": i, \"score\": best_model_score if best_candidate else 0, \"action\": \"DISCARD\", \"cost\": total_cost})\n\n    with open(\"results.tsv\", \"w\") as f:  # Save results to a TSV file for easy analysis\n        f.write(\"iteration\\taction\\tscore\\tcost\\n\")\n        for result in results:\n            f.write(f\"{result['iteration']}\\t{result['action']}\\t{result['score']:.2f}\\t{result['cost']:.4f}\\n\")\n\nif __name__ == \"__main__\":\n    asyncio.run(main())\n```\n\n## Step 2: Run Your Evaluation Loop\n\nExecute the script with:\n\n```bash\npython loop.py\n```\n\nYou'll see output indicating keeps and discards, such as:\n\n```\nIter 0: KEEP  score=0.85\nIter 1: DISCARD  best_score=0.85\n```\n\nThe script updates `artifact.txt`, commits changes via Git, and saves detailed results to `results.tsv`.\n\n## Why Greedy Hill-Climbing with Parallel Model Queries?\n\nGreedy hill-climbing selects the best immediate improvement, making it ideal for quick iterations in resource-constrained environments. It's computationally efficient and easy to implement, as it avoids complex global searches. By running queries in parallel via `asyncio.gather()`, we reduce wait times and enable direct model comparisons, helping identify which LLM performs best for your task. However, this method risks local optima, where the loop might plateau without finding a global best.\n\nWe use subprocesses for Git interactions to keep the main script clean and handle exte