{"type": "stage2_complete", "rankings": [{"letter": "A", "display_letter": "E", "avg_position": 0.0, "votes": 4}, {"letter": "D", "display_letter": "B", "avg_position": 1.5, "votes": 4}, {"letter": "B", "display_letter": "A", "avg_position": 1.75, "votes": 4}, {"letter": "C", "display_letter": "D", "avg_position": 3.0, "votes": 4}, {"letter": "E", "display_letter": "C", "avg_position": 3.75, "votes": 4}], "shuffle_map": {"E": "A", "A": "B", "D": "C", "B": "D", "C": "E"}, "votes": [{"model": "meta-llama/llama-4-maverick", "display_ranking": "E > A > D > B > C", "original_ranking": "A > B > C > D > E", "reasoning": "To evaluate the given versions of the tutorial on building a minimal LLM evaluation loop in Python, we will assess them based on the provided criteria: Correctness, Completeness, Clarity, Code Quality, and Depth.\n\n## Step 1: Evaluate Version E\nVersion E provides a comprehensive tutorial that covers all essential steps, including API key setup, making LLM calls, defining a metric function, implementing KEEP/DISCARD logic, running the loop, and saving results. It also includes features like cost tracking, parallel model queries, and git versioning. The code is well-structured, and the tutorial explains key design decisions.\n\n## Step 2: Evaluate Version A\nVersion A introduces a probabilistic exploration strategy instead of pure greedy hill-climbing, which is a significant deviation from the other versions. It includes features like temperature decay for probabilistic selection, which adds depth to the optimization process. However, the core structure and clarity are similar to Version E.\n\n## Step 3: Evaluate Version D\nVersion D focuses on a minimal, automated evaluation loop with a greedy hill-climbing strategy. It emphasizes practicality and includes features like git versioning and cost tracking. The tutorial is clear and well-structured, but it lacks some features present in Versions E and A, such as parallel queries to multiple models.\n\n## Step 4: Evaluate Version B\nVersion B is similar to Version C but includes saving results to a TSV file instead of JSON. It covers all essential steps and provides a clear, well-structured tutorial. The code is idiomatic and safe, with basic error handling.\n\n## Step 5: Evaluate Version C\nVersion C provides a solid foundation for the evaluation loop, covering API key setup, LLM calls, scoring, and git versioning. It is clear and well-structured but lacks some features like cost tracking and saving results in a user-friendly format.\n\n## Step 6: Compare the Versions\n- Version E is comprehensive, covering all essential steps and including advanced features like parallel model queries and cost tracking. It is clear, well-structured, and explains key design decisions.\n- Version A adds depth with its probabilistic exploration strategy, making it a strong candidate.\n- Version D is practical and focuses on minimalism but lacks some advanced features.\n- Version B is clear and well-structured, with a useful feature like saving results to TSV.\n- Version C is a solid foundation but lacks some features.\n\n## Step 7: Rank the Versions\nBased on the evaluation criteria:\n- **Correctness**: All versions have syntactically valid code, but some handle errors better than others.\n- **Completeness**: Versions E and A are more complete due to their additional features.\n- **Clarity**: Versions E, B, and C are clear and well-structured.\n- **Code Quality**: Versions E and B have high code quality due to their idiomatic Python and error handling.\n- **Depth**: Versions E and A provide more depth in their explanations and approaches.\n\n## Step 8: Final Ranking\nVersion E stands out due to its comprehensiveness, clarity, and the balance of features and explanations. Version A is a close second due to its innovative probabilistic exploration strategy. Version D is practical and clear but lacks some features. Versions B and C are solid but have fewer distinguishing features."}, {"model": "anthropic/claude-3-5-haiku", "display_ranking": "E > B > A > D > C", "original_ranking": "A > D > B > C > E", "reasoning": "Evaluation of Versions:\n\nVersion E (Best):\n- Most comprehensive tutorial with the most complete feature set\n- Provides deep explanations of design choices and tradeoffs\n- Includes advanced strategies like adaptive retry and parallel model queries\n- Exceptional depth in explaining architectural decisions\n\nVersion B (Second Best):\n- Strong tutorial with clear, practical implementation\n- Good balance of technical detail and explanatory prose\n- Includes TSV result tracking and thoughtful error handling\n- Slightly less comprehensive than Version E, but very solid\n\nVersion A (Third):\n- Introduces probabilistic exploration as a novel approach\n- Good explanation of why randomness matters in optimization\n- Less comprehensive than E and B in overall tutorial structure\n- Slightly more experimental in its optimization strategy\n\nVersion D (Fourth):\n- More philosophical approach to the problem\n- Strong on explaining conceptual challenges of LLM optimization\n- Less complete implementation compared to other versions\n- Lacks some practical implementation details\n\nVersion C (Worst):\n- Very similar to Version E, but less detailed\n- Lacks the depth and nuanced explanations of the best versions\n- Seems like a slightly simplified draft of Version E\n- Minimal additional insights compared to other versions"}, {"model": "google/gemini-3.1-flash-lite-preview", "display_ranking": "E > B > A > D > C", "original_ranking": "A > D > B > C > E", "reasoning": "To evaluate these tutorials, I focused on the completeness of the code (including robust error handling and proper environment setup), the clarity of the pedagogical approach, and the quality of the technical explanations.\n\n*   **Version E:** This is the most complete and robust version; it includes essential features like adaptive retry logic, cost tracking, git versioning, and parallel processing, while maintaining clear, actionable code.\n*   **Version B:** This is a very strong runner-up that provides excellent clarity and includes useful extras like TSV output for analysis and explicit handling of the first iteration, though it lacks the retry logic found in E.\n*   **Version A:** This version introduces an interesting exploration strategy (probabilistic selection), but the complexity of the math/logic might be slightly beyond the \"minimal\" requirement, and the code is slightly less defensive than E.\n*   **Version D:** This version is well-written and conceptually sound, but the code is less \"production-ready\" (e.g., missing retry logic, less robust error handling) and the prompt injection in the loop is a bit simplistic.\n*   **Version C:** This is a solid, functional baseline but lacks the extra polish, error handling (specifically retries), and depth of the other versions, making it the least comprehensive.\n\n**Reasoning:**\n*   **Version E:** Best overall; includes adaptive retries, thorough error handling, and a professional structure that matches the \"ML engineer\" persona perfectly.\n*   **Version B:** Excellent clarity and practical additions like TSV logging, though it misses the robustness of retry logic.\n*   **Version A:** Highly creative approach to the loop, but slightly over-engineered for a \"minimal\" tutorial relative to the more standard greedy implementations.\n*   **Version D:** Good pedagogical tone, but the code implementation is less defensive than the top versions.\n*   **Version C:** A perfectly functional \"Hello World\" of loops, but lacks the depth and defensive coding practices of the other versions."}, {"model": "x-ai/grok-3-mini-beta", "display_ranking": "E > B > A > C > D", "original_ranking": "A > D > B > E > C", "reasoning": "Below is my evaluation and ranking of the versions based on the specified criteria (Correctness, Completeness, Clarity, Code Quality, and Depth). I scored each version out of 100 points total and judged solely on quality, without considering authorship.\n\n- **Version E**: This version excels in overall quality with strong correctness due to robust error handling and retries, comprehensive coverage of all steps including advanced features like adaptive retry, clear structure with inline explanations, high code quality through type hints and meaningful variables, and good depth by justifying design choices and including tradeoffs; total score: 92/100.\n- **Version A**: It introduces an innovative probabilistic approach but has minor correctness issues in selection logic; it's complete with good coverage of iterations and tracking, clear but slightly confusing for intermediate users due to the new strategy, solid code quality with basic error handling, and strong depth in explaining exploration tradeoffs; total score: 88/100.\n- **Version D**: The code is mostly correct but lacks refined error handling, providing good completeness for core steps while missing some result-saving details, moderate clarity with concise explanations, acceptable code quality using TypedDict, and excellent depth in discussing architecture and pitfalls; total score: 85/100.\n- **Version B**: It demonstrates high correctness with improved timeouts and error handling, excellent completeness by adding TSV saving and cost tracking, clear step-by-step guidance, good code quality with secure practices, and solid depth in explaining stopping conditions and tradeoffs; total score: 90/100.\n- **Version C**: Similar to E but with slightly lower correctness due to basic error handling, adequate completeness covering essentials but without extras like adaptive retry, clear presentation with explanations, decent code quality though less polished, and good depth with justifications and examples; total score: 86/100."}], "model_names": {"A": "meta-llama/llama-4-maverick", "B": "anthropic/claude-3-5-haiku", "C": "google/gemini-3.1-flash-lite-preview", "D": "x-ai/grok-3-mini-beta"}}
{"type": "stage3_complete", "winner": "A", "winner_model": "meta-llama/llama-4-maverick", "council_score": 90, "sub_scores": {"CORRECTNESS": 18, "COMPLETENESS": 19, "CLARITY": 18, "CODE_QUALITY": 17, "DEPTH": 18}, "critique": "Proposal A effectively outlines a systematic approach for building a minimal LLM evaluation loop, with a strong focus on completeness and clarity. The tutorial includes essential steps such as API key setup, metric definition, and error handling, making it accessible to the target audience. However, it could improve by providing more depth on design decisions and trade-offs, particularly regarding the greedy hill-climbing strategy. Future iterations might explore integrating more complex optimization techniques or adaptive mechanisms to enhance robustness.", "chairman_full_response": "WINNER: A\nSCORE_CORRECTNESS: 18\nSCORE_COMPLETENESS: 19\nSCORE_CLARITY: 18\nSCORE_CODE_QUALITY: 17\nSCORE_DEPTH: 18\nCOUNCIL_SCORE: 90\n\nCRITIQUE:\nProposal A effectively outlines a systematic approach for building a minimal LLM evaluation loop, with a strong focus on completeness and clarity. The tutorial includes essential steps such as API key setup, metric definition, and error handling, making it accessible to the target audience. However, it could improve by providing more depth on design decisions and trade-offs, particularly regarding the greedy hill-climbing strategy. Future iterations might explore integrating more complex optimization techniques or adaptive mechanisms to enhance robustness.", "chairman_model": "openai/gpt-4o-mini", "model_names": {"A": "meta-llama/llama-4-maverick", "B": "anthropic/claude-3-5-haiku", "C": "google/gemini-3.1-flash-lite-preview", "D": "x-ai/grok-3-mini-beta"}}
{"type": "iteration_result", "iteration": 48, "status": "DISCARD", "council_score": 90, "winner": "A", "best_score": 96, "commit": "de0e250", "spent_usd": 0.888856, "timestamp": "2026-04-03T16:05:37.706717Z"}
{"type": "run_end", "reason": "plateau", "iteration": 48, "best_score": 96, "spent_usd": 0.888856, "timestamp": "2026-04-03T16:05:37.707103Z"}
