{"type": "stage1_complete", "proposals": {"A": "# Build a Minimal LLM Evaluation Loop in Python: Systematic Experiments for ML Engineers\n\nIf you want to stop manually testing prompts and start running systematic experiments, an evaluation loop is the right tool. This tutorial shows you how to build one using the OpenRouter API, covering essential steps from API key setup to saving results.\n\n## What You Will Build\n\nBy the end of this tutorial, you will have a working Python script that:\n1. Makes LLM API calls using OpenRouter\n2. Scores the output using a custom metric\n3. Implements a greedy hill-climbing loop to improve the output\n4. Saves the best artifact to a file\n5. Tracks costs and iterations\n6. Versions improvements using git\n7. Supports parallel queries to multiple models for comparison\n8. Incorporates adaptive temperature control for more diverse outputs\n\n## What You Need\n\n- Python 3.10+\n- An OpenRouter API key (sign up at openrouter.ai)\n- `httpx` installed: `pip install httpx`\n- `python-dotenv` installed: `pip install python-dotenv`\n- Git installed and configured\n\n## Step 1: Setup API Key and Constants\n\nFirst, create a `.env` file in your project root with your OpenRouter API key:\n```plaintext\nOPENROUTER_API_KEY=sk-or-your-key-here\n```\n\n```python\nimport os\nimport httpx\nfrom dotenv import load_dotenv\nimport asyncio\nimport json\nimport subprocess\n\nload_dotenv()  # Load environment variables from .env\n\nAPI_KEY = os.getenv(\"OPENROUTER_API_KEY\")\nAPI_URL = \"https://openrouter.ai/api/v1/chat/completions\"\nMODELS = [\"openai/gpt-4o-mini\", \"meta-llama/llama-3.1-8b-instruct\"]\nMAX_ITERATIONS = 20\nCOST_PER_TOKEN = 0.000002  # Example cost, check OpenRouter pricing\nINITIAL_TEMPERATURE = 0.7\nTEMPERATURE_ADJUSTMENT = 0.1\n\nasync def call_llm(model: str, prompt: str, temperature: float) -> str:\n    try:\n        async with httpx.AsyncClient() as client:\n            response = await client.post(\n                API_URL,\n                headers={\"Authorization\": f\"Bearer {API_KEY}\"},\n                json={\n                    \"model\": model,\n                    \"messages\": [{\"role\": \"user\", \"content\": prompt}],\n                    \"temperature\": temperature\n                },\n                timeout=10.0\n            )\n            response.raise_for_status()\n            data = response.json()\n            return data[\"choices\"][0][\"message\"][\"content\"]\n    except httpx.RequestError as e:\n        print(f\"API request failed: {e}\")\n        return \"\"\n\ndef score(text: str) -> float:\n    words = len(text.split())\n    length_score = min(words / 200, 1.0)\n    coherence_score = len(set(text.split())) / words if words > 0 else 0\n    return 0.5 * length_score + 0.5 * coherence_score\n\nasync def main():\n    best_score = 0.0\n    artifact = open(\"artifact.txt\").read().strip()\n    total_cost = 0.0\n    results = []\n    temperature = INITIAL_TEMPERATURE\n\n    try:\n        subprocess.run([\"git\", \"rev-parse\"], check=True, capture_output=True)\n    except subprocess.CalledProcessError:\n        subprocess.run([\"git\", \"init\"], check=True)\n        subprocess.run([\"git\", \"add\", \"artifact.txt\"], check=True)\n        subprocess.run([\"git\", \"commit\", \"-m\", \"Initial artifact\"], check=True)\n\n    for i in range(MAX_ITERATIONS):\n        prompt = f\"Improve this text:\\n\\n{artifact}\"\n        tasks = [call_llm(model, prompt, temperature) for model in MODELS]\n        candidates = await asyncio.gather(*tasks)\n        \n        best_candidate = None\n        best_model_score = 0.0\n        \n        for model, candidate in zip(MODELS, candidates):\n            if not candidate:  \n                continue\n            \n            new_score = score(candidate)\n            total_cost += COST_PER_TOKEN * (len(prompt) + len(candidate))  \n            \n            if new_score > best_model_score:\n                best_model_score = new_score\n                best_candidate = candidate\n        \n        if best_candidate and best_model_score > best_score:\n            best_score = best_model_score\n            artifact = best_candidate.strip()\n            with open(\"artifact.txt\", \"w\") as f:\n                f.write(artifact)\n            subprocess.run([\"git\", \"add\", \"artifact.txt\"], check=True)\n            subprocess.run([\"git\", \"commit\", \"-m\", f\"Iter {i}: Improved artifact\"], check=True)\n            print(f\"Iter {i}: KEEP  score={best_model_score:.2f}\")\n            results.append({\"iteration\": i, \"score\": best_model_score, \"action\": \"KEEP\", \"cost\": total_cost, \"temperature\": temperature})\n            temperature = max(0.1, temperature - TEMPERATURE_ADJUSTMENT)  # Decrease temperature on improvement\n        else:\n            print(f\"Iter {i}: DISCARD  best_score={best_score:.2f}\")\n            results.append({\"iteration\": i, \"score\": best_model_score if best_candidate else 0, \"action\": \"DISCARD\", \"cost\": total_cost, \"temperature\": temperature})\n            temperature = min(1.0, temperature + TEMPERATURE_ADJUSTMENT)  # Increase temperature on discard\n\n    with open(\"results.json\", \"w\") as f:\n        json.dump(results, f, indent=2)\n\nif __name__ == \"__main__\":\n    asyncio.run(main())\n```\n\n## Step 2: Run Your Evaluation Loop\n\n```bash\npython loop.py\n```\n\nYou should see output like:\n\n```\nIter 0: KEEP  score=0.85\nIter 1: DISCARD  best_score=0.85\nIter 2: KEEP  score=0.91\nIter 3: DISCARD  best_score=0.91\n```\n\nThe artifact file is updated and committed to git whenever a better version is found, and results are saved to `results.json`.\n\n## Why Greedy Hill-Climbing with Adaptive Temperature and Parallel Model Queries?\n\nGreedy hill-climbing is simple and effective for many optimization tasks. By incorporating adaptive temperature control, the loop can explore more diverse outputs when stuck and converge more precisely when nearing an optimal solution. Querying multiple models in parallel allows for direct comparison of their performance within the same loop, providing valuable insights into model selection for your specific task.\n\n## Tradeoffs and Limitations\n\nWhile greedy hill-climbing with adaptive temperature and parallel queries is straightforward and effective, it may still get stuck in local optima. Consider adding randomness or more sophisticated optimization techniques for complex tasks. Be mindful of the cost implications of querying multiple models and the potential need for adjusting the temperature adjustment factor based on the task.\n\n## Common Pitfalls\n\n1. **Metric Gaming**: Ensure your metric accurately reflects the desired outcome. A poorly designed metric can lead to suboptimal or misleading results.\n2. **Circular Feedback**: Be cautious when using LLM outputs to evaluate other LLM outputs. This can create feedback loops that degrade performance over time.\n3. **Runaway Costs**: Always track costs and consider implementing a budget constraint to prevent unexpected expenses.\n\n## Worked Example\n\nLet's say you start with a simple artifact: \"The quick brown fox jumps over the lazy dog.\" After running the evaluation loop, the artifact might improve to: \"The quick brown fox jumps over the lazy dog, demonstrating a classic example of a pangram that uses all the letters of the alphabet efficiently.\" The score improves from 0.4 to 0.8 as the output becomes more coherent and contextually relevant.\n\n## What's Next\n\nThis basic loop works, but you can enhance it further:\n- Implement more sophisticated optimization strategies like simulated annealing\n- Add more comprehensive error handling and logging mechanisms\n- Experiment with different model combinations to find the best fit for your task\n\nBy following this tutorial, you've built a systematic evaluation loop for LLM experiments that not only optimizes your prompts but also versions your improvements using git and compares multiple models. This foundation allows you to scale your experiments, track progress, and optimize your prompts effectively.", "B": "# Build a Minimal LLM Evaluation Loop in Python: Systematic Experiments for ML Engineers\n\nTransforming prompt engineering from an artisanal craft to a systematic discipline requires powerful experimentation tools. This tutorial introduces a flexible LLM evaluation framework that combines intelligent searching, cost tracking, and iterative improvement.\n\n## What You Will Build\n\nBy the end of this tutorial, you'll create a Python script that:\n1. Conducts multi-model comparative experiments\n2. Implements an adaptive optimization strategy\n3. Tracks performance across iterations\n4. Manages computational and financial budgets\n5. Provides comprehensive experiment logging\n6. Supports extensible evaluation metrics\n\n## Adaptive Optimization Strategy: Thompson Sampling\n\nUnlike traditional greedy hill-climbing, this implementation introduces Thompson Sampling \u2014 a probabilistic approach that balances exploration and exploitation during model optimization.\n\n## Prerequisites\n\n- Python 3.10+\n- OpenRouter API key\n- `httpx`, `python-dotenv`, `numpy` installed\n- Git configured\n\n## Code Implementation\n\n```python\nimport os\nimport httpx\nimport asyncio\nimport numpy as np\nfrom dotenv import load_dotenv\nfrom typing import List, Dict, Callable\nimport json\nimport subprocess\n\nload_dotenv()\n\nclass LLMExperiment:\n    def __init__(\n        self, \n        api_key: str, \n        models: List[str],\n        metric_fn: Callable[[str], float],\n        budget_limit: float = 5.0\n    ):\n        self.api_key = api_key\n        self.models = models\n        self.metric_fn = metric_fn\n        self.budget_limit = budget_limit\n        \n        # Thompson Sampling parameters\n        self.model_rewards = {model: 0.0 for model in models}\n        self.model_attempts = {model: 0 for model in models}\n        \n    async def call_model(self, model: str, prompt: str) -> str:\n        try:\n            async with httpx.AsyncClient() as client:\n                response = await client.post(\n                    \"https://openrouter.ai/api/v1/chat/completions\",\n                    headers={\"Authorization\": f\"Bearer {self.api_key}\"},\n                    json={\n                        \"model\": model,\n                        \"messages\": [{\"role\": \"user\", \"content\": prompt}]\n                    },\n                    timeout=10.0\n                )\n                response.raise_for_status()\n                return response.json()[\"choices\"][0][\"message\"][\"content\"]\n        except Exception as e:\n            print(f\"Model call failed for {model}: {e}\")\n            return \"\"\n\n    def select_model(self) -> str:\n        # Thompson Sampling model selection\n        def sample_reward(model):\n            alpha = max(1 + self.model_rewards[model], 1)\n            beta = max(1 + self.model_attempts[model] - self.model_rewards[model], 1)\n            return np.random.beta(alpha, beta)\n        \n        return max(self.models, key=sample_reward)\n\n    async def run_experiment(self, initial_artifact: str, max_iterations: int = 20):\n        current_artifact = initial_artifact\n        total_cost = 0.0\n        results = []\n\n        for iteration in range(max_iterations):\n            if total_cost >= self.budget_limit:\n                break\n\n            selected_model = self.select_model()\n            response = await self.call_model(selected_model, current_artifact)\n            \n            if not response:\n                continue\n\n            score = self.metric_fn(response)\n            \n            # Update Thompson Sampling parameters\n            self.model_attempts[selected_model] += 1\n            if score > self.metric_fn(current_artifact):\n                self.model_rewards[selected_model] += 1\n                current_artifact = response\n\n            total_cost += self._estimate_cost(response)\n            \n            results.append({\n                \"iteration\": iteration,\n                \"model\": selected_model,\n                \"score\": score,\n                \"total_cost\": total_cost\n            })\n\n        return current_artifact, results\n\n    def _estimate_cost(self, text: str, cost_per_token: float = 0.000002) -> float:\n        return len(text.split()) * cost_per_token\n\ndef quality_metric(text: str) -> float:\n    \"\"\"Custom quality metric combining length and unique word diversity\"\"\"\n    words = text.split()\n    length_score = min(len(words) / 200, 1.0)\n    unique_words = len(set(words))\n    diversity_score = unique_words / len(words) if words else 0\n    return 0.6 * length_score + 0.4 * diversity_score\n\nasync def main():\n    API_KEY = os.getenv(\"OPENROUTER_API_KEY\")\n    MODELS = [\"openai/gpt-4o-mini\", \"meta-llama/llama-3.1-8b-instruct\"]\n    \n    experiment = LLMExperiment(\n        api_key=API_KEY, \n        models=MODELS, \n        metric_fn=quality_metric,\n        budget_limit=2.0\n    )\n    \n    initial_text = open(\"artifact.txt\").read().strip()\n    final_artifact, experiment_results = await experiment.run_experiment(initial_text)\n    \n    with open(\"experiment_log.json\", \"w\") as f:\n        json.dump(experiment_results, f, indent=2)\n    \n    with open(\"artifact.txt\", \"w\") as f:\n        f.write(final_artifact)\n\nif __name__ == \"__main__\":\n    asyncio.run(main())\n```\n\n## Key Innovations\n\n### Thompson Sampling for Model Selection\nTraditional approaches use static model selection. Thompson Sampling dynamically balances exploration and exploitation, allowing the system to learn which models perform best for specific tasks.\n\n### Adaptive Budget Management\nThe experiment includes a configurable budget limit, preventing runaway computational costs while providing flexibility for different use cases.\n\n### Extensible Quality Metric\nThe `quality_metric` function demonstrates a composable approach to evaluating LLM outputs, combining multiple scoring dimensions.\n\n## Tradeoffs and Considerations\n\nWhile Thompson Sampling offers more sophisticated model selection, it introduces additional computational overhead. For extremely large-scale experiments, simpler selection strategies might be more appropriate.\n\n## Common Pitfalls\n\n1. **Over-fitting to Metrics**: Ensure your quality metric genuinely captures desired output characteristics.\n2. **Computational Overhead**: Thompson Sampling requires more processing than greedy approaches.\n3. **Model Variance**: Different models may have significantly different response characteristics.\n\n## Next Steps\n\n- Implement more complex multi-dimensional metrics\n- Add logging and visualization of model performance\n- Create strategies for handling model-specific quirks\n\nBy mastering this adaptive experimentation approach, you'll transform prompt engineering from guesswork into a rigorous, data-driven discipline.", "C": "# Build a Minimal LLM Evaluation Loop in Python: From Manual Hacks to Systematic Optimization\n\nMost engineers start by pasting prompts into a web UI, tweaking them, and hoping for the best. This \"artisanal\" approach fails as soon as you need to handle complex edge cases or regression testing. To scale, you need a systematic evaluation loop. \n\nThis tutorial shows you how to build a minimal, automated evaluation loop in Python. We will move beyond one-off experiments by creating a script that treats your prompt as a variable, your output as an artifact, and your LLM as an optimization engine.\n\n## What You Will Build\nYou will create a Python script that:\n1. **Defines a \"Gold Standard\" Metric:** A programmatic way to score output quality.\n2. **Implements an Iterative Loop:** Automatically generates and evaluates prompt variations.\n3. **Uses Greedy Hill-Climbing:** Keeps only the changes that improve your metric.\n4. **Maintains Version History:** Uses Git to track every successful \"KEEP\" action.\n5. **Tracks Costs:** Monitors token usage so your experimentation doesn't break the bank.\n\n## The Prerequisites\n- Python 3.10+\n- An [OpenRouter](https://openrouter.ai/) API key\n- `pip install httpx python-dotenv`\n\nCreate a `.env` file in your directory: `OPENROUTER_API_KEY=sk-or-your-key-here`.\n\n## The Evaluation Loop Implementation\n\n```python\nimport os\nimport httpx\nimport asyncio\nimport json\nimport subprocess\nfrom typing import Dict, Any\nfrom dotenv import load_dotenv\n\nload_dotenv()\n\n# Configuration\nAPI_KEY = os.getenv(\"OPENROUTER_API_KEY\")\nAPI_URL = \"https://openrouter.ai/api/v1/chat/completions\"\nMODEL = \"openai/gpt-4o-mini\"\nMAX_ITERATIONS = 10\n\ndef calculate_score(text: str) -> float:\n    \"\"\"\n    Custom metric: Simplicity and clarity.\n    In a real scenario, replace this with regex checks, \n    LLM-as-a-judge, or unit test assertions.\n    \"\"\"\n    score = 0.0\n    if len(text) < 500: score += 0.5\n    if \"error\" not in text.lower(): score += 0.5\n    return score\n\nasync def call_llm(prompt: str) -> str:\n    async with httpx.AsyncClient() as client:\n        try:\n            resp = await client.post(\n                API_URL,\n                headers={\"Authorization\": f\"Bearer {API_KEY}\"},\n                json={\"model\": MODEL, \"messages\": [{\"role\": \"user\", \"content\": prompt}]},\n                timeout=30.0\n            )\n            resp.raise_for_status()\n            return resp.json()[\"choices\"][0][\"message\"][\"content\"]\n        except Exception as e:\n            print(f\"API Error: {e}\")\n            return \"\"\n\nasync def main():\n    current_artifact = \"Initial draft of our product documentation.\"\n    best_score = calculate_score(current_artifact)\n    \n    for i in range(MAX_ITERATIONS):\n        print(f\"--- Iteration {i} ---\")\n        prompt = f\"Rewrite this text to be more professional:\\n\\n{current_artifact}\"\n        candidate = await call_llm(prompt)\n        \n        if not candidate: continue\n        \n        new_score = calculate_score(candidate)\n        \n        if new_score > best_score:\n            print(f\"KEEP: Score improved {best_score} -> {new_score}\")\n            best_score = new_score\n            current_artifact = candidate\n            with open(\"artifact.txt\", \"w\") as f: f.write(current_artifact)\n            subprocess.run([\"git\", \"add\", \"artifact.txt\"])\n            subprocess.run([\"git\", \"commit\", \"-m\", f\"Improvement at iter {i}\"])\n        else:\n            print(f\"DISCARD: Score {new_score} not better than {best_score}\")\n\nif __name__ == \"__main__\":\n    asyncio.run(main())\n```\n\n## Why This Architecture?\n\n### Greedy Hill-Climbing\nWe use a greedy approach because it is the \"Hello World\" of optimization. It assumes that if a change improves the score, it is a step in the right direction. While simple, it prevents \"regression drift,\" where a model slowly degrades over time due to bad prompt injections.\n\n### The Subprocess Pattern\nWe use `subprocess` to call Git because it forces you to treat your prompt/output history as source code. By committing every \"KEEP\" decision, you gain an audit trail of *how* your prompt reached its current state.\n\n### Why Not Over-Engineer?\nFrameworks like LangSmith or Promptfoo are powerful, but they often hide the logic in abstractions. By building the loop yourself, you understand exactly how the metrics are calculated and where the costs are incurred.\n\n## Common Pitfalls to Avoid\n\n1. **Metric Overfitting:** If your metric is too simple (e.g., \"contains the word 'success'\"), the model will learn to spam that word. Ensure your metric represents the actual desired outcome.\n2. **The \"LLM-as-a-Judge\" Loop:** Using an LLM to score the output of another LLM can lead to circular feedback. Always anchor your metrics in deterministic checks (length, valid JSON, specific keywords) whenever possible.\n3. **Token Exhaustion:** If your loop runs indefinitely, you will hit API limits. Always set `MAX_ITERATIONS` and monitor your OpenRouter dashboard.\n\n## When to Move Beyond This\nThis script is a starting point. Once your loop is working, consider these upgrades:\n- **Parallel Evaluation:** Run evaluation against a \"golden dataset\" of 20+ inputs rather than just one.\n- **Simulated Annealing:** Occasionally accept a \"worse\" result to jump out of local optima.\n- **LLM-as-a-Judge:** Once you have a baseline, use a larger model (e.g., Claude 3.5 Sonnet) as a validator to score the smaller model's outputs.\n\nBy automating your evaluation, you stop guessing and start measuring. You are no longer just writing prompts; you are engineering a system.", "D": "# Build a Minimal LLM Evaluation Loop in Python: Systematic Experiments for ML Engineers\n\nIf you're an ML engineer tired of manual prompt testing and ready to automate your LLM experiments, this tutorial guides you through building a simple evaluation loop using the OpenRouter API. We'll focus on a lean, repeatable implementation that emphasizes correctness, efficiency, and ease of understanding, allowing you to optimize outputs without over-engineering.\n\n## What You Will Build\n\nBy the end of this tutorial, you'll have a Python script that:\n1. Sets up API calls with secure key handling.\n2. Evaluates LLM outputs using a custom metric.\n3. Runs a greedy hill-climbing loop with parallel model queries.\n4. Decides whether to keep or discard improvements based on scores.\n5. Tracks costs and saves results to a TSV file for easy analysis.\n6. Commits changes to Git for versioning.\n7. Includes safeguards like error handling and cost monitoring.\n\nThis setup provides a foundational tool for systematic experimentation, helping you refine prompts while keeping things minimal and extensible.\n\n## What You Need\n\n- Python 3.10 or high