{"type": "stage1_complete", "proposals": {"A": "# Build a Minimal LLM Evaluation Loop in Python: Systematic Experiments for ML Engineers\n\nIf you want to stop manually testing prompts and start running systematic experiments, an evaluation loop is the right tool. This tutorial shows you how to build one using the OpenRouter API, covering essential steps from API key setup to saving results.\n\n## What You Will Build\n\nBy the end of this tutorial, you will have a working Python script that:\n1. Makes LLM API calls using OpenRouter\n2. Scores the output using a custom metric\n3. Implements a greedy hill-climbing loop to improve the output\n4. Saves the best artifact to a file\n5. Tracks costs and iterations\n6. Versions improvements using git\n7. Supports parallel queries to multiple models for comparison\n\n## What You Need\n\n- Python 3.10+\n- An OpenRouter API key (sign up at openrouter.ai)\n- `httpx` installed: `pip install httpx`\n- `python-dotenv` installed: `pip install python-dotenv`\n- Git installed and configured\n\n## Step 1: Setup API Key and Constants\n\nFirst, create a `.env` file in your project root with your OpenRouter API key:\n```plaintext\nOPENROUTER_API_KEY=sk-or-your-key-here\n```\n\n```python\nimport os\nimport httpx\nfrom dotenv import load_dotenv\nimport asyncio\nimport json\nimport subprocess\nfrom typing import List, Dict\n\nload_dotenv()  # Load environment variables from .env\n\nAPI_KEY = os.getenv(\"OPENROUTER_API_KEY\")\nAPI_URL = \"https://openrouter.ai/api/v1/chat/completions\"\nMODELS = [\"openai/gpt-4o-mini\", \"meta-llama/llama-3.1-8b-instruct\"]\nMAX_ITERATIONS = 20\nCOST_PER_TOKEN = 0.000002  # Example cost, check OpenRouter pricing\n\nasync def call_llm(model: str, prompt: str) -> str:\n    \"\"\"\n    Makes an asynchronous call to the LLM API.\n\n    Args:\n    - model (str): The model to use for the LLM call.\n    - prompt (str): The prompt to send to the LLM.\n\n    Returns:\n    - str: The content of the LLM response.\n    \"\"\"\n    try:\n        async with httpx.AsyncClient() as client:\n            response = await client.post(\n                API_URL,\n                headers={\"Authorization\": f\"Bearer {API_KEY}\"},\n                json={\n                    \"model\": model,\n                    \"messages\": [{\"role\": \"user\", \"content\": prompt}]\n                },\n                timeout=10.0\n            )\n            response.raise_for_status()\n            data = response.json()\n            return data[\"choices\"][0][\"message\"][\"content\"]\n    except httpx.RequestError as e:\n        print(f\"API request failed: {e}\")\n        return \"\"\n\ndef score(text: str) -> float:\n    \"\"\"\n    Scores the given text based on length and coherence.\n\n    Args:\n    - text (str): The text to score.\n\n    Returns:\n    - float: The score of the text.\n    \"\"\"\n    words = len(text.split())\n    length_score = min(words / 200, 1.0)\n    coherence_score = len(set(text.split())) / words if words > 0 else 0\n    return 0.5 * length_score + 0.5 * coherence_score\n\nasync def main():\n    best_score = 0.0\n    artifact = open(\"artifact.txt\").read().strip()\n    total_cost = 0.0\n    results: List[Dict] = []\n\n    try:\n        subprocess.run([\"git\", \"rev-parse\"], check=True, capture_output=True)\n    except subprocess.CalledProcessError:\n        subprocess.run([\"git\", \"init\"], check=True)\n        subprocess.run([\"git\", \"add\", \"artifact.txt\"], check=True)\n        subprocess.run([\"git\", \"commit\", \"-m\", \"Initial artifact\"], check=True)\n\n    for i in range(MAX_ITERATIONS):\n        prompt = f\"Improve this text:\\n\\n{artifact}\"\n        tasks = [call_llm(model, prompt) for model in MODELS]\n        candidates = await asyncio.gather(*tasks)\n        \n        best_candidate = None\n        best_model_score = 0.0\n        \n        for model, candidate in zip(MODELS, candidates):\n            if not candidate:  \n                continue\n            \n            new_score = score(candidate)\n            total_cost += COST_PER_TOKEN * (len(prompt) + len(candidate))  \n            \n            if new_score > best_model_score:\n                best_model_score = new_score\n                best_candidate = candidate\n        \n        if best_candidate and best_model_score > best_score:\n            best_score = best_model_score\n            artifact = best_candidate.strip()\n            with open(\"artifact.txt\", \"w\") as f:\n                f.write(artifact)\n            subprocess.run([\"git\", \"add\", \"artifact.txt\"], check=True)\n            subprocess.run([\"git\", \"commit\", \"-m\", f\"Iter {i}: Improved artifact\"], check=True)\n            print(f\"Iter {i}: KEEP  score={best_model_score:.2f}\")\n            results.append({\"iteration\": i, \"score\": best_model_score, \"action\": \"KEEP\", \"cost\": total_cost})\n        else:\n            print(f\"Iter {i}: DISCARD  best_score={best_score:.2f}\")\n            results.append({\"iteration\": i, \"score\": best_model_score if best_candidate else 0, \"action\": \"DISCARD\", \"cost\": total_cost})\n\n    with open(\"results.json\", \"w\") as f:\n        json.dump(results, f, indent=2)\n\n    # Visualize results\n    try:\n        import matplotlib.pyplot as plt\n        iterations = [r['iteration'] for r in results]\n        scores = [r['score'] for r in results]\n        plt.plot(iterations, scores)\n        plt.xlabel('Iteration')\n        plt.ylabel('Score')\n        plt.title('Evaluation Loop Progress')\n        plt.savefig('progress.png')\n        print(\"Progress graph saved to progress.png\")\n    except ImportError:\n        print(\"Matplotlib not found, skipping graph generation\")\n\nif __name__ == \"__main__\":\n    asyncio.run(main())\n```\n\n## Step 2: Run Your Evaluation Loop\n\n```bash\npython loop.py\n```\n\nYou should see output like:\n\n```\nIter 0: KEEP  score=0.85\nIter 1: DISCARD  best_score=0.85\nIter 2: KEEP  score=0.91\nIter 3: DISCARD  best_score=0.91\n```\n\nThe artifact file is updated and committed to git whenever a better version is found, and results are saved to `results.json`. A progress graph is also generated and saved to `progress.png` if matplotlib is installed.\n\n## Why Greedy Hill-Climbing with Parallel Model Queries?\n\nGreedy hill-climbing is simple and effective for many optimization tasks. By querying multiple models in parallel, you can compare their performance directly within the same loop, providing valuable insights into model selection for your specific task. This approach helps in identifying the most suitable model while optimizing the output.\n\n## Tradeoffs and Limitations\n\nWhile greedy hill-climbing with parallel queries is straightforward and effective, it may still get stuck in local optima. Consider adding randomness or more sophisticated optimization techniques for complex tasks. Additionally, be mindful of the cost implications of querying multiple models.\n\n## Common Pitfalls\n\n1. **Metric Gaming**: Ensure your metric accurately reflects the desired outcome. A poorly designed metric can lead to suboptimal or misleading results.\n2. **Circular Feedback**: Be cautious when using LLM outputs to evaluate other LLM outputs. This can create feedback loops that degrade performance over time.\n3. **Runaway Costs**: Always track costs and consider implementing a budget constraint to prevent unexpected expenses.\n\n## Worked Example\n\nLet's say you start with a simple artifact: \"The quick brown fox jumps over the lazy dog.\" After running the evaluation loop, the artifact might improve to: \"The quick brown fox jumps over the lazy dog, demonstrating a classic example of a pangram that uses all the letters of the alphabet efficiently.\" The score improves from 0.4 to 0.8 as the output becomes more coherent and contextually relevant.\n\n## What's Next\n\nThis basic loop works, but you can enhance it further:\n- Implement more sophisticated optimization strategies like simulated annealing\n- Add more comprehensive error handling and logging mechanisms\n- Experiment with different model combinations to find the best fit for your task\n- Use the generated progress graph to analyze the optimization process and identify potential issues early.\n\nBy following this tutorial, you've built a systematic evaluation loop for LLM experiments that not only optimizes your prompts but also versions your improvements using git, compares multiple models, and visualizes the optimization progress. This foundation allows you to scale your experiments, track progress, and optimize your prompts effectively.", "B": "# Build a Minimal LLM Evaluation Loop in Python: Systematic Experiments for ML Engineers\n\nIf you want to stop manually testing prompts and start running systematic experiments, an evaluation loop is the right tool. This tutorial shows you how to build a robust, adaptable optimization framework using the OpenRouter API.\n\n## What You Will Build\n\nBy the end of this tutorial, you will have a Python script that:\n1. Makes LLM API calls using OpenRouter\n2. Scores the output using a configurable metric\n3. Implements a multi-strategy optimization loop\n4. Supports dynamic model selection and fallback mechanisms\n5. Tracks experiment provenance and performance\n6. Handles real-world complexity beyond simple hill-climbing\n\n## What You Need\n\n- Python 3.10+\n- An OpenRouter API key (sign up at openrouter.ai)\n- `httpx` installed: `pip install httpx`\n- `python-dotenv` installed: `pip install python-dotenv`\n- Git installed and configured\n\n## Step 1: Setup API Key and Constants\n\nFirst, create a `.env` file in your project root with your OpenRouter API key:\n```plaintext\nOPENROUTER_API_KEY=sk-or-your-key-here\n```\n\n```python\nimport os\nimport httpx\nfrom dotenv import load_dotenv\nimport asyncio\nimport json\nimport subprocess\nfrom typing import List, Dict, Optional, Callable\nfrom dataclasses import dataclass, asdict\n\nload_dotenv()  # Load environment variables from .env\n\n@dataclass\nclass ExperimentConfig:\n    api_key: str = os.getenv(\"OPENROUTER_API_KEY\")\n    api_url: str = \"https://openrouter.ai/api/v1/chat/completions\"\n    models: List[str] = [\"openai/gpt-4o-mini\", \"meta-llama/llama-3.1-8b-instruct\"]\n    max_iterations: int = 20\n    temperature: float = 0.7\n    strategies: List[str] = [\"expand\", \"compress\", \"rephrase\", \"specialize\"]\n\nclass LLMEvaluator:\n    def __init__(self, config: ExperimentConfig):\n        self.config = config\n\n    async def call_llm(self, model: str, prompt: str, strategy: str = \"default\") -> Optional[str]:\n        \"\"\"Make a robust LLM API call with strategy-specific prompting.\"\"\"\n        strategy_prompts = {\n            \"expand\": f\"Expand and elaborate on this text: {prompt}\",\n            \"compress\": f\"Compress this text while preserving core meaning: {prompt}\",\n            \"rephrase\": f\"Rephrase this text to improve clarity: {prompt}\",\n            \"specialize\": f\"Specialize this text for a technical audience: {prompt}\",\n            \"default\": prompt\n        }\n\n        try:\n            async with httpx.AsyncClient() as client:\n                response = await client.post(\n                    self.config.api_url,\n                    headers={\"Authorization\": f\"Bearer {self.config.api_key}\"},\n                    json={\n                        \"model\": model,\n                        \"messages\": [{\"role\": \"user\", \"content\": strategy_prompts.get(strategy, prompt)}],\n                        \"temperature\": self.config.temperature\n                    },\n                    timeout=15.0\n                )\n                response.raise_for_status()\n                return response.json()[\"choices\"][0][\"message\"][\"content\"]\n        except Exception as e:\n            print(f\"API call failed for {model} with strategy {strategy}: {e}\")\n            return None\n\n    def score_text(self, text: str, metric_fn: Optional[Callable[[str], float]] = None) -> float:\n        \"\"\"Flexible text scoring with optional custom metric.\"\"\"\n        if metric_fn:\n            return metric_fn(text)\n        \n        # Default multi-dimensional scoring\n        words = text.split()\n        word_count = len(words)\n        unique_words = len(set(words))\n        complexity = len([w for w in words if len(w) > 5]) / word_count if word_count > 0 else 0\n        \n        return (\n            0.4 * (word_count / 200) +  # Length normalization\n            0.3 * (unique_words / word_count) +  # Lexical diversity\n            0.3 * complexity  # Complexity factor\n        )\n\n    async def run_experiment(self, initial_artifact: str) -> Dict:\n        \"\"\"Multi-strategy optimization loop with fallback and tracking.\"\"\"\n        best_artifact = initial_artifact\n        best_score = self.score_text(initial_artifact)\n        experiment_results = []\n\n        for iteration in range(self.config.max_iterations):\n            tasks = [\n                self.call_llm(model, best_artifact, strategy)\n                for model in self.config.models\n                for strategy in self.config.strategies\n            ]\n            \n            candidates = await asyncio.gather(*tasks)\n            candidates = [c for c in candidates if c is not None]\n\n            if not candidates:\n                break\n\n            scored_candidates = [\n                (candidate, self.score_text(candidate))\n                for candidate in candidates\n            ]\n\n            best_candidate = max(scored_candidates, key=lambda x: x[1])\n\n            if best_candidate[1] > best_score:\n                best_artifact = best_candidate[0]\n                best_score = best_candidate[1]\n                \n                with open(\"artifact.txt\", \"w\") as f:\n                    f.write(best_artifact)\n                \n                subprocess.run([\"git\", \"add\", \"artifact.txt\"], check=True)\n                subprocess.run([\"git\", \"commit\", \"-m\", f\"Iter {iteration}: Improved artifact\"], check=True)\n\n            experiment_results.append({\n                \"iteration\": iteration,\n                \"best_score\": best_score,\n                \"strategies_tried\": self.config.strategies\n            })\n\n        return {\n            \"final_artifact\": best_artifact,\n            \"final_score\": best_score,\n            \"results\": experiment_results\n        }\n\nasync def main():\n    config = ExperimentConfig()\n    evaluator = LLMEvaluator(config)\n    \n    with open(\"artifact.txt\", \"r\") as f:\n        initial_artifact = f.read().strip()\n\n    result = await evaluator.run_experiment(initial_artifact)\n    \n    with open(\"experiment_log.json\", \"w\") as f:\n        json.dump(result, f, indent=2)\n\nif __name__ == \"__main__\":\n    asyncio.run(main())\n```\n\n## Key Enhancements\n\n### Multi-Strategy Optimization\nUnlike traditional hill-climbing, this implementation supports multiple optimization strategies: expansion, compression, rephrasing, and specialization. This approach increases the likelihood of finding better artifacts by exploring diverse transformations.\n\n### Flexible Scoring\nThe `score_text()` method allows custom metric functions while providing a sophisticated default scoring mechanism that considers word count, lexical diversity, and complexity.\n\n### Robust Error Handling\nThe implementation includes comprehensive error handling for API calls, ensuring the experiment continues even if individual model queries fail.\n\n## Tradeoffs and Considerations\n\nWhile powerful, this approach has limitations:\n- Increased computational cost from parallel queries\n- Potential for generating less coherent text with multiple strategies\n- Dependency on the quality of initial artifact and chosen models\n\n## Next Steps\n\nPotential future enhancements include:\n- Adding more sophisticated optimization strategies\n- Implementing cost tracking\n- Creating more nuanced scoring mechanisms\n- Supporting custom model configurations\n\nThis tutorial provides a flexible, extensible framework for systematic LLM experimentation that goes beyond simple prompt testing.", "C": "# Build a Minimal LLM Evaluation Loop: From Manual Prompts to Systematic Iteration\n\nIf you are still manually copy-pasting prompts into a web UI, you are bottlenecking your own development. Systematic evaluation is the difference between \"guessing why a prompt works\" and \"knowing what changes improve performance.\"\n\nIn this guide, we will build a production-ready, minimal LLM evaluation loop in Python. We will use **greedy hill-climbing**: a technique where the system iteratively proposes changes, evaluates them against a metric, and only keeps those that improve the score.\n\n## What You Will Build\n\nYour evaluation loop will:\n1. **Automate:** Run multiple LLM iterations without human intervention.\n2. **Evaluate:** Use a programmatic metric to judge \"quality\" objectively.\n3. **Version:** Automatically commit successful prompts to Git, creating an audit trail of your optimization process.\n4. **Compare:** Query multiple models simultaneously to find the best candidate for your specific task.\n\n## Prerequisites\n\n- **Python 3.10+**\n- **OpenRouter API Key:** Get one at [openrouter.ai](https://openrouter.ai).\n- **Dependencies:** `pip install httpx python-dotenv`\n- **Setup:** Create a `.env` file containing `OPENROUTER_API_KEY=sk-or-your-key-here`.\n\n## The Implementation\n\nThis script uses `asyncio` for parallel model querying and `subprocess` to manage version control.\n\n```python\nimport os\nimport httpx\nimport asyncio\nimport json\nimport subprocess\nfrom typing import TypedDict\nfrom dotenv import load_dotenv\n\nload_dotenv()\n\n# Configuration Constants\nAPI_URL = \"https://openrouter.ai/api/v1/chat/completions\"\nMODELS = [\"openai/gpt-4o-mini\", \"meta-llama/llama-3.1-8b-instruct\"]\nMAX_ITERATIONS = 5\n\nclass Result(TypedDict):\n    iteration: int\n    score: float\n    action: str\n\nasync def call_llm(model: str, prompt: str) -> str:\n    \"\"\"Invokes the OpenRouter API with basic error handling.\"\"\"\n    async with httpx.AsyncClient() as client:\n        try:\n            response = await client.post(\n                API_URL,\n                headers={\"Authorization\": f\"Bearer {os.getenv('OPENROUTER_API_KEY')}\"},\n                json={\"model\": model, \"messages\": [{\"role\": \"user\", \"content\": prompt}]},\n                timeout=20.0\n            )\n            response.raise_for_status()\n            return response.json()[\"choices\"][0][\"message\"][\"content\"]\n        except Exception as e:\n            return f\"Error: {str(e)}\"\n\ndef evaluate_metric(text: str) -> float:\n    \"\"\"\n    Define your success criteria here. \n    Example: Reward length and absence of common hallucinations.\n    \"\"\"\n    score = 0.0\n    if len(text) > 50: score += 0.5\n    if \"Error\" not in text: score += 0.5\n    return score\n\nasync def run_loop():\n    artifact = \"Initial prompt: Summarize the history of space travel.\"\n    best_score = evaluate_metric(artifact)\n    results = []\n\n    for i in range(MAX_ITERATIONS):\n        print(f\"--- Iteration {i} ---\")\n        prompt = f\"Improve this prompt to be more specific and actionable: {artifact}\"\n        \n        # Parallel execution of multiple models\n        tasks = [call_llm(model, prompt) for model in MODELS]\n        candidates = await asyncio.gather(*tasks)\n        \n        best_candidate = None\n        current_best = -1.0\n        \n        for cand in candidates:\n            score = evaluate_metric(cand)\n            if score > current_best:\n                current_best, best_candidate = score, cand\n        \n        # Greedy Hill-Climbing logic\n        if current_best > best_score:\n            best_score = current_best\n            artifact = best_candidate\n            with open(\"artifact.txt\", \"w\") as f: f.write(artifact)\n            # Version control the improvement\n            subprocess.run([\"git\", \"add\", \"artifact.txt\"])\n            subprocess.run([\"git\", \"commit\", \"-m\", f\"Iter {i}: score {best_score}\"])\n            print(f\"KEEP: New score {best_score}\")\n            results.append({\"iteration\": i, \"score\": best_score, \"action\": \"KEEP\"})\n        else:\n            print(f\"DISCARD: Score {current_best} did not beat {best_score}\")\n            results.append({\"iteration\": i, \"score\": current_best, \"action\": \"DISCARD\"})\n\n    with open(\"results.json\", \"w\") as f: json.dump(results, f, indent=2)\n\nif __name__ == \"__main__\":\n    asyncio.run(run_loop())\n```\n\n## Why This Architecture?\n\n### 1. The Subprocess Pattern\nWe use `git commit` inside the loop. This provides an **immutable history** of your prompt engineering. If an iteration introduces a regression, you can `git checkout` to a previous version of `artifact.txt`.\n\n### 2. Greedy Hill-Climbing\nWe only accept changes that strictly improve our `evaluate_metric` score. This prevents the \"drifting\" problem where long, complex prompts eventually lose their original intent.\n\n### 3. Parallelism\nBy using `asyncio.gather`, we query multiple models simultaneously. This is crucial for comparing model capabilities (e.g., GPT vs. Llama) in real-time, allowing you to identify which models are more \"coachable\" for your specific prompt structure.\n\n## Common Pitfalls to Avoid\n\n*   **Metric Gaming:** If your metric rewards length, the model will naturally output verbose, useless fluff. Design metrics that penalize negative traits (e.g., length penalties, ban-lists of forbidden words).\n*   **The \"LLM-as-a-Judge\" Loop:** Using an LLM to evaluate another LLM is powerful but prone to bias. Always supplement LLM-based metrics with deterministic checks (regex,