{"type": "stage2_complete", "rankings": [{"letter": "A", "display_letter": "A", "avg_position": 0.75, "votes": 4}, {"letter": "D", "display_letter": "B", "avg_position": 0.75, "votes": 4}, {"letter": "C", "display_letter": "D", "avg_position": 1.5, "votes": 4}, {"letter": "E", "display_letter": "C", "avg_position": 3.25, "votes": 4}, {"letter": "B", "display_letter": "E", "avg_position": 3.75, "votes": 4}], "shuffle_map": {"A": "A", "E": "B", "D": "C", "B": "D", "C": "E"}, "votes": [{"model": "meta-llama/llama-4-maverick", "display_ranking": "A > D > B > E > C", "original_ranking": "A > C > D > B > E", "reasoning": "## Step 1: Evaluate Version A\nVersion A is comprehensive, covering all essential steps, implementing a greedy hill-climbing loop, and including features like cost tracking, git versioning, and parallel model queries, making it a strong candidate.\n\n## Step 2: Evaluate Version E\nVersion E introduces advanced concepts like probabilistic scoring and multi-armed bandit optimization, enhancing exploration and adaptability, but its complexity might be challenging for the target audience.\n\n## Step 3: Evaluate Version D\nVersion D provides a clear, robust implementation of a greedy hill-climbing loop with enhanced error handling and cost tracking, and it effectively discusses tradeoffs and common pitfalls.\n\n## Step 4: Evaluate Version B\nVersion B is well-structured, includes a stopping condition, and explains design decisions thoroughly, making it a solid tutorial that balances completeness and clarity.\n\n## Step 5: Evaluate Version C\nVersion C covers the basics of building an evaluation loop but lacks some advanced features and detailed explanations present in other versions, making it less comprehensive.\n\n## Step 6: Compare All Versions\nComparing all versions, Version A stands out for its completeness and inclusion of advanced features like parallel model queries. Version D is strong in its clarity and robustness. Version B is notable for its thorough explanations and stopping condition. Version E, while innovative, may be too complex. Version C is the most basic.\n\n## Step 7: Rank the Versions\nBased on the evaluation criteria, the ranking from best to worst is determined by considering correctness, completeness, clarity, code quality, and depth.\n\n## Step 8: Final Ranking\nAfter evaluating each version against the criteria, the final ranking is as follows: Version A is highly comprehensive and feature-rich. Version D is clear and robust. Version B provides good explanations and is well-structured. Version E is innovative but potentially too complex for the target audience. Version C is the most basic."}, {"model": "anthropic/claude-3-5-haiku", "display_ranking": "A > B > D > C > E", "original_ranking": "A > D > C > E > B", "reasoning": "Analysis of each version:\n\nVersion A: Strong, comprehensive tutorial with clear structure, robust implementation, and excellent depth. Covers all key requirements with good explanations and anticipates potential pitfalls.\n\nVersion B: Very solid implementation with slightly more nuanced technical depth. Strong error handling, clear explanations, and good balance between technical detail and readability.\n\nVersion C: Nearly identical to Version A, but slightly less comprehensive and with fewer advanced features. Seems like a simplified draft of Version A.\n\nVersion D: Interesting approach with more philosophical framing. Strong on conceptual explanations but slightly less rigorous in implementation details. Good narrative flow.\n\nVersion E: Most experimental and theoretical version. Uses advanced probabilistic techniques, but potentially too abstract for the stated target audience of intermediate ML engineers.\n\nDetailed Scoring Rationale:\n- Correctness: A and B excel, E is most speculative\n- Completeness: A is most comprehensive, E is most experimental\n- Clarity: A and B are most clear, E is most abstract\n- Code Quality: A and B have the most robust implementations\n- Depth: E is most theoretically deep, A provides most practical depth"}, {"model": "google/gemini-3.1-flash-lite-preview", "display_ranking": "B > D > A > C > E", "original_ranking": "D > C > A > E > B", "reasoning": "The evaluation criteria focused on building a minimal, runnable, and educational LLM evaluation loop.\n\n*   **Version B** is the strongest because it provides a complete, robust, and well-documented implementation. It includes essential quality-of-life features like stopping conditions, proper type hinting, comprehensive error handling, and file-based data logging (TSV) that makes the results immediately useful.\n*   **Version D** is excellent for its clarity and focuses on the \"why\" behind the code. It is highly readable and provides a very practical \"worked example\" that bridges the gap between the concept and the output.\n*   **Version A** is a solid, feature-rich implementation that includes parallel model querying, but it lacks some of the polish and robustness found in Version B (e.g., stopping conditions, refined error handling).\n*   **Version C** is a clean and correct implementation, but it is the most basic of the bunch and lacks the additional features (like parallel processing or stopping conditions) that distinguish the other versions as more \"optimized\" tutorials.\n*   **Version E** fails the core requirement of being a tutorial for a \"minimal\" loop; it introduces complex probabilistic concepts (Multi-Armed Bandits, Thompson sampling) that are not fully implemented in the provided code snippets, making it incomplete and confusing for the target audience.\n\n**Reasoning:**\n*   **Version B:** Most professional and robust code with excellent features like stopping conditions and clear documentation.\n*   **Version D:** Very clear, pedagogical, and provides a great practical example of prompt evolution.\n*   **Version A:** Good implementation including parallel execution, but slightly less refined than B.\n*   **Version C:** Competent and correct, but lacks the extra utility features of the top versions.\n*   **Version E:** Over-engineered and incomplete, failing to provide a simple, runnable loop as requested."}, {"model": "x-ai/grok-3-mini-beta", "display_ranking": "B > A > D > C > E", "original_ranking": "D > A > C > E > B", "reasoning": "Below is my evaluation and ranking of the versions based on the specified criteria: Correctness, Completeness, Clarity, Code Quality, and Depth. Each version is scored out of 100 points (20 per criterion), and I've provided a brief one-sentence reasoning for each, focusing on its strengths and weaknesses relative to the tutorial's goals.\n\n- **Version A**: This version scores 89/100 (Correctness: 18, Completeness: 19, Clarity: 17, Code Quality: 18, Depth: 17) for its well-rounded implementation with parallel queries, error handling, and thorough explanations, making it highly effective but slightly overly complex in some areas.  \n- **Version E**: This version scores 80/100 (Correctness: 15, Completeness: 15, Clarity: 16, Code Quality: 16, Depth: 18) for introducing advanced probabilistic concepts that add depth but result in incomplete code and potential confusion for the target audience, deviating from a minimal approach.  \n- **Version D**: This version scores 86/100 (Correctness: 17, Completeness: 17, Clarity: 18, Code Quality: 17, Depth: 17) for its clear, straightforward structure and practical features like Git versioning, though it lacks some enhancements like parallel queries for fuller completeness.  \n- **Version B**: This version scores 91/100 (Correctness: 18, Completeness: 18, Clarity: 18, Code Quality: 19, Depth: 18) for its excellent balance of features, refined code with type hints and stopping conditions, and clear explanations, making it the most polished and extensible option.  \n- **Version C**: This version scores 82/100 (Correctness: 17, Completeness: 16, Clarity: 17, Code Quality: 16, Depth: 16) for covering the basics adequately but falling short in advanced features like parallel queries and robust error handling, resulting in a less comprehensive tutorial."}], "model_names": {"A": "meta-llama/llama-4-maverick", "B": "anthropic/claude-3-5-haiku", "C": "google/gemini-3.1-flash-lite-preview", "D": "x-ai/grok-3-mini-beta"}}
{"type": "stage3_complete", "winner": "A", "winner_model": "meta-llama/llama-4-maverick", "council_score": 94, "sub_scores": {"CORRECTNESS": 20, "COMPLETENESS": 20, "CLARITY": 18, "CODE_QUALITY": 18, "DEPTH": 18}, "critique": "Proposal A effectively addresses all key components of building a minimal LLM evaluation loop, including API setup, metric definition, and the KEEP/DISCARD logic. The clarity is strong, with well-structured explanations and inline comments; however, the depth could be improved by elaborating more on the trade-offs of the greedy hill-climbing approach. The code is idiomatic and adheres to best practices, though there's room for enhanced error handling. Going forward, consider introducing more sophisticated optimization strategies or discussing the implications of different scoring metrics on output quality.", "chairman_full_response": "WINNER: A\nSCORE_CORRECTNESS: 20\nSCORE_COMPLETENESS: 20\nSCORE_CLARITY: 18\nSCORE_CODE_QUALITY: 18\nSCORE_DEPTH: 18\nCOUNCIL_SCORE: 94\n\nCRITIQUE:\nProposal A effectively addresses all key components of building a minimal LLM evaluation loop, including API setup, metric definition, and the KEEP/DISCARD logic. The clarity is strong, with well-structured explanations and inline comments; however, the depth could be improved by elaborating more on the trade-offs of the greedy hill-climbing approach. The code is idiomatic and adheres to best practices, though there's room for enhanced error handling. Going forward, consider introducing more sophisticated optimization strategies or discussing the implications of different scoring metrics on output quality.", "chairman_model": "openai/gpt-4o-mini", "model_names": {"A": "meta-llama/llama-4-maverick", "B": "anthropic/claude-3-5-haiku", "C": "google/gemini-3.1-flash-lite-preview", "D": "x-ai/grok-3-mini-beta"}}
{"type": "iteration_result", "iteration": 9, "status": "DISCARD", "council_score": 94, "winner": "A", "best_score": 94, "commit": "ebb51dd", "spent_usd": 0.269915, "timestamp": "2026-04-03T14:40:23.608719Z"}
