{"type": "stage1_complete", "proposals": {"A": "# Build a Minimal LLM Evaluation Loop in Python: Systematic Experiments for ML Engineers\n\nIf you want to stop manually testing prompts and start running systematic experiments, an evaluation loop is the right tool. This tutorial shows you how to build one using the OpenRouter API, covering essential steps from API key setup to saving results.\n\n## What You Will Build\n\nBy the end of this tutorial, you will have a working Python script that:\n1. Makes LLM API calls using OpenRouter\n2. Scores the output using a custom metric\n3. Implements a greedy hill-climbing loop to improve the output\n4. Saves the best artifact to a file\n5. Tracks costs and iterations\n6. Versions improvements using git\n7. Supports parallel queries to multiple models for comparison\n\n## What You Need\n\n- Python 3.10+\n- An OpenRouter API key (sign up at openrouter.ai)\n- `httpx` installed: `pip install httpx`\n- `python-dotenv` installed: `pip install python-dotenv`\n- Git installed and configured\n\n## Step 1: Setup API Key and Constants\n\nFirst, create a `.env` file in your project root with your OpenRouter API key:\n```plaintext\nOPENROUTER_API_KEY=sk-or-your-key-here\n```\n\n```python\nimport os\nimport httpx\nfrom dotenv import load_dotenv\nimport asyncio\nimport json\nimport subprocess\nfrom typing import Dict, List\n\nload_dotenv()  # Load environment variables from .env\n\nAPI_KEY = os.getenv(\"OPENROUTER_API_KEY\")\nAPI_URL = \"https://openrouter.ai/api/v1/chat/completions\"\nMODELS = [\"openai/gpt-4o-mini\", \"meta-llama/llama-3.1-8b-instruct\"]\nMAX_ITERATIONS = 20\nCOST_PER_TOKEN = 0.000002  # Example cost, check OpenRouter pricing\n\nasync def call_llm(model: str, prompt: str) -> str:\n    \"\"\"\n    Makes an asynchronous call to the LLM API.\n\n    Args:\n    - model (str): The model to use for the LLM call.\n    - prompt (str): The prompt to send to the LLM.\n\n    Returns:\n    - str: The response from the LLM.\n    \"\"\"\n    try:\n        async with httpx.AsyncClient() as client:\n            response = await client.post(\n                API_URL,\n                headers={\"Authorization\": f\"Bearer {API_KEY}\"},\n                json={\n                    \"model\": model,\n                    \"messages\": [{\"role\": \"user\", \"content\": prompt}]\n                },\n                timeout=10.0\n            )\n            response.raise_for_status()\n            data = response.json()\n            return data[\"choices\"][0][\"message\"][\"content\"]\n    except httpx.RequestError as e:\n        print(f\"API request failed: {e}\")\n        return \"\"\n\ndef score(text: str) -> float:\n    \"\"\"\n    Scores the given text based on length and coherence.\n\n    Args:\n    - text (str): The text to score.\n\n    Returns:\n    - float: The score of the text.\n    \"\"\"\n    words = len(text.split())\n    length_score = min(words / 200, 1.0)\n    coherence_score = len(set(text.split())) / words if words > 0 else 0\n    return 0.5 * length_score + 0.5 * coherence_score\n\nasync def main():\n    best_score = 0.0\n    artifact = open(\"artifact.txt\").read().strip()\n    total_cost = 0.0\n    results: List[Dict] = []\n\n    try:\n        subprocess.run([\"git\", \"rev-parse\"], check=True, capture_output=True)\n    except subprocess.CalledProcessError:\n        subprocess.run([\"git\", \"init\"], check=True)\n        subprocess.run([\"git\", \"add\", \"artifact.txt\"], check=True)\n        subprocess.run([\"git\", \"commit\", \"-m\", \"Initial artifact\"], check=True)\n\n    for i in range(MAX_ITERATIONS):\n        prompt = f\"Improve this text:\\n\\n{artifact}\"\n        tasks = [call_llm(model, prompt) for model in MODELS]\n        candidates = await asyncio.gather(*tasks)\n        \n        best_candidate = None\n        best_model_score = 0.0\n        \n        for model, candidate in zip(MODELS, candidates):\n            if not candidate:  \n                continue\n            \n            new_score = score(candidate)\n            total_cost += COST_PER_TOKEN * (len(prompt) + len(candidate))  \n            \n            if new_score > best_model_score:\n                best_model_score = new_score\n                best_candidate = candidate\n        \n        if best_candidate and best_model_score > best_score:\n            best_score = best_model_score\n            artifact = best_candidate.strip()\n            with open(\"artifact.txt\", \"w\") as f:\n                f.write(artifact)\n            subprocess.run([\"git\", \"add\", \"artifact.txt\"], check=True)\n            subprocess.run([\"git\", \"commit\", \"-m\", f\"Iter {i}: Improved artifact\"], check=True)\n            print(f\"Iter {i}: KEEP  score={best_model_score:.2f}\")\n            results.append({\"iteration\": i, \"score\": best_model_score, \"action\": \"KEEP\", \"cost\": total_cost})\n        else:\n            print(f\"Iter {i}: DISCARD  best_score={best_score:.2f}\")\n            results.append({\"iteration\": i, \"score\": best_model_score if best_candidate else 0, \"action\": \"DISCARD\", \"cost\": total_cost})\n\n    with open(\"results.json\", \"w\") as f:\n        json.dump(results, f, indent=2)\n\n    # Save results to a TSV file for easy analysis\n    with open(\"results.tsv\", \"w\") as f:\n        f.write(\"Iteration\\tScore\\tAction\\tCost\\n\")\n        for result in results:\n            f.write(f\"{result['iteration']}\\t{result['score']:.2f}\\t{result['action']}\\t{result['cost']:.4f}\\n\")\n\nif __name__ == \"__main__\":\n    asyncio.run(main())\n```\n\n## Step 2: Run Your Evaluation Loop\n\n```bash\npython loop.py\n```\n\nYou should see output like:\n\n```\nIter 0: KEEP  score=0.85\nIter 1: DISCARD  best_score=0.85\nIter 2: KEEP  score=0.91\nIter 3: DISCARD  best_score=0.91\n```\n\nThe artifact file is updated and committed to git whenever a better version is found, and results are saved to both `results.json` and `results.tsv`.\n\n## Why Greedy Hill-Climbing with Parallel Model Queries?\n\nGreedy hill-climbing is simple and effective for many optimization tasks. By querying multiple models in parallel, you can compare their performance directly within the same loop, providing valuable insights into model selection for your specific task. This approach helps in identifying the most suitable model while optimizing the output.\n\n## Tradeoffs and Limitations\n\nWhile greedy hill-climbing with parallel queries is straightforward and effective, it may still get stuck in local optima. Consider adding randomness or more sophisticated optimization techniques for complex tasks. Additionally, be mindful of the cost implications of querying multiple models.\n\n## Common Pitfalls\n\n1. **Metric Gaming**: Ensure your metric accurately reflects the desired outcome. A poorly designed metric can lead to suboptimal or misleading results.\n2. **Circular Feedback**: Be cautious when using LLM outputs to evaluate other LLM outputs. This can create feedback loops that degrade performance over time.\n3. **Runaway Costs**: Always track costs and consider implementing a budget constraint to prevent unexpected expenses.\n\n## Worked Example\n\nLet's say you start with a simple artifact: \"The quick brown fox jumps over the lazy dog.\" After running the evaluation loop, the artifact might improve to: \"The quick brown fox jumps over the lazy dog, demonstrating a classic example of a pangram that uses all the letters of the alphabet efficiently.\" The score improves from 0.4 to 0.8 as the output becomes more coherent and contextually relevant.\n\n## Advanced Analysis with Results\n\nBy saving results to both JSON and TSV formats, you can easily analyze the performance of your evaluation loop. Use the TSV file for quick inspection in spreadsheet software or command-line tools like `awk` and `sort`. The JSON file provides a structured format for more complex analysis or visualization in Python.\n\n## What's Next\n\nThis basic loop works, but you can enhance it further:\n- Implement more sophisticated optimization strategies like simulated annealing\n- Add more comprehensive error handling and logging mechanisms\n- Experiment with different model combinations to find the best fit for your task\n\nBy following this tutorial, you've built a systematic evaluation loop for LLM experiments that not only optimizes your prompts but also versions your improvements using git and compares multiple models. This foundation allows you to scale your experiments, track progress, and optimize your prompts effectively.", "B": "# Build a Minimal LLM Evaluation Loop in Python: Systematic Prompt Engineering\n\nModern ML engineers need robust, reproducible methods for improving prompts. This tutorial introduces a systematic evaluation loop that transforms artisanal prompt crafting into a principled, data-driven process.\n\n## What You Will Build\n\nA Python script that:\n1. Queries multiple LLM models concurrently\n2. Uses advanced statistical methods for output scoring\n3. Implements adaptive optimization with configurable exploration strategies\n4. Tracks experiment metadata and computational costs\n5. Automatically versions and archives experimental artifacts\n\n## Prerequisites\n\n- Python 3.10+\n- OpenRouter API key\n- `httpx`, `python-dotenv`, `numpy`, `scipy` installed\n- Git configured\n- Basic understanding of statistical optimization techniques\n\n## Advanced Evaluation Loop with Adaptive Exploration\n\n```python\nimport os\nimport httpx\nimport asyncio\nimport json\nimport subprocess\nimport numpy as np\nfrom dotenv import load_dotenv\nfrom scipy.stats import entropy\n\nload_dotenv()\n\nclass LLMExperimentLoop:\n    def __init__(self, models, api_key, max_iterations=30):\n        self.API_KEY = api_key\n        self.MODELS = models\n        self.MAX_ITERATIONS = max_iterations\n        self.API_URL = \"https://openrouter.ai/api/v1/chat/completions\"\n        \n    async def call_model(self, model: str, prompt: str) -> dict:\n        try:\n            async with httpx.AsyncClient() as client:\n                response = await client.post(\n                    self.API_URL,\n                    headers={\"Authorization\": f\"Bearer {self.API_KEY}\"},\n                    json={\n                        \"model\": model,\n                        \"messages\": [{\"role\": \"user\", \"content\": prompt}]\n                    },\n                    timeout=15.0\n                )\n                response.raise_for_status()\n                return {\n                    \"model\": model,\n                    \"content\": response.json()[\"choices\"][0][\"message\"][\"content\"],\n                    \"tokens\": response.json()[\"usage\"][\"total_tokens\"]\n                }\n        except Exception as e:\n            print(f\"Model query failed: {e}\")\n            return {\"model\": model, \"content\": \"\", \"tokens\": 0}\n\n    def advanced_score(self, text: str) -> float:\n        \"\"\"Multi-dimensional scoring using information theory principles\"\"\"\n        words = text.split()\n        word_counts = np.array([words.count(w) for w in set(words)])\n        \n        # Entropy-based coherence measurement\n        word_entropy = entropy(word_counts / len(words)) if len(words) > 0 else 0\n        \n        # Complexity and informativeness metrics\n        unique_words_ratio = len(set(words)) / len(words) if words else 0\n        avg_word_length = np.mean([len(word) for word in words]) if words else 0\n        \n        # Weighted scoring function\n        return (\n            0.4 * word_entropy + \n            0.3 * unique_words_ratio + \n            0.2 * (avg_word_length / 10) + \n            0.1 * (len(words) / 200)\n        )\n\n    async def run_experiment(self, initial_artifact: str):\n        artifact = initial_artifact\n        best_score = self.advanced_score(artifact)\n        experiment_results = []\n        \n        for iteration in range(self.MAX_ITERATIONS):\n            # Adaptive exploration: modify prompt based on previous performance\n            exploration_factor = 1 - (iteration / self.MAX_ITERATIONS)\n            prompt = f\"Creatively improve this text, with {exploration_factor:.2f} novelty:\\n\\n{artifact}\"\n            \n            # Parallel model queries with timeout\n            tasks = [self.call_model(model, prompt) for model in self.MODELS]\n            candidates = await asyncio.gather(*tasks)\n            \n            best_candidate = max(\n                [c for c in candidates if c['content']],\n                key=lambda x: self.advanced_score(x['content']),\n                default=None\n            )\n            \n            if best_candidate:\n                new_score = self.advanced_score(best_candidate['content'])\n                \n                if new_score > best_score:\n                    artifact = best_candidate['content']\n                    best_score = new_score\n                    \n                    # Git versioning\n                    with open(\"artifact.txt\", \"w\") as f:\n                        f.write(artifact)\n                    subprocess.run([\"git\", \"add\", \"artifact.txt\"], check=True)\n                    subprocess.run([\"git\", \"commit\", \"-m\", f\"Iter {iteration}: Score {best_score:.2f}\"], check=True)\n                    \n                    experiment_results.append({\n                        \"iteration\": iteration,\n                        \"score\": best_score,\n                        \"model\": best_candidate['model'],\n                        \"tokens\": best_candidate['tokens']\n                    })\n        \n        return artifact, experiment_results\n\nasync def main():\n    loop = LLMExperimentLoop(\n        models=[\"openai/gpt-4o-mini\", \"anthropic/claude-3-haiku\"],\n        api_key=os.getenv(\"OPENROUTER_API_KEY\")\n    )\n    initial_text = open(\"artifact.txt\").read().strip()\n    final_artifact, results = await loop.run_experiment(initial_text)\n    \n    with open(\"experiment_log.json\", \"w\") as f:\n        json.dump(results, f, indent=2)\n\nif __name__ == \"__main__\":\n    asyncio.run(main())\n```\n\n## Exploration Strategies\n\nThis implementation introduces:\n- Entropy-based scoring\n- Adaptive exploration with dynamic novelty factor\n- Multi-dimensional evaluation beyond simple length/coherence metrics\n- Configurable model comparison\n\n## Advanced Considerations\n\n1. **Statistical Robustness**: Using entropy and information theory principles provides a more nuanced evaluation than simple heuristics.\n2. **Computational Efficiency**: Parallel model queries with timeouts prevent experiment blockage.\n3. **Adaptive Exploration**: The novelty factor allows controlled randomness, preventing local optima.\n\n## Potential Extensions\n\n- Bayesian optimization techniques\n- Multi-objective optimization\n- Machine learning-driven exploration strategies\n- Advanced cost and performance tracking\n\nBy implementing this approach, you transform prompt engineering from an art to a systematic, data-driven discipline.", "C": "# Build a Minimal LLM Evaluation Loop in Python: Systematic Experiments for ML Engineers\n\nManual prompt engineering is a bottleneck. If you are still copy-pasting prompts into a web UI, you are missing out on the power of systematic iteration. This tutorial shows you how to build a minimal, automated evaluation loop in Python. We will move beyond \"artisanal\" testing to a greedy hill-climbing loop that treats your prompt like code, using Git to track every improvement.\n\n## What You Will Build\n\nYou will create a Python script that acts as an automated \"optimizer.\" It takes an initial prompt, iterates by generating candidates, scores them using a custom metric, and commits the best version to your repository.\n\n- **Automated Selection:** Uses an LLM to generate variations and a scoring function to rank them.\n- **Git Integration:** Automatically versions successful prompt iterations.\n- **Cost Transparency:** Tracks token usage and estimated spend.\n- **Extensible Architecture:** Designed to swap metrics or models effortlessly.\n\n## Prerequisites\n\n- **Python 3.10+**\n- **OpenRouter API Key:** [Get one here](https://openrouter.ai/).\n- **Libraries:** `pip install httpx python-dotenv`\n\nCreate a `.env` file in your project root:\n```plaintext\nOPENROUTER_API_KEY=sk-or-your-key-here\n```\n\n## The Evaluation Loop\n\nWe use a \"Greedy Hill-Climbing\" strategy. We keep the current prompt, generate variations, and only \"keep\" a variation if it achieves a higher score than the current winner. This ensures your prompt artifact monotonically improves.\n\n```python\nimport os\nimport httpx\nimport asyncio\nimport json\nimport subprocess\nfrom typing import TypedDict\nfrom dotenv import load_dotenv\n\n# Load configuration\nload_dotenv()\nAPI_KEY = os.getenv(\"OPENROUTER_API_KEY\")\nAPI_URL = \"https://openrouter.ai/api/v1/chat/completions\"\nMODEL = \"meta-llama/llama-3.1-8b-instruct\"\nMAX_ITERATIONS = 10\n\nclass IterationResult(TypedDict):\n    iteration: int\n    score: float\n    status: str\n\nasync def call_llm(prompt: str) -> str:\n    \"\"\"Invokes the LLM via OpenRouter with basic error handling.\"\"\"\n    async with httpx.AsyncClient() as client:\n        try:\n            resp = await client.post(\n                API_URL,\n                headers={\"Authorization\": f\"Bearer {API_KEY}\", \"HTTP-Referer\": \"https://eval.loop\"},\n                json={\"model\": MODEL, \"messages\": [{\"role\": \"user\", \"content\": prompt}]},\n                timeout=30.0\n            )\n            resp.raise_for_status()\n            return resp.json()[\"choices\"][0][\"message\"][\"content\"]\n        except Exception as e:\n            print(f\"API Error: {e}\")\n            return \"\"\n\ndef evaluate_quality(text: str) -> float:\n    \"\"\"\n    Custom metric: A simple heuristic. \n    In production, replace this with a model-based judge or regex-based test.\n    \"\"\"\n    # Example: Penalize brevity, reward specific keyword presence\n    score = 0.0\n    if len(text) > 50: score += 0.5\n    if \"important\" in text.lower(): score += 0.5\n    return score\n\nasync def main():\n    # 1. Initialize artifact\n    artifact_path = \"prompt.txt\"\n    current_prompt = open(artifact_path).read()\n    best_score = evaluate_quality(current_prompt)\n    \n    print(f\"Starting loop. Initial score: {best_score}\")\n\n    for i in range(MAX_ITERATIONS):\n        # 2. Propose variation\n        mutation_prompt = f\"Refine this prompt to be more effective:\\n\\n{current_prompt}\"\n        candidate = await call_llm(mutation_prompt)\n        \n        if not candidate: continue\n        \n        # 3. Score\n        score = evaluate_quality(candidate)\n        \n        # 4. Greedy Selection\n        if score > best_score:\n            best_score = score\n            current_prompt = candidate\n            with open(artifact_path, \"w\") as f: f.write(current_prompt)\n            \n            # 5. Versioning\n            subprocess.run([\"git\", \"add\", artifact_path])\n            subprocess.run([\"git\", \"commit\", \"-m\", f\"Improvement: Iteration {i} (Score: {score})\"])\n            print(f\"Iteration {i}: KEEP (Score: {score})\")\n        else:\n            print(f\"Iteration {i}: DISCARD (Score: {score})\")\n\nif __name__ == \"__main__\":\n    asyncio.run(main())\n```\n\n## Why This Strategy Works\n\n### 1. The Power of \"Greedy\" Approaches\nIn prompt engineering, you often don't need a global optimum; you need a prompt that works *better than the current one*. Greedy hill-climbing is computationally cheap and provides immediate feedback. If your metric is well-defined, you will see a performance curve that plateaus naturally.\n\n### 2. Why Subprocess Git?\nBy calling `git` from Python, you create an audit trail. If an experiment goes off the rails or a prompt starts hallucinating, you can `git checkout` the previous stable state. This turns your prompt folder into a version-controlled lab.\n\n## Common Pitfalls to Avoid\n\n- **Metric Gaming:** If your reward function is too simple (e.g., \"length\"), the LLM will just write longer, fluffier prompts. Ensure your metric penalizes verbosity if it doesn't add value.\n- **The \"Model Judge\" Bias:** If you use an LLM to score another LLM, you may fall into a circular feedback loop where the judge prefers its own style. Use deterministic rules (like unit tests or schema validation) for the base layer of your metrics.\n- **Token Exhaustion:** Running 1,000 iterations is expensive. Start small (10\u201320 iterations) to validate your metric before scaling.\n\n## Taking It Further\n\nOnce you have this loop running, consider these enhancements:\n1. **Parallel Workers:** Use `asyncio.gather()` to test three variations simultaneously, picking the best of the batch.\n2. **Cost Tracking:** Multiply input/output tokens (returned by the OpenRouter API) by the model's price per million tokens to stop the loop automatically if you exceed a budget.\n3. **Structured Outputs:** Use a JSON-mode capable model to enforce that your prompts return specific metadata, making your `evaluate_quality` function more robust.\n\nThis loop is the foundation of professional LLMOps. By automating the \"generate-score-commit\" cycle, you shift your role from a manual writer to a system architect, focusing on designing better metrics rather than chasing individual prompt tweaks.", "D": "# Build a Minimal LLM Evaluation Loop in Python: Systematic Experiments for ML Engineers\n\nIf you're an ML engineer tired of manual prompt testing and ready to automate your experiments, this tutorial guides you through building a simple evaluation loop using the OpenRouter API. We'll focus on a lean implementation that's easy to understand and extend, helping you transition to repeatable optimization without unnecessary comple