{"type": "stage2_complete", "rankings": [{"letter": "D", "display_letter": "B", "avg_position": 0.3333333333333333, "votes": 3}, {"letter": "A", "display_letter": "A", "avg_position": 0.6666666666666666, "votes": 3}, {"letter": "B", "display_letter": "E", "avg_position": 2.3333333333333335, "votes": 3}, {"letter": "E", "display_letter": "D", "avg_position": 2.6666666666666665, "votes": 3}], "shuffle_map": {"A": "A", "E": "B", "B": "D", "D": "E"}, "votes": [{"model": "anthropic/claude-3-5-haiku", "display_ranking": "A > B > E > D", "original_ranking": "A > D > B > E", "reasoning": "Evaluation of Versions:\n\nVersion A: Strong overall implementation with comprehensive explanations, good code quality, and thorough exploration of design considerations. Excels in clarity, completeness, and depth of explanation. Provides clear rationale for design choices and includes advanced error handling.\n\nVersion B: Very solid technical implementation with clear step-by-step explanation. Strong code quality and practical approach. Slightly less comprehensive than Version A, but still provides excellent insights into the evaluation loop design.\n\nVersion E: Innovative approach with more abstract and flexible implementation. Strong on code quality and extensibility, but slightly less beginner-friendly and more complex. Introduces interesting multi-metric scoring approach.\n\nVersion D: Very similar to Version A, but with slightly less depth and fewer detailed explanations. Covers core concepts but lacks some of the nuanced discussion found in the top versions.\n\nDetailed Reasoning:\n- Version A stands out for its comprehensive approach, balancing technical depth with clear explanations.\n- Version B is a close second, with a more straightforward and immediately implementable approach.\n- Version E introduces interesting advanced concepts but may be harder for beginners to immediately grasp.\n- Version D is competent but feels more like a slightly simplified version of Version A."}, {"model": "google/gemini-3.1-flash-lite-preview", "display_ranking": "B > A > D > E", "original_ranking": "D > A > E > B", "reasoning": "The evaluation criteria prioritize technical accuracy, completeness, clarity, and depth. \n\n*   **Version B** is the strongest. It incorporates all requested refinements: it uses a TSV format (as suggested in the exploration directions), includes robust type hints, handles errors gracefully, and features an excellent, detailed \"Worked Example\" that provides real clarity on the improvement process. Its prose is professional and directly addresses the \"why\" behind the design choices.\n*   **Version A** is a solid, well-structured tutorial that hits almost all the requirements, though it lacks the polish of the TSV output and the slightly more advanced type hinting found in Version B.\n*   **Version D** is essentially identical to Version A but slightly less comprehensive in its closing sections, feeling like a truncated version of the same content.\n*   **Version E** introduces an Object-Oriented approach that is technically interesting, but it makes a significant error by using `random.random()` without importing the `random` module, rendering the provided code non-runnable. It also deviates from the specific \"greedy hill-climbing\" constraints requested by introducing a probabilistic exploration rate not explicitly asked for, making it less of a \"minimal\" tutorial for beginners.\n\n**Reasoning:**\n*   **Version B:** Best overall; includes all requested features (TSV, type hints, best worked example, robust error handling).\n*   **Version A:** Very strong and correct, just slightly less refined than B.\n*   **Version D:** Good, but lacks the extra polish and detail provided in the top two versions.\n*   **Version E:** Includes a `NameError` (missing `import random`) and overcomplicates the \"minimal\" requirement."}, {"model": "x-ai/grok-3-mini-beta", "display_ranking": "B > A > E > D", "original_ranking": "D > A > B > E", "reasoning": "Below is my evaluation and ranking of the versions (A, E, B, D) based on the specified criteria: Correctness, Completeness, Clarity, Code Quality, and Depth. I scored each version out of 100 points total (20 per criterion) and ranked them from best to worst.\n\n**Version A**: This version is strong overall, with solid code that runs correctly, covers most essentials like API setup and Git integration, and provides good explanations, though it could improve clarity in code comments and depth in tradeoffs (Score: 88/100).  \n**Version E**: It introduces innovative features like multi-metric scoring and adaptive strategies, but the code has potential issues (e.g., missing import for random) and feels over-engineered for a minimal tutorial, reducing clarity and correctness (Score: 83/100).  \n**Version B**: This is the most polished, with excellent correctness, comprehensive coverage including TSV saving and a detailed worked example, clear step-by-step guidance, and strong depth in explaining tradeoffs, making it highly extensible and user-friendly (Score: 93/100).  \n**Version D**: It covers the basics adequately with correct code and essential steps, but lacks depth in justifications, code quality enhancements like type hints, and overall completeness compared to others (Score: 80/100)."}], "model_names": {"A": "meta-llama/llama-4-maverick", "B": "anthropic/claude-3-5-haiku", "C": "google/gemini-3.1-flash-lite-preview", "D": "x-ai/grok-3-mini-beta"}}
{"type": "stage3_complete", "winner": "D", "winner_model": "x-ai/grok-3-mini-beta", "council_score": 94, "sub_scores": {"CORRECTNESS": 18, "COMPLETENESS": 20, "CLARITY": 18, "CODE_QUALITY": 19, "DEPTH": 19}, "critique": "Proposal D effectively outlines a clear and practical approach to building a minimal LLM evaluation loop with adequate detail and structure. The code is mostly correct, with minor improvements needed in error handling and documentation. It demonstrates completeness by covering all essential steps and provides a good balance between clarity and depth in explanations. Future iterations could focus on further refining the error handling mechanisms and exploring alternative optimization strategies or additional metrics. Overall, it's a strong tutorial that caters well to the target audience.", "chairman_full_response": "WINNER: D\nSCORE_CORRECTNESS: 18\nSCORE_COMPLETENESS: 20\nSCORE_CLARITY: 18\nSCORE_CODE_QUALITY: 19\nSCORE_DEPTH: 19\nCOUNCIL_SCORE: 94\n\nCRITIQUE:\nProposal D effectively outlines a clear and practical approach to building a minimal LLM evaluation loop with adequate detail and structure. The code is mostly correct, with minor improvements needed in error handling and documentation. It demonstrates completeness by covering all essential steps and provides a good balance between clarity and depth in explanations. Future iterations could focus on further refining the error handling mechanisms and exploring alternative optimization strategies or additional metrics. Overall, it's a strong tutorial that caters well to the target audience.", "chairman_model": "openai/gpt-4o-mini", "model_names": {"A": "meta-llama/llama-4-maverick", "B": "anthropic/claude-3-5-haiku", "C": "google/gemini-3.1-flash-lite-preview", "D": "x-ai/grok-3-mini-beta"}}
{"type": "iteration_result", "iteration": 47, "status": "DISCARD", "council_score": 94, "winner": "D", "best_score": 96, "commit": "de0e250", "spent_usd": 0.873079, "timestamp": "2026-04-03T16:04:21.366848Z"}
