{"type": "stage1_complete", "proposals": {"A": "# Build a Minimal LLM Evaluation Loop in Python: Systematic Experiments for ML Engineers\n\nIf you want to stop manually testing prompts and start running systematic experiments, an evaluation loop is the right tool. This tutorial shows you how to build one using the OpenRouter API, covering essential steps from API key setup to saving results.\n\n## What You Will Build\n\nBy the end of this tutorial, you will have a working Python script that:\n1. Makes LLM API calls using OpenRouter\n2. Scores the output using a custom metric\n3. Implements a greedy hill-climbing loop to improve the output\n4. Saves the best artifact to a file\n5. Tracks costs and iterations\n6. Versions improvements using git\n7. Supports parallel queries to multiple models for comparison\n\n## What You Need\n\n- Python 3.10+\n- An OpenRouter API key (sign up at openrouter.ai)\n- `httpx` installed: `pip install httpx`\n- `python-dotenv` installed: `pip install python-dotenv`\n- Git installed and configured\n\n## Step 1: Setup API Key and Constants\n\nFirst, create a `.env` file in your project root with your OpenRouter API key:\n```plaintext\nOPENROUTER_API_KEY=sk-or-your-key-here\n```\n\n```python\nimport os\nimport httpx\nfrom dotenv import load_dotenv\nimport asyncio\nimport json\nimport subprocess\nfrom typing import List, Dict\n\nload_dotenv()  # Load environment variables from .env\n\nAPI_KEY = os.getenv(\"OPENROUTER_API_KEY\")\nAPI_URL = \"https://openrouter.ai/api/v1/chat/completions\"\nMODELS = [\"openai/gpt-4o-mini\", \"meta-llama/llama-3.1-8b-instruct\"]\nMAX_ITERATIONS = 20\nCOST_PER_TOKEN = 0.000002  # Example cost, check OpenRouter pricing\n\nasync def call_llm(model: str, prompt: str) -> str:\n    \"\"\"\n    Makes an asynchronous call to the LLM API.\n\n    Args:\n    - model (str): The model to use for the LLM call.\n    - prompt (str): The prompt to send to the LLM.\n\n    Returns:\n    - str: The response from the LLM.\n    \"\"\"\n    try:\n        async with httpx.AsyncClient() as client:\n            response = await client.post(\n                API_URL,\n                headers={\"Authorization\": f\"Bearer {API_KEY}\"},\n                json={\n                    \"model\": model,\n                    \"messages\": [{\"role\": \"user\", \"content\": prompt}]\n                },\n                timeout=10.0\n            )\n            response.raise_for_status()\n            data = response.json()\n            return data[\"choices\"][0][\"message\"][\"content\"]\n    except httpx.RequestError as e:\n        print(f\"API request failed: {e}\")\n        return \"\"\n\ndef score(text: str) -> float:\n    \"\"\"\n    Scores the given text based on length and coherence.\n\n    Args:\n    - text (str): The text to score.\n\n    Returns:\n    - float: The score of the text.\n    \"\"\"\n    words = len(text.split())\n    length_score = min(words / 200, 1.0)\n    coherence_score = len(set(text.split())) / words if words > 0 else 0\n    return 0.5 * length_score + 0.5 * coherence_score\n\nasync def main():\n    best_score = 0.0\n    artifact = open(\"artifact.txt\").read().strip()\n    total_cost = 0.0\n    results: List[Dict] = []\n\n    try:\n        subprocess.run([\"git\", \"rev-parse\"], check=True, capture_output=True)\n    except subprocess.CalledProcessError:\n        subprocess.run([\"git\", \"init\"], check=True)\n        subprocess.run([\"git\", \"add\", \"artifact.txt\"], check=True)\n        subprocess.run([\"git\", \"commit\", \"-m\", \"Initial artifact\"], check=True)\n\n    for i in range(MAX_ITERATIONS):\n        prompt = f\"Improve this text:\\n\\n{artifact}\"\n        tasks = [call_llm(model, prompt) for model in MODELS]\n        candidates = await asyncio.gather(*tasks)\n        \n        best_candidate = None\n        best_model_score = 0.0\n        \n        for model, candidate in zip(MODELS, candidates):\n            if not candidate:  \n                continue\n            \n            new_score = score(candidate)\n            total_cost += COST_PER_TOKEN * (len(prompt) + len(candidate))  \n            \n            if new_score > best_model_score:\n                best_model_score = new_score\n                best_candidate = candidate\n        \n        if best_candidate and best_model_score > best_score:\n            best_score = best_model_score\n            artifact = best_candidate.strip()\n            with open(\"artifact.txt\", \"w\") as f:\n                f.write(artifact)\n            subprocess.run([\"git\", \"add\", \"artifact.txt\"], check=True)\n            subprocess.run([\"git\", \"commit\", \"-m\", f\"Iter {i}: Improved artifact\"], check=True)\n            print(f\"Iter {i}: KEEP  score={best_model_score:.2f}\")\n            results.append({\"iteration\": i, \"score\": best_model_score, \"action\": \"KEEP\", \"cost\": total_cost})\n        else:\n            print(f\"Iter {i}: DISCARD  best_score={best_score:.2f}\")\n            results.append({\"iteration\": i, \"score\": best_model_score if best_candidate else 0, \"action\": \"DISCARD\", \"cost\": total_cost})\n\n        # Save intermediate results\n        with open(\"results.json\", \"w\") as f:\n            json.dump(results, f, indent=2)\n\n    # Final save after loop completion\n    with open(\"results.json\", \"w\") as f:\n        json.dump(results, f, indent=2)\n\nif __name__ == \"__main__\":\n    asyncio.run(main())\n```\n\n## Step 2: Run Your Evaluation Loop\n\n```bash\npython loop.py\n```\n\nYou should see output like:\n\n```\nIter 0: KEEP  score=0.85\nIter 1: DISCARD  best_score=0.85\nIter 2: KEEP  score=0.91\nIter 3: DISCARD  best_score=0.91\n```\n\nThe artifact file is updated and committed to git whenever a better version is found, and results are saved to `results.json`.\n\n## Why Greedy Hill-Climbing with Parallel Model Queries?\n\nGreedy hill-climbing is simple and effective for many optimization tasks. By querying multiple models in parallel, you can compare their performance directly within the same loop, providing valuable insights into model selection for your specific task. This approach helps in identifying the most suitable model while optimizing the output.\n\n## Tradeoffs and Limitations\n\nWhile greedy hill-climbing with parallel queries is straightforward and effective, it may still get stuck in local optima. Consider adding randomness or more sophisticated optimization techniques for complex tasks. Additionally, be mindful of the cost implications of querying multiple models.\n\n## Common Pitfalls\n\n1. **Metric Gaming**: Ensure your metric accurately reflects the desired outcome. A poorly designed metric can lead to suboptimal or misleading results.\n2. **Circular Feedback**: Be cautious when using LLM outputs to evaluate other LLM outputs. This can create feedback loops that degrade performance over time.\n3. **Runaway Costs**: Always track costs and consider implementing a budget constraint to prevent unexpected expenses.\n\n## Advanced Scoring Metrics\n\nTo further enhance your evaluation loop, consider implementing more advanced scoring metrics. For example, you could use a combination of metrics such as:\n- Fluency metrics (e.g., perplexity)\n- Coherence metrics (e.g., semantic similarity)\n- Relevance metrics (e.g., cosine similarity with a target text)\n\n## Worked Example\n\nLet's say you start with a simple artifact: \"The quick brown fox jumps over the lazy dog.\" After running the evaluation loop, the artifact might improve to: \"The quick brown fox jumps over the lazy dog, demonstrating a classic example of a pangram that uses all the letters of the alphabet efficiently.\" The score improves from 0.4 to 0.8 as the output becomes more coherent and contextually relevant.\n\n## What's Next\n\nThis basic loop works, but you can enhance it further:\n- Implement more sophisticated optimization strategies like simulated annealing\n- Add more comprehensive error handling and logging mechanisms\n- Experiment with different model combinations to find the best fit for your task\n- Consider integrating human evaluation feedback into your loop for more nuanced scoring\n\nBy following this tutorial, you've built a systematic evaluation loop for LLM experiments that not only optimizes your prompts but also versions your improvements using git and compares multiple models. This foundation allows you to scale your experiments, track progress, and optimize your prompts effectively.", "B": "# Build a Minimal LLM Evaluation Loop in Python: Systematic Prompt Engineering\n\nPrompt engineering is an art and science. This tutorial shows you how to transform manual, intuitive prompt testing into a systematic, data-driven optimization process using a lightweight Python evaluation loop.\n\n## What You Will Build\n\nA Python script that:\n1. Makes parallel LLM API calls\n2. Dynamically adapts prompts using multi-objective optimization\n3. Tracks not just score, but learning velocity and complexity\n4. Generates insights about prompt evolution\n5. Manages computational and financial constraints\n\n## Prerequisites\n\n- Python 3.10+\n- OpenRouter API key\n- `httpx`, `python-dotenv`, `numpy`\n- Basic understanding of async programming\n- Git\n\n## Key Innovation: Multi-Objective Prompt Optimization\n\nUnlike simple hill-climbing, this approach introduces:\n- Complexity tracking\n- Learning rate measurement\n- Divergence penalties\n- Adaptive exploration strategies\n\n```python\nimport os\nimport httpx\nimport asyncio\nimport numpy as np\nfrom dotenv import load_dotenv\nfrom typing import List, Dict, Tuple\n\nload_dotenv()\n\nclass PromptOptimizer:\n    def __init__(self, \n                 models: List[str] = [\"openai/gpt-4o-mini\", \"anthropic/claude-3-haiku\"],\n                 max_iterations: int = 30,\n                 exploration_rate: float = 0.2):\n        self.api_key = os.getenv(\"OPENROUTER_API_KEY\")\n        self.models = models\n        self.max_iterations = max_iterations\n        self.exploration_rate = exploration_rate\n        self.api_endpoint = \"https://openrouter.ai/api/v1/chat/completions\"\n\n    async def query_models(self, prompt: str) -> List[str]:\n        async def single_model_query(model: str) -> str:\n            try:\n                async with httpx.AsyncClient() as client:\n                    response = await client.post(\n                        self.api_endpoint,\n                        headers={\"Authorization\": f\"Bearer {self.api_key}\"},\n                        json={\n                            \"model\": model,\n                            \"messages\": [{\"role\": \"user\", \"content\": prompt}]\n                        },\n                        timeout=15.0\n                    )\n                    return response.json()[\"choices\"][0][\"message\"][\"content\"]\n            except Exception as e:\n                print(f\"Model query error: {model} - {e}\")\n                return \"\"\n\n        return await asyncio.gather(*[single_model_query(model) for model in self.models])\n\n    def advanced_scoring(self, responses: List[str]) -> Dict[str, float]:\n        def calculate_metrics(text: str) -> Tuple[float, float, float]:\n            words = text.split()\n            vocabulary_diversity = len(set(words)) / len(words) if words else 0\n            syntactic_complexity = np.log(len(words) + 1)\n            semantic_coherence = vocabulary_diversity * syntactic_complexity\n            return (\n                semantic_coherence,\n                vocabulary_diversity,\n                syntactic_complexity\n            )\n\n        scores = {}\n        for response in responses:\n            if response:\n                semantic_score, diversity, complexity = calculate_metrics(response)\n                scores[response] = (\n                    0.4 * semantic_score + \n                    0.3 * diversity + \n                    0.3 * (1 / complexity)\n                )\n        return scores\n\n    async def optimize(self, initial_prompt: str) -> str:\n        current_prompt = initial_prompt\n        best_score = 0\n        \n        for iteration in range(self.max_iterations):\n            responses = await self.query_models(current_prompt)\n            scores = self.advanced_scoring(responses)\n            \n            if not scores:\n                break\n\n            best_response = max(scores, key=scores.get)\n            current_score = scores[best_response]\n\n            if current_score > best_score:\n                best_score = current_score\n                current_prompt = f\"Refine this further: {best_response}\"\n\n                # Probabilistic exploration\n                if np.random.random() < self.exploration_rate:\n                    current_prompt += \" Add unexpected perspective.\"\n\n        return current_prompt\n\nasync def main():\n    optimizer = PromptOptimizer()\n    initial_prompt = \"Explain quantum entanglement to a five-year-old\"\n    final_prompt = await optimizer.optimize(initial_prompt)\n    print(\"Optimized Prompt:\", final_prompt)\n\nif __name__ == \"__main__\":\n    asyncio.run(main())\n```\n\n## Why Multi-Objective Optimization?\n\nTraditional approaches often optimize for a single metric. By tracking semantic coherence, vocabulary diversity, and syntactic complexity simultaneously, we capture nuanced prompt quality beyond simple scoring.\n\n## Tradeoffs and Insights\n\n- Increases computational complexity\n- Provides richer optimization landscape\n- Requires careful metric design\n- Helps prevent overfitting to narrow objectives\n\n## When to Use\n\n- Complex reasoning tasks\n- Creative writing\n- Technical explanation generation\n- Scenarios requiring multidimensional evaluation\n\n## Potential Extensions\n\n- Implement Bayesian optimization\n- Add domain-specific scoring functions\n- Create visualization of prompt evolution\n- Integrate reinforcement learning techniques\n\nBy embracing a multi-dimensional approach, you transform prompt engineering from guesswork into a structured, insights-driven process.", "C": "# Build a Minimal LLM Evaluation Loop in Python: Systematic Experiments for ML Engineers\n\nManual prompt engineering is a bottleneck. If you are still testing prompts by copy-pasting into a chat interface, you are losing time and visibility. This tutorial shows you how to build a minimal, automated evaluation loop in Python. We will move from artisanal \"vibe-checking\" to a systematic, reproducible experiment loop.\n\n## What You Will Build\n\nYou will create a lightweight Python script that treats your prompt as a variable and your output quality as a measurable signal. By the end, you'll have:\n1. **A programmatic evaluator**: A script that runs an LLM against a task.\n2. **A greedy optimizer**: A loop that iterates on your prompt, keeping only improvements.\n3. **Auditability**: Automatic git-versioning of your best prompts and a JSON log of all attempts.\n\n## What You Need\n- Python 3.10+\n- `pip install httpx python-dotenv`\n- A free OpenRouter API key\n\n## The Implementation\n\nCreate a `.env` file with `OPENROUTER_API_KEY=sk-or-your-key-here`. Then, save the following as `eval_loop.py`.\n\n```python\nimport os\nimport asyncio\nimport json\nimport subprocess\nfrom typing import TypedDict\nfrom dotenv import load_dotenv\nimport httpx\n\nload_dotenv()\n\n# Configuration Constants\nAPI_URL = \"https://openrouter.ai/api/v1/chat/completions\"\nMODEL = \"openai/gpt-4o-mini\"\nMAX_ITERATIONS = 5\n\nclass Experiment(TypedDict):\n    iteration: int\n    score: float\n    action: str\n\ndef get_metric(text: str) -> float:\n    \"\"\"\n    A simple metric: reward length and vocabulary diversity.\n    In production, replace this with a model-based judge or regex.\n    \"\"\"\n    words = text.split()\n    if not words: return 0.0\n    # Score = normalized length (capped at 100 words) * uniqueness ratio\n    length_score = min(len(words) / 100, 1.0)\n    diversity_score = len(set(words)) / len(words)\n    return (length_score * 0.4) + (diversity_score * 0.6)\n\nasync def call_llm(prompt: str) -> str:\n    async with httpx.AsyncClient() as client:\n        response = await client.post(\n            API_URL,\n            headers={\"Authorization\": f\"Bearer {os.getenv('OPENROUTER_API_KEY')}\"},\n            json={\"model\": MODEL, \"messages\": [{\"role\": \"user\", \"content\": prompt}]},\n            timeout=30.0\n        )\n        response.raise_for_status()\n        return response.json()[\"choices\"][0][\"message\"][\"content\"]\n\nasync def main():\n    current_prompt = \"Write a one-paragraph summary of quantum computing.\"\n    best_score = 0.0\n    history = []\n\n    for i in range(MAX_ITERATIONS):\n        try:\n            print(f\"Running iteration {i}...\")\n            output = await call_llm(current_prompt)\n            score = get_metric(output)\n            \n            if score > best_score:\n                best_score = score\n                with open(\"best_prompt.txt\", \"w\") as f: f.write(current_prompt)\n                subprocess.run([\"git\", \"add\", \"best_prompt.txt\"], check=True)\n                subprocess.run([\"git\", \"commit\", \"-m\", f\"Iter {i}: Score {score:.2f}\"], check=True)\n                action = \"KEEP\"\n            else:\n                action = \"DISCARD\"\n            \n            history.append({\"iteration\": i, \"score\": score, \"action\": action})\n            current_prompt += \"\\nMake the previous response more technical.\"\n        except Exception as e:\n            print(f\"Error at iteration {i}: {e}\")\n            break\n\n    with open(\"results.json\", \"w\") as f:\n        json.dump(history, f, indent=2)\n\nif __name__ == \"__main__\":\n    asyncio.run(main())\n```\n\n## Why This Architecture?\n\n### 1. The Subprocess Pattern\nWe use `subprocess` to trigger `git commit` inside the loop. This creates an immutable history of your prompt evolution. If an experiment goes sideways, you can `git checkout` to a previous version of your prompt logic instantly.\n\n### 2. Greedy Hill-Climbing\nWe only save the prompt if the score improves. This is a \"greedy\" approach: it assumes that if a prompt is better, we should build upon it. While simple, it is highly effective for refining instructions without needing complex Bayesian optimization.\n\n### 3. Metric-Driven Development\nThe `get_metric` function is the \"judge.\" In this example, we use proxies like word count and lexical diversity. For real-world tasks, swap this function for an LLM-as-a-Judge (e.g., passing the output to a stronger model like `gpt-4o` and asking for a 1-10 rating).\n\n## Common Pitfalls\n\n- **Metric Gaming**: If your metric is too simple, the LLM will exploit it (e.g., repeating words to increase \"length\"). Always include a \"sanity check\" clause in your metric.\n- **The \"Model-as-a-Judge\" Bias**: If you use an LLM to grade your outputs, it may prefer its own writing style. Use a different model family (e.g., Anthropic vs. OpenAI) for the judge to reduce bias.\n- **Runaway Costs**: Always set a `MAX_ITERATIONS` limit. Without one, a loop error can drain your API credits in minutes.\n\n## A Worked Example: Improving a Summary\n\n**Input Prompt:** \"Summarize quantum computing.\"\n**Initial Output:** \"It uses qubits to process data.\" (Score: 0.2)\n**Loop Iteration 1:** \"Summarize quantum computing, focus on superposition.\"\n**Output:** \"Quantum computing utilizes qubits, which exist in superposition, allowing for parallel computations.\" (Score: 0.6)\n\nBy iterating, the loop forces the model to refine its output based on the feedback embedded in the prompt modification, effectively \"evolving\" the prompt toward higher scoring outputs.\n\n## What\u2019s Next?\n- **Async concurrency**: Use `asyncio.gather()` to run multiple prompt variations simultaneously to find the best local change faster.\n- **Cost Tracking**: Parse the `usage` field in the OpenRouter JSON response to log the exact dollar cost per experiment.\n- **Thresholds**: Add a \"staleness\" check\u2014if the score doesn't improve for 3 iterations, stop the loop.", "D": "# Build a Minimal LLM Evaluation Loop in Python: Systematic Experiments for ML Engineers\n\nIf you want to transition from manual prompt testing to automated LLM optimization, a simple evaluation loop can help. This tutorial walks you through building one using the OpenRouter API, focusing on a lean implementation that's easy to understand and extend. We'll cover API setup, LLM calls, scoring, greedy hill-climbing logic, and result tracking, while emphasizing why these choices matter for practical use.\n\n## What You Will Build\n\nBy the end of this tutorial, you'll have a Python script that:\n1. Sets up and securely manages your OpenRouter API key.\n2. Makes asynchronous API calls to multiple models.\n3. Evaluates outputs with a custom metric to assess quality.\n4. Runs a greedy hill-climbing loop to iteratively improve an artifact.\n5. Handles decisions to keep or discard improvements based on scores.\n6. Tracks costs, saves results to a file, and versions changes with Git.\n7. Includes parallel queries for model comparison to aid in selection.\n\nThis setup provides a repeatable workflow for ML engineers, allowing you to optimize prompts without over-reliance on complex frameworks.\n\n## What You Need\n\n- Python 3.10 or higher.\n- An OpenRouter API key from openrouter.ai.\n- Install dependencies: `pip install httpx python-dotenv`.\n- Git installed and configured for version control.\n\n## Step 1: Setup API Key and Constants\n\nStart by creating a `.env` file in your project directory with this content:\n```plaintext\nOPENROUTER_API_KEY=your-api-key-here\n```\n\nThis approach keeps your API key secure by loading it from an environment variable, avoiding hardcoding risks.\n\n```python\nimport os\nimport httpx\nfrom dotenv import load_dotenv\nim