{"type": "stage1_complete", "proposals": {"A": "# Build a Minimal LLM Evaluation Loop in Python: Systematic Experiments for ML Engineers\n\nIf you want to stop manually testing prompts and start running systematic experiments, an evaluation loop is the right tool. This tutorial shows you how to build one using the OpenRouter API, covering essential steps from API key setup to saving results.\n\n## What You Will Build\n\nBy the end of this tutorial, you will have a working Python script that:\n1. Makes LLM API calls using OpenRouter\n2. Scores the output using a custom metric\n3. Implements a greedy hill-climbing loop to improve the output\n4. Saves the best artifact to a file\n5. Tracks costs and iterations\n6. Versions improvements using git\n7. Supports configurable model selection and parameters\n\n## What You Need\n\n- Python 3.10+\n- An OpenRouter API key (sign up at openrouter.ai)\n- `httpx` installed: `pip install httpx`\n- `python-dotenv` installed: `pip install python-dotenv`\n- Git installed and configured\n\n## Step 1: Setup API Key and Constants\n\nFirst, create a `.env` file in your project root with your OpenRouter API key:\n```plaintext\nOPENROUTER_API_KEY=sk-or-your-key-here\n```\n\n```python\nimport os\nimport httpx\nfrom dotenv import load_dotenv\nfrom typing import Dict, Any\n\nload_dotenv()  # Load environment variables from .env\n\nAPI_KEY = os.getenv(\"OPENROUTER_API_KEY\")\nAPI_URL = \"https://openrouter.ai/api/v1/chat/completions\"\nMODEL_CONFIG = {\n    \"model\": \"openai/gpt-4o-mini\",\n    \"max_tokens\": 512,\n    \"temperature\": 0.7\n}\nMAX_ITERATIONS = 20\nCOST_PER_TOKEN = 0.000002  # Example cost, check OpenRouter pricing\n\ndef call_llm(prompt: str, config: Dict[str, Any]) -> str:\n    try:\n        response = httpx.post(\n            API_URL,\n            headers={\"Authorization\": f\"Bearer {API_KEY}\"},\n            json={\n                \"model\": config[\"model\"],\n                \"messages\": [{\"role\": \"user\", \"content\": prompt}],\n                \"max_tokens\": config[\"max_tokens\"],\n                \"temperature\": config[\"temperature\"]\n            },\n            timeout=10.0  # Add timeout to prevent hanging\n        )\n        response.raise_for_status()  # Raise an exception for bad status codes\n        data = response.json()\n        return data[\"choices\"][0][\"message\"][\"content\"]\n    except httpx.RequestError as e:\n        print(f\"API request failed: {e}\")\n        return \"\"\n```\n\n## Step 2: Define a Metric Function\n\nYour metric function scores the LLM output. Higher is better. Here is a simple example that scores based on length, coherence, and relevance to a target topic, with additional comments for clarity:\n\n```python\ndef score(text: str, target_topic: str) -> float:\n    # Calculate the number of words in the output\n    words = len(text.split())\n    # Normalize length score to be between 0 and 1\n    length_score = min(words / 200, 1.0)\n    # Simple coherence check: higher lexical diversity is better\n    coherence_score = len(set(text.split())) / words if words > 0 else 0\n    # Relevance score: check if the target topic is mentioned\n    relevance_score = 1.0 if target_topic.lower() in text.lower() else 0.0\n    # Weighted average of length, coherence, and relevance scores\n    return 0.4 * length_score + 0.3 * coherence_score + 0.3 * relevance_score\n```\n\n## Step 3: Implement the Evaluation Loop with Cost Tracking, Git Versioning, and Configurable Model Parameters\n\n```python\nimport json\nimport subprocess\n\ndef main():\n    best_score = 0.0\n    artifact = open(\"artifact.txt\").read().strip()\n    total_cost = 0.0\n    results = []\n    target_topic = \"optimization\"\n\n    # Initialize git repository if not already done\n    try:\n        subprocess.run([\"git\", \"rev-parse\"], check=True, capture_output=True)\n    except subprocess.CalledProcessError:\n        subprocess.run([\"git\", \"init\"], check=True)\n        subprocess.run([\"git\", \"add\", \"artifact.txt\"], check=True)\n        subprocess.run([\"git\", \"commit\", \"-m\", \"Initial artifact\"], check=True)\n\n    for i in range(MAX_ITERATIONS):\n        prompt = f\"Improve this text to be more relevant to {target_topic}:\\n\\n{artifact}\"\n        candidate = call_llm(prompt, MODEL_CONFIG)\n        \n        if not candidate:  # Skip iteration if API call failed\n            continue\n        \n        new_score = score(candidate, target_topic)\n        total_cost += COST_PER_TOKEN * (len(prompt) + len(candidate))  # Simplified cost calculation\n        \n        if new_score > best_score:\n            best_score = new_score\n            artifact = candidate.strip()\n            with open(\"artifact.txt\", \"w\") as f:\n                f.write(artifact)\n            # Commit changes to git\n            subprocess.run([\"git\", \"add\", \"artifact.txt\"], check=True)\n            subprocess.run([\"git\", \"commit\", \"-m\", f\"Iter {i}: Improved artifact\"], check=True)\n            print(f\"Iter {i}: KEEP  score={new_score:.2f}\")\n            results.append({\"iteration\": i, \"score\": new_score, \"action\": \"KEEP\", \"cost\": total_cost})\n        else:\n            print(f\"Iter {i}: DISCARD  score={new_score:.2f}  best={best_score:.2f}\")\n            results.append({\"iteration\": i, \"score\": new_score, \"action\": \"DISCARD\", \"cost\": total_cost})\n\n    # Save results to a JSON file for later analysis\n    with open(\"results.json\", \"w\") as f:\n        json.dump(results, f, indent=2)\n\n    # Save final configuration to a JSON file\n    with open(\"config.json\", \"w\") as f:\n        json.dump(MODEL_CONFIG, f, indent=2)\n\nif __name__ == \"__main__\":\n    main()\n```\n\n## Step 4: Run Your Evaluation Loop\n\n```bash\npython loop.py\n```\n\nYou should see output like:\n\n```\nIter 0: KEEP  score=0.85\nIter 1: DISCARD  score=0.81  best=0.85\nIter 2: KEEP  score=0.91\nIter 3: DISCARD  score=0.88  best=0.91\n```\n\nThe artifact file is updated and committed to git whenever a better version is found, and results are saved to `results.json`.\n\n## Why Greedy Hill-Climbing?\n\nGreedy hill-climbing is simple and effective for many optimization tasks. It always moves towards better solutions, making it suitable for improving LLM outputs. However, it may get stuck in local optima. Consider adding randomness or more sophisticated optimization techniques for complex tasks.\n\n## Tradeoffs and Limitations\n\nWhile greedy hill-climbing is straightforward to implement, it lacks the ability to explore the solution space broadly. For tasks requiring more exploration, consider techniques like simulated annealing or genetic algorithms. Additionally, be mindful of the cost implications of repeated LLM queries.\n\n## Common Pitfalls\n\n1. **Metric Gaming**: Ensure your metric accurately reflects the desired outcome. A poorly designed metric can lead to suboptimal or misleading results.\n2. **Circular Feedback**: Be cautious when using LLM outputs to evaluate other LLM outputs. This can create feedback loops that degrade performance over time.\n3. **Runaway Costs**: Always track costs and consider implementing a budget constraint to prevent unexpected expenses.\n\n## Worked Example\n\nLet's say you start with a simple artifact: \"The quick brown fox jumps over the lazy dog.\" After running the evaluation loop with a target topic \"optimization\", the artifact might improve to: \"The quick brown fox demonstrates an optimized jumping technique over the lazy dog, showcasing a practical example of motion optimization.\" The score improves from 0.4 to 0.8 as the output becomes more coherent, relevant, and contextually appropriate.\n\n## Advanced Configuration and Model Selection\n\nTo further enhance your evaluation loop, you can experiment with different models and parameters. Modify the `MODEL_CONFIG` dictionary to try out various models available on OpenRouter, adjusting parameters like `max_tokens` and `temperature` to suit your specific needs.\n\n## What's Next\n\nThis basic loop works, but you can enhance it further:\n- Query multiple models in parallel to compare their performance\n- Implement more sophisticated optimization strategies like simulated annealing\n- Add more comprehensive error handling and logging mechanisms\n- Integrate with other tools for more advanced analysis and visualization of results\n\nBy following this tutorial, you've built a systematic evaluation loop for LLM experiments that not only optimizes your prompts but also versions your improvements using git and supports configurable model selection. This foundation allows you to scale your experiments, track progress, and optimize your prompts effectively.", "B": "# Build a Minimal LLM Evaluation Loop in Python: Systematic Experiments for ML Engineers\n\nIf you want to stop manually testing prompts and start running systematic experiments, an evaluation loop is the right tool. This tutorial shows you how to build one using the OpenRouter API, covering essential steps from API key setup to saving results.\n\n## What You Will Build\n\nBy the end of this tutorial, you will have a working Python script that:\n1. Makes LLM API calls using OpenRouter\n2. Scores the output using a custom metric\n3. Implements a probabilistic exploration strategy to improve the output\n4. Saves the best artifact to a file\n5. Tracks costs and iterations\n6. Versions improvements using git\n\n## What You Need\n\n- Python 3.10+\n- An OpenRouter API key (sign up at openrouter.ai)\n- `httpx` installed: `pip install httpx`\n- `python-dotenv` installed: `pip install python-dotenv`\n- Git installed and configured\n\n## Step 1: Setup API Key and Constants\n\nFirst, create a `.env` file in your project root with your OpenRouter API key:\n```plaintext\nOPENROUTER_API_KEY=sk-or-your-key-here\n```\n\n```python\nimport os\nimport math\nimport httpx\nfrom dotenv import load_dotenv\nfrom typing import Optional, Dict, Any\n\nload_dotenv()  # Load environment variables from .env\n\nAPI_KEY = os.getenv(\"OPENROUTER_API_KEY\")\nAPI_URL = \"https://openrouter.ai/api/v1/chat/completions\"\nMODEL = \"openai/gpt-4o-mini\"\nMAX_ITERATIONS = 30\nTEMPERATURE_DECAY = 0.9  # Probabilistic exploration parameter\nCOST_PER_TOKEN = 0.000002  # Example cost, check OpenRouter pricing\n\ndef call_llm(prompt: str, temperature: float = 0.7) -> Optional[str]:\n    try:\n        response = httpx.post(\n            API_URL,\n            headers={\n                \"Authorization\": f\"Bearer {API_KEY}\",\n                \"Content-Type\": \"application/json\"\n            },\n            json={\n                \"model\": MODEL,\n                \"messages\": [{\"role\": \"user\", \"content\": prompt}],\n                \"temperature\": temperature  # Add temperature for exploration\n            },\n            timeout=15.0  # Extended timeout for more complex generations\n        )\n        response.raise_for_status()\n        data: Dict[str, Any] = response.json()\n        return data[\"choices\"][0][\"message\"][\"content\"]\n    except (httpx.RequestError, KeyError) as e:\n        print(f\"API request failed: {e}\")\n        return None\n```\n\n## Step 2: Advanced Metric Function with Probabilistic Scoring\n\n```python\nimport nltk\nnltk.download('punkt', quiet=True)\nnltk.download('wordnet', quiet=True)\n\nfrom nltk.translate.bleu_score import sentence_bleu\nfrom nltk.tokenize import word_tokenize\n\ndef advanced_score(text: str, reference: Optional[str] = None) -> float:\n    \"\"\"\n    Multi-dimensional scoring function with probabilistic exploration.\n    \n    Args:\n        text: Generated text to evaluate\n        reference: Optional reference text for comparative scoring\n    \n    Returns:\n        Composite score between 0 and 1\n    \"\"\"\n    # Length normalization\n    words = text.split()\n    length_score = min(len(words) / 100, 1.0)\n    \n    # Lexical diversity\n    unique_words = len(set(words)) / len(words) if words else 0\n    diversity_score = min(unique_words, 1.0)\n    \n    # BLEU score if reference is provided\n    bleu_score = 0\n    if reference:\n        reference_tokens = [word_tokenize(reference)]\n        candidate_tokens = word_tokenize(text)\n        bleu_score = sentence_bleu(reference_tokens, candidate_tokens)\n    \n    # Weighted combination of scores with randomness\n    import random\n    exploration_bonus = random.uniform(0, 0.1)  # Small random bonus for exploration\n    \n    return 0.4 * length_score + \\\n           0.3 * diversity_score + \\\n           0.2 * bleu_score + \\\n           0.1 * exploration_bonus\n```\n\n## Step 3: Probabilistic Exploration Loop\n\n```python\nimport json\nimport subprocess\nimport random\n\ndef main():\n    initial_artifact = open(\"artifact.txt\", \"r\").read().strip()\n    best_artifact = initial_artifact\n    best_score = advanced_score(initial_artifact)\n    total_cost = 0.0\n    results = []\n    temperature = 1.0  # Start with high exploration\n\n    for iteration in range(MAX_ITERATIONS):\n        # Probabilistic prompt generation strategy\n        prompt_strategies = [\n            f\"Improve this text with more detail: {best_artifact}\",\n            f\"Rewrite this text from a different perspective: {best_artifact}\",\n            f\"Expand on the key points in this text: {best_artifact}\"\n        ]\n        prompt = random.choice(prompt_strategies)\n\n        # Dynamic temperature for exploration\n        candidate = call_llm(prompt, temperature=temperature)\n        \n        if not candidate:\n            continue\n        \n        candidate_score = advanced_score(candidate, reference=best_artifact)\n        total_cost += COST_PER_TOKEN * (len(prompt) + len(candidate))\n        \n        # Probabilistic acceptance with temperature-based exploration\n        acceptance_probability = math.exp((candidate_score - best_score) / temperature)\n        \n        if candidate_score > best_score or random.random() < acceptance_probability:\n            best_artifact = candidate\n            best_score = candidate_score\n            \n            with open(\"artifact.txt\", \"w\") as f:\n                f.write(best_artifact)\n            \n            subprocess.run([\"git\", \"add\", \"artifact.txt\"], check=True)\n            subprocess.run([\"git\", \"commit\", \"-m\", f\"Iter {iteration}: Improved artifact\"], check=True)\n            \n            print(f\"Iter {iteration}: EXPLORE  score={candidate_score:.2f}\")\n            results.append({\n                \"iteration\": iteration, \n                \"score\": candidate_score, \n                \"action\": \"EXPLORE\", \n                \"cost\": total_cost\n            })\n        \n        # Decay temperature to reduce exploration over time\n        temperature *= TEMPERATURE_DECAY\n\n    with open(\"results.json\", \"w\") as f:\n        json.dump(results, f, indent=2)\n\nif __name__ == \"__main__\":\n    main()\n```\n\n## Why Probabilistic Exploration?\n\nUnlike traditional greedy hill-climbing, this approach introduces controlled randomness. By using temperature-based exploration, we prevent getting stuck in local optima while still maintaining a bias towards improvement. The dynamic temperature ensures early iterations explore more broadly, while later iterations focus on refinement.\n\n## Common Pitfalls and Mitigation\n\n1. **Metric Gaming**: The multi-dimensional scoring function reduces the risk of optimizing for a single, easily manipulated metric.\n2. **Runaway Costs**: Temperature decay and iteration limits prevent unbounded exploration.\n3. **Circular Feedback**: By introducing randomness and using reference-based scoring, we reduce the risk of circular optimization.\n\n## What's Next\n\nPotential enhancements include:\n- Implementing multi-model comparative evaluation\n- Adding more sophisticated exploration strategies\n- Creating more nuanced scoring mechanisms\n\nBy adopting this probabilistic exploration approach, you transform your LLM experimentation from rigid, deterministic iterations to a more adaptive, intelligent optimization process.", "C": "# Build a Minimal LLM Evaluation Loop in Python: Systematic Experiments for ML Engineers\n\nMoving from \"artisanal\" prompt crafting to systematic optimization is the single biggest productivity jump you can make as an LLM developer. If you aren't measuring your prompts, you aren't engineering them; you're just guessing.\n\nThis tutorial builds a minimal, robust evaluation loop using Python and OpenRouter. We will implement a greedy hill-climbing algorithm that treats your LLM prompt as a variable and your output quality as a measurable objective.\n\n## What You Will Build\n\nYou will build a script that:\n1. **Systematizes experimentation:** Iteratively improves a prompt based on a quantitative `score` function.\n2. **Automates versioning:** Uses `git` to snapshots successful prompt/output pairs.\n3. **Tracks costs:** Monitors token usage to prevent budget blowouts.\n4. **Ensures reproducibility:** Saves results to a structured TSV file for analysis.\n\n## Prerequisites\n\n- Python 3.10+\n- `pip install httpx python-dotenv`\n- A configured Git repository in your project folder.\n\n## Step 1: Configuration\n\nCreate a `.env` file to store your credentials securely:\n```plaintext\nOPENROUTER_API_KEY=sk-or-your-key-here\n```\n\n## Step 2: The Evaluation Engine\n\nWe use `httpx` for asynchronous-ready, robust API calls. We define a `ModelConfig` to hold our parameters, keeping the code modular.\n\n```python\nimport os\nimport httpx\nimport json\nfrom dotenv import load_dotenv\nfrom typing import NamedTuple\n\nload_dotenv()\n\nclass ModelConfig(NamedTuple):\n    api_key: str = os.getenv(\"OPENROUTER_API_KEY\", \"\")\n    url: str = \"https://openrouter.ai/api/v1/chat/completions\"\n    model: str = \"openai/gpt-4o-mini\"\n\ndef call_llm(prompt: str, config: ModelConfig) -> str:\n    \"\"\"Sends a prompt to the LLM with basic error handling.\"\"\"\n    payload = {\n        \"model\": config.model,\n        \"messages\": [{\"role\": \"user\", \"content\": prompt}]\n    }\n    headers = {\"Authorization\": f\"Bearer {config.api_key}\"}\n    \n    try:\n        with httpx.Client(timeout=30.0) as client:\n            response = client.post(config.url, json=payload, headers=headers)\n            response.raise_for_status()\n            return response.json()[\"choices\"][0][\"message\"][\"content\"]\n    except Exception as e:\n        print(f\"Error: {e}\")\n        return \"\"\n```\n\n## Step 3: Defining the Metric\n\nA metric is simply a function that maps a string to a float. In a real-world scenario, this might call a \"Judge LLM\" or run regex patterns. Here, we use a heuristic score.\n\n```python\ndef score_output(text: str) -> float:\n    \"\"\"Heuristic: score based on length and presence of key required terms.\"\"\"\n    required_terms = [\"summary\", \"key points\", \"conclusion\"]\n    score = 0.0\n    # Reward length (up to a point)\n    score += min(len(text.split()) / 100, 1.0)\n    # Reward presence of required keywords\n    for term in required_terms:\n        if term.lower() in text.lower():\n            score += 0.3\n    return score\n```\n\n## Step 4: The Optimization Loop\n\nWe use a \"greedy\" approach: if the new score exceeds the current best, we accept the change and commit it to git. \n\n```python\nimport subprocess\nimport csv\n\ndef run_experiment(initial_prompt: str, iterations: int = 10):\n    config = ModelConfig()\n    best_score = -1.0\n    current_prompt = initial_prompt\n    \n    with open(\"results.tsv\", \"w\", newline='') as f:\n        writer = csv.writer(f, delimiter='\\t')\n        writer.writerow([\"iteration\", \"score\", \"status\"])\n\n        for i in range(iterations):\n            output = call_llm(current_prompt, config)\n            if not output: continue\n            \n            s = score_output(output)\n            \n            if s > best_score:\n                best_score = s\n                # Logic: If we improve, we update the source of truth\n                with open(\"best_prompt.txt\", \"w\") as pf: pf.write(current_prompt)\n                subprocess.run([\"git\", \"add\", \"best_prompt.txt\"], check=True)\n                subprocess.run([\"git\", \"commit\", \"-m\", f\"Improved score to {s}\"], check=True)\n                status = \"KEEP\"\n            else:\n                status = \"DISCARD\"\n            \n            writer.writerow([i, s, status])\n            print(f\"Iter {i}: {status} (Score: {s:.2f})\")\n            \n            # Simple mutation: append a directive to improve\n            current_prompt += \"\\nRefine the above to be more concise.\"\n```\n\n## Why Greedy Hill-Climbing?\n\nGreedy hill-climbing is the \"Hello World\" of optimization. It works because LLM prompt engineering often involves additive refinement. By only keeping changes that increase the score, you ensure the system monotonically improves. However, beware of **local optima**: if your metric is too narrow, the LLM will \"game\" the score (e.g., repeating the same word to increase length) rather than improving quality.\n\n## Common Pitfalls\n\n1. **The \"Judge\" Bias:** If you use an LLM to score your outputs, the judge will prefer its own writing style. Use objective, non-LLM metrics (like code execution or regex) whenever possible.\n2. **Metric Gaming:** If your metric rewards length, the LLM will become verbose. Always include penalties for undesirable traits.\n3. **API Cost Creep:** Even cheap models add up. Always implement a max-iteration limit and a \"circuit breaker\" that stops the loop if the total cost exceeds a threshold.\n\n## Worked Example: Before vs. After\n\n**Initial Output (Score 0.3):** \"The project failed because of bad communication.\"\n**Optimized Output (Score 0.9):** \"The project failure was primarily driven by communicatio