{"type": "stage1_complete", "proposals": {"A": "# Build a Minimal LLM Evaluation Loop in Python: Systematic Experiments for ML Engineers\n\n## What You Will Build\n\nBy the end of this tutorial, you will have a working Python script that:\n1. Makes LLM API calls using OpenRouter\n2. Scores the output using a custom metric\n3. Implements a greedy hill-climbing loop to improve the output\n4. Saves the best artifact to a file\n5. Tracks costs and iterations\n6. Versions improvements using git\n\n## What You Need\n\n- Python 3.10+\n- An OpenRouter API key (sign up at openrouter.ai)\n- `httpx` installed: `pip install httpx`\n- `python-dotenv` installed: `pip install python-dotenv`\n- Git installed and configured\n\n## Step 1: Setup API Key and Constants\n\nFirst, create a `.env` file in your project root with your OpenRouter API key:\n```plaintext\nOPENROUTER_API_KEY=sk-or-your-key-here\n```\n\n```python\nimport os\nimport httpx\nfrom dotenv import load_dotenv\n\nload_dotenv()  # Load environment variables from .env\n\nAPI_KEY = os.getenv(\"OPENROUTER_API_KEY\")\nAPI_URL = \"https://openrouter.ai/api/v1/chat/completions\"\nMODEL = \"openai/gpt-4o-mini\"\nMAX_ITERATIONS = 20\nCOST_PER_TOKEN = 0.000002  # Example cost, check OpenRouter pricing\n\ndef call_llm(prompt: str) -> str:\n    try:\n        response = httpx.post(\n            API_URL,\n            headers={\"Authorization\": f\"Bearer {API_KEY}\"},\n            json={\n                \"model\": MODEL,\n                \"messages\": [{\"role\": \"user\", \"content\": prompt}]\n            },\n            timeout=10.0  # Add timeout to prevent hanging\n        )\n        response.raise_for_status()  # Raise an exception for bad status codes\n        data = response.json()\n        return data[\"choices\"][0][\"message\"][\"content\"]\n    except httpx.RequestError as e:\n        print(f\"API request failed: {e}\")\n        return \"\"\n```\n\n## Step 2: Define a Metric Function\n\nYour metric function scores the LLM output. Higher is better. Here is a simple example that scores based on length and coherence, with additional comments for clarity:\n\n```python\ndef score(text: str) -> float:\n    # Calculate the number of words in the output\n    words = len(text.split())\n    # Normalize length score to be between 0 and 1\n    length_score = min(words / 200, 1.0)\n    # Simple coherence check: higher lexical diversity is better\n    coherence_score = len(set(text.split())) / words if words > 0 else 0\n    # Weighted average of length and coherence scores\n    return 0.5 * length_score + 0.5 * coherence_score\n```\n\n## Step 3: Implement the Evaluation Loop with Cost Tracking, Git Versioning, and Parallel Model Queries\n\n```python\nimport json\nimport subprocess\nimport asyncio\nimport httpx\n\nasync def call_llm_async(prompt: str, model: str) -> str:\n    try:\n        async with httpx.AsyncClient() as client:\n            response = await client.post(\n                API_URL,\n                headers={\"Authorization\": f\"Bearer {API_KEY}\"},\n                json={\n                    \"model\": model,\n                    \"messages\": [{\"role\": \"user\", \"content\": prompt}]\n                },\n                timeout=10.0\n            )\n            response.raise_for_status()\n            data = response.json()\n            return data[\"choices\"][0][\"message\"][\"content\"]\n    except httpx.RequestError as e:\n        print(f\"API request failed: {e}\")\n        return \"\"\n\nasync def main():\n    best_score = 0.0\n    artifact = open(\"artifact.txt\").read().strip()\n    total_cost = 0.0\n    results = []\n\n    # Initialize git repository if not already done\n    try:\n        subprocess.run([\"git\", \"rev-parse\"], check=True, capture_output=True)\n    except subprocess.CalledProcessError:\n        subprocess.run([\"git\", \"init\"], check=True)\n        subprocess.run([\"git\", \"add\", \"artifact.txt\"], check=True)\n        subprocess.run([\"git\", \"commit\", \"-m\", \"Initial artifact\"], check=True)\n\n    models = [\"openai/gpt-4o-mini\", \"anthropic/claude-3-haiku\"]\n\n    for i in range(MAX_ITERATIONS):\n        prompt = f\"Improve this text:\\n\\n{artifact}\"\n        tasks = [call_llm_async(prompt, model) for model in models]\n        candidates = await asyncio.gather(*tasks)\n\n        for model, candidate in zip(models, candidates):\n            if not candidate:  # Skip iteration if API call failed\n                continue\n            \n            new_score = score(candidate)\n            total_cost += COST_PER_TOKEN * (len(prompt) + len(candidate))  # Simplified cost calculation\n            \n            if new_score > best_score:\n                best_score = new_score\n                artifact = candidate.strip()\n                with open(\"artifact.txt\", \"w\") as f:\n                    f.write(artifact)\n                # Commit changes to git\n                subprocess.run([\"git\", \"add\", \"artifact.txt\"], check=True)\n                subprocess.run([\"git\", \"commit\", \"-m\", f\"Iter {i}: Improved artifact\"], check=True)\n                print(f\"Iter {i}: KEEP  score={new_score:.2f}  model={model}\")\n                results.append({\"iteration\": i, \"score\": new_score, \"action\": \"KEEP\", \"cost\": total_cost, \"model\": model})\n            else:\n                print(f\"Iter {i}: DISCARD  score={new_score:.2f}  best={best_score:.2f}  model={model}\")\n                results.append({\"iteration\": i, \"score\": new_score, \"action\": \"DISCARD\", \"cost\": total_cost, \"model\": model})\n\n    # Save results to a JSON file for later analysis\n    with open(\"results.json\", \"w\") as f:\n        json.dump(results, f, indent=2)\n\nif __name__ == \"__main__\":\n    asyncio.run(main())\n```\n\n## Step 4: Run Your Evaluation Loop\n\n```bash\npython loop.py\n```\n\nYou should see output like:\n\n```\nIter 0: KEEP  score=0.85  model=openai/gpt-4o-mini\nIter 1: DISCARD  score=0.81  best=0.85  model=anthropic/claude-3-haiku\nIter 2: KEEP  score=0.91  model=openai/gpt-4o-mini\nIter 3: DISCARD  score=0.88  best=0.91  model=anthropic/claude-3-haiku\n```\n\nThe artifact file is updated and committed to git whenever a better version is found, and results are saved to `results.json`.\n\n## Why Greedy Hill-Climbing?\n\nGreedy hill-climbing is simple and effective for many optimization tasks. It always moves towards better solutions, making it suitable for improving LLM outputs. However, it may get stuck in local optima. Consider adding randomness or more sophisticated optimization techniques for complex tasks.\n\n## Tradeoffs and Limitations\n\nWhile greedy hill-climbing is straightforward to implement, it lacks the ability to explore the solution space broadly. For tasks requiring more exploration, consider techniques like simulated annealing or genetic algorithms. Additionally, be mindful of the cost implications of repeated LLM queries.\n\n## Common Pitfalls\n\n1. **Metric Gaming**: Ensure your metric accurately reflects the desired outcome. A poorly designed metric can lead to suboptimal or misleading results.\n2. **Circular Feedback**: Be cautious when using LLM outputs to evaluate other LLM outputs. This can create feedback loops that degrade performance over time.\n3. **Runaway Costs**: Always track costs and consider implementing a budget constraint to prevent unexpected expenses.\n\n## Worked Example\n\nLet's say you start with a simple artifact: \"The quick brown fox jumps over the lazy dog.\" After running the evaluation loop, the artifact might improve to: \"The quick brown fox jumps over the lazy dog, demonstrating a classic example of a pangram that uses all the letters of the alphabet efficiently.\" The score improves from 0.4 to 0.8 as the output becomes more coherent and contextually relevant.\n\n## What's Next\n\nThis basic loop works, but you can enhance it further:\n- Implement more sophisticated optimization strategies like simulated annealing\n- Add more comprehensive error handling and logging mechanisms\n- Experiment with different models and compare their performance\n\nBy following this tutorial, you've built a systematic evaluation loop for LLM experiments that not only optimizes your prompts but also versions your improvements using git. This foundation allows you to scale your experiments, track progress, and optimize your prompts effectively.", "B": "# Build a Minimal LLM Evaluation Loop in Python: Systematic Experiments for ML Engineers\n\nSystematic prompt engineering requires more than manual tweaking\u2014it demands a structured, repeatable approach. This tutorial introduces a lightweight Python framework for automatically improving LLM outputs through principled experimentation.\n\n## What You Will Build\n\nA Python script that:\n1. Runs automated LLM experiments\n2. Implements multi-objective optimization\n3. Tracks experiment provenance\n4. Manages computational and financial budgets\n5. Provides extensible evaluation infrastructure\n\n## Prerequisites\n\n- Python 3.10+\n- OpenRouter API key\n- `httpx`, `python-dotenv`, `pydantic`\n- Basic async programming knowledge\n\n## Design Philosophy: Observability-Driven Experimentation\n\nUnlike traditional one-off prompt testing, this framework treats prompt engineering as a structured scientific process. By capturing detailed metadata about each experiment, we transform subjective prompt crafting into a measurable, reproducible discipline.\n\n## Core Implementation\n\n```python\nfrom typing import List, Dict, Any\nfrom pydantic import BaseModel, Field\nimport asyncio\nimport httpx\nimport json\nimport os\nfrom dotenv import load_dotenv\n\nload_dotenv()\n\nclass ExperimentConfig(BaseModel):\n    api_key: str = Field(default_factory=lambda: os.getenv(\"OPENROUTER_API_KEY\"))\n    model: str = \"openai/gpt-4o-mini\"\n    max_iterations: int = 20\n    budget_usd: float = 5.00\n    \nclass MultiObjectiveScorer:\n    @staticmethod\n    def compute_score(response: str) -> Dict[str, float]:\n        \"\"\"\n        Compute multi-dimensional scoring across different quality axes.\n        \n        Dimensions:\n        - Coherence: Lexical diversity\n        - Relevance: Semantic alignment with task\n        - Conciseness: Information density\n        \"\"\"\n        words = response.split()\n        return {\n            \"coherence\": len(set(words)) / len(words) if words else 0,\n            \"relevance\": len(words) / 200,  # Normalized length proxy\n            \"conciseness\": sum(len(word) for word in words) / (len(words) * 10 if words else 1)\n        }\n\nclass ExperimentRunner:\n    def __init__(self, config: ExperimentConfig):\n        self.config = config\n        self.total_cost = 0.0\n        self.iterations: List[Dict[str, Any]] = []\n\n    async def call_llm(self, prompt: str) -> str:\n        async with httpx.AsyncClient() as client:\n            try:\n                response = await client.post(\n                    \"https://openrouter.ai/api/v1/chat/completions\",\n                    headers={\"Authorization\": f\"Bearer {self.config.api_key}\"},\n                    json={\n                        \"model\": self.config.model,\n                        \"messages\": [{\"role\": \"user\", \"content\": prompt}]\n                    },\n                    timeout=10.0\n                )\n                response.raise_for_status()\n                return response.json()[\"choices\"][0][\"message\"][\"content\"]\n            except httpx.RequestError as e:\n                print(f\"API Error: {e}\")\n                return \"\"\n\n    async def run_experiment(self, initial_artifact: str):\n        current_artifact = initial_artifact\n        best_scores = {\n            \"coherence\": 0,\n            \"relevance\": 0,\n            \"conciseness\": 0\n        }\n\n        for iteration in range(self.config.max_iterations):\n            prompt = f\"Systematically improve this text, focusing on making it more precise and coherent:\\n\\n{current_artifact}\"\n            \n            candidate = await self.call_llm(prompt)\n            scores = MultiObjectiveScorer.compute_score(candidate)\n            \n            # Multi-objective improvement condition\n            if all(scores[dim] > best_scores[dim] for dim in scores):\n                current_artifact = candidate\n                best_scores = scores\n                \n                self.iterations.append({\n                    \"iteration\": iteration,\n                    \"artifact\": current_artifact,\n                    \"scores\": scores\n                })\n                \n                print(f\"Iteration {iteration}: Improvement detected\")\n            \n            if self.total_cost > self.config.budget_usd:\n                break\n\n        return current_artifact, best_scores\n\nasync def main():\n    config = ExperimentConfig()\n    runner = ExperimentRunner(config)\n    \n    initial_text = \"The quick brown fox jumps over the lazy dog.\"\n    final_artifact, final_scores = await runner.run_experiment(initial_text)\n    \n    with open(\"experiment_log.json\", \"w\") as f:\n        json.dump({\n            \"final_artifact\": final_artifact,\n            \"final_scores\": final_scores,\n            \"iterations\": runner.iterations\n        }, f, indent=2)\n\nif __name__ == \"__main__\":\n    asyncio.run(main())\n```\n\n## Key Innovations\n\n1. **Multi-Objective Scoring**: Unlike single-metric approaches, this framework evaluates responses across multiple dimensions simultaneously.\n2. **Async Design**: Leverages Python's async capabilities for efficient API interactions.\n3. **Comprehensive Logging**: Captures detailed experiment metadata for retrospective analysis.\n4. **Budget-Aware Experimentation**: Prevents runaway computational costs.\n\n## Tradeoffs and Limitations\n\nWhile powerful, this approach has constraints:\n- Multi-objective optimization can miss nuanced improvements\n- API costs can accumulate quickly\n- Not suitable for highly complex or creative tasks\n\n## Next Steps\n\nPotential enhancements include:\n- Implementing more sophisticated scoring algorithms\n- Adding parallel model comparison\n- Creating visualization tools for experiment tracking\n\nBy adopting this systematic approach, ML engineers can transform prompt engineering from an art into a rigorous, data-driven discipline.", "C": "# Build a Minimal LLM Evaluation Loop in Python: Systematic Experiments for ML Engineers\n\nIf you want to move from manual, artisanal prompt testing to repeatable, automated optimization, an evaluation loop is your most powerful asset. This tutorial guides you through building a lean, robust evaluation loop using Python and the OpenRouter API. We will move beyond \"vibe checks\" to a systematic system that tracks metrics, costs, and version history.\n\n## What You Will Build\n\nBy the end of this tutorial, you will have a production-ready Python script that:\n1.  **Orchestrates LLM Calls:** Uses an asynchronous approach for better throughput.\n2.  **Implements Greedy Hill-Climbing:** Iteratively refines prompts based on a programmatic metric.\n3.  **Tracks Technical Debt:** Logs costs and scores to a TSV file for later analysis.\n4.  **Versions Artifacts:** Automates git commits only when a \"KEEP\" threshold is met.\n\n## What You Need\n\n- Python 3.10+\n- `httpx` (for async requests) and `python-dotenv` (for security)\n- An OpenRouter API key\n\nInstall dependencies: `pip install httpx python-dotenv`\n\n## Step 1: Secure Configuration and Client Setup\n\nNever hardcode secrets. Use a `.env` file to store your `OPENROUTER_API_KEY`.\n\n```python\nimport os\nimport httpx\nimport asyncio\nfrom dotenv import load_dotenv\n\nload_dotenv()\n\nAPI_KEY = os.getenv(\"OPENROUTER_API_KEY\")\nAPI_URL = \"https://openrouter.ai/api/v1/chat/completions\"\n# Using a high-performance, cost-effective model\nMODEL = \"openai/gpt-4o-mini\" \n\nasync def call_llm(prompt: str) -> str | None:\n    async with httpx.AsyncClient() as client:\n        try:\n            response = await client.post(\n                API_URL,\n                headers={\"Authorization\": f\"Bearer {API_KEY}\"},\n                json={\n                    \"model\": MODEL,\n                    \"messages\": [{\"role\": \"user\", \"content\": prompt}]\n                },\n                timeout=30.0\n            )\n            response.raise_for_status()\n            return response.json()[\"choices\"][0][\"message\"][\"content\"]\n        except httpx.HTTPError as e:\n            print(f\"Request failed: {e}\")\n            return None\n```\n\n## Step 2: Formalizing the Metric\n\nIn a real-world loop, your metric is your \"objective function.\" To avoid \"metric gaming\"\u2014where the LLM produces verbose, repetitive text to inflate scores\u2014we use a combination of length and keyword presence.\n\n```python\ndef evaluate_artifact(text: str) -> float:\n    # Example: Penalize brevity, reward specific required keywords\n    keywords = [\"professional\", \"concise\", \"actionable\"]\n    score = 0.0\n    if len(text) > 50: score += 0.5\n    for kw in keywords:\n        if kw in text.lower(): score += 0.15\n    return score\n```\n\n## Step 3: The Optimization Loop\n\nWe use a \"Greedy Hill-Climbing\" approach. We accept a new version only if it improves the score, ensuring the artifact monotonically improves over time.\n\n```python\nimport subprocess\nimport time\n\nasync def run_experiment():\n    current_artifact = \"Drafting a professional email to a client.\"\n    best_score = evaluate_artifact(current_artifact)\n    \n    with open(\"results.tsv\", \"w\") as f:\n        f.write(\"iteration\\tscore\\tstatus\\n\")\n\n    for i in range(10):\n        prompt = f\"Rewrite this text to be more professional: {current_artifact}\"\n        candidate = await call_llm(prompt)\n        \n        if not candidate: continue\n        \n        score = evaluate_artifact(candidate)\n        \n        if score > best_score:\n            best_score = score\n            current_artifact = candidate\n            with open(\"artifact.txt\", \"w\") as f: f.write(current_artifact)\n            subprocess.run([\"git\", \"commit\", \"-am\", f\"Iter {i}: Improved score to {score}\"])\n            status = \"KEEP\"\n        else:\n            status = \"DISCARD\"\n            \n        with open(\"results.tsv\", \"a\") as f:\n            f.write(f\"{i}\\t{score}\\t{status}\\n\")\n        print(f\"Iter {i}: {status} (Score: {score:.2f})\")\n        await asyncio.sleep(1) # Rate limit compliance\n\nif __name__ == \"__main__\":\n    asyncio.run(run_experiment())\n```\n\n## Why Greedy Hill-Climbing?\n\nGreedy hill-climbing is the \"hello world\" of LLM optimization. It is computationally cheap and provides immediate, observable progress. However, it is prone to local optima\u2014where the LLM gets stuck in a specific stylistic rut. If you find your results plateauing, consider adding \"temperature\" variation or \"restarts\" (randomly changing the prompt) to force the model out of local traps.\n\n## Common Pitfalls\n\n1.  **Metric Gaming:** If your metric relies solely on length, the LLM will generate long, nonsensical strings. Always include a \"coherence\" or \"keyword\" check.\n2.  **Circular Feedback:** If you use an LLM to score your LLM, the grader may become biased toward the style of the generator. Use deterministic, code-based metrics whenever possible.\n3.  **Runaway Costs:** Always verify your `MAX_ITERATIONS` and test with a cheap model (like `gpt-4o-mini`) before moving to expensive ones.\n\n## Worked Example\n\n**Initial Input:** \"Drafting a professional email to a client.\" (Score: 0.2)\n**Iteration 0:** \"Dear Client, I am writing to provide an update on our project status...\" (Score: 0.6)\n**Iteration 1:** \"Dear Valued Client, I am pleased to provide a concise, professional update regarding the actionable milestones of our current project...\" (Score: 0.95)\n\nBy the end of the loop, the system has automatically navigated from a vague intent to a high-scoring, professional artifact.\n\n## Conclusion\n\nThis loop is a starting point. By decoupling your evaluation metric from your generation logic, you gain the ability to experiment with different models, prompts, and parameters systematically. As you grow, consider moving these metrics into a dedicated testing framework like `pytest` or integrating them into your CI/CD pipeline to ensure that future prompt changes don't degrade your established baseline.", "D": "# Build a Minimal LLM Evaluation Loop in Python: Systematic Experiments for ML Engineers\n\nIf you're an ML engineer tired of manual prompt testing, this tutorial guides you through building a streamlined evaluation loop using the OpenRouter API. By the end, you'll have a Python script that automates iterations, scores outputs, and incorporates parallel model queries to enhance exploration, all while keeping things lean and understandable.\n\n## What You Will Build\n\nThis tutorial results in a working script that:\n1. Sets up API calls with OpenRouter for multiple models simultaneously.\n2. Scores LLM outputs using a custom metric.\n3. Runs a greedy hill-climbing loop, now enhanced with parallel queries for better candidate selection.\n4. Implements KEEP/DISCARD logic based on scores.\n5. Saves results to a TSV file for easy analysis.\n6. Tracks costs and versions improvements via git.\n\nThis approach ensures faster experimentation by querying multiple models in parallel, helping you avoid local optima more effectively.\n\n## What You Need\n\n- Python 3.10+\n- An OpenRouter API key from openrouter.ai\n- Install dependencies: `pip install httpx python-dotenv pandas`\n- Git installed and configured\n\n## Step 1: Setup API Key and Constants\n\nStart by creating a `.env` file in your project root:\n```plaintext\nOPENROUTER_API_KEY=sk-or-your-key-he