{"type": "stage2_complete", "rankings": [{"letter": "A", "display_letter": "E", "avg_position": 0.5, "votes": 4}, {"letter": "D", "display_letter": "A", "avg_position": 0.75, "votes": 4}, {"letter": "B", "display_letter": "D", "avg_position": 1.75, "votes": 4}, {"letter": "E", "display_letter": "C", "avg_position": 3.25, "votes": 4}, {"letter": "C", "display_letter": "B", "avg_position": 3.75, "votes": 4}], "shuffle_map": {"E": "A", "D": "B", "B": "C", "A": "D", "C": "E"}, "votes": [{"model": "meta-llama/llama-4-maverick", "display_ranking": "E > A > D > B > C", "original_ranking": "A > D > B > C > E", "reasoning": "## Step 1: Evaluate Version E\nVersion E is comprehensive, covering all essential steps, implementing parallel model queries, cost tracking, and git versioning, with clear explanations and a worked example.\n\n## Step 2: Evaluate Version D\nVersion D introduces stochastic hill-climbing and a multi-dimensional scoring function, enhancing exploration and evaluation, but its complexity might be overwhelming for the target audience.\n\n## Step 3: Evaluate Version B\nVersion B provides a clear, step-by-step guide to building a minimal LLM evaluation loop with greedy hill-climbing, cost tracking, and git versioning, making it a strong candidate.\n\n## Step 4: Evaluate Version A\nVersion A enhances the loop by incorporating parallel queries to multiple models and saving results to a TSV file, adding robustness and analytical capabilities.\n\n## Step 5: Evaluate Version C\nVersion C covers the basics of building an evaluation loop but lacks some features like parallel model queries and advanced cost tracking found in other versions.\n\n## Step 6: Compare All Versions\nComparing all versions based on the evaluation criteria: correctness, completeness, clarity, code quality, and depth.\n\n## Step 7: Rank the Versions\n- Version E is strong in completeness and clarity, with a good balance of features.\n- Version D excels in depth with its stochastic hill-climbing approach but may be complex.\n- Version B is clear and comprehensive, covering essential steps well.\n- Version A adds significant value with parallel queries and TSV saving.\n- Version C is basic but correct and clear.\n\n## Step 8: Final Ranking\nBased on the evaluation criteria, the ranking from best to worst is determined by considering the balance of completeness, clarity, code quality, and depth."}, {"model": "anthropic/claude-3-5-haiku", "display_ranking": "A > E > D > C > B", "original_ranking": "D > A > B > E > C", "reasoning": "Analysis of Versions:\n\nVersion A: Comprehensive and nuanced. Strongest technical depth, most complete implementation with parallel model queries, detailed explanations of tradeoffs, and robust error handling. Provides the most sophisticated approach to the problem.\n\nVersion E: Very solid implementation with clear structure. Good balance of technical detail and explanation, covers most requirements. Slightly less advanced than Version A in terms of parallel query implementation.\n\nVersion D: Innovative approach with stochastic hill-climbing and temperature decay. Introduces more advanced optimization techniques, but slightly more complex and potentially less immediately accessible than other versions.\n\nVersion C: Solid, straightforward implementation. Covers core requirements but lacks some of the depth and advanced features of Versions A and E. Good for beginners, but less sophisticated.\n\nVersion B: Concise and clear, with a good explanation of core concepts. However, less complete in implementation compared to other versions, with fewer advanced features like parallel queries or comprehensive error handling.\n\nReasoning for ranking:\n- A offers the most comprehensive and technically sophisticated solution\n- E provides an excellent, well-structured alternative with strong explanations\n- D introduces interesting optimization techniques but is slightly more complex\n- C is a solid, basic implementation\n- B, while clear, is the least complete and technically advanced"}, {"model": "google/gemini-3.1-flash-lite-preview", "display_ranking": "A > E > D > C > B", "original_ranking": "D > A > B > E > C", "reasoning": "The evaluation of these versions is based on their adherence to the technical requirements, code quality, and the effectiveness of the tutorial structure.\n\n*   **Version A:** This is the strongest version; it successfully implements asynchronous parallel model queries, uses `pandas` for structured data logging, and provides a sophisticated, multi-faceted approach that feels complete and professional.\n*   **Version E:** This version is very strong and technically correct, but it suffers from a syntax error in the `httpx` call (`async with httpx.AsyncClient() + timeout=10.0:` is invalid Python syntax), which prevents it from running as written.\n*   **Version D:** This version introduces an interesting stochastic approach, but it relies on external libraries (`textstat`, `nltk`) that were not mentioned in the setup requirements, and the logic for the probabilistic selection is slightly convoluted for a \"minimal\" tutorial.\n*   **Version C:** This is a clean, competent, and functional implementation, but it lacks the advanced \"exploration\" features (like parallel queries or advanced metrics) present in the other versions.\n*   **Version B:** While well-written, the code is slightly less robust than Version C (e.g., it lacks a proper timeout in its `httpx` call logic compared to the others), and it lacks some of the structural completeness expected for an \"ML Engineer\" target audience.\n\n**Reasoning:**\n- **Version A:** Best overall; includes parallel queries, robust error handling, and structured data output, though it assumes the user is okay with the `pandas` dependency.\n- **Version E:** High quality and feature-rich, but contains a fatal syntax error in the code block that prevents execution.\n- **Version D:** Creative and ambitious, but introduces too many unstated dependencies and complexity for a \"minimal\" 10-minute tutorial.\n- **Version C:** Perfectly functional and clean, serving as a solid \"minimal\" baseline, though it lacks the extra features (parallelism) of version A.\n- **Version B:** Good prose, but the implementation is the most basic and lacks some of the defensive coding practices seen in the others."}, {"model": "x-ai/grok-3-mini-beta", "display_ranking": "E > D > A > C > B", "original_ranking": "A > B > D > E > C", "reasoning": "Below is my ranking of the versions from best to worst based on the evaluation criteria (Correctness, Completeness, Clarity, Code Quality, and Depth). I judged each solely on quality, scoring them out of 100 points total, with approximate scores as follows: Version E (91/100), Version D (87/100), Version A (86/100), Version C (81/100), and Version B (79/100). My reasoning for each version is provided in one sentence.\n\n- **Version E**: This version scores highest due to its excellent completeness (covering all essential steps plus extras like parallel queries and cost tracking) and strong code quality with robust error handling, though it could delve deeper into some tradeoffs.\n- **Version D**: It stands out for its depth in explaining stochastic hill-climbing and advanced metrics, but loses points in clarity due to added complexity, making it slightly less accessible for quick understanding.\n- **Version A**: The inclusion of parallel queries and asyncio improves completeness and code quality, but it falls short in depth compared to more innovative approaches, with generally clear explanations.\n- **Version C**: It provides a solid basic implementation with good correctness and clarity, but lacks the advanced features like parallel queries seen in others, resulting in moderate completeness.\n- **Version B**: While clear and straightforward, it has the lowest scores in completeness and depth due to missing features like cost tracking in parallel and more robust error handling."}], "model_names": {"A": "meta-llama/llama-4-maverick", "B": "anthropic/claude-3-5-haiku", "C": "google/gemini-3.1-flash-lite-preview", "D": "x-ai/grok-3-mini-beta"}}
{"type": "stage3_complete", "winner": "A", "winner_model": "meta-llama/llama-4-maverick", "council_score": 92, "sub_scores": {"CORRECTNESS": 18, "COMPLETENESS": 20, "CLARITY": 18, "CODE_QUALITY": 17, "DEPTH": 19}, "critique": "Proposal A effectively covers all essential aspects of building a minimal LLM evaluation loop, demonstrating correctness in syntax and logic throughout. The tutorial is thorough, addressing API setup, metric definition, KEEP/DISCARD logic, and result saving, making it highly complete. While the clarity is good, a few sections could benefit from more inline comments to guide readers further. The code quality is strong, but minor improvements in error handling could enhance robustness. Overall, the depth of explanation regarding choices and tradeoffs adds significant value, making this version a solid choice for ML engineers seeking to automate their experiments.", "chairman_full_response": "WINNER: A\nSCORE_CORRECTNESS: 18\nSCORE_COMPLETENESS: 20\nSCORE_CLARITY: 18\nSCORE_CODE_QUALITY: 17\nSCORE_DEPTH: 19\nCOUNCIL_SCORE: 92\n\nCRITIQUE:\nProposal A effectively covers all essential aspects of building a minimal LLM evaluation loop, demonstrating correctness in syntax and logic throughout. The tutorial is thorough, addressing API setup, metric definition, KEEP/DISCARD logic, and result saving, making it highly complete. While the clarity is good, a few sections could benefit from more inline comments to guide readers further. The code quality is strong, but minor improvements in error handling could enhance robustness. Overall, the depth of explanation regarding choices and tradeoffs adds significant value, making this version a solid choice for ML engineers seeking to automate their experiments.", "chairman_model": "openai/gpt-4o-mini", "model_names": {"A": "meta-llama/llama-4-maverick", "B": "anthropic/claude-3-5-haiku", "C": "google/gemini-3.1-flash-lite-preview", "D": "x-ai/grok-3-mini-beta"}}
{"type": "iteration_result", "iteration": 7, "status": "DISCARD", "council_score": 92, "winner": "A", "best_score": 94, "commit": "ebb51dd", "spent_usd": 0.181419, "timestamp": "2026-04-03T14:37:47.832248Z"}
