{"type": "run_start", "run_tag": "20260403_142816", "timestamp": "2026-04-03T14:28:17.928827Z", "cost_limit_usd": 5.0, "initial_usage_usd": 2.29260198}
