{"type": "stage1_complete", "proposals": {"A": "# Build a Minimal LLM Evaluation Loop in Python: Systematic Experiments for ML Engineers\n\nIf you want to stop manually testing prompts and start running systematic experiments, an evaluation loop is the right tool. This tutorial shows you how to build one using the OpenRouter API, covering essential steps from API key setup to saving results and providing a deeper dive into optimization strategies and potential pitfalls.\n\n## What You Will Build\n\nBy the end of this tutorial, you will have a working Python script that:\n1. Makes LLM API calls using OpenRouter\n2. Scores the output using a custom metric\n3. Implements a greedy hill-climbing loop to improve the output\n4. Saves the best artifact to a file\n5. Tracks costs and iterations\n6. Versions improvements using git\n\n## What You Need\n\n- Python 3.10+\n- An OpenRouter API key (sign up at openrouter.ai)\n- `httpx` installed: `pip install httpx`\n- `python-dotenv` installed: `pip install python-dotenv`\n- Git installed and configured\n\n## Step 1: Setup API Key and Constants\n\nFirst, create a `.env` file in your project root with your OpenRouter API key:\n```plaintext\nOPENROUTER_API_KEY=sk-or-your-key-here\n```\n\n```python\nimport os\nimport httpx\nfrom dotenv import load_dotenv\nfrom typing import Optional\n\nload_dotenv()  # Load environment variables from .env\n\nAPI_KEY = os.getenv(\"OPENROUTER_API_KEY\")\nAPI_URL = \"https://openrouter.ai/api/v1/chat/completions\"\nMODEL = \"openai/gpt-4o-mini\"\nMAX_ITERATIONS = 20\nCOST_PER_TOKEN = 0.000002  # Example cost, check OpenRouter pricing\n\ndef call_llm(prompt: str, timeout: float = 10.0) -> Optional[str]:\n    \"\"\"\n    Makes a call to the LLM API with the given prompt.\n\n    Args:\n    - prompt (str): The input prompt for the LLM.\n    - timeout (float): Timeout for the API request in seconds.\n\n    Returns:\n    - Optional[str]: The content of the LLM response or None if the request fails.\n    \"\"\"\n    try:\n        response = httpx.post(\n            API_URL,\n            headers={\"Authorization\": f\"Bearer {API_KEY}\"},\n            json={\n                \"model\": MODEL,\n                \"messages\": [{\"role\": \"user\", \"content\": prompt}]\n            },\n            timeout=timeout\n        )\n        response.raise_for_status()  # Raise an exception for bad status codes\n        data = response.json()\n        return data[\"choices\"][0][\"message\"][\"content\"]\n    except httpx.RequestError as e:\n        print(f\"API request failed: {e}\")\n        return None\n```\n\n## Step 2: Define a Metric Function\n\nYour metric function scores the LLM output. Higher is better. Here is a simple example that scores based on length and coherence:\n\n```python\ndef score(text: str) -> float:\n    \"\"\"\n    Scores the given text based on its length and coherence.\n\n    Args:\n    - text (str): The text to be scored.\n\n    Returns:\n    - float: A score between 0 and 1, where higher is better.\n    \"\"\"\n    # Calculate the number of words in the output\n    words = text.split()\n    word_count = len(words)\n    # Normalize length score to be between 0 and 1\n    length_score = min(word_count / 200, 1.0)\n    # Simple coherence check: higher lexical diversity is better\n    coherence_score = len(set(words)) / word_count if word_count > 0 else 0\n    # Weighted average of length and coherence scores\n    return 0.5 * length_score + 0.5 * coherence_score\n```\n\n## Step 3: Implement the Evaluation Loop with Cost Tracking and Git Versioning\n\n```python\nimport json\nimport subprocess\n\ndef main():\n    best_score = 0.0\n    artifact = open(\"artifact.txt\").read().strip()\n    total_cost = 0.0\n    results = []\n\n    # Initialize git repository if not already done\n    try:\n        subprocess.run([\"git\", \"rev-parse\"], check=True, capture_output=True)\n    except subprocess.CalledProcessError:\n        subprocess.run([\"git\", \"init\"], check=True)\n        subprocess.run([\"git\", \"add\", \"artifact.txt\"], check=True)\n        subprocess.run([\"git\", \"commit\", \"-m\", \"Initial artifact\"], check=True)\n\n    for i in range(MAX_ITERATIONS):\n        prompt = f\"Improve this text:\\n\\n{artifact}\"\n        candidate = call_llm(prompt)\n        \n        if candidate is None:  # Skip iteration if API call failed\n            continue\n        \n        new_score = score(candidate)\n        total_tokens = len(prompt.split()) + len(candidate.split())\n        total_cost += COST_PER_TOKEN * total_tokens  # Simplified cost calculation\n        \n        if new_score > best_score:\n            best_score = new_score\n            artifact = candidate.strip()\n            with open(\"artifact.txt\", \"w\") as f:\n                f.write(artifact)\n            # Commit changes to git\n            subprocess.run([\"git\", \"add\", \"artifact.txt\"], check=True)\n            subprocess.run([\"git\", \"commit\", \"-m\", f\"Iter {i}: Improved artifact\"], check=True)\n            print(f\"Iter {i}: KEEP  score={new_score:.2f}\")\n            results.append({\"iteration\": i, \"score\": new_score, \"action\": \"KEEP\", \"cost\": total_cost})\n        else:\n            print(f\"Iter {i}: DISCARD  score={new_score:.2f}  best={best_score:.2f}\")\n            results.append({\"iteration\": i, \"score\": new_score, \"action\": \"DISCARD\", \"cost\": total_cost})\n\n    # Save results to a JSON file for later analysis\n    with open(\"results.json\", \"w\") as f:\n        json.dump(results, f, indent=2)\n\nif __name__ == \"__main__\":\n    main()\n```\n\n## Step 4: Run Your Evaluation Loop\n\n```bash\npython loop.py\n```\n\nYou should see output like:\n\n```\nIter 0: KEEP  score=0.85\nIter 1: DISCARD  score=0.81  best=0.85\nIter 2: KEEP  score=0.91\nIter 3: DISCARD  score=0.88  best=0.91\n```\n\nThe artifact file is updated and committed to git whenever a better version is found, and results are saved to `results.json`.\n\n## Why Greedy Hill-Climbing?\n\nGreedy hill-climbing is simple and effective for many optimization tasks. It always moves towards better solutions, making it suitable for improving LLM outputs. However, it may get stuck in local optima. Consider adding randomness or more sophisticated optimization techniques for complex tasks.\n\n## Advanced Optimization Strategies\n\nWhile greedy hill-climbing is straightforward to implement, other strategies like simulated annealing or genetic algorithms can offer more robust optimization by exploring the solution space more broadly. Simulated annealing, for instance, allows for occasional \"downhill\" moves to escape local optima, controlled by a cooling schedule.\n\n## Tradeoffs and Limitations\n\nThe choice of optimization algorithm depends on the specific task. Greedy hill-climbing is simple but may not explore the solution space thoroughly. More complex algorithms can offer better results but at the cost of increased complexity and potentially higher computational costs.\n\n## Common Pitfalls and Mitigation Strategies\n\n1. **Metric Gaming**: Ensure your metric accurately reflects the desired outcome. A poorly designed metric can lead to suboptimal or misleading results. To mitigate, validate your metric against human judgments or use multiple metrics.\n2. **Circular Feedback**: Be cautious when using LLM outputs to evaluate other LLM outputs. This can create feedback loops that degrade performance over time. Mitigation includes using diverse evaluation methods or human oversight.\n3. **Runaway Costs**: Always track costs and consider implementing a budget constraint to prevent unexpected expenses. Setting a maximum budget per experiment and using cost estimation tools can help.\n\n## Worked Example\n\nLet's say you start with a simple artifact: \"The quick brown fox jumps over the lazy dog.\" After running the evaluation loop, the artifact might improve to: \"The quick brown fox jumps over the lazy dog, demonstrating a classic example of a pangram that uses all the letters of the alphabet efficiently.\" The score improves from 0.4 to 0.8 as the output becomes more coherent and contextually relevant.\n\n## Visualizing Results\n\nTo better understand the optimization process, you can visualize the scores and costs over iterations using a plotting library like `matplotlib`. This can help identify trends and potential issues early on.\n\n```python\nimport matplotlib.pyplot as plt\n\n# Load results from JSON\nwith open(\"results.json\", \"r\") as f:\n    results = json.load(f)\n\n# Plot scores and costs\nscores = [r[\"score\"] for r in results]\ncosts = [r[\"cost\"] for r in results]\niterations = list(range(len(results)))\n\nplt.figure(figsize=(10, 5))\nplt.subplot(1, 2, 1)\nplt.plot(iterations, scores)\nplt.title(\"Score Over Iterations\")\nplt.xlabel(\"Iteration\")\nplt.ylabel(\"Score\")\n\nplt.subplot(1, 2, 2)\nplt.plot(iterations, costs)\nplt.title(\"Cost Over Iterations\")\nplt.xlabel(\"Iteration\")\nplt.ylabel(\"Cost\")\n\nplt.tight_layout()\nplt.show()\n```\n\n## What's Next\n\nThis basic loop works, but you can enhance it further:\n- Query multiple models in parallel to compare their performance\n- Implement more sophisticated optimization strategies like simulated annealing\n- Add more comprehensive error handling and logging mechanisms\n\nBy following this tutorial, you've built a systematic evaluation loop for LLM experiments that not only optimizes your prompts but also versions your improvements using git. This foundation allows you to scale your experiments, track progress, and optimize your prompts effectively.", "B": "# Build a Minimal LLM Evaluation Loop in Python: Systematic Experiments for ML Engineers\n\nAutomated prompt optimization transforms experimental AI development from artisanal guesswork into a structured, repeatable process. This tutorial introduces a lean, powerful evaluation loop that helps ML engineers systematically improve LLM outputs.\n\n## What You Will Build\n\nA Python script that:\n1. Makes intelligent, cost-aware LLM API calls\n2. Implements a probabilistic exploration strategy\n3. Tracks experimental variations\n4. Provides comprehensive logging and analysis\n5. Manages computational and financial constraints\n\n## Prerequisites\n\n- Python 3.10+\n- OpenRouter API key\n- `httpx`, `python-dotenv`, `numpy` installed\n- Basic understanding of async programming\n- Git configured locally\n\n## Core Components: Beyond Greedy Hill-Climbing\n\nTraditional evaluation loops often get stuck in local optima. Our approach introduces controlled randomness and adaptive exploration to break through optimization plateaus.\n\n```python\nimport os\nimport httpx\nimport numpy as np\nfrom typing import List, Dict, Optional\nfrom dotenv import load_dotenv\n\nload_dotenv()\n\nclass LLMExperimentManager:\n    def __init__(\n        self, \n        api_key: str, \n        model: str = \"openai/gpt-4o-mini\", \n        max_budget: float = 5.00\n    ):\n        self.api_key = api_key\n        self.model = model\n        self.max_budget = max_budget\n        self.total_cost = 0.0\n        self.exploration_history: List[Dict] = []\n        \n    async def query_llm(\n        self, \n        prompt: str, \n        temperature: float = 0.7\n    ) -> Optional[str]:\n        try:\n            async with httpx.AsyncClient() as client:\n                response = await client.post(\n                    \"https://openrouter.ai/api/v1/chat/completions\",\n                    headers={\"Authorization\": f\"Bearer {self.api_key}\"},\n                    json={\n                        \"model\": self.model,\n                        \"messages\": [{\"role\": \"user\", \"content\": prompt}],\n                        \"temperature\": temperature\n                    },\n                    timeout=15.0\n                )\n                response.raise_for_status()\n                return response.json()[\"choices\"][0][\"message\"][\"content\"]\n        except httpx.RequestError as e:\n            print(f\"API query failed: {e}\")\n            return None\n\n    def adaptive_score(self, text: str) -> float:\n        \"\"\"\n        Probabilistic scoring that rewards novelty and complexity\n        \n        Scoring dimensions:\n        - Lexical diversity\n        - Information density\n        - Structural complexity\n        \"\"\"\n        word_count = len(text.split())\n        unique_words = len(set(text.split()))\n        \n        diversity_score = unique_words / word_count if word_count > 0 else 0\n        length_penalty = min(word_count / 300, 1.0)\n        \n        # Introduce controlled randomness\n        exploration_bonus = np.random.uniform(0.1, 0.3)\n        \n        return (\n            0.4 * diversity_score + \n            0.3 * length_penalty + \n            0.3 * exploration_bonus\n        )\n\n    async def run_experiment(\n        self, \n        initial_artifact: str, \n        max_iterations: int = 30\n    ):\n        current_artifact = initial_artifact\n        best_score = self.adaptive_score(current_artifact)\n        \n        for iteration in range(max_iterations):\n            # Dynamically adjust exploration temperature\n            temperature = max(0.5, 1.0 - (iteration * 0.03))\n            \n            improvement_prompt = (\n                f\"Creatively enhance this text, maintaining its core meaning. \"\n                f\"Current artifact: {current_artifact}\"\n            )\n            \n            candidate = await self.query_llm(\n                improvement_prompt, \n                temperature=temperature\n            )\n            \n            if not candidate:\n                continue\n            \n            candidate_score = self.adaptive_score(candidate)\n            \n            # Probabilistic acceptance: not just greedy\n            acceptance_probability = np.exp(\n                (candidate_score - best_score) / temperature\n            )\n            \n            if (candidate_score > best_score or \n                np.random.random() < acceptance_probability):\n                current_artifact = candidate\n                best_score = candidate_score\n                \n                self.exploration_history.append({\n                    \"iteration\": iteration,\n                    \"score\": candidate_score,\n                    \"temperature\": temperature\n                })\n        \n        return current_artifact, best_score\n\n# Example Usage\nasync def main():\n    manager = LLMExperimentManager(\n        api_key=os.getenv(\"OPENROUTER_API_KEY\")\n    )\n    result, score = await manager.run_experiment(\n        \"The quick brown fox jumps over the lazy dog.\"\n    )\n    print(f\"Optimized Artifact: {result}\")\n    print(f\"Final Score: {score}\")\n\nif __name__ == \"__main__\":\n    import asyncio\n    asyncio.run(main())\n```\n\n## Advanced Exploration Strategies\n\n### Why Probabilistic Exploration?\n\nTraditional greedy algorithms can:\n- Get trapped in local optima\n- Miss potentially transformative variations\n- Produce overly conservative results\n\nOur approach uses simulated annealing principles:\n- Dynamic temperature controls exploration\n- Probabilistic acceptance of variations\n- Controlled randomness prevents stagnation\n\n## Practical Considerations\n\n### Computational Constraints\n- Set explicit budget limits\n- Track per-query and cumulative costs\n- Implement graceful termination\n\n### Ethical AI Development\n- Avoid metric gaming\n- Maintain output diversity\n- Preserve core semantic meaning\n\n## Next Horizons\n\nFuture enhancements could include:\n- Multi-model comparative experiments\n- Advanced metric design\n- Automated hyperparameter tuning\n- Integration with experiment tracking platforms\n\n## Conclusion\n\nThis tutorial demonstrates how systematic, probabilistic exploration can transform prompt engineering from art to science. By introducing controlled randomness and adaptive scoring, we create a robust framework for continuous AI artifact improvement.", "C": "# Engineering Systematic LLM Evals: From Artisanal Prompts to Automated Loops\n\nManual prompt engineering is a bottleneck. If you are still iterating by copy-pasting into a chat interface, you lack the data to prove which prompt actually works better. This tutorial teaches you to build a \"Greedy Hill-Climbing\" evaluation loop: a Python script that systematically tests prompt variations and retains only the ones that improve your defined success metric.\n\n## The Architecture\nWe will build a loop that treats your prompt as a \"candidate\" solution. The script will:\n1. **Generate** a new variation of the prompt output.\n2. **Evaluate** the output using a programmatic metric.\n3. **Compare** the new score against the current \"best\" version.\n4. **Persist** the winner to disk and version control (Git).\n\n### What We Are Building\nThis is a \"minimalist\" approach. We avoid heavy framework abstractions, preferring raw Python and `httpx` so you can understand every line of execution.\n\n## Step 1: The Foundation (Environment & API)\nCreate a `.env` file to hold your credentials safely:\n```plaintext\nOPENROUTER_API_KEY=sk-or-your-key-here\n```\n\nWe use `httpx` for its clean `async` support and robust timeout handling\u2014essential for preventing runaway API costs during long experimental runs.\n\n```python\nimport os\nimport httpx\nfrom dotenv import load_dotenv\n\nload_dotenv()\n\n# Configuration\nAPI_URL = \"https://openrouter.ai/api/v1/chat/completions\"\nMODEL = \"openai/gpt-4o-mini\"\nAPI_KEY = os.getenv(\"OPENROUTER_API_KEY\")\n\ndef call_llm(messages: list[dict]) -> str:\n    \"\"\"Sends a request to the LLM with basic error handling.\"\"\"\n    with httpx.Client(timeout=30.0) as client:\n        response = client.post(\n            API_URL,\n            headers={\"Authorization\": f\"Bearer {API_KEY}\"},\n            json={\"model\": MODEL, \"messages\": messages}\n        )\n        response.raise_for_status()\n        return response.json()[\"choices\"][0][\"message\"][\"content\"]\n```\n\n## Step 2: The Metric (The \"Why\")\nAn evaluation loop is only as good as its metric. If your metric is flawed, your loop will optimize for the wrong behavior. Here, we use a scoring function that rewards brevity and the inclusion of specific keywords.\n\n```python\ndef evaluate_output(text: str) -> float:\n    \"\"\"\n    Programmatic heuristic: \n    - Reward length > 50 characters\n    - Reward presence of 'required' keywords\n    \"\"\"\n    score = 0.0\n    if len(text) > 50: score += 0.5\n    if \"actionable\" in text.lower(): score += 0.5\n    return score\n```\n\n## Step 3: The Evaluation Loop\nWe implement a greedy search. We don't just ask for a \"better\" version; we provide the current working artifact back to the LLM with a \"Refinement\" instruction.\n\n```python\nimport subprocess\nimport time\n\ndef run_experiment(start_artifact: str, iterations: int = 5):\n    current_best = start_artifact\n    best_score = evaluate_output(current_best)\n\n    for i in range(iterations):\n        print(f\"--- Iteration {i+1} ---\")\n        prompt = f\"Refine this text to be more professional: {current_best}\"\n        \n        try:\n            candidate = call_llm([{\"role\": \"user\", \"content\": prompt}])\n            score = evaluate_output(candidate)\n            \n            if score > best_score:\n                print(f\"Improvement found! Score: {score:.2f}\")\n                current_best = candidate\n                best_score = score\n                # Persist to disk\n                with open(\"best_artifact.txt\", \"w\") as f:\n                    f.write(current_best)\n                # Version control\n                subprocess.run([\"git\", \"add\", \"best_artifact.txt\"])\n                subprocess.run([\"git\", \"commit\", \"-m\", f\"Improvement: {score:.2f}\"])\n            else:\n                print(f\"No improvement. Score: {score:.2f}\")\n                \n        except Exception as e:\n            print(f\"Error on iteration {i}: {e}\")\n        \n        time.sleep(1) # Respect rate limits\n```\n\n## Why Greedy Hill-Climbing?\nThis pattern is the \"Hello World\" of automated optimization. By always keeping the best version, you ensure monotonic progress. \n**The Tradeoff:** You risk falling into a \"local optimum\"\u2014a prompt that is \"good enough\" but stops you from finding a \"great\" one because the script rejects all changes that aren't immediately better.\n\n## Common Pitfalls: The \"Evaluation Trap\"\n1. **Metric Gaming:** If you reward length, the LLM will become verbose. If you reward specific keywords, it will \"keyword stuff.\" Always sanity-check your top-scoring outputs manually.\n2. **Circular Feedback:** Never use the LLM to write the evaluation metric for its own output. This leads to \"hallucinated success,\" where the model claims it is doing great because it is biased toward its own style.\n3. **Budget Leakage:** Always wrap your calls in a `try/except` block. A logic error in a loop could trigger thousands of API calls while you are asleep.\n\n## Beyond the Basics: Scaling Up\nOnce you master this loop, consider these three enhancements:\n* **Parallelization:** Use `asyncio` to run 5 variations concurrently.\n* **LLM-as-a-Judge:** Replace the `evaluate_output` function with a call to a stronger model (e.g., Claude 3.5 Sonnet) to perform semantic analysis on the output.\n* **TSV Logging:** Instead of just printing, append `[timestamp, iteration, score, cost]` to a TSV file. This allows you to graph your progress in Excel or Pandas later, proving that your engineering efforts are yielding measurable gains.\n\nBy moving your experimentation into a script, you stop guessing and start measuring. You now have a repeatable process that turns prompt engineering from a \"vibe-based\" activity into a rigorous engineering discipline."