{"type": "stage2_complete", "rankings": [{"letter": "A", "display_letter": "B", "avg_position": 0.5, "votes": 4}, {"letter": "D", "display_letter": "D", "avg_position": 0.5, "votes": 4}, {"letter": "B", "display_letter": "A", "avg_position": 2.5, "votes": 4}, {"letter": "E", "display_letter": "E", "avg_position": 3.25, "votes": 4}, {"letter": "C", "display_letter": "C", "avg_position": 3.25, "votes": 4}], "shuffle_map": {"B": "A", "A": "B", "C": "C", "D": "D", "E": "E"}, "votes": [{"model": "meta-llama/llama-4-maverick", "display_ranking": "B > D > A > E > C", "original_ranking": "A > D > B > E > C", "reasoning": "To rank the versions, I will evaluate each based on the criteria provided: Correctness, Completeness, Clarity, Code Quality, and Depth.\n\n## Step 1: Evaluate Version A\nVersion A provides a modular design with a clear separation of concerns, making it highly extensible and maintainable. It scores well on Code Quality and Depth due to its modular architecture and use of type hints.\n\n## Step 2: Evaluate Version B\nVersion B is comprehensive, covering all essential steps and including parallel model queries, cost tracking, and git versioning. It demonstrates high Completeness and includes a worked example, enhancing Clarity.\n\n## Step 3: Evaluate Version C\nVersion C introduces a minimal evaluation loop with a greedy hill-climbing algorithm and git versioning. It is straightforward and easy to follow, scoring well on Clarity. However, it lacks some features like parallel queries.\n\n## Step 4: Evaluate Version D\nVersion D enhances the loop by incorporating parallel model queries, improving efficiency. It also saves results to a TSV file and discusses when to stop the loop, showing improvements in Completeness and Clarity.\n\n## Step 5: Evaluate Version E\nVersion E provides a basic implementation of the evaluation loop with cost tracking and git versioning. It is simple and covers the essential steps but lacks some advanced features like parallel queries.\n\n## Step 6: Compare Versions\n- Version A excels in modularity and extensibility but lacks a direct, runnable example using the OpenRouter API in the main function.\n- Version B is very comprehensive, with parallel model queries and a clear structure, making it highly complete and clear.\n- Version C is clear and straightforward but lacks some advanced features.\n- Version D improves upon Version E by adding parallel queries and TSV saving, enhancing completeness and efficiency.\n- Version E is simple and covers the basics but is less comprehensive than Versions B and D.\n\n## Step 7: Rank Versions\nBased on the evaluation:\n- Version B stands out for its completeness, clarity, and the inclusion of advanced features like parallel model queries.\n- Version D is a close second due to its enhancements over Version E, including parallel queries and TSV saving.\n- Version A is highly modular and extensible, making it a strong candidate, but its ranking depends on the importance given to modularity versus direct implementation details.\n- Version E is a basic yet functional implementation, lacking some features.\n- Version C, while clear and straightforward, is less comprehensive in terms of features.\n\n## Step 8: Final Ranking\nConsidering all criteria, the ranking from best to worst is based on a balance of completeness, clarity, code quality, and depth."}, {"model": "anthropic/claude-3-5-haiku", "display_ranking": "B > D > A > C > E", "original_ranking": "A > D > B > C > E", "reasoning": "Evaluation of Versions:\n\nVersion B (Detailed Analysis):\n- Extremely strong across all criteria\n- Comprehensive tutorial with clear step-by-step guidance\n- Robust code implementation with parallel model queries\n- Excellent depth of explanation and tradeoffs\n- Demonstrates advanced features like git versioning and cost tracking\n\nVersion D (Strong Contender):\n- Very similar to Version B in structure and quality\n- Slightly more technical depth in explanations\n- Excellent code quality and clear optimization strategies\n- Minor differences in implementation details\n\nVersion A (Theoretical/Architectural Approach):\n- More abstract and protocol-driven design\n- Strong on code quality and modularity\n- Less practical walkthrough compared to B and D\n- More focused on extensibility than immediate usability\n\nVersion C (Minimalist Approach):\n- Concise and direct tutorial style\n- Clear explanation of core concepts\n- Less comprehensive in implementation\n- Lacks some of the advanced features of B and D\n\nVersion E (Basic Implementation):\n- Most similar to tutorial template\n- Covers basic concepts\n- Less depth and fewer advanced features\n- Simplest implementation, but lacks sophistication\n\nReasoning Summary:\n- B excels in completeness and depth\n- D is very close to B with slight variations\n- A offers interesting architectural approach\n- C provides a lean, focused tutorial\n- E is the most basic implementation"}, {"model": "google/gemini-3.1-flash-lite-preview", "display_ranking": "D > B > E > C > A", "original_ranking": "D > A > E > C > B", "reasoning": "The provided versions were evaluated based on technical correctness, completeness, clarity, code quality, and depth.\n\n*   **Version D** is the best because it correctly implements asynchronous parallel queries (most performant for this task), handles token-based cost tracking accurately, uses robust error handling, and provides a clean, professional tutorial structure.\n*   **Version B** is strong but slightly less polished than D, as it initializes the git repo inside the loop logic and has minor issues with the `artifact.txt` file handling.\n*   **Version E** is a solid, readable implementation, but it falls behind because it uses synchronous calls, meaning users lose the benefits of parallel model testing which is a key advantage for this type of loop.\n*   **Version C** is clear and readable but lacks the asynchronous implementation requested in the \"Exploration Directions\" and is slightly less robust in its error handling than the others.\n*   **Version A** is ranked last because, while it attempts a sophisticated object-oriented design, the implementation is incomplete (e.g., it does not actually implement the loop logic correctly to handle the `best_artifact` update across multiple optimizers) and the code is unnecessarily over-engineered for a \"minimal\" tutorial.\n\nReasoning:\n- **Version D**: Best technical implementation with async support, correct cost tracking, and clear tutorial steps.\n- **Version B**: Very good, but slightly less refined than D in its git and file handling logic.\n- **Version E**: Clear and functional, but lacks the performance benefit of asynchronous parallel queries.\n- **Version C**: Good for beginners, but misses the parallel processing and robust error handling features.\n- **Version A**: Over-engineered class structure that actually contains logical flaws in the experiment execution loop."}, {"model": "x-ai/grok-3-mini-beta", "display_ranking": "D > B > A > C > E", "original_ranking": "D > A > B > C > E", "reasoning": "Below is my evaluation and ranking of the versions based on the specified criteria: Correctness (0\u201320), Completeness (0\u201320), Clarity (0\u201320), Code Quality (0\u201320), and Depth (0\u201320). I judged each version solely on quality, scoring them holistically as follows:\n\n- **Version A**: Scores 16/20 for Correctness (code is valid but overly complex), 15/20 for Completeness (covers core components but lacks git integration and cost tracking), 14/20 for Clarity (modular design is abstract and hard for intermediates to follow quickly), 18/20 for Code Quality (excellent use of types and protocols, making it extensible), and 17/20 for Depth (strong on innovations and strategies but doesn't address common pitfalls deeply); overall, it's solid but not minimal enough for the audience.\n- **Version B**: Scores 18/20 for Correctness (well-structured async code with error handling), 19/20 for Completeness (covers all steps including parallel queries and git), 17/20 for Clarity (logical flow with sections and explanations), 17/20 for Code Quality (idiomatic with safe practices like env variables), and 16/20 for Depth (good justifications for choices but could expand on tradeoffs); it's comprehensive and practical for the target users.\n- **Version C**: Scores 15/20 for Correctness (synchronous code works but has potential loop issues), 16/20 for Completeness (includes essentials like git but misses parallelism), 18/20 for Clarity (straightforward and easy to follow step-by-step), 14/20 for Code Quality (basic and safe but lacks type hints), and 15/20 for Depth (explains greedy hill-climbing well and covers pitfalls, but doesn't delve into advanced extensions); it's clear and minimal but feels dated.\n- **Version D**: Scores 19/20 for Correctness (async with robust error handling and no obvious bugs), 20/20 for Completeness (thoroughly covers all steps plus TSV saving and parallels), 18/20 for Clarity (includes worked examples and overviews), 18/20 for Code Quality (idiomatic with type hints and meaningful names), and 18/20 for Depth (effectively discusses tradeoffs and stopping conditions); it's the most balanced and efficient overall.\n- **Version E**: Scores 14/20 for Correctness (synchronous code is simple but vulnerable to failures), 15/20 for Completeness (covers basics like git and costs but lacks parallels), 16/20 for Clarity (easy to follow with explanations), 15/20 for Code Quality (adequate but misses async and advanced features), and 14/20 for Depth (basic justifications without deep tradeoffs); it's straightforward but lacks the enhancements needed for systematic optimization."}], "model_names": {"A": "meta-llama/llama-4-maverick", "B": "anthropic/claude-3-5-haiku", "C": "google/gemini-3.1-flash-lite-preview", "D": "x-ai/grok-3-mini-beta"}}
{"type": "stage3_complete", "winner": "A", "winner_model": "meta-llama/llama-4-maverick", "council_score": 92, "sub_scores": {"CORRECTNESS": 19, "COMPLETENESS": 20, "CLARITY": 18, "CODE_QUALITY": 18, "DEPTH": 17}, "critique": "Proposal A effectively covers all essential steps for building the evaluation loop, ensuring completeness with a focus on parallel model queries. The code is mostly correct and idiomatic, but minor adjustments could enhance clarity, such as more inline comments. Depth is commendable, explaining the greedy hill-climbing method while hinting at potential improvements. Overall, it provides a practical, systematic approach for ML engineers looking to optimize their LLM experimentation efficiently. Future iterations could explore advanced optimization techniques or deeper discussions on trade-offs in model selection.", "chairman_full_response": "WINNER: A\nSCORE_CORRECTNESS: 19\nSCORE_COMPLETENESS: 20\nSCORE_CLARITY: 18\nSCORE_CODE_QUALITY: 18\nSCORE_DEPTH: 17\nCOUNCIL_SCORE: 92\n\nCRITIQUE:\nProposal A effectively covers all essential steps for building the evaluation loop, ensuring completeness with a focus on parallel model queries. The code is mostly correct and idiomatic, but minor adjustments could enhance clarity, such as more inline comments. Depth is commendable, explaining the greedy hill-climbing method while hinting at potential improvements. Overall, it provides a practical, systematic approach for ML engineers looking to optimize their LLM experimentation efficiently. Future iterations could explore advanced optimization techniques or deeper discussions on trade-offs in model selection.", "chairman_model": "openai/gpt-4o-mini", "model_names": {"A": "meta-llama/llama-4-maverick", "B": "anthropic/claude-3-5-haiku", "C": "google/gemini-3.1-flash-lite-preview", "D": "x-ai/grok-3-mini-beta"}}
{"type": "iteration_result", "iteration": 36, "status": "DISCARD", "council_score": 92, "winner": "A", "best_score": 94, "commit": "ebb51dd", "spent_usd": 0.462859, "timestamp": "2026-04-03T15:43:59.771432Z"}
