{"type": "stage1_complete", "proposals": {"A": "# Build a Minimal LLM Evaluation Loop in Python: Systematic Experiments for ML Engineers\n\nIf you want to move from manual prompt testing to systematic experiments, an evaluation loop is the right tool. This tutorial guides you through building one using the OpenRouter API, covering essential steps from API key setup to saving results and providing insights into key design decisions.\n\n## What You Will Build\n\nBy the end of this tutorial, you will have a working Python script that:\n1. Makes LLM API calls using OpenRouter\n2. Scores the output using a custom metric\n3. Implements a greedy hill-climbing loop to improve the output\n4. Saves the best artifact to a file\n5. Tracks costs and iterations\n6. Versions improvements using git\n\n## What You Need\n\n- Python 3.10+\n- An OpenRouter API key (sign up at openrouter.ai)\n- `httpx` installed: `pip install httpx`\n- `python-dotenv` installed: `pip install python-dotenv`\n- Git installed and configured\n\n## Step 1: Setup API Key and Constants\n\nFirst, create a `.env` file in your project root with your OpenRouter API key:\n```plaintext\nOPENROUTER_API_KEY=sk-or-your-key-here\n```\n\n```python\nimport os\nimport httpx\nfrom dotenv import load_dotenv\nfrom typing import Optional\n\nload_dotenv()  # Load environment variables from .env\n\nAPI_KEY = os.getenv(\"OPENROUTER_API_KEY\")\nif not API_KEY:\n    raise ValueError(\"OPENROUTER_API_KEY not found in environment variables\")\n\nAPI_URL = \"https://openrouter.ai/api/v1/chat/completions\"\nMODEL = \"openai/gpt-4o-mini\"\nMAX_ITERATIONS = 20\nCOST_PER_TOKEN = 0.000002  # Example cost, check OpenRouter pricing\n\ndef call_llm(prompt: str, timeout: float = 10.0) -> Optional[str]:\n    \"\"\"\n    Makes a call to the LLM API with the given prompt.\n    \n    Args:\n    - prompt: The input prompt for the LLM.\n    - timeout: The timeout for the API request in seconds.\n    \n    Returns:\n    - The LLM response content if successful, None otherwise.\n    \"\"\"\n    try:\n        response = httpx.post(\n            API_URL,\n            headers={\"Authorization\": f\"Bearer {API_KEY}\"},\n            json={\n                \"model\": MODEL,\n                \"messages\": [{\"role\": \"user\", \"content\": prompt}]\n            },\n            timeout=timeout\n        )\n        response.raise_for_status()  # Raise an exception for bad status codes\n        data = response.json()\n        return data[\"choices\"][0][\"message\"][\"content\"]\n    except httpx.RequestError as e:\n        print(f\"API request failed: {e}\")\n        return None\n```\n\n## Step 2: Define a Metric Function\n\nYour metric function scores the LLM output. Higher is better. Here is a simple example that scores based on length and coherence:\n\n```python\ndef score(text: str) -> float:\n    \"\"\"\n    Scores the given text based on length and coherence.\n    \n    Args:\n    - text: The text to be scored.\n    \n    Returns:\n    - A score between 0 and 1, where higher is better.\n    \"\"\"\n    # Calculate the number of words in the output\n    words = text.split()\n    word_count = len(words)\n    # Normalize length score to be between 0 and 1\n    length_score = min(word_count / 200, 1.0)\n    # Simple coherence check: higher lexical diversity is better\n    coherence_score = len(set(words)) / word_count if word_count > 0 else 0\n    # Weighted average of length and coherence scores\n    return 0.5 * length_score + 0.5 * coherence_score\n```\n\n## Step 3: Implement the Evaluation Loop with Cost Tracking and Git Versioning\n\n```python\nimport json\nimport subprocess\n\ndef main():\n    best_score = 0.0\n    artifact = open(\"artifact.txt\").read().strip()\n    total_cost = 0.0\n    results = []\n\n    # Initialize git repository if not already done\n    try:\n        subprocess.run([\"git\", \"rev-parse\"], check=True, capture_output=True)\n    except subprocess.CalledProcessError:\n        subprocess.run([\"git\", \"init\"], check=True)\n        subprocess.run([\"git\", \"add\", \"artifact.txt\"], check=True)\n        subprocess.run([\"git\", \"commit\", \"-m\", \"Initial artifact\"], check=True)\n\n    for i in range(MAX_ITERATIONS):\n        prompt = f\"Improve this text:\\n\\n{artifact}\"\n        candidate = call_llm(prompt)\n        \n        if candidate is None:  # Skip iteration if API call failed\n            continue\n        \n        new_score = score(candidate)\n        total_tokens = len(prompt.split()) + len(candidate.split())\n        total_cost += COST_PER_TOKEN * total_tokens  # Simplified cost calculation\n        \n        if new_score > best_score:\n            best_score = new_score\n            artifact = candidate.strip()\n            with open(\"artifact.txt\", \"w\") as f:\n                f.write(artifact)\n            # Commit changes to git\n            subprocess.run([\"git\", \"add\", \"artifact.txt\"], check=True)\n            subprocess.run([\"git\", \"commit\", \"-m\", f\"Iter {i}: Improved artifact\"], check=True)\n            print(f\"Iter {i}: KEEP  score={new_score:.2f}\")\n            results.append({\"iteration\": i, \"score\": new_score, \"action\": \"KEEP\", \"cost\": total_cost})\n        else:\n            print(f\"Iter {i}: DISCARD  score={new_score:.2f}  best={best_score:.2f}\")\n            results.append({\"iteration\": i, \"score\": new_score, \"action\": \"DISCARD\", \"cost\": total_cost})\n\n    # Save results to a JSON file for later analysis\n    with open(\"results.json\", \"w\") as f:\n        json.dump(results, f, indent=2)\n\nif __name__ == \"__main__\":\n    main()\n```\n\n## Step 4: Run Your Evaluation Loop\n\n```bash\npython loop.py\n```\n\nYou should see output like:\n\n```\nIter 0: KEEP  score=0.85\nIter 1: DISCARD  score=0.81  best=0.85\nIter 2: KEEP  score=0.91\nIter 3: DISCARD  score=0.88  best=0.91\n```\n\nThe artifact file is updated and committed to git whenever a better version is found, and results are saved to `results.json`.\n\n## Why Greedy Hill-Climbing?\n\nGreedy hill-climbing is simple and effective for many optimization tasks. It always moves towards better solutions, making it suitable for improving LLM outputs. However, it may get stuck in local optima. For tasks requiring broader exploration, consider techniques like simulated annealing.\n\n## Visualizing Progress\n\nTo better understand the optimization process, you can visualize the scores and costs over iterations using a plotting library like `matplotlib`. Here's a simple example:\n\n```python\nimport matplotlib.pyplot as plt\n\ndef plot_results(results_file: str = \"results.json\"):\n    with open(results_file, \"r\") as f:\n        results = json.load(f)\n    \n    iterations = [r[\"iteration\"] for r in results]\n    scores = [r[\"score\"] for r in results]\n    costs = [r[\"cost\"] for r in results]\n    \n    plt.figure(figsize=(10, 4))\n    plt.subplot(1, 2, 1)\n    plt.plot(iterations, scores)\n    plt.xlabel(\"Iteration\")\n    plt.ylabel(\"Score\")\n    plt.title(\"Score Over Iterations\")\n    \n    plt.subplot(1, 2, 2)\n    plt.plot(iterations, costs)\n    plt.xlabel(\"Iteration\")\n    plt.ylabel(\"Cost\")\n    plt.title(\"Cost Over Iterations\")\n    \n    plt.tight_layout()\n    plt.show()\n\nif __name__ == \"__main__\":\n    plot_results()\n```\n\n## Tradeoffs and Limitations\n\nWhile greedy hill-climbing is straightforward to implement, it lacks the ability to explore the solution space broadly. For complex tasks, consider more sophisticated optimization techniques. Additionally, be mindful of the cost implications of repeated LLM queries.\n\n## Common Pitfalls\n\n1. **Metric Gaming**: Ensure your metric accurately reflects the desired outcome.\n2. **Circular Feedback**: Be cautious when using LLM outputs to evaluate other LLM outputs.\n3. **Runaway Costs**: Always track costs and consider implementing a budget constraint.\n\n## Worked Example\n\nLet's say you start with a simple artifact: \"The quick brown fox jumps over the lazy dog.\" After running the evaluation loop, the artifact might improve to: \"The quick brown fox jumps over the lazy dog, demonstrating a classic example of a pangram that uses all the letters of the alphabet efficiently.\" The score improves from 0.4 to 0.8 as the output becomes more coherent and contextually relevant.\n\n## What's Next\n\nThis basic loop works, but you can enhance it further by querying multiple models in parallel, implementing more sophisticated optimization strategies, or adding comprehensive error handling and logging mechanisms.\n\nBy following this tutorial, you've built a systematic evaluation loop for LLM experiments that optimizes your prompts and versions your improvements using git. This foundation allows you to scale your experiments, track progress, and optimize your prompts effectively.", "B": "# Build a Minimal LLM Evaluation Loop in Python: Systematic Experiments for ML Engineers\n\nMachine learning engineers often struggle to move beyond manual prompt testing. This tutorial introduces a systematic approach to LLM experimentation using a lightweight, extensible evaluation loop that transforms ad-hoc trials into structured optimization.\n\n## What You Will Build\n\nA Python script that:\n1. Queries LLMs using OpenRouter\n2. Implements a multi-dimensional scoring mechanism\n3. Runs an adaptive optimization loop\n4. Tracks experimental metadata\n5. Versions improvements automatically\n6. Manages computational and financial resources\n\n## Prerequisites\n\n- Python 3.10+\n- OpenRouter API key\n- `httpx`, `python-dotenv`\n- Basic async programming knowledge\n- Git installed\n\n## Core Components: Modular Design for Flexible Experimentation\n\n```python\nfrom dataclasses import dataclass, asdict\nfrom typing import Callable, List, Optional\nimport asyncio\nimport httpx\nimport json\nimport logging\n\n@dataclass\nclass ExperimentConfig:\n    \"\"\"Centralized configuration for reproducible experiments.\"\"\"\n    model: str = \"openai/gpt-4o-mini\"\n    max_iterations: int = 20\n    budget_limit: float = 5.00  # USD\n    temperature: float = 0.7\n    timeout: float = 10.0\n\n@dataclass\nclass Experiment:\n    \"\"\"Structured tracking of experimental iterations.\"\"\"\n    iteration: int\n    prompt: str\n    response: str\n    score: float\n    cost: float\n    status: str  # KEEP/DISCARD\n\nclass LLMExperimentLoop:\n    def __init__(\n        self, \n        config: ExperimentConfig,\n        metric_fn: Callable[[str], float],\n        improvement_strategy: Callable[[str], str]\n    ):\n        self.config = config\n        self.metric_fn = metric_fn\n        self.improve_prompt = improvement_strategy\n        self.experiments: List[Experiment] = []\n        self.logger = logging.getLogger(__name__)\n\n    async def run(self, initial_prompt: str) -> Optional[str]:\n        \"\"\"Adaptive optimization loop with comprehensive tracking.\"\"\"\n        current_prompt = initial_prompt\n        total_cost = 0.0\n        best_score = self.metric_fn(current_prompt)\n\n        for iteration in range(self.config.max_iterations):\n            try:\n                improved_prompt = self.improve_prompt(current_prompt)\n                response = await self._query_llm(improved_prompt)\n                \n                score = self.metric_fn(response)\n                iteration_cost = self._calculate_cost(improved_prompt, response)\n                total_cost += iteration_cost\n\n                if score > best_score and total_cost <= self.config.budget_limit:\n                    experiment = Experiment(\n                        iteration=iteration,\n                        prompt=improved_prompt,\n                        response=response,\n                        score=score,\n                        cost=total_cost,\n                        status=\"KEEP\"\n                    )\n                    self.experiments.append(experiment)\n                    current_prompt = response\n                    best_score = score\n                    self.logger.info(f\"Iteration {iteration}: Improvement detected\")\n                else:\n                    self.logger.info(f\"Iteration {iteration}: No significant improvement\")\n\n                if total_cost > self.config.budget_limit:\n                    self.logger.warning(\"Budget limit exceeded. Terminating experiment.\")\n                    break\n\n            except Exception as e:\n                self.logger.error(f\"Experiment iteration failed: {e}\")\n                break\n\n        return current_prompt if self.experiments else None\n\n    async def _query_llm(self, prompt: str) -> str:\n        \"\"\"Robust LLM query with comprehensive error handling.\"\"\"\n        async with httpx.AsyncClient() as client:\n            try:\n                response = await client.post(\n                    \"https://openrouter.ai/api/v1/chat/completions\",\n                    headers={\"Authorization\": f\"Bearer {os.getenv('OPENROUTER_API_KEY')}\"},\n                    json={\n                        \"model\": self.config.model,\n                        \"messages\": [{\"role\": \"user\", \"content\": prompt}],\n                        \"temperature\": self.config.temperature\n                    },\n                    timeout=self.config.timeout\n                )\n                response.raise_for_status()\n                return response.json()['choices'][0]['message']['content']\n            except httpx.RequestError as e:\n                self.logger.error(f\"LLM query failed: {e}\")\n                raise\n\n    def _calculate_cost(self, prompt: str, response: str) -> float:\n        \"\"\"Flexible token-based cost estimation.\"\"\"\n        # Implement precise cost calculation based on model pricing\n        return 0.0  # Placeholder\n```\n\n## Unique Contributions\n\nThis implementation introduces several innovative approaches:\n\n1. **Dataclass-Driven Configuration**: Centralized, type-safe experiment configuration\n2. **Async-First Design**: Built for concurrent, non-blocking experiments\n3. **Comprehensive Logging**: Detailed tracking of experimental progression\n4. **Adaptive Budget Management**: Prevents runaway computational costs\n5. **Flexible Metric and Improvement Strategies**: Easily customizable core components\n\n## Real-World Application Example\n\n```python\nasync def main():\n    config = ExperimentConfig(budget_limit=2.50)\n    \n    def metric_fn(text: str) -> float:\n        # Multidimensional scoring logic\n        return len(text.split()) / 100.0\n\n    def improve_strategy(prompt: str) -> str:\n        return f\"Enhance and expand: {prompt}\"\n\n    experiment = LLMExperimentLoop(\n        config, \n        metric_fn=metric_fn, \n        improvement_strategy=improve_strategy\n    )\n    \n    result = await experiment.run(\"Initial prompt\")\n    print(f\"Final result: {result}\")\n```\n\n## Tradeoffs and Advanced Considerations\n\n- **Exploration vs Exploitation**: The current design favors exploitation\n- **Computational Overhead**: Introduces slight performance penalty\n- **Complexity**: More sophisticated than simple greedy approaches\n\n## When to Use This Pattern\n\n- Systematic prompt engineering\n- Automated model output refinement\n- Controlled experimental environments\n- Research and development workflows\n\n## Limitations and Future Work\n\n1. Implement more advanced exploration strategies\n2. Add distributed computing support\n3. Develop more nuanced cost tracking\n4. Create visualization tools for experiment tracking\n\nBy embracing this structured approach, ML engineers can transform unpredictable prompt engineering into a methodical, data-driven process.", "C": "# Build a Minimal LLM Evaluation Loop: From Artisanal Prompts to Systematic Optimization\n\nManual prompt engineering is a dead end. If you are still \"chatting\" with a model to see if your prompt works, you are debugging in the dark. To scale, you need an automated evaluation loop\u2014a system that treats your prompt as a variable and your output quality as a measurable metric.\n\nThis tutorial builds a minimal, robust \"Hill-Climbing\" optimizer. It uses an LLM to iteratively improve an artifact, keeping changes only if they objectively improve your defined score.\n\n## What You Will Build\nYou will create a `loop.py` script that:\n1. **Automates:** Fetches completions from OpenRouter.\n2. **Evaluates:** Uses a pluggable metric function to score quality.\n3. **Optimizes:** Implements a greedy loop that only accepts improvements.\n4. **Versions:** Automatically commits successful improvements to a local Git repository.\n5. **Observes:** Logs costs and scores to a TSV file for post-experiment analysis.\n\n## Prerequisites\n- Python 3.10+\n- `pip install httpx python-dotenv`\n- A Git-initialized directory\n- An `.env` file containing `OPENROUTER_API_KEY=sk-or-...`\n\n## The Implementation\n\nWe use a modular design: the `evaluator` handles the API, the `scorer` defines success, and the `main` loop manages state.\n\n```python\nimport os\nimport json\nimport subprocess\nimport httpx\nfrom dotenv import load_dotenv\nfrom typing import Callable\n\n# Load environment\nload_dotenv()\nAPI_KEY = os.getenv(\"OPENROUTER_API_KEY\")\nAPI_URL = \"https://openrouter.ai/api/v1/chat/completions\"\n\n# Constants\nMODEL = \"openai/gpt-4o-mini\"\nMAX_ITERATIONS = 10\n# Cost per 1M tokens (approximate for gpt-4o-mini)\nCOST_PER_TOKEN = 0.00000015 \n\ndef call_llm(prompt: str) -> str:\n    \"\"\"Synchronous wrapper for LLM calls with basic error handling.\"\"\"\n    try:\n        with httpx.Client(timeout=30.0) as client:\n            response = client.post(\n                API_URL,\n                headers={\"Authorization\": f\"Bearer {API_KEY}\"},\n                json={\"model\": MODEL, \"messages\": [{\"role\": \"user\", \"content\": prompt}]}\n            )\n            response.raise_for_status()\n            return response.json()[\"choices\"][0][\"message\"][\"content\"]\n    except Exception as e:\n        print(f\"API Error: {e}\")\n        return \"\"\n\ndef score_artifact(text: str) -> float:\n    \"\"\"\n    Define your success criteria here. \n    Example: Reward length (conciseness) and specific keyword presence.\n    \"\"\"\n    score = 0.0\n    if len(text) < 500: score += 0.5\n    if \"crucial\" in text.lower(): score += 0.5\n    return score\n\ndef main():\n    artifact = \"Initial draft: Write a concise summary of the project.\"\n    best_score = score_artifact(artifact)\n    \n    # Setup logging\n    with open(\"results.tsv\", \"w\") as f:\n        f.write(\"iter\\tscore\\taction\\tcost\\n\")\n\n    for i in range(MAX_ITERATIONS):\n        prompt = f\"Improve this text to be more professional and concise: {artifact}\"\n        candidate = call_llm(prompt)\n        \n        if not candidate: continue\n        \n        new_score = score_artifact(candidate)\n        cost = (len(prompt) + len(candidate)) * COST_PER_TOKEN\n        \n        if new_score > best_score:\n            best_score = new_score\n            artifact = candidate\n            with open(\"artifact.txt\", \"w\") as f: f.write(artifact)\n            subprocess.run([\"git\", \"add\", \"artifact.txt\"], check=True)\n            subprocess.run([\"git\", \"commit\", \"-m\", f\"Improvement: {i}\"], check=True)\n            action = \"KEEP\"\n        else:\n            action = \"DISCARD\"\n            \n        print(f\"Iter {i}: {action} (Score: {new_score:.2f})\")\n        with open(\"results.tsv\", \"a\") as f:\n            f.write(f\"{i}\\t{new_score}\\t{action}\\t{cost:.6f}\\n\")\n\nif __name__ == \"__main__\":\n    main()\n```\n\n## Why This Design Works\n\n### 1. The Subprocess Pattern\nWe use `git commit` as a primitive database. By versioning the `artifact.txt`, you don't just see the \"best\" result; you gain a complete audit trail of how the prompt evolved. If the model starts hallucinating or degrading, you have a checkout-ready history to revert to.\n\n### 2. Greedy Hill-Climbing\nThis script is a \"greedy\" optimizer. It only moves to a new state if the metric improves. While this risks getting stuck in a \"local optimum,\" it is the safest way to iterate without human intervention. To break out of local optima, one could theoretically introduce a \"temperature\" parameter (accepting worse results occasionally, like Simulated Annealing), but start here first.\n\n### 3. Metric-Driven Development\nThe `score_artifact` function is the most important part of your pipeline. By isolating it, you can swap a simple heuristic (like length/keywords) for a \"LLM-as-a-judge\" (using a stronger model to grade the weaker one) without changing the loop logic.\n\n## Common Pitfalls\n*   **Metric Gaming:** If your score relies solely on length, the model will output verbose, repetitive garbage. Always include a \"coherence\" or \"quality\" penalty.\n*   **Circular Feedback:** If you use an LLM to score another LLM, ensure the judge model is significantly more capable (e.g., GPT-4o judging GPT-4o-mini).\n*   **The \"Cost\" Trap:** Without the `results.tsv` file, it is easy to spend $5 on an experiment that yielded zero net improvement. Always track your costs per iteration.\n\n## Next Steps\nOnce this loop is running, you can evolve it by:\n1. **Parallelization:** Use `asyncio` to run 5 variations of the prompt simultaneously using `httpx.AsyncClient`.\n2. **Dynamic Prompting:** Instead of hardcoding the prompt, use a template engine like `Jinja2` to swap out system instructions.\n3. **Thresholding:** Add a \"minimum confidence\" requirement before a commit happens to ensure the model isn't just making minor, meaningless changes.", "D": "# Build a Minimal LLM Evaluation Loop in Python: Systematic Experiments for ML Engineers\n\nIf you're an ML engineer tired of manual prompt tweaks and ready to automate LLM optimization, this tutorial guides