{"type": "stage2_complete", "rankings": [{"letter": "D", "display_letter": "C", "avg_position": 0.75, "votes": 4}, {"letter": "A", "display_letter": "A", "avg_position": 1.25, "votes": 4}, {"letter": "B", "display_letter": "B", "avg_position": 1.75, "votes": 4}, {"letter": "C", "display_letter": "D", "avg_position": 2.5, "votes": 4}, {"letter": "E", "display_letter": "E", "avg_position": 3.75, "votes": 4}], "shuffle_map": {"A": "A", "B": "B", "D": "C", "C": "D", "E": "E"}, "votes": [{"model": "meta-llama/llama-4-maverick", "display_ranking": "C > A > B > D > E", "original_ranking": "D > A > B > C > E", "reasoning": "## Step 1: Evaluate Version A\nVersion A is well-structured, covers all essential steps, and includes a clear \"what you will build\" section, making it easy to follow. It scores high on clarity and completeness.\n\n## Step 2: Evaluate Version B\nVersion B introduces an advanced async design and comprehensive logging, enhancing code quality and depth, but its complexity might be overwhelming for the target audience. It excels in depth and code quality but may lack clarity for some readers.\n\n## Step 3: Evaluate Version C\nVersion C strikes a good balance between clarity, completeness, and code quality, with robust error handling and a clear explanation of design decisions, making it highly effective. It is very comprehensive and handles potential issues well.\n\n## Step 4: Evaluate Version D\nVersion D is concise and directly addresses the task, focusing on a minimal viable evaluation loop with git versioning and cost tracking, making it straightforward. It is clear and to the point but lacks some depth in explanations.\n\n## Step 5: Evaluate Version E\nVersion E is similar to Version A but lacks some of the additional features and explanations that make Version A and Version C stand out, such as detailed error handling and a worked example with real input/output. It is clear and covers the basics but is less comprehensive.\n\n## Step 6: Compare All Versions\nComparing all versions, Version C stands out for its balance of clarity, completeness, and robustness. Version A is clear and comprehensive, Version B is advanced but complex, Version D is concise but lacks depth, and Version E is basic and clear but less comprehensive.\n\n## Step 7: Rank the Versions\nBased on the evaluation criteria, the ranking from best to worst is determined by how well each version balances correctness, completeness, clarity, code quality, and depth.\n\nThe final answer is:"}, {"model": "anthropic/claude-3-5-haiku", "display_ranking": "A > B > C > D > E", "original_ranking": "A > B > D > C > E", "reasoning": "Let me evaluate each version systematically against the criteria:\n\nVERSION A:\nStrengths: Very comprehensive, excellent code quality, strong depth of explanation\nWeaknesses: Slightly verbose, some repetition\nOverall: Solid, professional implementation with great educational value\n\nVERSION B:\nStrengths: Innovative dataclass-driven design, async-first approach, excellent modularity\nWeaknesses: More complex, might overwhelm beginners\nOverall: Advanced implementation showing sophisticated engineering principles\n\nVERSION C:\nStrengths: Strong balance between depth and accessibility, robust error handling\nWeaknesses: Slightly less innovative design compared to B\nOverall: Very solid, practical tutorial with good explanations\n\nVERSION D:\nStrengths: Direct, pragmatic approach, clear subprocess pattern explanation\nWeaknesses: Less comprehensive error handling, slightly less polished\nOverall: Lean, no-nonsense implementation focusing on core concepts\n\nVERSION E:\nStrengths: Clean, concise, covers core requirements\nWeaknesses: Less depth, fewer advanced considerations\nOverall: Serviceable but somewhat generic implementation\n\nDetailed scoring across criteria:\n- Correctness: B > A > C > D > E\n- Completeness: A > B > C > D > E\n- Clarity: A > C > D > B > E\n- Code Quality: B > A > C > D > E\n- Depth: B > A > C > D > E\n\nConsidering all factors, my ranking prioritizes comprehensive, innovative design with strong educational value."}, {"model": "google/gemini-3.1-flash-lite-preview", "display_ranking": "D > C > B > A > E", "original_ranking": "C > D > B > A > E", "reasoning": "The evaluation of these tutorials centered on their ability to provide a robust, idiomatic, and educational approach to building an LLM evaluation loop.\n\n*   **Version D** is the best because it provides a highly readable, pragmatically structured script that correctly implements the requested Git versioning and cost tracking while offering the most insightful \"Why this design works\" commentary.\n*   **Version C** is a strong second, offering excellent error handling and an improved TSV logging format, though it is slightly more verbose than D.\n*   **Version B** introduces an ambitious, professional-grade `asyncio` and `dataclass` architecture that is technically impressive but perhaps over-engineered for the \"10-minute\" constraint requested in the prompt.\n*   **Version A** is functionally correct and clear, but it lacks the depth of explanation found in the top versions and relies on a simpler, less robust error-handling approach.\n*   **Version E** is the weakest as it provides a nearly identical, less-polished version of A, missing the specific improvements to error handling and logging that distinguish the other versions.\n\n**Reasoning:**\n*   **Version D:** Provides the most balanced, concise, and professional implementation with excellent pedagogical explanations of the design choices.\n*   **Version C:** Very high quality, with robust error handling and a well-structured TSV output, though slightly more verbose than D.\n*   **Version B:** Demonstrates high-level software engineering practices, but its focus on `asyncio` and `dataclasses` may be too much for a \"minimal\" 10-minute tutorial.\n*   **Version A:** A solid, standard implementation that completes the requirements but lacks the extra polish and depth of the better versions.\n*   **Version E:** Effectively a duplicate of A with no significant improvements or unique advantages."}, {"model": "x-ai/grok-3-mini-beta", "display_ranking": "C > A > B > E > D", "original_ranking": "D > A > B > E > C", "reasoning": "Below is my ranking of the versions from best to worst based on the evaluation criteria (Correctness, Completeness, Clarity, Code Quality, and Depth). I judged each version solely on its quality, focusing on how well it meets the criteria for the target audience of ML engineers seeking a minimal, understandable implementation.\n\n- **Version C**: This version excels in clarity and completeness with enhanced error handling, TSV file saving, and detailed explanations, while maintaining strong correctness and code quality, making it highly accessible and robust.\n- **Version A**: It provides a balanced, comprehensive tutorial with solid code, good depth in explaining design decisions, and coverage of all essential steps, though it could improve slightly on advanced error handling.\n- **Version B**: While it scores high on code quality and depth through features like dataclasses and async design, its over-engineered approach reduces clarity and completeness due to placeholders and potential complexity for the target audience.\n- **Version E**: Similar to Version A in correctness and completeness, it covers the basics well but lacks the refinements in error handling and additional features, making it slightly less polished.\n- **Version D**: The code is correct and clear in parts but falls short in completeness and depth, with gaps in features like cost tracking and insufficient justification of design choices."}], "model_names": {"A": "meta-llama/llama-4-maverick", "B": "anthropic/claude-3-5-haiku", "C": "google/gemini-3.1-flash-lite-preview", "D": "x-ai/grok-3-mini-beta"}}
{"type": "stage3_complete", "winner": "D", "winner_model": "x-ai/grok-3-mini-beta", "council_score": 88, "sub_scores": {"CORRECTNESS": 18, "COMPLETENESS": 18, "CLARITY": 17, "CODE_QUALITY": 18, "DEPTH": 17}, "critique": "Proposal D effectively covers all essential aspects of building an LLM evaluation loop, with clear explanations and structured code. The tutorial includes robust error handling and well-defined metrics, making it easier for readers to follow along. However, while the depth is commendable, it could benefit from slightly more discussion on the trade-offs of the greedy algorithm approach. Overall, this version is strong and actionable, ideal for ML engineers looking to streamline their experimentation processes. For future iterations, consider integrating more advanced optimization techniques or parallel processing insights.", "chairman_full_response": "WINNER: D\nSCORE_CORRECTNESS: 18\nSCORE_COMPLETENESS: 18\nSCORE_CLARITY: 17\nSCORE_CODE_QUALITY: 18\nSCORE_DEPTH: 17\nCOUNCIL_SCORE: 88\n\nCRITIQUE:\nProposal D effectively covers all essential aspects of building an LLM evaluation loop, with clear explanations and structured code. The tutorial includes robust error handling and well-defined metrics, making it easier for readers to follow along. However, while the depth is commendable, it could benefit from slightly more discussion on the trade-offs of the greedy algorithm approach. Overall, this version is strong and actionable, ideal for ML engineers looking to streamline their experimentation processes. For future iterations, consider integrating more advanced optimization techniques or parallel processing insights.", "chairman_model": "openai/gpt-4o-mini", "model_names": {"A": "meta-llama/llama-4-maverick", "B": "anthropic/claude-3-5-haiku", "C": "google/gemini-3.1-flash-lite-preview", "D": "x-ai/grok-3-mini-beta"}}
{"type": "iteration_result", "iteration": 35, "status": "DISCARD", "council_score": 88, "winner": "D", "best_score": 94, "commit": "ebb51dd", "spent_usd": 0.410476, "timestamp": "2026-04-03T15:42:42.022659Z"}
