{"type": "stage2_complete", "rankings": [{"letter": "A", "display_letter": "A", "avg_position": 0.75, "votes": 4}, {"letter": "D", "display_letter": "B", "avg_position": 1.25, "votes": 4}, {"letter": "B", "display_letter": "D", "avg_position": 2.0, "votes": 4}, {"letter": "C", "display_letter": "E", "avg_position": 2.25, "votes": 4}, {"letter": "E", "display_letter": "C", "avg_position": 3.75, "votes": 4}], "shuffle_map": {"A": "A", "D": "B", "E": "C", "B": "D", "C": "E"}, "votes": [{"model": "meta-llama/llama-4-maverick", "display_ranking": "E > A > D > B > C", "original_ranking": "C > A > B > D > E", "reasoning": "## Step 1: Evaluate Version A\nVersion A scores high on completeness and clarity, covering all essential steps and providing a clear overview of what the reader will build. It includes a detailed code example and explanations, making it a strong candidate.\n\n## Step 2: Evaluate Version D\nVersion D improves upon Version A by introducing a probabilistic hill-climbing approach and advanced scoring mechanisms, enhancing depth and code quality. However, its complexity might make it less clear for some readers.\n\n## Step 3: Evaluate Version E\nVersion E is concise and directly implements a greedy hill-climbing loop with clear explanations of the architecture and common pitfalls. It effectively balances clarity and depth, making it accessible to the target audience.\n\n## Step 4: Evaluate Version B\nVersion B is comprehensive, covering API setup, asynchronous calls, custom metrics, and cost tracking. It saves results to a TSV file and commits improvements to Git, showing a good balance between completeness and clarity.\n\n## Step 5: Evaluate Version C\nVersion C is a basic implementation that covers the essential steps but lacks some details and advanced features seen in other versions, making it less comprehensive.\n\n## Step 6: Compare All Versions\nComparing all versions:\n- Version A is clear and complete, with a good balance of features.\n- Version D adds advanced features but may be less clear due to its complexity.\n- Version E is concise and clear, with a good explanation of the implementation.\n- Version B is comprehensive and includes useful features like TSV saving.\n- Version C is basic and lacks advanced features.\n\n## Step 7: Rank the Versions\nBased on the evaluation criteria (Correctness, Completeness, Clarity, Code Quality, Depth), the versions can be ranked. Version E stands out for its clarity and effective implementation. Version A and Version D are strong contenders due to their completeness and depth. Version B is comprehensive but slightly less polished. Version C is the most basic.\n\n## Step 8: Final Ranking\nAfter evaluating each version against the criteria, the final ranking from best to worst is determined."}, {"model": "anthropic/claude-3-5-haiku", "display_ranking": "A > D > B > C > E", "original_ranking": "A > B > D > E > C", "reasoning": "I'll evaluate each version across the five criteria and provide reasoning:\n\nVersion A:\n- Correctness: Very solid, comprehensive error handling\n- Completeness: Excellent, covers all major steps with clear explanations\n- Clarity: Strong, with good inline explanations and a clear structure\n- Code Quality: High, uses type hints, handles errors, avoids hardcoded values\n- Depth: Strong, includes \"why\" discussions and tradeoffs\nReasoning: Most comprehensive and well-rounded implementation with excellent documentation.\n\nVersion D:\n- Correctness: Good, but slightly more complex with probabilistic approach\n- Completeness: Very good, adds advanced features like structured logging\n- Clarity: Good, but slightly more abstract/complex than Version A\n- Code Quality: High, uses dataclasses, advanced type handling\n- Depth: Excellent, deep discussions of tradeoffs and design choices\nReasoning: More advanced implementation with stronger theoretical underpinnings, but slightly more complex.\n\nVersion B:\n- Correctness: Good, solid implementation\n- Completeness: Good coverage of core steps\n- Clarity: Clear, but slightly less polished than A and D\n- Code Quality: Solid, but less sophisticated type handling\n- Depth: Decent, but less comprehensive tradeoff discussion\nReasoning: Competent implementation with good fundamentals, but not as refined as A or D.\n\nVersion C:\n- Correctness: Similar to B, basic but functional\n- Completeness: Good core coverage, fewer advanced features\n- Clarity: Clear, but less detailed explanations\n- Code Quality: Adequate, fewer type hints and error handling\n- Depth: Limited tradeoff and design discussion\nReasoning: Very similar to Version B, but slightly less developed.\n\nVersion E:\n- Correctness: Good basic implementation\n- Completeness: Covers core steps, but fewer advanced features\n- Clarity: Clear and concise, but less comprehensive\n- Code Quality: Basic, fewer type hints and error handling\n- Depth: Limited depth in design discussions\nReasoning: Leanest implementation, focuses on core concepts but lacks sophistication."}, {"model": "google/gemini-3.1-flash-lite-preview", "display_ranking": "B > A > E > D > C", "original_ranking": "D > A > C > B > E", "reasoning": "To evaluate these versions, I assessed them based on code quality (idiomatic Python, error handling, type safety), completeness of the tutorial (setup, logic, and explanation), and adherence to the constraints and exploration directions.\n\n*   **Version B** is the strongest. It incorporates a TSV export for better data analysis, uses clear type hints, includes robust error handling for API calls, and provides a very thoughtful \"Why\" section that explains the architectural choices well.\n*   **Version A** is excellent and very similar to B, but slightly less refined regarding data-handling (JSON vs. TSV) and code structure. It includes a helpful cost summary section and is very clear.\n*   **Version E** is high-quality and focuses on clean architecture. It correctly identifies the \"Reward Hacking\" pitfall and provides good advice on moving beyond the loop, though it is slightly less focused on the specific \"parallel model query\" comparison aspect as a primary feature compared to A and B.\n*   **Version D** introduces more advanced concepts (probabilistic hill-climbing, `structlog`), but it moves away from the \"minimal\" requirement for the target audience of ML engineers who want a 10-minute setup, and the logic is slightly more opaque.\n*   **Version C** is essentially a slightly less polished version of Version A, missing the cost summary and some of the helpful explanatory context provided in the others.\n\n**Reasoning:**\n*   **Version B**: Best overall; it combines clean, typed code with practical enhancements like TSV output and thorough explanations of the \"why\" and \"how.\"\n*   **Version A**: Very strong, clear, and feature-complete; a close second to B.\n*   **Version E**: Excellent professional advice and clean code, though slightly less focused on the specific constraint of parallel model comparison as a primary feature.\n*   **Version D**: Good advanced concepts, but slightly over-engineered for a \"minimal\" tutorial request.\n*   **Version C**: Functional and correct, but lacks the polish, documentation, and specific enhancements found in the other versions."}, {"model": "x-ai/grok-3-mini-beta", "display_ranking": "B > A > D > E > C", "original_ranking": "D > A > B > C > E", "reasoning": "Below is my evaluation and ranking of the versions based on the specified criteria: Correctness, Completeness, Clarity, Code Quality, and Depth (each scored out of 20, for a total of 100). I judged solely on quality, assigning approximate scores as follows:\n\n- **Version A**: Scores: Correctness (18/20, code is valid and handles errors well), Completeness (18/20, covers all steps including cost tracking and git), Clarity (17/20, well-structured with explanations), Code Quality (17/20, idiomatic with good error handling), Depth (16/20, justifies decisions and discusses tradeoffs). Total: 86/100. It's a strong, balanced entry but slightly less polished in code extensibility than some alternatives.\n\n- **Version B**: Scores: Correctness (18/20, robust and error-free), Completeness (17/20, includes TSV saving and cost tracking), Clarity (18/20, highly readable with step-by-step guidance), Code Quality (18/20, excellent use of typing and constants), Depth (17/20, thorough explanations of tradeoffs and pitfalls). Total: 88/100. This version excels in clarity and code quality, making it the most accessible and practical for the target audience.\n\n- **Version C**: Scores: Correctness (17/20, functional but with minor potential issues in metric handling), Completeness (16/20, covers essentials but lacks some advanced features like TSV saving), Clarity (16/20, straightforward but less detailed), Code Quality (15/20, basic and safe but not as refined), Depth (15/20, adequate explanations but superficial on tradeoffs). Total: 79/100. It's a solid baseline but feels redundant and less innovative compared to similar versions.\n\n- **Version D**: Scores: Correctness (16/20, introduces complexity that could lead to bugs), Completeness (18/20, includes advanced features like probabilistic exploration), Clarity (15/20, more complex and potentially confusing), Code Quality (17/20, good use of dataclasses and logging), Depth (18/20, strong justifications for design choices). Total: 84/100. It offers great depth and completeness but sacrifices clarity for added sophistication.\n\n- **Version E**: Scores: Correctness (17/20, simple and reliable), Completeness (16/20, covers core steps but omits some tracking details), Clarity (18/20, very easy to follow), Code Quality (16/20, safe but less extensible), Depth (15/20, discusses pitfalls well but lacks deeper justifications). Total: 82/100. It's clear and user-friendly but falls short in depth and advanced features."}], "model_names": {"A": "meta-llama/llama-4-maverick", "B": "anthropic/claude-3-5-haiku", "C": "google/gemini-3.1-flash-lite-preview", "D": "x-ai/grok-3-mini-beta"}}
{"type": "stage3_complete", "winner": "A", "winner_model": "meta-llama/llama-4-maverick", "council_score": 93, "sub_scores": {"CORRECTNESS": 20, "COMPLETENESS": 20, "CLARITY": 18, "CODE_QUALITY": 18, "DEPTH": 17}, "critique": "Proposal A effectively covers all essential steps for building a minimal LLM evaluation loop, ensuring both correctness and completeness. The code is syntactically valid and logically sound, with good handling of potential errors. However, clarity could be improved with additional inline comments and a more structured overview of concepts before diving into the code. Depth is generally strong, but further exploration of design decisions and tradeoffs would enhance understanding, especially for novice users. Overall, this proposal provides a solid foundation for ML engineers looking to automate their prompt optimization processes.", "chairman_full_response": "WINNER: A\nSCORE_CORRECTNESS: 20\nSCORE_COMPLETENESS: 20\nSCORE_CLARITY: 18\nSCORE_CODE_QUALITY: 18\nSCORE_DEPTH: 17\nCOUNCIL_SCORE: 93\n\nCRITIQUE:\nProposal A effectively covers all essential steps for building a minimal LLM evaluation loop, ensuring both correctness and completeness. The code is syntactically valid and logically sound, with good handling of potential errors. However, clarity could be improved with additional inline comments and a more structured overview of concepts before diving into the code. Depth is generally strong, but further exploration of design decisions and tradeoffs would enhance understanding, especially for novice users. Overall, this proposal provides a solid foundation for ML engineers looking to automate their prompt optimization processes.", "chairman_model": "openai/gpt-4o-mini", "model_names": {"A": "meta-llama/llama-4-maverick", "B": "anthropic/claude-3-5-haiku", "C": "google/gemini-3.1-flash-lite-preview", "D": "x-ai/grok-3-mini-beta"}}
{"type": "iteration_result", "iteration": 42, "status": "DISCARD", "council_score": 93, "winner": "A", "best_score": 96, "commit": "de0e250", "spent_usd": 0.670142, "timestamp": "2026-04-03T15:53:02.214303Z"}
