{"type": "stage2_complete", "rankings": [{"letter": "D", "display_letter": "E", "avg_position": 0.25, "votes": 4}, {"letter": "A", "display_letter": "A", "avg_position": 1.0, "votes": 4}, {"letter": "C", "display_letter": "B", "avg_position": 2.0, "votes": 4}, {"letter": "E", "display_letter": "D", "avg_position": 3.25, "votes": 4}, {"letter": "B", "display_letter": "C", "avg_position": 3.5, "votes": 4}], "shuffle_map": {"A": "A", "C": "B", "B": "C", "E": "D", "D": "E"}, "votes": [{"model": "meta-llama/llama-4-maverick", "display_ranking": "E > A > B > D > C", "original_ranking": "D > A > C > E > B", "reasoning": "## Step 1: Evaluate Version A\nVersion A is comprehensive, covering all essential steps, implementing a greedy hill-climbing loop, and providing a clear explanation of the design decisions and tradeoffs. It includes a worked example and discusses common pitfalls.\n\n## Step 2: Evaluate Version B\nVersion B provides a lean and robust implementation with a clear structure, separating tasks, metrics, and the loop logic. It includes features like cost tracking, Git versioning, and a discussion on common pitfalls and potential enhancements.\n\n## Step 3: Evaluate Version C\nVersion C introduces a novel multi-strategy evaluation framework, supporting configurable, multi-dimensional scoring, and robust error handling. However, its complexity might be overwhelming for the target audience seeking a minimal evaluation loop.\n\n## Step 4: Evaluate Version D\nVersion D is straightforward, covering the essential steps for building a minimal LLM evaluation loop. It lacks some of the advanced features and detailed explanations found in other versions but is clear and easy to follow.\n\n## Step 5: Evaluate Version E\nVersion E is highly detailed, with clear explanations, type hints for better readability, and a comprehensive discussion on design choices and tradeoffs. It effectively balances simplicity with depth, making it suitable for ML engineers.\n\n## Step 6: Compare All Versions\n- Version A is strong in completeness and clarity but slightly less so in depth compared to Version E.\n- Version B is notable for its lean implementation and clear structure.\n- Version C, while innovative, may be too complex for the target audience.\n- Version D is simple and to the point but lacks depth.\n- Version E stands out for its balance of clarity, depth, and completeness.\n\n## Step 7: Rank the Versions\nBased on the evaluation criteria (correctness, completeness, clarity, code quality, and depth), Version E is the most balanced and effective tutorial. Version A is a close second due to its comprehensive coverage and clarity. Version B is also strong in its lean and structured approach. Version D is simpler and less detailed. Version C, despite its innovations, is less suitable due to its complexity."}, {"model": "anthropic/claude-3-5-haiku", "display_ranking": "A > E > B > D > C", "original_ranking": "A > D > C > E > B", "reasoning": "Analysis of Versions:\n\nVersion A: Strong overall implementation with comprehensive coverage. Provides clear explanations, robust error handling, and a well-structured approach to LLM evaluation that meets all criteria exceptionally well.\n\nVersion B: Lean and pragmatic implementation with a focus on simplicity. Slightly less comprehensive than Version A but still provides a solid, no-nonsense approach to LLM evaluation.\n\nVersion C: Overly complex and academically-oriented, with excessive abstraction that might intimidate the target audience of practical ML engineers. Introduces unnecessary complexity without proportional benefit.\n\nVersion D: Very similar to Version A, but slightly less detailed and with marginally less clear explanations. Covers the core concepts but lacks the nuanced depth of Version A.\n\nVersion E: Comprehensive and well-explained, with strong type hinting and detailed comments. Slightly more verbose than Version B but maintains a good balance of depth and accessibility.\n\nDetailed Scoring Breakdown:\n- Version A: Excels in correctness, completeness, clarity, and depth. Strong code quality with comprehensive error handling.\n- Version E: Very strong, with excellent type hints and explanations. Slightly more verbose but highly educational.\n- Version B: Pragmatic and clear, with a lean implementation that focuses on core concepts.\n- Version D: Solid but less distinctive, essentially a slightly less polished version of A.\n- Version C: Overengineered and least aligned with the target audience's needs."}, {"model": "google/gemini-3.1-flash-lite-preview", "display_ranking": "E > B > A > D > C", "original_ranking": "D > C > A > E > B", "reasoning": "The versions were evaluated based on the criteria of correctness, completeness, clarity, code quality, and depth.\n\n*   **Version E** is the strongest; it provides the most professional structure, includes clear type hints, handles potential file read errors implicitly, and explains the reasoning behind the design (such as the subprocess pattern) very well.\n*   **Version B** is excellent and very practical; it introduces a custom `TypedDict` for the results, suggests a TSV format (which is often more useful for ML engineers than JSON), and includes a very helpful section on \"The Subprocess Pattern.\"\n*   **Version A** is a solid, standard implementation that is easy to follow and includes good documentation, though it is slightly less polished in its code structure than E or B.\n*   **Version D** is functional and clear, but it lacks the depth of explanation and the extra polish (like type hints and robust dependency management) found in the top three versions.\n*   **Version C** is the weakest; while it attempts to be \"advanced,\" the code is fragmented, relies on external heavy-duty NLP libraries (`nltk`, `textstat`) which contradicts the \"minimal\" and \"10-minute\" goals, and contains syntax errors (e.g., `field` is used but not imported).\n\nReasoning for the ranking:\n- **Version E**: Best balance of professional code quality, clear explanations, and alignment with the \"minimal\" but \"systematic\" requirements.\n- **Version B**: Highly practical and well-reasoned, with useful insights into why specific patterns (TSV, subprocess) were chosen.\n- **Version A**: Very clear and effective tutorial that covers all requirements well.\n- **Version D**: Competent and correct, but lacks the pedagogical depth of the higher-ranked versions.\n- **Version C**: Over-engineered, includes unnecessary dependencies, and contains errors that would prevent it from running."}, {"model": "x-ai/grok-3-mini-beta", "display_ranking": "E > A > C > B > D", "original_ranking": "D > A > B > C > E", "reasoning": "Below is my ranking of the versions from best to worst based on the evaluation criteria (Correctness, Completeness, Clarity, Code Quality, and Depth). I judged each version holistically, scoring them out of 100 points: Version E scored ~90 (strong clarity and code quality with type hints and explanations, making it highly accessible); Version A scored ~90 (comprehensive coverage with good depth and error handling, but slightly less emphasis on inline clarity than E); Version C scored ~85 (advanced features and depth but over-engineered, reducing clarity for the minimal audience); Version B scored ~83 (solid completeness and practicality but weaker depth and broader error handling); Version D scored ~81 (basic and correct but lacks the refinements in code quality and depth seen in A and E)."}], "model_names": {"A": "meta-llama/llama-4-maverick", "B": "anthropic/claude-3-5-haiku", "C": "google/gemini-3.1-flash-lite-preview", "D": "x-ai/grok-3-mini-beta"}}
{"type": "stage3_complete", "winner": "D", "winner_model": "x-ai/grok-3-mini-beta", "council_score": 91, "sub_scores": {"CORRECTNESS": 18, "COMPLETENESS": 20, "CLARITY": 18, "CODE_QUALITY": 18, "DEPTH": 17}, "critique": "Proposal D provides a clear, complete, and correct implementation of the LLM evaluation loop, covering all necessary steps and incorporating good coding practices such as type hints and error handling. The tutorial is accessible and structured in a way that guides readers through the process effectively. While it explains the \"why\" behind the design choices, further elaboration on trade-offs, especially regarding the greedy hill-climbing strategy, could enhance depth. To improve further, consider integrating a section on potential extensions or alternative strategies for evaluation to encourage broader exploration among users.", "chairman_full_response": "WINNER: D\nSCORE_CORRECTNESS: 18\nSCORE_COMPLETENESS: 20\nSCORE_CLARITY: 18\nSCORE_CODE_QUALITY: 18\nSCORE_DEPTH: 17\nCOUNCIL_SCORE: 91\n\nCRITIQUE:\nProposal D provides a clear, complete, and correct implementation of the LLM evaluation loop, covering all necessary steps and incorporating good coding practices such as type hints and error handling. The tutorial is accessible and structured in a way that guides readers through the process effectively. While it explains the \"why\" behind the design choices, further elaboration on trade-offs, especially regarding the greedy hill-climbing strategy, could enhance depth. To improve further, consider integrating a section on potential extensions or alternative strategies for evaluation to encourage broader exploration among users.", "chairman_model": "openai/gpt-4o-mini", "model_names": {"A": "meta-llama/llama-4-maverick", "B": "anthropic/claude-3-5-haiku", "C": "google/gemini-3.1-flash-lite-preview", "D": "x-ai/grok-3-mini-beta"}}
{"type": "iteration_result", "iteration": 3, "status": "DISCARD", "council_score": 91, "winner": "D", "best_score": 94, "commit": "ebb51dd", "spent_usd": 0.05552, "timestamp": "2026-04-03T14:32:21.019173Z"}
