{"type": "stage2_complete", "rankings": [{"letter": "B", "display_letter": "C", "avg_position": 1.0, "votes": 4}, {"letter": "C", "display_letter": "E", "avg_position": 1.75, "votes": 4}, {"letter": "D", "display_letter": "A", "avg_position": 1.75, "votes": 4}, {"letter": "A", "display_letter": "B", "avg_position": 1.75, "votes": 4}, {"letter": "E", "display_letter": "D", "avg_position": 3.75, "votes": 4}], "shuffle_map": {"B": "A", "C": "B", "E": "C", "A": "D", "D": "E"}, "votes": [{"model": "meta-llama/llama-4-maverick", "display_ranking": "E > C > B > A > D", "original_ranking": "C > B > A > D > E", "reasoning": "To evaluate the given versions of the tutorial on building a minimal LLM evaluation loop in Python, we need to consider the provided evaluation criteria: Correctness, Completeness, Clarity, Code quality, and Depth.\n\n## Step 1: Evaluating Correctness\nAll versions appear to have syntactically valid code and logically correct loop logic. However, subtle differences in error handling and API call implementations might affect their correctness.\n\n## Step 2: Evaluating Completeness\nThe completeness of each version varies. Some versions cover all essential steps, including API key setup, making LLM calls, defining a metric function, and saving results. Others might lack certain details or features like cost tracking or parallel model queries.\n\n## Step 3: Evaluating Clarity\nClarity is assessed based on how easily a reader with intermediate Python skills can follow the tutorial. Versions with clear explanations, inline comments, and a logical structure score higher.\n\n## Step 4: Evaluating Code Quality\nCode quality is judged on its idiomaticness, safety, and structure. Factors include the use of named constants, error handling, type hints, and meaningful variable names.\n\n## Step 5: Evaluating Depth\nDepth refers to how well the tutorial explains why certain design decisions were made, acknowledges tradeoffs, and provides insights beyond the basic implementation.\n\n## Analysis of Versions\n\n- **Version A**: Provides a comprehensive tutorial with clear explanations and justifications for design decisions. It covers essential steps, includes parallel model queries, and has a good balance of code quality and depth.\n- **Version B**: Similar to Version A but includes additional features like cost tracking and a progress graph. It maintains clarity and code quality while enhancing completeness.\n- **Version C**: Offers a more advanced implementation with multi-strategy optimization and flexible scoring. While it excels in depth and code quality, its complexity might affect clarity for some readers.\n- **Version D**: Essentially similar to Version B, with minor differences in presentation. It is complete, clear, and has good code quality.\n- **Version E**: Distinguished by its emphasis on the \"why\" behind the architecture and common pitfalls. It provides a clear and structured tutorial with good code examples and explanations.\n\n## Ranking\n\n- **Version E**: Stands out for its clarity, depth, and emphasis on explaining the reasoning behind the design decisions and common pitfalls, making it highly educational.\n- **Version C**: Excels in depth and code quality with its advanced features, but might be slightly less clear due to its complexity.\n- **Version B**: Offers a good balance of completeness, clarity, and code quality, with additional features like cost tracking.\n- **Version A**: Comprehensive and clear, with a good balance of code quality and depth, making it a strong contender.\n- **Version D**: While complete and clear, it is very similar to Version B and lacks some of the distinctive features or depth of other versions.\n\n##"}, {"model": "anthropic/claude-3-5-haiku", "display_ranking": "B > C > E > A > D", "original_ranking": "A > B > C > D > E", "reasoning": "I'll evaluate each version against the criteria and provide a quick reasoning:\n\nVersion B: Solid implementation with good clarity and completeness. Strong depth in explaining design choices, comprehensive error handling, and a clear progression of ideas. Slightly over-engineered but very thorough.\n\nVersion C: Similar to B but with a more flexible, configurable design. Excellent depth in explaining optimization strategies and tradeoffs. Slightly more complex, which might intimidate beginners.\n\nVersion E: Lean, focused implementation with an excellent narrative style. Strong emphasis on practical engineering and real-world constraints. Slightly less comprehensive in implementation details.\n\nVersion A: Comprehensive and well-explained, with good balance between technical depth and readability. Solid implementation with clear comments and justifications.\n\nVersion D: Very similar to B, but slightly less polished. Feels more like a template than a deeply considered tutorial.\n\nDetailed evaluation against criteria:\n\nVersion B:\n- Correctness: \u2713 (Solid, runnable code)\n- Completeness: \u2713 (Covers all essential steps)\n- Clarity: \u2713\u2713 (Excellent step-by-step explanation)\n- Code Quality: \u2713 (Good error handling, type hints)\n- Depth: \u2713\u2713 (Excellent discussion of tradeoffs)\n\nVersion C:\n- Correctness: \u2713 \n- Completeness: \u2713\u2713 (More flexible design)\n- Clarity: \u2713 \n- Code Quality: \u2713\u2713 (More robust, configurable)\n- Depth: \u2713\u2713 (Excellent strategy discussions)\n\nVersion E:\n- Correctness: \u2713\n- Completeness: \u2713 \n- Clarity: \u2713\u2713 (Most conversational, engaging)\n- Code Quality: \u2713 \n- Depth: \u2713 (Good philosophical discussion)\n\nVersion A:\n- Correctness: \u2713\n- Completeness: \u2713\n- Clarity: \u2713\n- Code Quality: \u2713\n- Depth: \u2713 \n\nVersion D:\n- Correctness: \u2713\n- Completeness: \u2713 (Similar to B)\n- Clarity: \u2713 \n- Code Quality: \u2713\n- Depth: \u2713 (Less distinctive)"}, {"model": "google/gemini-3.1-flash-lite-preview", "display_ranking": "A > E > C > B > D", "original_ranking": "D > C > B > A > E", "reasoning": "The versions were evaluated based on the criteria of correctness, completeness, clarity, code quality, and depth.\n\n*   **Version A:** This version is the strongest; it includes excellent pedagogical explanations, handles Git initialization gracefully, uses a robust TSV output format, and includes a thoughtful discussion on the \"why\" and \"when to stop\" aspects of the loop.\n*   **Version E:** This version has the most professional tone and the most concise, readable code; it correctly identifies the importance of explaining the \"subprocess pattern\" and provides a very clear, actionable \"Why This Architecture\" section.\n*   **Version C:** While this version attempts to add complexity with a `dataclass` and multi-strategy optimization, it introduces a potential bug in the `run_experiment` loop where it might fail if `artifact.txt` doesn't exist, and the complexity feels slightly over-engineered for a \"minimal\" 10-minute tutorial.\n*   **Version B:** This is a solid, functional version that includes a visualization step (matplotlib), though the code is less polished than A or E, and it lacks the deeper conceptual explanation of the trade-offs found in the top-tier versions.\n*   **Version D:** This version is essentially an incomplete version of Version B; it is functional but lacks the extra features (like graph generation) and the polish present in the others."}, {"model": "x-ai/grok-3-mini-beta", "display_ranking": "C > A > B > D > E", "original_ranking": "B > D > A > E > C", "reasoning": "Below is my ranking of the versions (A, B, C, D, and E) from best to worst based on the evaluation criteria: Correctness, Completeness, Clarity, Code Quality, and Depth. I assigned approximate scores out of 100 as follows:\n\n- **Version C**: 88/100 \u2013 This version excels in correctness and code quality with robust error handling, type hints, and flexible structures, while also providing good completeness and depth through multi-strategy optimization and tradeoffs, though it slightly overcomplicates the \"minimal\" focus.\n- **Version A**: 84/100 \u2013 It scores high in completeness and clarity by covering all essential steps with clear explanations and inline code comments, plus solid depth in justifying design decisions, but lacks some advanced error handling seen in C.\n- **Version B**: 82/100 \u2013 Similar to A and D in structure, it adds completeness with features like cost tracking and visualization, but its depth is adequate without much innovation, making it redundant with D.\n- **Version D**: 80/100 \u2013 It meets the basics well in completeness and correctness but offers little new beyond B, with average clarity and depth that feel repetitive.\n- **Version E**: 76/100 \u2013 While clear and straightforward, it falls short in completeness and code quality due to limited error handling and tracking, though it provides decent depth on pitfalls."}], "model_names": {"A": "meta-llama/llama-4-maverick", "B": "anthropic/claude-3-5-haiku", "C": "google/gemini-3.1-flash-lite-preview", "D": "x-ai/grok-3-mini-beta"}}
{"type": "stage3_complete", "winner": "B", "winner_model": "anthropic/claude-3-5-haiku", "council_score": 94, "sub_scores": {"CORRECTNESS": 19, "COMPLETENESS": 20, "CLARITY": 18, "CODE_QUALITY": 19, "DEPTH": 18}, "critique": "Proposal B effectively builds on the baseline by introducing a multi-strategy optimization loop, which enhances the completeness of the tutorial. The code is mostly correct and well-structured, although minor adjustments could improve robustness in error handling. Clarity is generally high, but some sections could benefit from more inline explanations, especially regarding the new strategies implemented. The tutorial does a commendable job discussing tradeoffs and design decisions, which adds depth to the understanding of the optimization process. Moving forward, consider adding a section on potential pitfalls specific to the new strategies introduced to guide users in practical applications.", "chairman_full_response": "WINNER: B\nSCORE_CORRECTNESS: 19\nSCORE_COMPLETENESS: 20\nSCORE_CLARITY: 18\nSCORE_CODE_QUALITY: 19\nSCORE_DEPTH: 18\nCOUNCIL_SCORE: 94\n\nCRITIQUE:\nProposal B effectively builds on the baseline by introducing a multi-strategy optimization loop, which enhances the completeness of the tutorial. The code is mostly correct and well-structured, although minor adjustments could improve robustness in error handling. Clarity is generally high, but some sections could benefit from more inline explanations, especially regarding the new strategies implemented. The tutorial does a commendable job discussing tradeoffs and design decisions, which adds depth to the understanding of the optimization process. Moving forward, consider adding a section on potential pitfalls specific to the new strategies introduced to guide users in practical applications.", "chairman_model": "openai/gpt-4o-mini", "model_names": {"A": "meta-llama/llama-4-maverick", "B": "anthropic/claude-3-5-haiku", "C": "google/gemini-3.1-flash-lite-preview", "D": "x-ai/grok-3-mini-beta"}}
{"type": "iteration_result", "iteration": 44, "status": "DISCARD", "council_score": 94, "winner": "B", "best_score": 96, "commit": "de0e250", "spent_usd": 0.753448, "timestamp": "2026-04-03T15:57:34.434307Z"}
