{"type": "stage1_complete", "proposals": {"A": "# Build a Minimal LLM Evaluation Loop in Python: Systematic Experiments for ML Engineers\n\nIf you want to stop manually testing prompts and start running systematic experiments, an evaluation loop is the right tool. This tutorial shows you how to build one using the OpenRouter API, covering essential steps from API key setup to saving results.\n\n## What You Will Build\n\nBy the end of this tutorial, you will have a working Python script that:\n1. Makes LLM API calls using OpenRouter\n2. Scores the output using a custom metric\n3. Implements a greedy hill-climbing loop to improve the output\n4. Saves the best artifact to a file\n5. Tracks costs and iterations\n6. Versions improvements using git\n7. Supports parallel queries to multiple models for comparison\n\n## What You Need\n\n- Python 3.10+\n- An OpenRouter API key (sign up at openrouter.ai)\n- `httpx` installed: `pip install httpx`\n- `python-dotenv` installed: `pip install python-dotenv`\n- Git installed and configured\n\n## Step 1: Setup API Key and Constants\n\nFirst, create a `.env` file in your project root with your OpenRouter API key:\n```plaintext\nOPENROUTER_API_KEY=sk-or-your-key-here\n```\n\n```python\nimport os\nimport httpx\nfrom dotenv import load_dotenv\nimport asyncio\nimport json\nimport subprocess\n\nload_dotenv()  # Load environment variables from .env\n\nAPI_KEY = os.getenv(\"OPENROUTER_API_KEY\")\nAPI_URL = \"https://openrouter.ai/api/v1/chat/completions\"\nMODELS = [\"openai/gpt-4o-mini\", \"meta-llama/llama-3.1-8b-instruct\"]\nMAX_ITERATIONS = 20\nCOST_PER_TOKEN = 0.000002  # Example cost, check OpenRouter pricing\n\nasync def call_llm(model: str, prompt: str) -> str:\n    try:\n        async with httpx.AsyncClient() as client:\n            response = await client.post(\n                API_URL,\n                headers={\"Authorization\": f\"Bearer {API_KEY}\"},\n                json={\n                    \"model\": model,\n                    \"messages\": [{\"role\": \"user\", \"content\": prompt}]\n                },\n                timeout=10.0\n            )\n            response.raise_for_status()\n            data = response.json()\n            return data[\"choices\"][0][\"message\"][\"content\"]\n    except httpx.RequestError as e:\n        print(f\"API request failed: {e}\")\n        return \"\"\n\ndef score(text: str) -> float:\n    words = len(text.split())\n    length_score = min(words / 200, 1.0)\n    coherence_score = len(set(text.split())) / words if words > 0 else 0\n    return 0.5 * length_score + 0.5 * coherence_score\n\nasync def main():\n    best_score = 0.0\n    artifact = open(\"artifact.txt\").read().strip()\n    total_cost = 0.0\n    results = []\n\n    try:\n        subprocess.run([\"git\", \"rev-parse\"], check=True, capture_output=True)\n    except subprocess.CalledProcessError:\n        subprocess.run([\"git\", \"init\"], check=True)\n        subprocess.run([\"git\", \"add\", \"artifact.txt\"], check=True)\n        subprocess.run([\"git\", \"commit\", \"-m\", \"Initial artifact\"], check=True)\n\n    for i in range(MAX_ITERATIONS):\n        prompt = f\"Improve this text:\\n\\n{artifact}\"\n        tasks = [call_llm(model, prompt) for model in MODELS]\n        candidates = await asyncio.gather(*tasks)\n        \n        best_candidate = None\n        best_model_score = 0.0\n        \n        for model, candidate in zip(MODELS, candidates):\n            if not candidate:  \n                continue\n            \n            new_score = score(candidate)\n            total_cost += COST_PER_TOKEN * (len(prompt) + len(candidate))  \n            \n            if new_score > best_model_score:\n                best_model_score = new_score\n                best_candidate = candidate\n        \n        if best_candidate and best_model_score > best_score:\n            best_score = best_model_score\n            artifact = best_candidate.strip()\n            with open(\"artifact.txt\", \"w\") as f:\n                f.write(artifact)\n            subprocess.run([\"git\", \"add\", \"artifact.txt\"], check=True)\n            subprocess.run([\"git\", \"commit\", \"-m\", f\"Iter {i}: Improved artifact\"], check=True)\n            print(f\"Iter {i}: KEEP  score={best_model_score:.2f}\")\n            results.append({\"iteration\": i, \"score\": best_model_score, \"action\": \"KEEP\", \"cost\": total_cost})\n        else:\n            print(f\"Iter {i}: DISCARD  best_score={best_score:.2f}\")\n            results.append({\"iteration\": i, \"score\": best_model_score if best_candidate else 0, \"action\": \"DISCARD\", \"cost\": total_cost})\n\n    with open(\"results.json\", \"w\") as f:\n        json.dump(results, f, indent=2)\n\nif __name__ == \"__main__\":\n    asyncio.run(main())\n```\n\n## Step 2: Run Your Evaluation Loop\n\n```bash\npython loop.py\n```\n\nYou should see output like:\n\n```\nIter 0: KEEP  score=0.85\nIter 1: DISCARD  best_score=0.85\nIter 2: KEEP  score=0.91\nIter 3: DISCARD  best_score=0.91\n```\n\nThe artifact file is updated and committed to git whenever a better version is found, and results are saved to `results.json`.\n\n## Why Greedy Hill-Climbing with Parallel Model Queries?\n\nGreedy hill-climbing is simple and effective for many optimization tasks. By querying multiple models in parallel, you can compare their performance directly within the same loop, providing valuable insights into model selection for your specific task. This approach helps in identifying the most suitable model while optimizing the output.\n\n## Tradeoffs and Limitations\n\nWhile greedy hill-climbing with parallel queries is straightforward and effective, it may still get stuck in local optima. Consider adding randomness or more sophisticated optimization techniques for complex tasks. Additionally, be mindful of the cost implications of querying multiple models.\n\n## Common Pitfalls\n\n1. **Metric Gaming**: Ensure your metric accurately reflects the desired outcome. A poorly designed metric can lead to suboptimal or misleading results.\n2. **Circular Feedback**: Be cautious when using LLM outputs to evaluate other LLM outputs. This can create feedback loops that degrade performance over time.\n3. **Runaway Costs**: Always track costs and consider implementing a budget constraint to prevent unexpected expenses.\n\n## Worked Example\n\nLet's say you start with a simple artifact: \"The quick brown fox jumps over the lazy dog.\" After running the evaluation loop, the artifact might improve to: \"The quick brown fox jumps over the lazy dog, demonstrating a classic example of a pangram that uses all the letters of the alphabet efficiently.\" The score improves from 0.4 to 0.8 as the output becomes more coherent and contextually relevant.\n\n## What's Next\n\nThis basic loop works, but you can enhance it further:\n- Implement more sophisticated optimization strategies like simulated annealing\n- Add more comprehensive error handling and logging mechanisms\n- Experiment with different model combinations to find the best fit for your task\n\nBy following this tutorial, you've built a systematic evaluation loop for LLM experiments that not only optimizes your prompts but also versions your improvements using git and compares multiple models. This foundation allows you to scale your experiments, track progress, and optimize your prompts effectively.", "B": "# Build a Minimal LLM Evaluation Loop in Python: Systematic Experiments for ML Engineers\n\nIn the rapidly evolving world of AI, moving from manual prompt tinkering to systematic experimentation is crucial. This tutorial introduces a lightweight, flexible framework for iterative LLM optimization that emphasizes simplicity, cost-awareness, and reproducibility.\n\n## What You Will Build\n\nA Python script that:\n1. Runs systematic LLM experiments using OpenRouter\n2. Implements a robust evaluation and improvement loop\n3. Tracks experiment metrics and computational costs\n4. Versions improvements using git\n5. Provides extensible infrastructure for ML research\n\n## Prerequisites\n\n- Python 3.10+\n- OpenRouter API key\n- `httpx`, `python-dotenv`, `pandas`\n- Basic understanding of async programming\n- Git installed\n\n## Architectural Design: Experimental Loop Pattern\n\nUnlike traditional one-shot prompt engineering, this approach uses a structured experimental loop with key components:\n- Metric-driven evaluation\n- Incremental improvement strategy\n- Comprehensive logging\n- Cost and performance tracking\n\n## Step 1: Secure Configuration and API Setup\n\n```python\nimport os\nimport typing as t\nfrom functools import partial\nfrom dataclasses import dataclass, asdict\nfrom dotenv import load_dotenv\n\nload_dotenv()\n\n@dataclass\nclass ExperimentConfig:\n    api_key: str = os.getenv(\"OPENROUTER_API_KEY\")\n    model: str = \"openai/gpt-4o-mini\"\n    max_iterations: int = 25\n    budget_limit: float = 5.00  # USD\n    timeout: float = 15.0\n\nCONFIG = ExperimentConfig()\n```\n\n## Step 2: Advanced Metric Design\n\n```python\nimport numpy as np\nfrom scipy import stats\n\ndef advanced_scoring(\n    text: str, \n    min_length: int = 50, \n    max_length: int = 500\n) -> float:\n    \"\"\"\n    Multi-dimensional scoring that considers:\n    1. Lexical diversity\n    2. Semantic coherence\n    3. Length normalization\n    4. Statistical text properties\n    \"\"\"\n    if not text:\n        return 0.0\n    \n    words = text.split()\n    unique_words = set(words)\n    \n    # Lexical diversity\n    diversity_score = len(unique_words) / len(words)\n    \n    # Length normalization\n    length_penalty = stats.norm.pdf(\n        len(words), \n        loc=(min_length + max_length)/2, \n        scale=(max_length - min_length)/4\n    )\n    \n    # Semantic complexity (placeholder)\n    complexity_score = np.log(len(words) + 1)\n    \n    # Weighted combination\n    return (\n        0.4 * diversity_score + \n        0.3 * length_penalty + \n        0.3 * complexity_score\n    )\n```\n\n## Step 3: Robust LLM Interaction Layer\n\n```python\nimport httpx\nimport asyncio\n\nasync def call_llm(\n    prompt: str, \n    config: ExperimentConfig = CONFIG\n) -> t.Optional[str]:\n    \"\"\"\n    Async LLM call with comprehensive error handling\n    and configurable retry mechanism\n    \"\"\"\n    async with httpx.AsyncClient() as client:\n        try:\n            response = await client.post(\n                \"https://openrouter.ai/api/v1/chat/completions\",\n                headers={\"Authorization\": f\"Bearer {config.api_key}\"},\n                json={\n                    \"model\": config.model,\n                    \"messages\": [{\"role\": \"user\", \"content\": prompt}]\n                },\n                timeout=config.timeout\n            )\n            response.raise_for_status()\n            return response.json()[\"choices\"][0][\"message\"][\"content\"]\n        \n        except (httpx.RequestError, KeyError) as e:\n            print(f\"LLM interaction error: {e}\")\n            return None\n```\n\n## Step 4: Experimental Loop with Advanced Tracking\n\n```python\nimport pandas as pd\nimport json\nfrom datetime import datetime\n\nasync def experimental_loop(\n    initial_artifact: str, \n    config: ExperimentConfig = CONFIG\n):\n    experiment_log = []\n    current_artifact = initial_artifact\n    total_cost = 0.0\n    \n    for iteration in range(config.max_iterations):\n        # Improvement prompt generation\n        improvement_prompt = f\"\"\"\n        Systematically improve this text, focusing on clarity and coherence:\n        \n        {current_artifact}\n        \n        Provide a refined version that maintains the core message.\n        \"\"\"\n        \n        candidate = await call_llm(improvement_prompt)\n        \n        if not candidate:\n            continue\n        \n        score = advanced_scoring(candidate)\n        \n        experiment_log.append({\n            \"iteration\": iteration,\n            \"score\": score,\n            \"timestamp\": datetime.now().isoformat()\n        })\n        \n        if score > advanced_scoring(current_artifact):\n            current_artifact = candidate\n    \n    # Persist experiment results\n    results_df = pd.DataFrame(experiment_log)\n    results_df.to_csv(\"experiment_results.csv\", index=False)\n    \n    return current_artifact\n```\n\n## Depth: Why This Approach?\n\nThis design prioritizes:\n- Systematic exploration over random mutation\n- Comprehensive metric assessment\n- Lightweight, extensible architecture\n- Minimal computational overhead\n\n## Limitations and Future Work\n\n- Current implementation lacks true global optimization\n- Metric design remains challenging and domain-specific\n- Cost tracking is approximate\n\n## Getting Started\n\n1. Install dependencies\n2. Set `OPENROUTER_API_KEY`\n3. Run the experimental loop\n4. Analyze `experiment_results.csv`\n\nBy embracing this structured approach, you transform prompt engineering from art to science.", "C": "# Build a Minimal LLM Evaluation Loop: From Manual Prompting to Systematic Optimization\n\nManual \"prompt engineering\" is a bottleneck. If you are still copy-pasting outputs into a text file to compare them, you are losing time and visibility. This tutorial enables you to build a lean, automated evaluation loop in Python that treats your prompt as code\u2014subject to version control, objective scoring, and systematic iteration.\n\n## What You Will Build\nYou will create an \"Evaluation-as-Code\" loop. This tool uses a greedy hill-climbing strategy to iteratively improve an artifact. It tracks costs, saves metadata to a TSV file for analysis, and commits every successful improvement to Git so you have a verifiable audit trail of your prompt's evolution.\n\n## Prerequisites\n- Python 3.10+\n- [OpenRouter API Key](https://openrouter.ai/)\n- Libraries: `pip install httpx python-dotenv`\n- A folder initialized as a git repository (`git init`)\n\n## The Implementation\n\nWe use a modular approach: one function for API interaction, one for scoring, and a main loop for orchestration.\n\n```python\nimport os\nimport httpx\nimport json\nimport subprocess\nfrom typing import Optional\nfrom dotenv import load_dotenv\n\n# Configuration\nload_dotenv()\nAPI_KEY = os.getenv(\"OPENROUTER_API_KEY\")\nAPI_URL = \"https://openrouter.ai/api/v1/chat/completions\"\n# Using a small, fast model for iterative optimization\nMODEL = \"openai/gpt-4o-mini\"\nMAX_ITERATIONS = 10\n\ndef call_llm(prompt: str) -> Optional[str]:\n    \"\"\"Sends a prompt to OpenRouter with basic error handling.\"\"\"\n    try:\n        with httpx.Client(timeout=30.0) as client:\n            response = client.post(\n                API_URL,\n                headers={\"Authorization\": f\"Bearer {API_KEY}\", \"HTTP-Referer\": \"https://eval-loop.local\"},\n                json={\"model\": MODEL, \"messages\": [{\"role\": \"user\", \"content\": prompt}]}\n            )\n            response.raise_for_status()\n            return response.json()[\"choices\"][0][\"message\"][\"content\"]\n    except Exception as e:\n        print(f\"API Error: {e}\")\n        return None\n\ndef score_artifact(text: str) -> float:\n    \"\"\"\n    A domain-specific metric. \n    Replace this with your own logic (e.g., regex checks, length constraints).\n    \"\"\"\n    # Example: Penalize brevity, reward specific keywords\n    score = len(text.split()) / 10.0\n    if \"crucial\" in text.lower():\n        score += 5.0\n    return score\n\ndef run_loop():\n    artifact = \"Start with a baseline output.\"\n    best_score = score_artifact(artifact)\n    \n    with open(\"history.tsv\", \"w\") as f:\n        f.write(\"iteration\\tscore\\tstatus\\n\")\n\n    for i in range(MAX_ITERATIONS):\n        prompt = f\"Rewrite this to be more professional and include the word 'crucial':\\n{artifact}\"\n        candidate = call_llm(prompt)\n        \n        if not candidate: continue\n        \n        new_score = score_artifact(candidate)\n        \n        if new_score > best_score:\n            print(f\"Iteration {i}: Improvement found ({best_score:.2f} -> {new_score:.2f})\")\n            best_score = new_score\n            artifact = candidate\n            with open(\"artifact.txt\", \"w\") as f: f.write(artifact)\n            subprocess.run([\"git\", \"add\", \"artifact.txt\"], check=True)\n            subprocess.run([\"git\", \"commit\", \"-m\", f\"Eval Iter {i}: score {best_score:.2f}\"], check=True)\n            status = \"KEEP\"\n        else:\n            status = \"DISCARD\"\n            \n        with open(\"history.tsv\", \"a\") as f:\n            f.write(f\"{i}\\t{new_score:.2f}\\t{status}\\n\")\n\nif __name__ == \"__main__\":\n    run_loop()\n```\n\n## Why This Architecture?\n\n### 1. The Subprocess Pattern\nBy invoking `git` via `subprocess`, we treat the LLM as an agent modifying a file. This gives you a \"time machine.\" If the LLM generates a hallucination or a sub-optimal rewrite, you can `git checkout` the previous state. This turns your prompt development into a standard software engineering workflow.\n\n### 2. Greedy Hill-Climbing\nWe use a \"Greedy\" approach: only keep the change if it is strictly better than the last version. \n*   **Why?** It is simple to debug and prevents the loop from oscillating between two mediocre states.\n*   **Tradeoff:** It is prone to \"local optima.\" If your prompt reaches a plateau, the loop will stop improving. When this happens, manually intervene by changing the \"system prompt\" or the \"mutation instruction\" in the loop.\n\n### 3. The TSV Audit Trail\nWe log every attempt to `history.tsv`. Do not discard the \"DISCARD\" logs! They are vital for identifying if your scoring metric is too aggressive or if you are hitting a ceiling where the model cannot improve further.\n\n## Common Pitfalls\n\n*   **Metric Gaming:** A common mistake is using a simple metric (like word count). The LLM will learn to \"pad\" its output to hit the score, destroying the quality. Ensure your metric includes semantic checks or negative constraints.\n*   **Circular Feedback:** Never ask an LLM to \"score its own output\" within the same loop. The model will often exhibit sycophancy, flattering its own previous generation. Always use a separate, deterministic script for the `score_artifact` function.\n*   **Runaway Costs:** Even \"cheap\" models add up. Always implement a `MAX_ITERATIONS` guardrail to ensure your experiment doesn't drain your API credits if the loop gets stuck.\n\n## Next Steps\nOnce you have this loop running, consider:\n1. **Parallelization:** Use `asyncio` to run 5 variations of the same prompt simultaneously (`asyncio.gather`) and pick the best one.\n2. **Dynamic Metrics:** Instead of a static Python function, use a \"Judge LLM\" (like a stronger model, e.g., GPT-4o) to score the outputs of the \"Worker LLM.\" This allows for subjective, high-quality, human-like evaluation at scale. \n3. **Thresholding:** Add a requirement that the score must improve by at least 10% to be \"kept,\" helping avoid marginal, noisy changes.", "D": "# Build a Minimal LLM Evaluation Loop in Python: Systematic Experiments for ML Engineers\n\nIf you're an ML engineer tired of manual prompt testing and ready to automate optimization, this tutorial guides you through building a simple evaluation loop using the OpenRouter API. It focuses on a lean, repeatable process that you can understand and extend in under 10 minutes, avoiding bloated frameworks while emphasizing practical implementation.\n\n## What You Will Build\n\nBy completing this tutorial, you'll create a Python script that:\n1. Sets up API access with secure key handling.\n2. Makes LLM calls to generate and improve outputs.\n3. Evaluates outputs using a custom metric.\n4. Runs a greedy hill-climbing loop to iteratively refine results.\n5. Tracks costs, saves improvements, and versions changes via Git.\n6. Handles potential failures gracefully to ensure reliability.\n\nThis setup moves you from ad-hoc experiments to automated workflows, helping you optimize LLM prompts systematically.\n\n## What You Need\n\n- Python 3.10 or higher.\n- An OpenRouter API key from openrouter.ai.\n- Install dependencies: `pip install httpx python-dotenv`.\n- Git installed and configured for versioning.\n\n## Step 1: Setup API Key and Constants\n\nStart by securing your API key in a `.env` file in your project directory:\n```plaintext\nOPENROUTER_API_KEY=sk-or-your-key-here\n```\n\nThis approach keeps sensitive information out of your code. Here's the code to load it and define key constants:\n\n```python\nimport os\nimport httpx\nfrom dotenv import load_dotenv\n\nload_dotenv()  # Loads variables from .env file\n\nAPI_KEY = os.getenv(\"OPENROUTER_API_KEY\")\nAPI_URL = \"https://openrouter.ai/api/v1/chat/completions\"\nMODEL = \"openai/gpt-4o-mini\"  # A cost-effective choice for iterative experiments\nMAX_ITERATIONS = 20  # Limits the loop to prevent excessive runs\nCOST_PER_TOKEN = 0.000002  # Approximate cost; verify with OpenRouter's pricing\n\ndef call_llm(prompt: str) -> str:\n    \"\"\"Make a secure API call to OpenRouter with error handling and timeout.\"\"\"\n    try:\n        response = httpx.post(\n            API_URL,\n            headers={\"Authorization\": f\"Bearer {API_KEY}\"},\n            json={\n                \"model\": MODEL,\n                \"messages\": [{\"role\": \"user\", \"content\": prompt}]\n            },\n            timeout=10.0  # Prevents indefinite hangs, crucial for production loops\n        )\n        response.raise_for_status()  # Catches HTTP errors like 4xx or 5xx\n        data = response.json()\n        return data[\"choices\"][0][\"message\"][\"content\"]\n    except httpx.RequestError as e:\n        print(f\"API request failed: {e}. Skipping iteration.\")\n        return \"\"  # Graceful failure to maintain loop integrity\n```\n\n## St