{"type": "stage2_complete", "rankings": [{"letter": "A", "display_letter": "D", "avg_position": 1.0, "votes": 4}, {"letter": "B", "display_letter": "E", "avg_position": 1.25, "votes": 4}, {"letter": "D", "display_letter": "A", "avg_position": 1.25, "votes": 4}, {"letter": "E", "display_letter": "B", "avg_position": 2.5, "votes": 4}], "shuffle_map": {"D": "A", "E": "B", "A": "D", "B": "E"}, "votes": [{"model": "meta-llama/llama-4-maverick", "display_ranking": "E > D > B > A", "original_ranking": "B > A > E > D", "reasoning": "To evaluate the given versions of the tutorial on building a minimal LLM evaluation loop in Python, we need to assess them based on the provided criteria: Correctness, Completeness, Clarity, Code Quality, and Depth.\n\n## Version D\nVersion D scores high on Completeness as it covers all essential steps and includes additional features like cost tracking, parallel model queries, and git versioning. It also demonstrates a good balance between explaining the code and providing a clear, step-by-step guide. The code is well-structured, and the tutorial is comprehensive. However, upon closer inspection, while it is mostly correct and clear, the depth of explanation for certain design decisions could be improved.\n\n## Version E\nVersion E builds upon the strengths of Version D by introducing an adaptive optimization strategy, which enhances the Depth and potentially the Completeness of the tutorial by exploring different optimization techniques. It maintains Clarity and Code Quality by adapting the code to incorporate the new strategy without sacrificing readability. The introduction of varied optimization strategies like temperature, top_p, and presence penalty adds complexity but also makes the tutorial more comprehensive.\n\n## Version A\nVersion A is a solid foundation, covering the basics of setting up an LLM evaluation loop. It is Clear and has good Code Quality, making it understandable for ML engineers with intermediate Python skills. However, it lacks some of the advanced features and detailed explanations found in Versions D and E, making it less Comprehensive and Deep in its coverage.\n\n## Version B\nVersion B is very similar to Version D in terms of content and structure but lacks some of the finer details and explanations that Version D provides. It is Correct, Complete to a good extent, and Clear. However, it doesn't stand out as much as Version D or E in terms of Depth or additional features.\n\n## Ranking\n\n- **Correctness**: All versions are syntactically valid and logically correct to a good extent.\n- **Completeness**: Versions D and E are more complete due to their additional features.\n- **Clarity**: All versions are clear, but Version A is particularly noted for its clarity.\n- **Code Quality**: Versions D and E have high code quality due to their structure and use of type hints.\n- **Depth**: Version E stands out for its explanation of adaptive optimization strategies.\n\nGiven these observations:\n\n- Version E is the most comprehensive and deep, covering advanced optimization strategies.\n- Version D is a close second, offering a well-rounded tutorial with a good balance of features and explanations.\n- Version B follows closely, lacking some of the depth and additional features of D and E.\n- Version A, while clear and Version D-like completeness, is less detailed in its explanations and lacks some features."}, {"model": "anthropic/claude-3-5-haiku", "display_ranking": "D > E > A > B", "original_ranking": "A > B > D > E", "reasoning": "Evaluation of versions:\n\nVersion D (Detailed Reasoning):\n- Strongest overall with most comprehensive approach\n- Excellent depth in explaining design choices\n- Most robust implementation with multiple optimization strategies\n- Includes visualization and advanced tips\n- Provides the most complete tutorial experience\n\nVersion E (Solid Alternative):\n- Very similar to Version D, but slightly less comprehensive\n- Introduces adaptive optimization strategies\n- Good explanation of tradeoffs\n- Slightly less detailed in worked examples and explanations\n\nVersion A (Good Foundation):\n- Solid technical implementation\n- Clear explanation of core concepts\n- Lacks some of the depth and advanced strategies of D and E\n- More basic hill-climbing approach\n- Good for beginners, but less sophisticated\n\nVersion B (Basic Implementation):\n- Very similar to Version A\n- Slightly less technical depth\n- Fewer advanced explanations\n- Essentially a simplified version of Version A\n- Lacks the nuance of more advanced versions\n\nReasoning applied across the five core evaluation criteria:\n1. Correctness: D and E are most robust\n2. Completeness: D is most comprehensive\n3. Clarity: D provides the clearest step-by-step explanation\n4. Code Quality: D and E have the most idiomatic, well-structured code\n5. Depth: D offers the most insightful discussions of design choices"}, {"model": "google/gemini-3.1-flash-lite-preview", "display_ranking": "A > D > B > E", "original_ranking": "D > A > E > B", "reasoning": "The versions are evaluated based on their adherence to the technical requirements, code quality, and clarity.\n\n*   **Version A:** This version is the strongest; it includes type hints, better documentation, explicit imports, and a section explaining *why* and *when* to stop the loop, which addresses the \"Depth\" and \"Completeness\" criteria most effectively.\n*   **Version D:** Very similar to Version B, but includes a useful \"Visualizing Results\" section and code snippet, providing more value to the reader.\n*   **Version B:** A solid, clean implementation that follows all instructions, though it lacks the extra depth and polish found in Versions A and D.\n*   **Version E:** While it attempts an \"adaptive\" strategy, the implementation of `random.choice` for strategies within the loop logic is somewhat arbitrary and less \"minimalist\" than the others; it also introduces unnecessary complexity (params passed to the API) without a clear benefit for a \"minimal\" tutorial.\n\nReasoning:\n- **Version A** is the most professional, featuring type annotations, robust error handling, and insightful commentary on loop termination.\n- **Version D** provides a helpful visualization section that adds practical value for an engineer.\n- **Version B** is a clean, standard implementation that satisfies all constraints perfectly but offers less \"extra\" value.\n- **Version E** over-complicates the tutorial with random strategy selection, which detracts from the \"minimal\" requirement and introduces potential bugs in API parameter handling."}, {"model": "x-ai/grok-3-mini-beta", "display_ranking": "A > E > D > B", "original_ranking": "D > B > A > E", "reasoning": "Below is my ranking of the versions (D, E, A, B) from best to worst based on the evaluation criteria (Correctness, Completeness, Clarity, Code Quality, and Depth). I scored each version out of 100 points, considering the criteria as follows:\n\n- **Version A**: Scores 94/100 (Correctness: 20, Completeness: 18, Clarity: 19, Code Quality: 19, Depth: 18). This version is highly effective due to its type hints, detailed explanations of when to stop the loop, and a solid worked example, making it the most polished and extendable while maintaining clarity for the target audience.\n- **Version E**: Scores 92/100 (Correctness: 18, Completeness: 19, Clarity: 18, Code Quality: 18, Depth: 19). It introduces adaptive optimization strategies, which adds depth and completeness, but the random elements slightly reduce correctness confidence compared to others.\n- **Version D**: Scores 91/100 (Correctness: 20, Completeness: 18, Clarity: 18, Code Quality: 18, Depth: 17). This version is strong in core functionality and includes useful extras like visualization code, but it lacks the type hints and explicit depth on stopping conditions found in Version A.\n- **Version B**: Scores 88/100 (Correctness: 20, Completeness: 17, Clarity: 17, Code Quality: 18, Depth: 16). It's functionally similar to Version D but feels less complete and clear due to missing advanced tips and visualization, making it the weakest overall."}], "model_names": {"A": "meta-llama/llama-4-maverick", "B": "anthropic/claude-3-5-haiku", "C": "google/gemini-3.1-flash-lite-preview", "D": "x-ai/grok-3-mini-beta"}}
{"type": "stage3_complete", "winner": "A", "winner_model": "meta-llama/llama-4-maverick", "council_score": 94, "sub_scores": {"CORRECTNESS": 20, "COMPLETENESS": 20, "CLARITY": 18, "CODE_QUALITY": 18, "DEPTH": 18}, "critique": "Proposal A provides a clear, correct, and complete tutorial on building a minimal LLM evaluation loop. The code is well-structured and follows Python idioms, ensuring readability and maintainability. However, it could benefit from slightly more inline comments for clarity and a deeper exploration of tradeoffs and limitations in the approach. Nonetheless, it effectively balances technical guidance with practical application, making it an excellent resource for ML engineers looking to automate their prompt testing.", "chairman_full_response": "WINNER: A  \nSCORE_CORRECTNESS: 20  \nSCORE_COMPLETENESS: 20  \nSCORE_CLARITY: 18  \nSCORE_CODE_QUALITY: 18  \nSCORE_DEPTH: 18  \nCOUNCIL_SCORE: 94  \n\nCRITIQUE:  \nProposal A provides a clear, correct, and complete tutorial on building a minimal LLM evaluation loop. The code is well-structured and follows Python idioms, ensuring readability and maintainability. However, it could benefit from slightly more inline comments for clarity and a deeper exploration of tradeoffs and limitations in the approach. Nonetheless, it effectively balances technical guidance with practical application, making it an excellent resource for ML engineers looking to automate their prompt testing.", "chairman_model": "openai/gpt-4o-mini", "model_names": {"A": "meta-llama/llama-4-maverick", "B": "anthropic/claude-3-5-haiku", "C": "google/gemini-3.1-flash-lite-preview", "D": "x-ai/grok-3-mini-beta"}}
{"type": "iteration_result", "iteration": 43, "status": "DISCARD", "council_score": 94, "winner": "A", "best_score": 96, "commit": "de0e250", "spent_usd": 0.700634, "timestamp": "2026-04-03T15:55:31.930194Z"}
