{"type": "stage2_complete", "rankings": [{"letter": "D", "display_letter": "E", "avg_position": 0.5, "votes": 4}, {"letter": "A", "display_letter": "B", "avg_position": 1.0, "votes": 4}, {"letter": "C", "display_letter": "A", "avg_position": 2.0, "votes": 4}, {"letter": "E", "display_letter": "C", "avg_position": 2.75, "votes": 4}, {"letter": "B", "display_letter": "D", "avg_position": 3.75, "votes": 4}], "shuffle_map": {"B": "A", "D": "B", "A": "C", "E": "D", "C": "E"}, "votes": [{"model": "meta-llama/llama-4-maverick", "display_ranking": "E > B > C > A > D", "original_ranking": "D > A > E > C > B", "reasoning": "To rank the versions from best to worst based on the evaluation criteria, let's assess each version's strengths and weaknesses.\n\n## Version A\nStrengths: Provides a clear and simple implementation of a greedy hill-climbing loop, covers essential steps, and includes a worked example.\nWeaknesses: Lacks parallel model queries and advanced scoring metrics.\n\n## Version B\nStrengths: Implements parallel model queries, includes cost tracking, and versions improvements using Git, making it more comprehensive.\nWeaknesses: The code could benefit from more inline comments explaining each step and design decisions.\n\n## Version C\nStrengths: Similar to Version B, with a focus on parallel model queries and Git versioning, maintaining completeness.\nWeaknesses: Lacks detailed explanations of key design decisions and tradeoffs.\n\n## Version D\nStrengths: Introduces a multi-objective optimization approach, enhancing the scoring metric and providing a more nuanced evaluation.\nWeaknesses: May be overly complex for the target audience, and the implementation deviates from the original task's constraints.\n\n## Version E\nStrengths: Balances clarity with comprehensiveness, includes detailed explanations, and maintains a lean implementation, addressing common pitfalls.\nWeaknesses: Could further enhance depth by discussing alternative optimization strategies.\n\nBased on the evaluation criteria, the ranking considers correctness, completeness, clarity, code quality, and depth.\n\n- **Correctness and Completeness**: Versions B, C, and E are strong contenders as they cover all essential steps.\n- **Clarity and Code Quality**: Version E stands out for its clear explanations and well-structured code.\n- **Depth**: Version E provides a good balance of explaining \"why\" certain design decisions are made and acknowledging tradeoffs."}, {"model": "anthropic/claude-3-5-haiku", "display_ranking": "B > A > E > D > C", "original_ranking": "A > C > D > B > E", "reasoning": "Analysis of Versions:\n\nVersion B:\n+ Strong technical depth\n+ Comprehensive worked example\n+ Clear explanation of tradeoffs\n- Slightly verbose\n- Some repetition in explanations\n\nVersion D:\n+ Innovative multi-objective optimization approach\n+ Advanced scoring metrics\n+ Unique perspective on prompt engineering\n- More complex, less beginner-friendly\n- Less practical for immediate use\n\nVersion A:\n+ Concise and pragmatic\n+ Good balance of explanation and code\n+ Clear rationale for design choices\n- Slightly simpler implementation\n- Less comprehensive error handling\n\nVersion E:\n+ Very thorough documentation\n+ Comprehensive error handling\n+ Detailed explanation of design choices\n- Slightly over-explained in some sections\n- More verbose than necessary\n\nVersion C:\n+ Solid implementation\n+ Good overview of concepts\n- Nearly identical to Version B\n- Less distinctive technical contribution\n- Feels like a slightly modified copy\n\nDetailed Assessment:\n- Version B has the best balance of technical depth, clarity, and practical implementation\n- Version A is a close second with its pragmatic approach\n- Version E is comprehensive but slightly over-documented\n- Version D is innovative but less immediately applicable\n- Version C feels derivative and adds little unique value"}, {"model": "google/gemini-3.1-flash-lite-preview", "display_ranking": "E > A > B > C > D", "original_ranking": "D > C > A > E > B", "reasoning": "To evaluate these tutorials, I focused on technical correctness (especially the `asyncio` loop and error handling), code quality, and how well the prose explains the \"why\" behind the engineering decisions.\n\n*   **Version E** is the strongest; it includes robust error handling, uses `TSV` for better data logging, provides clear justifications for design choices, and maintains a highly professional, instructional tone.\n*   **Version A** is excellent and concise; it is the most readable for a beginner trying to understand the \"subprocess/git\" pattern, though it lacks the multi-model comparison featured in the others.\n*   **Version B** is a solid, functional implementation that covers all requirements, though it is slightly less polished in its explanation of tradeoffs than Version E.\n*   **Version C** is nearly identical to Version B but lacks the \"Advanced Scoring Metrics\" and \"What's Next\" sections, making it slightly less comprehensive.\n*   **Version D** is technically the most complex, but it deviates from the \"minimal\" goal by introducing unnecessary abstractions (classes, numpy-based math) that make the \"10-minute\" setup promise feel less achievable for the target audience.\n\n**Reasoning:**\n*   **Version E:** Best balance of code quality, error handling, and depth of explanation.\n*   **Version A:** Highly readable and very focused on the core \"minimal loop\" concept.\n*   **Version B:** Very good, complete, and correct, but slightly less refined than E.\n*   **Version C:** Competent and correct, but lacks the extra polish found in B.\n*   **Version D:** Over-engineered and moves away from the \"minimal\" requirement for a simple evaluation loop."}, {"model": "x-ai/grok-3-mini-beta", "display_ranking": "E > B > C > A > D", "original_ranking": "D > A > E > C > B", "reasoning": "Below is my ranking of the versions from best to worst based on the evaluation criteria (Correctness, Completeness, Clarity, Code Quality, and Depth). I'll provide a brief one-sentence reasoning for each version, focusing on how well it meets the overall criteria.\n\n- **Version E**: This version scores highly across all criteria (e.g., 18/20 for Correctness due to robust error handling, 19/20 for Completeness with features like cost tracking and TSV saving, and strong Depth with justifications and worked examples), making it the most balanced and practical for the target audience.  \n- **Version B**: It excels in Completeness and Clarity with a full-featured implementation and explanations, though its identical content to Version C slightly reduces its uniqueness in ranking.  \n- **Version C**: Identical to Version B, it performs well in most criteria but offers no distinct improvements, resulting in a tie for second place.  \n- **Version A**: It is correct and clear for a minimal setup but falls short in Completeness and Depth due to limited features like single-model queries and less emphasis on tradeoffs.  \n- **Version D**: While innovative in Depth with multi-objective optimization, it scores lower overall due to over-engineering that reduces Clarity and Code Quality for the audience seeking a lean implementation."}], "model_names": {"A": "meta-llama/llama-4-maverick", "B": "anthropic/claude-3-5-haiku", "C": "google/gemini-3.1-flash-lite-preview", "D": "x-ai/grok-3-mini-beta"}}
{"type": "stage3_complete", "winner": "D", "winner_model": "x-ai/grok-3-mini-beta", "council_score": 94, "sub_scores": {"CORRECTNESS": 20, "COMPLETENESS": 20, "CLARITY": 18, "CODE_QUALITY": 18, "DEPTH": 18}, "critique": "Proposal D provides a thorough and well-structured tutorial that covers all essential steps for building a minimal LLM evaluation loop. The code is syntactically correct and includes comprehensive error handling, making it robust and user-friendly. Clarity is mostly maintained, though some sections could benefit from additional inline comments for readers less familiar with the concepts. The depth of explanation is commendable, particularly regarding the rationale behind design choices and potential pitfalls. Future iterations could consider expanding on the implications of model selection and optimization strategies to further enrich the tutorial.", "chairman_full_response": "WINNER: D  \nSCORE_CORRECTNESS: 20  \nSCORE_COMPLETENESS: 20  \nSCORE_CLARITY: 18  \nSCORE_CODE_QUALITY: 18  \nSCORE_DEPTH: 18  \nCOUNCIL_SCORE: 94  \n\nCRITIQUE:  \nProposal D provides a thorough and well-structured tutorial that covers all essential steps for building a minimal LLM evaluation loop. The code is syntactically correct and includes comprehensive error handling, making it robust and user-friendly. Clarity is mostly maintained, though some sections could benefit from additional inline comments for readers less familiar with the concepts. The depth of explanation is commendable, particularly regarding the rationale behind design choices and potential pitfalls. Future iterations could consider expanding on the implications of model selection and optimization strategies to further enrich the tutorial.", "chairman_model": "openai/gpt-4o-mini", "model_names": {"A": "meta-llama/llama-4-maverick", "B": "anthropic/claude-3-5-haiku", "C": "google/gemini-3.1-flash-lite-preview", "D": "x-ai/grok-3-mini-beta"}}
{"type": "iteration_result", "iteration": 39, "status": "DISCARD", "council_score": 94, "winner": "D", "best_score": 96, "commit": "de0e250", "spent_usd": 0.555873, "timestamp": "2026-04-03T15:48:19.472106Z"}
