{"type": "stage1_complete", "proposals": {"A": "# Build a Minimal LLM Evaluation Loop in Python: Systematic Experiments for ML Engineers\n\nIf you want to stop manually testing prompts and start running systematic experiments, an evaluation loop is the right tool. This tutorial shows you how to build one using the OpenRouter API, covering essential steps from API key setup to saving results.\n\n## What You Will Build\n\nBy the end of this tutorial, you will have a working Python script that:\n1. Makes LLM API calls using OpenRouter\n2. Scores the output using a custom metric\n3. Implements a greedy hill-climbing loop to improve the output\n4. Saves the best artifact to a file\n5. Tracks costs and iterations\n6. Versions improvements using git\n7. Saves detailed iteration results to a structured file for later analysis\n\n## What You Need\n\n- Python 3.10+\n- An OpenRouter API key (sign up at openrouter.ai)\n- `httpx` installed: `pip install httpx`\n- `python-dotenv` installed: `pip install python-dotenv`\n- Git installed and configured\n\n## Step 1: Setup API Key and Constants\n\nFirst, create a `.env` file in your project root with your OpenRouter API key:\n```plaintext\nOPENROUTER_API_KEY=sk-or-your-key-here\n```\n\n```python\nimport os\nimport httpx\nfrom dotenv import load_dotenv\nimport json\nimport subprocess\nfrom dataclasses import dataclass\nfrom typing import List\n\nload_dotenv()  # Load environment variables from .env\n\nAPI_KEY = os.getenv(\"OPENROUTER_API_KEY\")\nAPI_URL = \"https://openrouter.ai/api/v1/chat/completions\"\nMODEL = \"openai/gpt-4o-mini\"\nMAX_ITERATIONS = 20\nCOST_PER_TOKEN = 0.000002  # Example cost, check OpenRouter pricing\n\n@dataclass\nclass IterationResult:\n    iteration: int\n    score: float\n    action: str\n    cost: float\n    artifact: str\n    prompt: str\n    candidate: str\n\ndef call_llm(prompt: str) -> str:\n    try:\n        response = httpx.post(\n            API_URL,\n            headers={\"Authorization\": f\"Bearer {API_KEY}\"},\n            json={\n                \"model\": MODEL,\n                \"messages\": [{\"role\": \"user\", \"content\": prompt}]\n            },\n            timeout=10.0  # Add timeout to prevent hanging\n        )\n        response.raise_for_status()  # Raise an exception for bad status codes\n        data = response.json()\n        return data[\"choices\"][0][\"message\"][\"content\"]\n    except httpx.RequestError as e:\n        print(f\"API request failed: {e}\")\n        return \"\"\n```\n\n## Step 2: Define a Metric Function\n\nYour metric function scores the LLM output. Higher is better. Here is a simple example that scores based on length and coherence, with additional comments for clarity:\n\n```python\ndef score(text: str) -> float:\n    # Calculate the number of words in the output\n    words = len(text.split())\n    # Normalize length score to be between 0 and 1\n    length_score = min(words / 200, 1.0)\n    # Simple coherence check: higher lexical diversity is better\n    coherence_score = len(set(text.split())) / words if words > 0 else 0\n    # Weighted average of length and coherence scores\n    return 0.5 * length_score + 0.5 * coherence_score\n```\n\n## Step 3: Implement the Evaluation Loop with Enhanced Result Tracking\n\n```python\ndef main():\n    best_score = 0.0\n    artifact = open(\"artifact.txt\").read().strip()\n    total_cost = 0.0\n    results: List[IterationResult] = []\n\n    # Initialize git repository if not already done\n    try:\n        subprocess.run([\"git\", \"rev-parse\"], check=True, capture_output=True)\n    except subprocess.CalledProcessError:\n        subprocess.run([\"git\", \"init\"], check=True)\n        subprocess.run([\"git\", \"add\", \"artifact.txt\"], check=True)\n        subprocess.run([\"git\", \"commit\", \"-m\", \"Initial artifact\"], check=True)\n\n    for i in range(MAX_ITERATIONS):\n        prompt = f\"Improve this text:\\n\\n{artifact}\"\n        candidate = call_llm(prompt)\n        \n        if not candidate:  # Skip iteration if API call failed\n            continue\n        \n        new_score = score(candidate)\n        total_cost += COST_PER_TOKEN * (len(prompt) + len(candidate))  # Simplified cost calculation\n        \n        if new_score > best_score:\n            best_score = new_score\n            artifact = candidate.strip()\n            with open(\"artifact.txt\", \"w\") as f:\n                f.write(artifact)\n            # Commit changes to git\n            subprocess.run([\"git\", \"add\", \"artifact.txt\"], check=True)\n            subprocess.run([\"git\", \"commit\", \"-m\", f\"Iter {i}: Improved artifact\"], check=True)\n            action = \"KEEP\"\n        else:\n            action = \"DISCARD\"\n        \n        result = IterationResult(\n            iteration=i,\n            score=new_score,\n            action=action,\n            cost=total_cost,\n            artifact=artifact,\n            prompt=prompt,\n            candidate=candidate\n        )\n        results.append(result)\n        \n        print(f\"Iter {i}: {action}  score={new_score:.2f}  best={best_score:.2f}\")\n\n    # Save results to a JSON file for later analysis\n    with open(\"results.json\", \"w\") as f:\n        json.dump([r.__dict__ for r in results], f, indent=2)\n\nif __name__ == \"__main__\":\n    main()\n```\n\n## Step 4: Run Your Evaluation Loop\n\n```bash\npython loop.py\n```\n\nYou should see output like:\n\n```\nIter 0: KEEP  score=0.85  best=0.85\nIter 1: DISCARD  score=0.81  best=0.85\nIter 2: KEEP  score=0.91  best=0.91\nIter 3: DISCARD  score=0.88  best=0.91\n```\n\nThe artifact file is updated and committed to git whenever a better version is found, and detailed results are saved to `results.json`.\n\n## Why Greedy Hill-Climbing?\n\nGreedy hill-climbing is simple and effective for many optimization tasks. It always moves towards better solutions, making it suitable for improving LLM outputs. However, it may get stuck in local optima. Consider adding randomness or more sophisticated optimization techniques for complex tasks.\n\n## Tradeoffs and Limitations\n\nWhile greedy hill-climbing is straightforward to implement, it lacks the ability to explore the solution space broadly. For tasks requiring more exploration, consider techniques like simulated annealing or genetic algorithms. Additionally, be mindful of the cost implications of repeated LLM queries.\n\n## Common Pitfalls\n\n1. **Metric Gaming**: Ensure your metric accurately reflects the desired outcome. A poorly designed metric can lead to suboptimal or misleading results.\n2. **Circular Feedback**: Be cautious when using LLM outputs to evaluate other LLM outputs. This can create feedback loops that degrade performance over time.\n3. **Runaway Costs**: Always track costs and consider implementing a budget constraint to prevent unexpected expenses.\n\n## Worked Example\n\nLet's say you start with a simple artifact: \"The quick brown fox jumps over the lazy dog.\" After running the evaluation loop, the artifact might improve to: \"The quick brown fox jumps over the lazy dog, demonstrating a classic example of a pangram that uses all the letters of the alphabet efficiently.\" The score improves from 0.4 to 0.8 as the output becomes more coherent and contextually relevant.\n\n## Analyzing Results\n\nThe `results.json` file contains detailed information about each iteration, including the prompt, candidate output, score, and action taken. This data can be used to analyze the optimization process, understand how the artifact evolved, and identify potential issues in the metric or optimization strategy.\n\n## What's Next\n\nThis basic loop works, but you can enhance it further:\n- Query multiple models in parallel to compare their performance\n- Implement more sophisticated optimization strategies like simulated annealing\n- Add more comprehensive error handling and logging mechanisms\n- Use the detailed results data to visualize the optimization process and gain insights into the LLM's behavior\n\nBy following this tutorial, you've built a systematic evaluation loop for LLM experiments that not only optimizes your prompts but also versions your improvements using git and tracks detailed iteration results. This foundation allows you to scale your experiments, track progress, and optimize your prompts effectively.", "B": "# Build a Minimal LLM Evaluation Loop in Python: Systematic Experiments for ML Engineers\n\nIf you want to stop manually testing prompts and start running systematic experiments, an evaluation loop is the right tool. This tutorial shows you how to build a robust, extensible optimization framework using the OpenRouter API.\n\n## What You Will Build\n\nBy the end of this tutorial, you will have a flexible Python script that:\n1. Makes LLM API calls using OpenRouter\n2. Implements multiple evaluation strategies\n3. Tracks performance across different metric approaches\n4. Provides a framework for comparative prompt engineering\n5. Handles API errors and cost management gracefully\n\n## Key Innovations: Multi-Strategy Evaluation\n\nUnlike traditional single-metric approaches, this tutorial introduces a novel multi-strategy evaluation framework that allows simultaneous exploration of different optimization techniques.\n\n## What You Need\n\n- Python 3.10+\n- An OpenRouter API key\n- `httpx` and `python-dotenv` installed\n- Git installed\n\n## Step 1: Advanced Configuration and Error-Resilient Setup\n\n```python\nimport os\nimport logging\nfrom dataclasses import dataclass\nfrom typing import Callable, List, Optional\nfrom dotenv import load_dotenv\n\nload_dotenv()\n\n@dataclass\nclass EvaluationConfig:\n    api_key: str = os.getenv(\"OPENROUTER_API_KEY\")\n    model: str = \"openai/gpt-4o-mini\"\n    max_iterations: int = 20\n    cost_threshold: float = 5.00  # Dollar budget\n    \n    # Configurable evaluation strategies\n    metric_weights: dict = field(default_factory=lambda: {\n        \"length\": 0.3,\n        \"complexity\": 0.3,\n        \"coherence\": 0.4\n    })\n\nclass ConfigurationError(Exception):\n    \"\"\"Custom exception for configuration issues.\"\"\"\n    pass\n\ndef validate_config(config: EvaluationConfig):\n    if not config.api_key:\n        raise ConfigurationError(\"OpenRouter API key is required\")\n```\n\n## Step 2: Advanced Metric Composition\n\n```python\nimport textstat\nimport nltk\nnltk.download('punkt', quiet=True)\n\nclass MetricEvaluator:\n    @staticmethod\n    def multi_dimensional_score(\n        text: str, \n        weights: dict = DEFAULT_METRIC_WEIGHTS\n    ) -> float:\n        \"\"\"Compute a multi-dimensional quality score.\"\"\"\n        scores = {\n            \"length\": min(len(text.split()) / 250, 1.0),\n            \"complexity\": 1 - (textstat.flesch_reading_ease(text) / 100),\n            \"coherence\": MetricEvaluator._compute_coherence(text)\n        }\n        \n        return sum(scores[k] * weights.get(k, 0) for k in scores)\n    \n    @staticmethod\n    def _compute_coherence(text: str) -> float:\n        \"\"\"Advanced coherence metric using semantic analysis.\"\"\"\n        sentences = nltk.sent_tokenize(text)\n        if len(sentences) < 2:\n            return 0.0\n        \n        # Simplified coherence: semantic diversity across sentences\n        unique_words = set(word.lower() for sent in sentences for word in sent.split())\n        return len(unique_words) / len(' '.join(sentences).split())\n```\n\n## Step 3: Robust API Interaction with Comprehensive Error Handling\n\n```python\nimport httpx\nfrom tenacity import retry, stop_after_attempt, wait_exponential\n\nclass LLMInteraction:\n    @retry(\n        stop=stop_after_attempt(3),\n        wait=wait_exponential(multiplier=1, min=4, max=10)\n    )\n    def query_llm(\n        self, \n        prompt: str, \n        config: EvaluationConfig\n    ) -> Optional[str]:\n        \"\"\"Robust LLM query with exponential backoff and retry.\"\"\"\n        try:\n            response = httpx.post(\n                \"https://openrouter.ai/api/v1/chat/completions\",\n                headers={\"Authorization\": f\"Bearer {config.api_key}\"},\n                json={\n                    \"model\": config.model,\n                    \"messages\": [{\"role\": \"user\", \"content\": prompt}]\n                },\n                timeout=15.0\n            )\n            response.raise_for_status()\n            return response.json()['choices'][0]['message']['content']\n        \n        except (httpx.RequestError, KeyError) as e:\n            logging.error(f\"LLM Query Failed: {e}\")\n            return None\n```\n\n## Step 4: Comprehensive Evaluation Loop\n\n```python\nclass PromptOptimizer:\n    def optimize(\n        self, \n        initial_prompt: str, \n        config: EvaluationConfig\n    ) -> List[dict]:\n        \"\"\"Systematic prompt optimization with multi-dimensional tracking.\"\"\"\n        results = []\n        current_artifact = initial_prompt\n        \n        for iteration in range(config.max_iterations):\n            improved_prompt = self._generate_improvement(current_artifact)\n            score = MetricEvaluator.multi_dimensional_score(improved_prompt)\n            \n            if score > self._get_best_score(results):\n                current_artifact = improved_prompt\n                results.append({\n                    \"iteration\": iteration,\n                    \"score\": score,\n                    \"artifact\": current_artifact\n                })\n        \n        return results\n```\n\n## Unique Contributions\n\nThis implementation goes beyond traditional evaluation loops by:\n- Supporting configurable, multi-dimensional scoring\n- Implementing robust error handling\n- Providing a flexible, extensible framework\n- Integrating advanced NLP techniques for evaluation\n\n## Tradeoffs and Considerations\n\nWhile powerful, this approach introduces complexity. It's most suitable for:\n- Systematic prompt engineering\n- Research-oriented experimentation\n- Scenarios requiring nuanced quality assessment\n\n## Common Pitfalls to Avoid\n\n1. Over-optimizing metrics\n2. Ignoring domain-specific context\n3. Treating the framework as a black box\n\n## Next Steps\n\nPotential enhancements include:\n- Adding model comparison capabilities\n- Implementing more sophisticated optimization strategies\n- Creating visualization tools for iteration tracking\n\nBy mastering this framework, you'll transform prompt engineering from an art to a systematic, data-driven discipline.", "C": "# Build a Minimal LLM Evaluation Loop in Python: Systematic Experiments for ML Engineers\n\nIf you want to move from manual, artisanal prompt testing to repeatable, automated optimization, you need an evaluation loop. This tutorial shows you how to build a lean, robust harness using the OpenRouter API to systematically improve your LLM outputs.\n\n## What You Will Build\n\nYou will create a Python script that acts as a \"prompt optimizer.\" It uses a greedy hill-climbing strategy to iteratively refine a target artifact.\n1. **Systematic Loop**: Automatically runs iterations to find the best prompt/output pair.\n2. **Deterministic Versioning**: Uses `git` to snapshot every successful improvement.\n3. **Audit Trail**: Saves results in a structured TSV (Tab-Separated Values) format for easy analysis in Excel or Pandas.\n4. **Resilience**: Includes robust error handling for API timeouts and rate limits.\n\n## Prerequisites\n\n- Python 3.10+\n- `pip install httpx python-dotenv`\n- A `.env` file with `OPENROUTER_API_KEY=sk-or-your-key-here`\n\n## The Implementation\n\nWe use `httpx` for asynchronous-ready requests. We wrap our logic in a clean structure that separates the *Task* (what we want), the *Metric* (how we judge it), and the *Loop* (how we optimize).\n\n```python\nimport os\nimport httpx\nimport json\nimport subprocess\nfrom dotenv import load_dotenv\nfrom typing import TypedDict\n\nload_dotenv()\n\n# Constants\nAPI_URL = \"https://openrouter.ai/api/v1/chat/completions\"\nMODEL = \"openai/gpt-4o-mini\"\nMAX_ITERATIONS = 10\n\nclass Result(TypedDict):\n    iteration: int\n    score: float\n    status: str\n\ndef call_llm(prompt: str) -> str:\n    \"\"\"Sends a prompt to OpenRouter with basic error handling.\"\"\"\n    try:\n        response = httpx.post(\n            API_URL,\n            headers={\"Authorization\": f\"Bearer {os.getenv('OPENROUTER_API_KEY')}\"},\n            json={\"model\": MODEL, \"messages\": [{\"role\": \"user\", \"content\": prompt}]},\n            timeout=15.0\n        )\n        response.raise_for_status()\n        return response.json()[\"choices\"][0][\"message\"][\"content\"]\n    except Exception as e:\n        print(f\"API Error: {e}\")\n        return \"\"\n\ndef evaluate_metric(text: str) -> float:\n    \"\"\"\n    Scoring logic: Higher is better.\n    Example: Penalize brevity and reward specific keyword presence.\n    \"\"\"\n    score = 0.0\n    if len(text) > 100: score += 0.5\n    if \"crucial\" in text.lower(): score += 0.5\n    return score\n\ndef save_to_tsv(results: list[Result]):\n    with open(\"eval_results.tsv\", \"w\") as f:\n        f.write(\"iteration\\tscore\\tstatus\\n\")\n        for r in results:\n            f.write(f\"{r['iteration']}\\t{r['score']}\\t{r['status']}\\n\")\n\ndef run_loop():\n    best_score = -1.0\n    current_prompt = \"Write a professional summary about AI safety.\"\n    results = []\n\n    for i in range(MAX_ITERATIONS):\n        output = call_llm(current_prompt)\n        score = evaluate_metric(output)\n        \n        if score > best_score:\n            best_score = score\n            with open(\"best_artifact.txt\", \"w\") as f:\n                f.write(output)\n            subprocess.run([\"git\", \"add\", \"best_artifact.txt\"], capture_output=True)\n            subprocess.run([\"git\", \"commit\", \"-m\", f\"Improvement at iter {i}\"], capture_output=True)\n            status = \"KEEP\"\n        else:\n            status = \"DISCARD\"\n            \n        results.append({\"iteration\": i, \"score\": score, \"status\": status})\n        print(f\"Iter {i}: {status} (Score: {score})\")\n        \n    save_to_tsv(results)\n\nif __name__ == \"__main__\":\n    run_loop()\n```\n\n## Why This Architecture?\n\n### 1. The Subprocess Pattern\nWe use `subprocess` to call `git` rather than a library like `GitPython`. This keeps dependencies minimal and ensures the environment remains predictable. By committing only on `KEEP` events, your git history becomes an audit trail of \"successful mutations\" to your prompt.\n\n### 2. The TSV Advantage\nWhile JSON is standard, TSV files are superior for quick debugging in CSV-aware tools (Excel, Google Sheets). By separating the logging (`save_to_tsv`) from the logic, you can easily swap this for a database insert or an API call to a logging service like Weights & Biases later.\n\n## Common Pitfalls\n\n- **Metric Gaming**: LLMs are excellent at finding shortcuts. If your metric rewards \"length,\" the model will eventually output repetitive filler. Always include a \"coherence\" or \"relevance\" term in your `evaluate_metric` function.\n- **The \"Model Collapse\" Loop**: If you feed the *output* of the model back into the *input* for the next iteration (self-improvement), the model's style will drift. Ensure the loop structure keeps the original \"System Prompt\" stable and only iterates on the \"User Prompt\" or \"Few-Shot Examples.\"\n- **API Latency**: With 10+ iterations, execution time grows. Use the `timeout` parameter effectively. If the API hangs, your local script shouldn't crash; it should log the failure and continue to the next iteration.\n\n## Worked Example: From Weak to Strong\n\n**Initial Prompt:** \"Explain AI.\"\n**Metric Score:** 0.2 (Too brief, lacks depth).\n*The loop runs, iterating on the prompt internally.*\n**After 5 Iterations:** The loop has optimized the prompt to \"Explain AI, focusing on safety, alignment, and technical challenges, in a professional tone for engineers.\" \n**Final Score:** 0.9.\n\n## Next Steps for Scaling\nOnce this loop is stable, consider:\n1. **Parallelization**: Use `asyncio` to run 5 variations of the same prompt in parallel to find the \"best\" path faster.\n2. **LLM-as-a-Judge**: Instead of a hardcoded Python `evaluate_metric`, pass the output to a *stronger* model (e.g., GPT-4o) and ask it to return a score from 1\u201310. This is the gold standard for subjective quality evaluation.", "D": "# Build a Minimal LLM Evaluation Loop in Python: Systematic Experiments for ML Engineers\n\nIf you're an ML engineer tired of manual prompt testing and eager to automate experiments, this tutorial guides you through building a simple evaluation loop using the OpenRouter API. We'll focus on a lean, repeatable process that you can grasp quickly, moving from one-off tests to systematic optimization without overcomplicating things.\n\n## What You Will Build\n\nBy the end of this tutorial, you'll have a Python script that:\n1. Sets up API calls with secure key handling.\n2. Generates LLM outputs and scores them using a custom metric.\n3. Runs a greedy hill-climbing loop to iteratively improve outputs.\n4. Tracks costs, saves results to a file, and versions changes with Git.\n5. Includes safeguards like error handling and cost monitoring.\n\nThis setup is designed for quick understanding and extension, ideal for those skeptical of bloated frameworks.\n\n## What You Need\n\n- Python 3.10 or higher.\n- An OpenRouter API key (obtain one from openrouter.ai).\n- Install required libraries: `pip install httpx python-dotenv`.\n- Git installed and configured for versioning.\n\n## Step 1: Setup API Key and Constants\n\nStart by securing your API key. Create a `.env` file in your project directory with:\n```plaintext\nOPENROUTER_API_KEY=sk-or-your-key-here\n```\n\nThis keeps sensitive information out of your code. Here's the setup code with ad